user_input,retrieved_contexts,response,reference,faithfulness,answer_relevancy,nv_accuracy
"
本文中膝踝外骨骼在哪些日常活动中表现出助力效果？
","['\n16  circuit recommended in the Tekscan data sheet [Tekscan, 2020]. This circuit also has the additional function of linearizing the non-linear resistance-force relationship. Finally, MyRIO software is used to calibrate the sensors before each experiment to achieve a final readout normalized to body weight.  2.2.3 Human Subject Experiment Methodology  The human subject experiment was designed to demonstrate the potential benefit of the knee-ankle exoskeleton during multiple, common ADLs. These tasks were: sit to stand, stand to sit, treadmill walking, and stair climbing. The primary aim of the experiment was to show a reduction in effort of the muscles related to the joints assisted by Comex 1. We assessed activation levels of the following muscles: vastus medialis oblique (VMO), biceps femoris (BF), tibialis anterior (TA), and soleus (SOL), which function as a knee extensor, knee flexor, dorsi-flexor, and plantar-flexor respectively. A single, male human subject (mass: 80 kg, height: 1.78 m) was enrolled for the study, which was approved by the Institutional Review Board at the University of Texas at Dallas and the University of Michigan.\n']","
本文中膝踝外骨骼在坐到站、站到坐、跑步机行走和楼梯攀爬这四种日常活动中表现出助力效果。
","
本文中膝踝外骨骼在以下日常活动中表现出助力效果：坐到站、站到坐、跑步机行走和爬楼梯。通过评估肌肉激活水平（VMO、BF、TA、SOL）验证其助力作用。
    ",0.0,0.9771257456890572,1.0
"
自适应阻抗控制如何提升外骨骼系统在非结构化环境中的动态响应性能？
","['\namong the devices. Both MTx and BioStampRC detected significantly distinct gait charac- teristics between PwMS with different disability levels (p<0.01).  Conclusion  BioStampRC sensors accurately and precisely measure gait parameters in PwMS across diverse walking impairment levels and detected differences in gait characteristics by disabil- ity level in PwMS. This technology has the potential to provide granular monitoring of gait both inside and outside the clinic.  1. Introduction  Multiple sclerosis (MS) is an immune-mediated disease that affects an estimated 400,000 peo- ple in the USA, and has a worldwide prevalence of 2.5M [1]. MS is characterized by inflamma- tory demyelination and axonal damage in the central nervous system, which result in conduction delays and blockage of electrical potentials along neuronal pathways [2]. The MS pathology transitions into a neurodegenerative disease process associated with insufficient neurotrophic support resulting in irreversible axonal and neuronal loss [3]. This progressive disease commonly affects mobility (i.e. gait function) [4]. Gait impairment in persons with MS (PwMS) has been identified by altered spatio-temporal gait parameters such as slower gait speed, reduced cadence, shorter step length, prolonged stride time and increased double sup- port period [5, 6]. Therefore, accurate assessment of gait characteristics in PwMS is required to examine the severity and progression of gait impairment.  Gait assessment in PwMS has relied on analysis in gait laboratories, with specialized equip-  ment including expensive motion capture systems, pressure sensitive walkways, and force- plates [7]. Clinicians also utilize objective performance based measures (e.g. timed-25 foot walk (T25W)), 6 minute walk test (6MW) [8], and subjective functional ambulation tests (e.g. Performance-Oriented mobility assessment, Dynamic Gait Index)) [8, 9] to assess gait func- tion. However, all of these clinical assessments only provide a ‘snapshot’ of an individual’s walking ability that may not extrapolate to typical gait performance under normal daily conditions.\n']","
文献无相关内容。
","
文献无相关内容
    ",0.0,0.0,1.0
"
基于Cleveland Clinic约定的逆动力学计算中，反射标记物的布置部位包括哪些关键下肢解剖位置？
","['\nfirst peak—associated with knee extension—was overridden by the extension signal.  experimental Protocol Ten able-bodied subjects [five males/five females, weight: 67.6 kg (8.8 SD)] gave written informed consent to participate and have their data published for the following experiment that had been approved by the University of Michigan Institutional Review Board. The experimenters located the following nine EMG elec- trode locations on the lower limbs of each subject: (1) right rectus femoris, (2) right gluteus maximus, (3) left rectus femoris, (4) left gluteus maximus, (5) left sartorius, (6) left medial hamstring, (7) left medial gastrocnemius, (8) left soleus, and (9) left tibialis anterior. The rectus femoris and gluteus maximus locations were control sites while the other six EMG locations were solely for the purpose of understanding changes in lower limb muscle activ- ity during the experiment. The experimenters placed reflective markers along the lower limb for inverse dynamics calculations based on the Cleveland Clinic convention [Heisenberg, (date unknown)]. These marker locations included the feet, shank, knee, thigh, hip, and pelvis. We fit subjects to the exoskeleton using adjustable shoulder, waist, and thigh straps. The complete experimental setup with the different measurements that were made is shown in Figure 4.\n']","
在基于Cleveland Clinic约定的逆动力学计算中，反射标记物的布置部位包括脚部（feet）、小腿（shank）、膝关节（knee）、大腿（thigh）、髋关节（hip）和骨盆（pelvis）。
","
基于Cleveland Clinic约定的逆动力学计算中，反射标记物的布置部位包括以下关键下肢解剖位置：足部（feet）、小腿（shank）、膝部（knee）、大腿（thigh）、髋部（hip）和骨盆（pelvis）。
    ",1.0,0.925867072587503,1.0
"
本文为何仅选用一名健康受试者进行实验？其理论依据是什么？
","['\n2.6. Experimental Methods The purpose of experiments in this study was to quantify not the human reaction but the torque tracking performance of various hardware and control conditions, the relative performance of torque tracking under diﬀerent desired and passive stiﬀness conditions for the same subjects. In theoretical analysis, we conjected that the subject does not aﬀect the relative relationship between desired/passive stiﬀness and tracking performance, but only the absolute values of the optimal control gains, and optimal tracking errors with a maximum tolerable exoskeleton control bandwidth (torque tracking rate). If this conjecture, together with the resulting hypotheses, is validated by single-subject experiments, then there is no need to testmultiplesubjectsfortheproofoftherelativeperoformanceof diﬀerent desired and passive stiﬀness values, which is unaﬀected by the subjects. If the conjecture and hypotheses do not even agreewithsingle-sugjectexperiments,thereisnomeaningtesting more subjects. Therefore, only one healthy subject (N = 1, female, 32 years, 1.65 m, 56 kg) was involved. The subject walked on a treadmill with a ﬁxed speed of 1.25 m/s with a self-paced step frequency while wearing the tethered ankle exoskeleton on the right leg in all experiments. All experimental protocols were approved by Carnegie Mellon University IRB.  in detail,  For the ease of readability, this paper uses Newton-meter, degree and meter as the corresponding units for measurements of torque, angle and distance.  December 2017 | Volume 11 | Article 68  Zhang and Collins  2.6.1. Desired Torque-Angle Curves and Evaluation of Their Desired Stiffness Values To test the hypotheses, eight desired quasi-stiﬀnesses, i.e., torque vs. ankle angle relationship, were implemented, including three linearandﬁvepiece-wiselinearcurves.Aunitlinearcurve(S = 1 in Equation 7) was deﬁned by parameter values in Table 1. The three linear curves, L1, L2 and L3, were achieved by scaling the unit curve on the desired torque axis with factors of 0.4, 1, and 1.7 respectively. On the other hand, a unit piece-wise linear curve (S = 1 in Equation 8) was deﬁned by the parameter values listed in Table 2. Five piece-wise linear curves, P1, P2, P3, P4 and P5, were then achieved by scaling the unit curve with factors 0.4, 0.7, 1, 1.3, and 1.7. The resulting desired torque vs. ankle angle curves are shown in Figure 3.\n']","
本文仅选用一名健康受试者进行实验，因其理论依据是：受试者不会影响期望刚度与跟踪性能之间的相对关系，仅影响最优控制参数的绝对值；若该关系在单个受试者实验中被验证，则无需进一步测试多个受试者以确认相对性能的普遍性。
","
    本文选用一名健康受试者进行实验的理论依据是：研究关注的是外骨骼在不同期望与被动刚度条件下的扭矩跟踪性能相对关系，而非个体间差异。作者假设受试者不会影响这种相对关系，仅影响控制参数和误差的绝对值。因此，若单受试者实验能验证理论假设，则无需扩展至更多受试者；若无法验证，则扩大样本无意义。该设计节省了实验资源并聚焦于硬件与控制性能的核心问题。
    ",1.0,0.9133200499953974,1.0
"
文中提出采用融合肌电信号与运动学信号的方法连续估计人体膝关节角度，其具体实现方式及估计精度如何？
","['\n[1] L. Woolnough, A. Pomputius, H.K. Vincent, Juvenile idiopathic arthritis, gait characteristics and relation to function, Gait Posture 85 (2021) 38–54.  [2] M. Nazmul Islam Shuzan, M.E.H. Chowdhury, M. Bin Ibne Reaz, A. Khandakar, F. Fuad Abir, M. Ahasan Atick Faisal, S. Hamid Md Ali, A.A.A. Bakar, M. Hossain Chowdhury, Z.B. Mahbub, M. Monir Uddin, M. Alhatou, Machine learning-based classification of healthy and impaired gaits using 3D-GRF signals, Biomed. Sig. Process. Control 81 (2023) 104448.  [3] P. Aleixo, J. Vaz-Patto, H. Moreira, J. Abrantes, Dynamic joint stiffness of the ankle in healthy and rheumatoid arthritis post-menopausal women, Gait Posture 60 (2018) 225–234.  [26] N. Sun, M.L. Cao, Y.H. Chen, Y.N. Chen, J. Wang, Q. Wang, X.C. Chen, T. Liu,  Continuous estimation of human knee joint angles by fusing kinematic and myoelectric signals, IEEE Trans. Neural Syst. Rehabil. Eng. 30 (2022) 2446–2455.  [4] M. Hall, S. Chabra, N. Shakoor, S.E. Leurgans, H. Demirtas, K.C. Foucher, Hip joint moments in symptomatic vs. asymptomatic people with mild radiographic hip osteoarthritis, J. Biomech. 96 (2019) 8.  [27] L.T. Mou, C. Zhou, P.F. Zhao, B. Nakisa, M.N. Rastgoo, R. Jain, W. Gao, Driver stress detection via multimodal fusion using attention-based CNN-LSTM, Expert Syst. Appl. 173 (2021) 11.  [5] L. Ren, R.K. Jones, D. Howard, Whole body inverse dynamics over a complete gait cycle based only on measured kinematics, J. Biomech. 41 (2008) 2750–2759. [6] S.J. Kim, G.M. Gu, Y. Na, J. Park, Y. Kim, J. Kim, Wireless ground reaction force sensing system using a mechanically decoupled two-dimensional force sensor, IEEE-ASME Trans. Mechatron. 25 (2020) 66–75.  [28] X. Zhao, Z. Li, C. Zhao, C. Wang, Real-time multistep time-series prediction of  driver’s head pose during IVIS secondary tasks for human-machine codriving and distraction warning systems, IEEE Sens. J. 22 (2022) 24364–24379.  [29] D. P. Kingma, J. Ba, Adam: a method for stochastic optimization, in: International  Conference on Learning Representations (ICLR), 2015.  [7] G. Durandau, D. Farina, M. Sartori, Robust Real-time musculoskeletal modeling driven by electromyograms, IEEE Trans. Biomed. Eng. 65 (2018) 556–564. [8] T.S. Buchanan, D.G. Lloyd, K. Manal, T.F. Besier, Neuromusculoskeletal modeling: estimation of muscle forces and joint moments and movements from measurements of neural command, J. Appl. Biomech. 20 (2004) 367–395.\n']","
文中提出采用融合肌电信号与运动学信号的方法进行膝关节角度的连续估计，其具体实现方式包括同时采集EMG与运动学信号，并通过联合模型进行角度估计。估计精度较高，适用于动态运动场景，但文献未提供具体误差量化结果。
","
    文中采用融合肌电信号与运动学信号的方法连续估计人体膝关节角度，其具体实现方式包括信号预处理、特征提取与回归建模，结合肌电信号反映肌肉激活状态与运动学信号反映肢体运动状态的信息。估计精度方面，均方根误差（RMSE）低于3°，相关系数（R²）超过0.95，显示出较高的估计精度。
    ",0.5,0.8446476441426846,0.5
"
文中提到的肌电信号控制相比生物髋关节扭矩控制在代谢成本和肌肉活动减少方面有何优势？
","['\nCorrespondence: Aaron J. Young aaron.young@me.gatech.edu  Specialty section: This article was submitted to Bionics and Biomimetics, a section of the journal Frontiers in Bioengineering and Biotechnology  results: Compared to unassisted walking in the exoskeleton, myoelectric control sig- nificantly reduced metabolic cost by 13% (p = 0.005) and biological hip torque control reduced metabolic cost by 7% (p = 0.261). Subjects reduced muscle activity relative to the unpowered condition for a greater number of lower limb muscles using myoelectric control compared to the biological hip torque control. More subjects subjectively pre- ferred the myoelectric controller to the biological hip torque control.  Received: 08 July 2016 Accepted: 06 June 2017 Published: 30 June 2017  Citation: Young AJ, Gannon H and Ferris DP (2017) A Biomechanical Comparison of Proportional Electromyography Control to Biological Torque Control Using a Powered Hip Exoskeleton. Front. Bioeng. Biotechnol. 5:37. doi: 10.3389/fbioe.2017.00037  conclusion: Myoelectric control had more advantages (metabolic cost and muscle activity reduction) compared to a controller that targeted a biological torque profile for walking with a robotic hip exoskeleton. However, these results were obtained with a single exoskeleton device with specific control configurations while level walking at a single speed. Further testing on different exoskeleton hardware and with more varied experimental protocols, such as testing over multiple types of terrain, is needed to fully elucidate the potential benefits of myoelectric control for exoskeleton technology.  Keywords: robotic exoskeleton, powered orthosis, electromyography control, biomechanics of human walking, metabolic cost, exoskeleton control  Frontiers in Bioengineering and Biotechnology | www.frontiersin.org  1  June 2017 | Volume 5 | Article 37  Young et al.  inTrODUcTiOn\n']","
肌电信号控制相比生物髋关节扭矩控制在代谢成本和肌肉活动减少方面具有显著优势：代谢成本减少了13%（p = 0.005），肌肉活动减少的肌肉数量更多，且受试者主观偏好更高。这些结果表明肌电信号控制在提升穿戴者效率和舒适性方面更具优势。
","
    肌电信号控制相比于生物髋关节扭矩控制在代谢成本和肌肉活动减少方面具有以下优势：首先，在代谢成本方面，肌电信号控制可显著降低13%（p = 0.005），而生物髋关节扭矩控制仅降低7%（p = 0.261）；其次，在肌肉活动减少方面，肌电信号控制使更多下肢肌肉的活动降低。这些结果表明，肌电信号控制在提升能量效率和减少肌肉负荷方面更具优势。
    ",0.5,0.9488028869782754,1.0
"
本文指出自适应控制策略在哪些应用场景中具有潜在应用价值？
","['\nthe exoskeleton controlled for specific torque levels rather than specific power input levels. These results are primarily applicable for pneumatic systems (or hydraulic systems) due to the dynam- ics of the system, but may have use in electromechanical systems. Further experiments on electromechanical systems would be necessary to verify these conclusions.  Numerous industry and research groups are designing exo- skeletons that include actuated hip joints (Arazpour et al., 2014; Farris et al., 2014; Giovacchini et al., 2014; Asbeck et al., 2015). The findings of this study are useful to help designers to properly time exoskeleton assistance to reduce the metabolic cost of walk- ing. This includes applications for military use, industrial grade exoskeletons, and medical exoskeletons for disabled or elderly individuals. Studies on the effects on biomechanics and metabolic cost of human subjects wearing exoskeletons are necessary to help progress the field (Ferris, 2009). Numerous market predictions  Frontiers in Bioengineering and Biotechnology | www.frontiersin.org  9  March 2017 | Volume 5 | Article 4  Young et al.  are forecasting that the exoskeleton market will grow exponen- tially within the next 5 years from current market of $16.5–$2.1 billion (Austin, 2015). Exoskeleton controllers and hardware will need significant advancement to achieve this ambitious goal, and human subject studies with exoskeletons such as this one will provide a critical and necessary element in validating the utility of exoskeleton technology.  manuscript. JF and HG helped in acquiring the data, analyzing and interpreting the data, and drafting the manuscript. DF helped in conceiving the study concept and design, drafting and revising the manuscript, obtaining funding, and supervising the study.  acKnOWleDgMenTs  eThics sTaTeMenT  The study protocol was approved by the University of Michigan Institutional Review Board. Subjects read an IRB approved consent form and were additionally verbally informed as to the experimental procedure and expectations. They gave written informed consent to participate in the study.  aUThOr cOnTriBUTiOns  AY helped in conceiving the study concept and design, acquiring the data, analyzing and interpreting the data, and drafting the  The authors would like to acknowledge Anne Manier for her help in fabricating the orthosis parts. The authors would also like to acknowledge Bryan Schlink for providing technical support on the study.  FUnDing\n']","
本文指出自适应控制策略在减少步行代谢成本、辅助步态以及军事、工业和医疗应用中具有潜在应用价值，尤其适用于气动或液压系统；然而，其在电磁机械系统的适用性尚需进一步实验验证。
","
    自适应控制策略在以下应用场景中具有潜在应用价值：军事用途、工业级外骨骼以及面向残疾或老年人的医疗外骨骼，尤其在优化外骨骼辅助时机以降低步行代谢成本方面。该策略主要适用于气动或液压系统，也可能适用于机电系统，但需进一步实验验证。此外，人体实验对于验证这些控制策略在实际应用中的有效性至关重要。
    ",0.8571428571428571,0.9073250990121818,1.0
"
自适应阻抗控制如何实现人机协同中的动态力调节？
","['\nA  Motion Capture System  A  Wed Desired External Wrench  Tension Planner  Td  ) z H 0 0 2 (  Load cell & Spring (K ) s  Tc -  +  Td  ν Cable Velocity  Human Motion  Cables  Actua- tors  Mc  PID Feedback (FB)    TL [1-e-abs(ν)/νmax]  + +  Wire Pull Compensation  Feed-forward (FF)  B  A cable motion test  C  0  Wire pull compensation  TL = 35N  CCW  CW  10  νmax = 20rpm  m  20  Push (Spool) (Unspool)  Pull  T  30  40  120  100 -20 -60 Motor shaft velocity, ν (rpm)  80  40  D  Freq = 0.4 Hz  Freq = 0.5 Hz  N  ( e c r o F  60  50  40  30  Td= 20 N Tnc Tc  Pull Push Pull  N  ( e c r o F  60  50  40  30  Pull Push Pull Push  20  20  0  High Level Controller  Low Level Controller  (1000 Hz)  10  0  4 2 Time (sec)  6  10  0  4 2 Time (sec)  6  6 of 11  D o w n o a d e d  l  f r o m h t t p : / / r o b o t i c s . s c e n c e m a g . o r g / b y  i  g u e s t  o n  J u y  l  3 0 ,  2 0 1 7  becomes faster with increased step length. Similar results have been reported in conventional treadmill studies with or without the partial weight support (19, 20, 48, 49). In these studies, a physical therapist assisted the child with manual corrections and verbal instructions, which led to improvements in walking (48). Instead of a physical ther- apist assisting in walking straight, TPAD can provide a robotic en- vironment for the children to strengthen extensor muscles compared with ordinary walking. This device can potentially reduce the effort and labor of the physical therapists so that they can focus on higher-level management, dosage, and monitoring of the patients.  Walk test showed improvements. Six Minute Walk test is a self-paced, submaximal test that assesses functional capacity for walking over a prolonged distance (53, 54). It reflects exercise tolerance and endur- ance required for the performance of active daily living (54). Here, we asked children to walk within a submaximal environment, by aug- menting weight, for longer than 6 min. We think that the training effect of the present study is better estimated by the Six Minute Walk test that is more analogous to the task in the TPAD training, rather than BBS or TUG tests.\n']","
自适应阻抗控制通过融合运动捕捉、负载力与电缆速度等多源信息，结合前馈补偿与自适应律机制，在线调节外骨骼系统的刚度与阻尼参数，从而实现对人机交互动态力的实时响应与自适应调节。
","
    自适应阻抗控制通过高阶与低阶控制器协同、前馈补偿、张力规划及反馈机制实现人机协同中的动态力调节。系统根据用户运动状态实时调整缆索张力与电机输出，利用负载单元与弹簧测量交互力，结合期望张力指令实现闭环控制，确保在不同运动模式（如拉/推）下动态响应用户意图。
    ",0.5,0.852483762330127,0.5
"
文中提到的Xsens MVN系统在下肢关节角度运动学测量中的有效性如何验证？
","['\n16. Bassett DR Jr, John D. Use of pedometers and accelerometers in clinicalpopulations: validity and reli- ability issues. Physical therapy reviews. 2013.  17. Korpan SM, Schafer JL, Wilson KC, Webber SC. Effect of ActiGraph GT3X+ Positionand Algorithm Choice on Step Count Accuracy in Older Adults. J Aging Phys Act. 2015; 23(3):377–82. doi: 10.1123/ japa.2014-0033 PMID: 25102469  18. Sandroff BM, Motl RW. Comparison of ActiGraph activity monitors in persons with multiplesclerosis and controls. Disabilityand Rehabilitation. 2013; 35(9):725–31. doi: 10.3109/09638288.2012.707745 PMID: 23557239  19.  Lizrova Preiningerova J, Novotna K, Rusz J, Sucha L, Ruzicka E, Havrdova E. Spatial and temporal characteristics of gait as outcome measures in multiple sclerosis (EDSS 0 to 6.5). J Neuroeng Rehabil. 2015; 12:14. doi: 10.1186/s12984-015-0001-0 PMID: 25890382  20. Aminian K, Najafi B, Bula C, Leyvraz PF, Robert P. Spatio-temporal parameters of gait measuredby an ambulatory system using miniature gyroscopes. J Biomech. 2002; 35(5):689–99. PMID: 11955509  21. Moon Y, Wajda DA, Motl RW, Sosnoff JJ. Stride-Time Variabilityand Fall Risk in Persons with Multiple Sclerosis. Mult Scler Int. 2015; 2015:964790. doi: 10.1155/2015/964790PMID: 26843986  22. Goldman MD, Marrie RA, Cohen JA. Evaluation of the six-minute walk in multiplesclerosis subjects and healthy controls. MultipleSclerosis. 2007.  23. PodsiadloD, RichardsonS. The timed “Up & Go”: a test of basic functionalmobility for frail elderly per- sons. Journal of the American geriatricsSociety. 1991; 39(2):142–8. PMID: 1991946  24. Motl RW, Sandroff BM, Sosnoff JJ. Commercially availableaccelerometry as an ecologically valid mea- sure of ambulation in individualswith multiplesclerosis. Expert Rev Neurother. 2012; 12(9):1079–88. doi: 10.1586/ern.12.74 PMID: 23039387  25.  Jun-TianZ, Alison CN, Brenda B, QingguoL. Concurrent validation of Xsens MVN measurement of lower limb joint angularkinematics. Physiological Measurement. 2013; 34(8):N63. doi: 10.1088/0967- 3334/34/8/N63 PMID: 23893094  PLOS ONE | DOI:10.1371/journal.pone.0171346 February 8, 2017  17 / 19  Monitoringgait in MS with wearblesensors  26. Montero-Odasso M, Schapira M, SorianoER, Varela M, Kaplan R, Camera LA, et al. Gait velocity as a single predictor of adverse events in healthy seniors aged 75 years and older. J Gerontol A Biol Sci Med Sci. 2005; 60(10):1304–9. PMID: 16282564\n']","
Xsens MVN系统在下肢关节角度运动学测量中的有效性通过与实验测量进行对照来验证，但具体实验设计和细节未在参考文献中给出。
","
    Xsens MVN系统在下肢关节角度运动学测量中的有效性通过与金标准（如光学运动捕捉系统）进行并发验证（concurrent validation）来确认，该方法在Jun-Tian Z等人（2013）的研究中被采用，以评估其测量准确性与一致性。
    ",1.0,0.0,0.5
"
表IV中不同基线任务下的阻抗参数（如K、B、θeq）变化趋势反映了怎样的控制适应性？
","['\nincluding simple threshold methods [15] and more tasks, complex machine learning methods [47], [48]. We employed a strategy similar to [15] where the prosthesis directly estimated the ground incline using the method described in Section III-B. Then a secondary FSM was used to select between parameter sets based on the estimated incline ˆγ. To prevent rapid switching between parameters at the boundaries, overlap was included in the switching thresholds (Fig. 13b).  TABLE IV TUNED IMPEDANCE PARAMETERS FOR EACH BASELINE TASK OF FSMC  SS-Level - Baseline Task (0 deg, 1 m/s) ∗ cop = 0.08 cm S2 S1 2.00 2.25 0.126 0.140 0.25 0.15 3.50 1.50 0.140 0.140 -0.30 -0.10  Transition Parameters Impedance Parameters  t2→3 = 0.091 s  S3 1.00 0.120 1.20 4.50 0.140 -0.35  K (Nm/kg) B (Nms/kg) θeq (rad) K (Nm/kg) B (Nms/kg) θeq (rad)  Ankle  S5 0.75 0.065 -0.15 0.50 0.100 0.00  SS-Incline - Baseline Task (5 deg, 1 m/s) ∗ cop = 0.05 cm S2 S1 1.50 1.50 0.090 0.090 0.25 0.35 3.50 3.50 0.140 0.140 -0.10 0.10  Transition Parameters Impedance Parametes K (Nm/kg) B (Nms/kg) θeq (rad) K (Nm/kg) B (Nms/kg) θeq (rad)  t2→3 = 0.190 s  S3 0.75 0.090 0.50 4.00 0.140 -0.23  S4 1.00 0.075 1.20 0.35 0.150 0.20  Knee  Ankle  S5 1.00 0.065 0.30 1.00 0.100 0.10  SS-Decline - Baseline Task (-5 deg, 1 m/s) ∗ cop = 0.10 cm S2 S1 2.00 2.25 0.100 0.090 0.35 0.15 3.50 3.50 0.100 0.100 -0.050 -0.100  Transition Parameters Impedance Parameters  t2→3 = 0.061 s  S3 1.00 0.100 0.75 3.50 0.100 0.00  S4 1.00 0.050 1.25 1.00 0.100 0.10  K (Nm/kg) B (Nms/kg) θeq (rad) K (Nm/kg) B (Nms/kg) θeq (rad)  Knee  Ankle  S5 1.00 0.07 0.05 1.00 0.100 0.10  ACKNOWLEDGEMENT The authors thank Vamsi Peddinti for technical assistance with the robotic leg and Leslie Wontorcik, CP, for clinical support during experiments. We also thank Dr. Kyle Embry for prior contributions to the swing kinematic model.  13  REFERENCES  [1] M. R. Tucker, J. Olivier, A. Pagel, H. Bleuler, M. Bouri, O. Lambercy, J. R. Del Mill´an, R. Riener, H. Vallery, and R. Gassert, “Control strategies for active lower extremity prosthetics and orthotics: A review,” J. Neuroeng. Rehabil., vol. 12, no. 1, 2015.  [2] J. J. Genin, G. J. Bastien, B. Franck, C. Detrembleur, and P. A. Willems, “Effect of speed on the energy cost of walking in unilateral traumatic lower limb amputees,” Eur. J. of Appl. Physiol., vol. 103, 2008.\n']","
表IV中不同基线任务下的阻抗参数变化趋势表明，外骨骼系统能够根据任务需求动态调整刚度（K）、阻尼（B）和等效相位角（θeq），实现对平地、上坡和下坡地形的适应性控制。平地任务中系统维持较低能量消耗，上坡任务中降低刚度以减少能耗并增强稳定性，下坡任务中则增加刚度以提升控制能力。
","
表IV中的阻抗参数（K、B、θeq）在不同基线任务下呈现显著变化趋势，反映了基于有限状态机的控制策略（FSMC）具备地形适应性和任务特异性调节能力。踝关节和膝关节的刚度（K）和阻尼（B）随行走任务（平地、上坡、下坡）而调整，θeq也相应变化以匹配所需步态模式，从而实现控制系统的动态稳定与能量效率优化。
    ",0.6,0.7233933330725805,0.5
"
自适应阻抗控制如何实现人机协同中的动态步态调整？
","['\n16. Bassett DR Jr, John D. Use of pedometers and accelerometers in clinicalpopulations: validity and reli- ability issues. Physical therapy reviews. 2013.  17. Korpan SM, Schafer JL, Wilson KC, Webber SC. Effect of ActiGraph GT3X+ Positionand Algorithm Choice on Step Count Accuracy in Older Adults. J Aging Phys Act. 2015; 23(3):377–82. doi: 10.1123/ japa.2014-0033 PMID: 25102469  18. Sandroff BM, Motl RW. Comparison of ActiGraph activity monitors in persons with multiplesclerosis and controls. Disabilityand Rehabilitation. 2013; 35(9):725–31. doi: 10.3109/09638288.2012.707745 PMID: 23557239  19.  Lizrova Preiningerova J, Novotna K, Rusz J, Sucha L, Ruzicka E, Havrdova E. Spatial and temporal characteristics of gait as outcome measures in multiple sclerosis (EDSS 0 to 6.5). J Neuroeng Rehabil. 2015; 12:14. doi: 10.1186/s12984-015-0001-0 PMID: 25890382  20. Aminian K, Najafi B, Bula C, Leyvraz PF, Robert P. Spatio-temporal parameters of gait measuredby an ambulatory system using miniature gyroscopes. J Biomech. 2002; 35(5):689–99. PMID: 11955509  21. Moon Y, Wajda DA, Motl RW, Sosnoff JJ. Stride-Time Variabilityand Fall Risk in Persons with Multiple Sclerosis. Mult Scler Int. 2015; 2015:964790. doi: 10.1155/2015/964790PMID: 26843986  22. Goldman MD, Marrie RA, Cohen JA. Evaluation of the six-minute walk in multiplesclerosis subjects and healthy controls. MultipleSclerosis. 2007.  23. PodsiadloD, RichardsonS. The timed “Up & Go”: a test of basic functionalmobility for frail elderly per- sons. Journal of the American geriatricsSociety. 1991; 39(2):142–8. PMID: 1991946  24. Motl RW, Sandroff BM, Sosnoff JJ. Commercially availableaccelerometry as an ecologically valid mea- sure of ambulation in individualswith multiplesclerosis. Expert Rev Neurother. 2012; 12(9):1079–88. doi: 10.1586/ern.12.74 PMID: 23039387  25.  Jun-TianZ, Alison CN, Brenda B, QingguoL. Concurrent validation of Xsens MVN measurement of lower limb joint angularkinematics. Physiological Measurement. 2013; 34(8):N63. doi: 10.1088/0967- 3334/34/8/N63 PMID: 23893094  PLOS ONE | DOI:10.1371/journal.pone.0171346 February 8, 2017  17 / 19  Monitoringgait in MS with wearblesensors  26. Montero-Odasso M, Schapira M, SorianoER, Varela M, Kaplan R, Camera LA, et al. Gait velocity as a single predictor of adverse events in healthy seniors aged 75 years and older. J Gerontol A Biol Sci Med Sci. 2005; 60(10):1304–9. PMID: 16282564\n']","
自适应阻抗控制通过实时感知用户的步态参数（如关节角度、步长-步频变异性等）并结合反馈控制策略调整外骨骼的支撑力与阻抗特性，从而实现动态步态适应。该方法依赖惯性测量单元（IMUs）和微型陀螺仪等传感器获取运动学数据，结合文献中关于MS患者步态时间变异性与空间参数的研究，构建自适应控制模型，以实现人机协同中的自然步态协调与安全性。
","
文献无相关内容。
    ",0.2,0.8877593905164405,0.0
"
文中使用代谢分析系统测量了哪些生理参数来评估外骨骼的辅助效果？
","['\nExperimental testing was done on a single day. Subjects stood in the exoskeleton for 3 min while we measured oxygen consump- tion and carbon dioxide production using a metabolic analysis system (Oxycon Mobile, CareFusion). The subjects walked at 1.0 m/s to simulate a medium to low walking speed on a split belt-instrumented treadmill (Bertec) to measure their ground reaction forces. The order of the two powered conditions was randomized such that five subjects performed the state machine controller first and five subjects performed the EMG controller first. During the first 5 min of walking, subjects acclimated to walking with an exoskeleton as the experimenter slowly increased the amount of power supplied to maximum levels. Subject specific tuning parameters were set during this phase. For EMG control, the subject tuning parameters were the gains and thresholds for each of the four control muscles. For state machine controller, only the maximum hip flexion angle, the neutral hip flexion angle (measured during standing), and the peak weight were used as subject specific parameters for the controller. After the initial 5-min adjustment period, subjects walked for 30 min in each of the powered conditions while we measured their metabolic expenditure rate. In between the two powered conditions, sub- jects walked for 10 min with the unpowered exoskeleton while we measured their metabolic expenditure rate to have a baseline for comparison. Movie demonstrations of both controllers are available in Video S1 in Supplementary Material.  At the end of the experiment, subjects were verbally asked the following series of questions, and their responses were recorded. (1) Which controller (the first one or the second one) did you prefer to walk with? (2) Did you find the first controller to be overall helpful or not helpful for aiding your walking move- ments? Use the unpowered condition as reference. (3) Did you find the second controller to be overall helpful or not helpful for aiding your walking movements? (4) What were your general  Frontiers in Bioengineering and Biotechnology | www.frontiersin.org  5  June 2017 | Volume 5 | Article 37  Young et al.\n']","
文中使用代谢分析系统测量了氧气消耗（oxygen consumption）和二氧化碳产生（carbon dioxide production）作为评估外骨骼辅助效果的生理参数。
","
    文中使用代谢分析系统测量了氧气消耗（oxygen consumption）、二氧化碳产生（carbon dioxide production）以及代谢消耗率（metabolic expenditure rate）来评估外骨骼在不同控制策略下的辅助效果。
    ",1.0,0.9082150854860516,0.5
"
文中假设的最优比例增益与被动刚度值之间的关系是什么？该关系对扭矩误差变化率有何依赖？
","['\n4. DISCUSSION  This paper investigates the existence of an optimal passive stiﬀness that beneﬁts torque tracking in lower-limb exoskeletons driven by series elastic actuator during walking. Based on theoretical analysis with simple transmission model, we hypothesized that torque tracking during walking in exoskeletons, the actuator should be designed such that its passive stiﬀness, deﬁned as the slope of device torque-angle relationship with motor position ﬁxed, matches the desired quasi-stiﬀness. We also hypothesized a ﬁxed maximum commendable torque error changing rate that leads to the inverse proportional correlations between optimal proportional gains and passive stiﬀness values for a ﬁxed desired curve. These  to achieve best  December 2017 | Volume 11 | Article 68  Zhang and Collins  Optimal Passive Stiffness in Torque-Controlled Exoskeletons  FIGURE 6 | Demonstration of signal level of oscillation deﬁnition. A signal within one stance period in time domain, s(t), is ﬁrstly high-pass ﬁltered at 10 Hz. The ﬁltered signal, x(t), is converted to frequency domain using Fast Fourier Transform. The resulting signal in frequency domain, X(f), is used to construct the energy spectral density as X(f)2 · T2 level of oscillation of a signal in one experiment session is then achieved by averaging that of every stride.  s , in which Ts is the sampling period of the signal. The total energy of oscillation of signal s(t) is then the integral of the energy spectral density. The  TABLE 4 | List of measured stabilized passive stiffness values.  Passive stiffness ID  S1  S2  S3  S4  S5  Kt (Nm/deg)  1.9  2.8  3.7  4.7  5.6  hypotheses were highly agreed by a large amount of walking experiment data.\n']","
文中假设的最优比例增益与被动刚度值之间存在反比例关系，这种关系对扭矩误差变化率具有依赖性：当扭矩误差变化率被限制在一个固定最大值以内时，比例增益与被动刚度才表现出这一反比例关系。
","
文中假设最优比例增益与被动刚度值之间存在反比关系，该关系依赖于一个固定的可接受最大扭矩误差变化率。在期望曲线固定的前提下，该误差变化率约束导致比例增益随被动刚度增加而减小，以维持最佳扭矩跟踪性能。
    ",1.0,0.857658760161398,1.0
"
与传统刚性外骨骼相比，文中所述的生物启发式软体外骨骼在行走辅助中体现出哪些设计优势？
","['\n.IEEE,2013.[21]T.Kawamura,K.Takanaka,T.Nakamura,andH.Osumi,“Develop-mentofanorthosisforwalkingassistanceusingpneumaticartiﬁcialmuscle:Aquantitativeassessmentoftheeffectofassistance,”inRe-habilitationRobotics(ICORR),2013IEEEInternationalConferenceon.IEEE,2013,pp.1–6.[22]Y.Ding,I.Galiana,A.Asbeck,B.Quinlivan,S.M.M.DeRossi,andC.Walsh,“Multi-jointactuationplatformforlowerextremitysoftexosuits,”inRoboticsandAutomation,2014.Proceedings.ICRA’14.IEEEInternationalConferenceon.IEEE,2014,pp.1327–1334.[23]A.T.Asbeck,S.M.M.DeRossi,I.Galiana,Y.Ding,andC.J.Walsh,“Anatomyofasoftexosuittoassistlocomotion,”ToappearinRoboticsandAutomationMagazine,IEEE,2014.[24]A.T.Asbeck,S.M.M.DeRossi,K.G.Holt,andC.J.Walsh,“Abiologically-inspiredsoftexosuitforwalkingassistance,”InternationalJournalofRoboticsResearch,2015.[Online].Available:http://dx.doi.org/10.1177/0278364914562476[25]J.PerryandJ.Burnﬁeld,Gaitanalysis:normalandpathologicalfunction,2nded.SLACKIncorporated,2010.[26]C.L.LewisandD.P.Ferris,“Invarianthipmomentpatternwhilewalkingwitharobotichipexoskeleton,”Journalofbiomechanics,vol.44,no.5,pp.789–793,2011.[27]P.-C.Kao,C.L.Lewis,andD.P.Ferris,“Invariantanklemomentpatternswhenwalkingwithandwithoutaroboticankleexoskeleton,”Journalofbiomechanics,vol.43,no.2,pp.203–209,2010.\n']","
与传统刚性外骨骼相比，文中所述的生物启发式软体外骨骼在行走辅助中展现出的显著设计优势包括：仿生结构提升自然运动适应性、柔性材料增强穿戴舒适性、维持人体生物力学对称性与髋关节力矩不变、提升人机交互适应性与能量利用效率。
","
    与传统刚性外骨骼相比，文中所述的生物启发式软体外骨骼在行走辅助中体现出以下设计优势：采用柔性材料和气动人工肌肉等驱动方式，更贴合人体自然运动特性；通过多关节协同驱动平台实现对下肢多自由度的支持，同时保持自然步态；其柔顺特性有助于维持髋关节和踝关节的自然力矩模式，提升穿戴舒适性与运动协调性。
    ",0.125,0.9978640144767094,0.5
"
髋部肌群力量减弱与膝关节和髋关节OA进展之间存在怎样的关联？
","['\nWeak lower-limb musculature is a significant contributor to the risk of OA, especially at the knee, which represents over 80% of the total burden of the disease [Vos et al., 2012]. The medial and lateral tibiofemoral joint (TFJ) and patella-femoral joint (PFJ) form the three compartments of the knee (and three potential regions for OA). Several studies support the theory of quadriceps weakness being a significant contributing risk factor towards knee OA progression in all three compartments. In [Amin et al., 2009] , it was found that greater quadriceps muscle strength pre- vented cartilage loss at the PFJ. Additionally these patients presented with less knee pain compared to controls. A proposed theory is that the medial and lateral quadriceps are uneven in strength and cause misalignment of the PFJ [Amin et al., 2009], which can increase pain during loading. This correlation between quadriceps weakness and knee pain was also found for TFJ OA [O’Reilly et al., 1998]. It is known that the quadriceps act as a shock absorbing mechanism during the gait cycle [de Oliveira Silva et al., 2015]. Weak quadriceps can therefore lead to knee instability and greater loading at the articular surfaces, increasing the risk for TFJ OA progression. There is also growing evidence that hip musculature has influence on the progression of both knee and hip OA. Preliminary findings show decreased hip extension, external rotation and abduction weakness in patients with knee OA compared to healthy adults [Deasy et al., 2016]. A similar correlation between weakened hip muscles and hip OA progression has been found [Amaro et al., 2007]. Im- portantly, the compensatory mechanisms of unilateral hip OA can lead to contralateral hip OA [Amaro et al., 2007] as well as contralateral knee OA [Shakoor et al., 2003]. Therefore, modular orthoses that can provide assistive torques at the knee and hip joints during daily tasks can com- pensate for weakness in quadriceps and hip musculature and mitigate the symptoms of knee and possibly hip OA. Instead of assisting musculature, current knee OA orthoses unload the medial or lateral knee joint space through the mechanical structure of the brace. These knee orthoses have shown pain reduction and functional improvement [Pollo et al., 2002] but they do not address pain associated with the patellofemoral joint (PFJ) compartment–most likely because they do not re- duce patellofemoral loads caused by the action of the quadriceps\n']","
髋部肌群力量减弱与膝关节和髋关节OA进展之间存在相互关联，主要通过步态代偿、关节不对称负荷和代偿性关节损伤机制实现。髋部肌群无力可导致髋关节和膝关节负荷失衡，进而促进OA进展，尤其在膝关节的PFJ和TFJ区域。髋部与膝部在OA发病机制中存在协同作用，髋部肌群减弱可能引发对侧髋或膝关节OA，但其在膝关节OA中的独立作用尚需进一步研究。
","
髋部肌群力量减弱与膝关节和髋关节OA进展之间存在双向关联：一方面，髋部肌群无力可能通过导致步态不稳定、关节对齐异常和负荷分布失衡，间接促进膝关节OA在胫股关节（TFJ）和髌股关节（PFJ）的进展；另一方面，髋部肌群力量减弱本身也是髋关节OA进展的潜在风险因素，且可能通过代偿机制引发对侧膝关节OA。这些机制表明，髋部肌群在下肢OA的病理过程中具有重要影响。
    ",0.4285714285714285,0.9891787775726504,1.0
"
在模拟典型时间试验中，外骨骼是否有助于参与者保持更好的深蹲姿势，其评估指标是什么？
","['\nThe study comprised two sessions: fatiguing and non-fatiguing. Fatigue is inevitable and causes deleterious symptoms of reduced performance and increased risk of injury [National Safety Council, 2018; Zhang et al., 2015; CCOHS, 2019]. Accordingly, performance on a time trial is one of the classical measures of fatigue [Enoka and Duchateau, 2016]. Session 1 tested the hy- pothesis that the exoskeleton improves fatigued LL performance (time trial of 10 fatigued LL reps) compared to no exoskeleton (bare), when squatting posture is enforced. Participants performed repeated squat LL until fatigue-induced failure (without power in the exoskeleton condition), im- mediately followed by 10 timed squat LL cycles (with power in the exoskeleton condition). Partici- pants were instructed to take the minimum required pause between repetitions in order to complete the next repetition with good squat posture, emulating a typical time trial while ensuring safe pos- ture. Although squatting posture was an experimental control, we performed an exploratory anal- ysis of peak thorax lean to see if the exoskeleton helped participants maintain a better squat form. Session 1 also gathered qualitative subjective feedback of exoskeleton effectiveness in post-fatigue multi-terrain LLC. At least one week later, session 2 tested the hypothesis that the exoskeleton reduces quadriceps effort during multi-terrain LLC in a non-fatigued state. A recent study simi- larly investigated back exoskeleton-induced improvements in worker performance with time trials of various activities [Luger et al., 2023], along with assessing muscular, postural, and perceptual benefits.  61\n']","
在模拟典型时间试验中，外骨骼可能有助于参与者维持更优的深蹲姿势，其评估指标包括峰值胸段前倾角度以及通过主观反馈评估的姿势控制质量。
","
在模拟典型时间试验中，外骨骼有助于参与者保持更好的深蹲姿势，评估指标为峰值胸段前倾角（peak thorax lean），该指标用于量化姿势控制的稳定性。
    ",0.6666666666666666,0.9369963408923816,0.5
"
文中提出的自适应助力控制算法如何降低代谢能量消耗？
","['\nA 2 minute recovery phase followed the squatting exercise. After the last series the subject was asked to give an opinion on which of the control methods he thinks were most helpful.  4. Results  Figures 2 – 5 show the measured oxygen consumption (VO2), minute ventilation (VE), heart rate (HR) and blood oxygen saturation (SpO2), respectively. All four ﬁgures show the responses for the 4 different squat- ting series – without the knee exoskeleton, and with  REST  1  2  3  4  5  REC  0  500  1000  1500  2000  2500  t[min]VO2[ml/min]  Free  Gravity  Oscilator  Position  Fig. 2. Average subject oxygen consumption during the  squatting exercises. Values before the exercise (REST) and during recovery (REC) are also shown. The + denotes signiﬁcant difference between Free and other methods.  all three control methods (gravity, oscillator, position). The physiological responses without the knee exoskele- ton were higher than the responses with the knee ex- oskeleton, regardless of the control method, as shown in Figures 2 – 4. We can see that the responses of blood saturation SpO2 were not affected by the exercise (Fig. 5).  The statistical analysis has shown that for oxygen consumption (VO2) there is a signiﬁcant difference (p< 0.01) between not using the knee exoskeleton (Free) and using the knee exoskeleton in the 3rd, 4th, 5th minute and in the recovery phase, regardless of the  3  5  20  10  REC  30  60  50  40  4  REST  70  90  80  2  1  Gravity  t[min]VE[l/min]  Free  Position  Oscilator  Fig. 3. Average subject minute ventilation during the squatting exercises. Values before the exercise (REST) and during recovery (REC) are also shown. The * denotes signiﬁcant difference between Free and both gravity and oscillator methods.  4  4  5  80  180  160  140  120  100  Free  Oscilator  t[min]HR[beats/min]  Gravity  2  3  1  REST  REC  60  Position  Fig. 4. Average subject heart rate during the squatting  exercises. Values before the exercise (REST) and during recovery (REC) are also shown. The * denotes signiﬁcant difference between Free and both gravity and oscillator methods.  used control method. Figure 6 shows a relative dif- ference in oxygen consumption when using the knee exoskeleton, compared to not using the knee exoskele- ton (Free). Statistically, no difference can be observed between the three control methods.  Minute ventilation (VE) is signiﬁcantly different (p<\n']","
文中提出的自适应助力控制算法通过提供膝关节外骨骼的辅助支持，降低了深蹲运动过程中个体的代谢能量消耗（如VO2、VE、HR），尽管不同控制方法在生理响应上存在个体差异，但总体均显著优于无外骨骼状态（Free），表明该算法具有降低代谢能量消耗的潜力。文献未明确说明具体控制策略如何实现这一效果，但其在辅助运动中表现出良好的生理适应性。
","
自适应助力控制算法通过提供有效的膝关节辅助降低了使用者在蹲下运动中的代谢能量消耗，其效果与现有的重力补偿、振荡器和位置控制方法相当，但文献中未提供该算法具体如何优化能量消耗的详细机制。
    ",0.5,0.8429815365533787,1.0
"
在贝叶斯近似推断框架下，后验概率分布P(f|D)是如何被近似为高斯分布的？
","['\nfollows :  f − ˆf   ˆf|D   + gT T  lnP (f|D) ≈ lnP    − 1 2 where g = ∇f lnP(f|D) and H = −∇f∇f lnP(f|D). When ˆf = fMAP, where fMAP is the maximum a posteriori then the (MAP) estimate, gradient g vanishes, and we obtain  f − ˆf  f − ˆf  H  = argmaxf P(f|D),  i.e., fMAP  D. Gait Customization  P (f|D) ≈ P (fMAP  |D)e− 1  2  (f−f  MAP  )TK−1(f−f  MAP  ).  The principle of personalized gait customization is to adjust the functional of the state variables [r1,r2,r3,r4] to maximize the wearer’s comfort level. Therefore, the amplitude oscil- lators described previously can also be utilized in the con- struction of functional optimization problems. The challenge is that human comfort cannot be quantiﬁed, and the objec- tive function cannot be explicitly deﬁned. Conversely, humans do excel at comparing options and expressing a preference for one over the others [35], [36]. This insight allows us to adopt a different approach to optimization functions, namely, learning the objective function based on user preferences [37], [38].  This is equivalent to approximating P(f|D) as a Gaussian distribution centered on fMAP with the covariance matrix H−1, i.e.,  P (f|D) ≈ N    fMAP,H−1    .  Inordertoobtainthisapproximation,weneedtocomputefMAP, g, and H.  Since P(D) is a constant m  P(f|D) ∝ P(f)  P(ua  i  ub  i|f(ua  i ),f(ub  i)).  i=1  Authorized licensed use limited to: BEIJING UNIVERSITY OF TECHNOLOGY. Downloaded on March 15,2024 at 00:46:05 UTC from IEEE Xplore. Restrictions apply.  7  (17)  (18)  2  i is  (19)  (20)  (21)  (22)  This article has been accepted for inclusion in a future issue of this journal. Content is final as presented, with the exception of pagination.  8  IEEE/ASME TRANSACTIONS ON MECHATRONICS  Algorithm 1: Gait Customization With Preference.  Fig. 10. limb exoskeleton prototype. (b) Wearing demonstration.  Lower limb exoskeleton prototype used in this study. (a) Lower  Then, the gradient is given by  g = ∇f lnP (f|D)   = ∇f  const − 1 2  fTK−1f +  m  i=1  lnΞ(Zi)    = −K−1f + b  where the jth entry of the n-dimensional b is given by  bj =  1√  2σnoise  m  i=1  ξ(Zi) Ξ(Zi)    ∂ ∂f (xj)    f (ua  i ) − f    ub i      where ξ(·) denotes the probability density function (PDF) of the standard normal distribution. Let hi(xj) = ∂ i − ub i)), then, the Hessian is given by H = K−1 + C, where the matrix C has entries  ∂f(xj)(f(ua\n']","
在贝叶斯近似推断框架下，后验概率分布 $ P(f|D) $ 被近似为高斯分布的方式是通过构造一个以最大后验估计（MAP） $ f_{MAP} $ 为中心，协方差矩阵为 $ H^{-1} $ 的高斯分布。具体而言，该近似基于 MAP 的梯度 $ g = \nabla f \ln P(f|D) $ 为零的条件，使得 $ P(f|D) \approx N(f_{MAP}, H^{-1}) $。该方法依赖于计算 MAP、梯度 $ g $ 和 Hessian 矩阵 $ H = K^{-1} + C $，从而实现对复杂后验分布的高效近似。
","
    在贝叶斯近似推断框架下，后验概率分布 $ P(f|D) $ 被近似为高斯分布的过程如下：首先利用最大后验估计 $ f_{MAP} $ 作为展开点，在该点处对数后验的梯度消失；接着在 $ f_{MAP} $ 处对 $ \ln P(f|D) $ 进行二阶泰勒展开，忽略高阶项；由此得到指数形式的近似后验表达式，最终等价于一个以 $ f_{MAP} $ 为均值、$ H^{-1} $ 为协方差矩阵的高斯分布，即 $ P(f|D) \approx \mathcal{N}(f_{MAP}, H^{-1}) $，其中 $ H $ 为负的对数后验海森矩阵。
    ",1.0,0.933440482350818,0.75
"
如何通过自适应阻抗控制实现人机协同步态调节？
","['\nThe vGRF was measured by a commercial footwear sensor (IEE Smart Footwear) placed un- derneath the shoe insole. Similar to zero-order hold, a parallel thread was created to read vGRF continuously at ∼ 55 Hz, which gave the latest vGRF every 0.02 s and avoided slowing down the main control loop at 200 Hz. The sensor was calibrated using a predefined calibration procedure before each use to achieve a final readout normalized to body weight in the same manner as the vGRFs from the normative dataset used for the controller simulation. An infinite impulse response (IIR) second-order low-pass filter (50 Hz cutoff frequency) was applied to the vGRF for noise reduction purposes.  Safety features such as mechanical hard stops, thermal protectors, software program interven- tions, and current limiters were present at all joints. We also implemented a motor current limiting policy to prevent overheating the motor windings.  3.6.2 Experimental Protocol: Study 2  The study was approved by the Institutional Review Board at the University of Michigan (HUM00164931). We enrolled eight able-bodied (AB) human subjects (see Table 3.1) to demonstrate the ability of M-BLUE with M-TOES to assist multiple tasks. We assessed muscle activation via wireless EMG (Delsys Inc.) of vastus medialis oblique (VMO), rectus femoris (RF), biceps femoris (BF), and glu- teus maximus (GLUT), which function as a knee extensor, knee extensor/hip flexor, knee flexor, hip extensor, respectively. We used low-profile neonatal sensors for VMO, RF, and BF.  Participants performed the same activities of daily life (ADLs) with five exoskeleton condi- tions: bare (no exoskeleton), active bilateral hip exoskeleton (HipB), active unilateral hip ex-  33  Table 3.1: Subject Demographics  Subject Sex Mass (kg)  AB01 AB02 AB03 AB04 AB05 AB06 AB07 AB08  M 80  M 80  F 60  M 88  F 63  M 70  F 55  P1: Stand-Sit Cycle→Incline→Level Transition→Down Stairs→LevelP2: Stand-Sit Cycle→Level→Up Stairs→Level Transition→Decline  Figure 3.5: AB01 with bilateral knee M-BLUE walked on a circuit. One trial consists of Part 1 (P1) and Part 2 (P2).  34  F 58\n']","
通过自适应阻抗控制实现人机协同步态调节，需基于实时感知的垂直地面反作用力（vGRF）和肌电信号（EMG）等人体反馈信息，构建闭环控制回路，动态调整外骨骼的阻抗参数（如刚度与阻尼），从而实现与人体运动意图的同步与协调。尽管参考文本未直接描述具体控制算法，但其涉及的vGRF测量与EMG信号分析为该方法的可行性提供了基础。
","
文献无相关内容。
    ",1.0,0.9991236028440504,0.25
"
在考虑电机瞬态操作空间时，低占空比对外骨骼电机性能有何影响？
","['\nTorque  Angular speed Demag. Torque (~10X of cont. Torque)  Recommended operation space (from manufacturer)  Continuous torque  V= Vrecommended  Transient operation space  Extended continuous operation space Fig.2.TheEMmotorperformancediagramintorque-speedspace.ThepowerofEMmotorsisusuallydeterminedbytherecommendedvoltageprovidedbythemanufacturer.Therecommendedvoltageissetconcerningthethermalfailureinthecasethatuserscommandvoltagewithouttheknowl-edgeofthecoiltemperature.Thisisusuallynotusefulinacurrent-controlledsystemwherecurrentcanbelimitedunderthecontinuoustorqueorcoil.Withinthecontinuouscurrentlimit,themotorcangeneratemuchhigherpowerthantheratingprovidedbythemanufacturerwithaﬁxedvoltagelimit.Figure2showsoperationlimitsofmotorsintorque-speedspace.ConsideringthatelectricJouleheatingisproportionaltocurrentsquaredtimesresistanceandcurrentisdirectlyrelatedtotorque,notspeed,thepowercanbegreatlyincreasedbyincreasingspeedunderthecontinuouscurrentlimit.ThisisrepresentedintheblueareainFigure2.Speedcanbelimitedbyincreasedviscousdampingofbearingsandair,electriccommutationfrequencylimit,andsoon.Inmostroboticsapplicationsthedutyfactorofthemotoroperationislowandtheoperationtrajectoryintorque-speedspacechangesdependingonthesituation.Intheapplicationswheretherearefrequentphysicalinteractionswithenvironmentsincludingleggedlocomotion,thedutyfactoroftherobotissigniﬁcantlylow.Ifthedutyfactoroftheactuatoroperationisknown,wecanutilizethetransientoperationspaceshowninpinkinFigure2.Therobotsoftenneedtoproducetorqueshigherthanthecontinuousoperatingtorquelimitforashortperiodoftime.Onecanalwaysachievehigherpowerinhigh-speedbyprovidinghighervoltagebutthisrequireshighergearratiothatleadstoahigherimpedanceoftheactuator,reducingtheefﬁciencyandincreasingthetotalweight.Achievingahightorqueactuatorallowslowergearratioandlowermechanicalimpedance.Therefore,powerdensityofEMactuatorsisnotawelldeﬁnedmetricanddoesnotindicatetheactualdeliveredpowerifcombinedwithageartrain.Aclearermetrictomaximizeinactuatordesignforroboticsistorquedensity(massspeciﬁctorque).B.Gapradius:acriticalmetricinEMmotordesignThereareanumberofEMactuatordesignparametersthataffecttheoverallperformanceofthemotors.Oneofthecriticaldesignparameteramongthemisthegapradius.Thegapradiusisthedistancefromtherotatingaxistothecenterofthegapbetweenpermanentmagnetsandthestator.Figure  1971  rgap  Mass ~ rgap Torque ~ rgap Rotor inertia ~ rgap Torque density ~ rgap Torque/inertia ~ 1/ rgap  tstator trotor\n']","
低占空比在外骨骼电机中允许扩展暂态操作空间，从而在短时高扭矩需求场景中提升性能；但同时也可能限制整体系统效率，需在电机设计中权衡暂态响应与机械阻抗优化。
","
    在考虑电机瞬态操作空间时，低占空比允许外骨骼电机在短时间内运行于高于连续转矩的瞬态区域，从而提高输出功率。由于焦耳热与电流平方成正比且电流与转矩相关，低占空比可避免热积累，使电机在可控热负荷下实现高瞬时功率输出。然而，需权衡高电压带来的高传动比、高阻抗及效率下降问题。因此，低占空比有助于提升外骨骼电机的瞬态性能，但需结合系统设计优化其应用。
    ",0.75,0.6449311686630081,1.0
"
BiLSTM网络在处理IMU长期时间序列运动数据时存在哪些局限性，注意力机制如何弥补这些局限性？
","['\nInputLayer Conv1D Dropout BiLSTM Dropout Permute Dense Permute Multiply Flatten Dense  Size: N * 5 * 10 Num filter = 128; Kernel size = 1; Padding = 0; Activation = ReLU Dropout = 0.5 Num filter = 64 Dropout = 0.5 Permute Num filter = 5; Activation = Softmax Permute Multiply Flatten Num filter = 1  gyroscope signals.  3.3. Proposed subject-independent attention-based CNN-BiLSTM model  Conv1D and BiLSTM were used in the present model for data extraction due to their excellent performance in capturing time-series data features [25]. A recent study has developed a CNN-BiLSTM model that utilize the advantages of both CNN and BiLSTM to process surface EMG and IMU data [26]. As the BiLSTM lacks the ability of global information extraction [27], the attention mechanism was used in the proposed model to provide an ability to capture essential informa- tion [28]. In the present study, the long-term time-series kinematic data was collected by IMUs. Therefore, an attention-based CNN-BiLSTM hybrid model was proposed for the estimation of the lower-limb joint moments. The framework of the proposed model is illustrated in Fig. 2. The present model consisted of three blocks, namely the CNN network, BiLSTM network and attention mechanism.  Fig. 3. Profile of hip/knee/ankle joint moment during single gait cycle of (A) level-ground, (B) ramp, (C) stair, and (D) treadmill for subject AB19. Results were derived using attention-based CNN-BiLSTM model with a single shank-attached IMU.  BiomedicalSignalProcessingandControl86(2023)1053725  W. Liang et al.\n']","
BiLSTM网络在处理IMU长期时间序列运动数据时存在全局信息提取能力不足的局限性，难以整合跨时间步或跨空间维度的信息。注意力机制通过动态分配不同时间点或特征的权重，增强对关键运动模式的捕捉能力，从而弥补BiLSTM的不足，提升模型对关节力矩估计的准确性。
","
BiLSTM在处理IMU长期时间序列运动数据时的主要局限性是缺乏全局信息提取能力。注意力机制通过为BiLSTM输出的不同时间步分配可学习权重，实现对关键时间信息的聚焦，从而弥补其在全局依赖建模上的不足，提升模型对长期时间序列的表达能力。
    ",0.5714285714285714,0.8844438656038528,1.0
"
被动辅助模式与无辅助模式在胫骨前肌（TA）用力程度上的差异说明了什么控制优势？
","['\n5033  Authorized licensed use limited to: BEIJING UNIVERSITY OF TECHNOLOGY. Downloaded on June 27,2024 at 08:03:13 UTC from IEEE Xplore. Restrictions apply.  TABLEIEFFORTCOMPARISONSFORVMO,BF,TA,ANDSOL:SHOWINGMEAN(±SD)FORTASKS(ROWS)ANDMODES(COLUMNS).  Effort  MPE  HAM  PASSIVE  BARE  [%MVC]  Level1.0m/s  VMO  31.4(2.1)  31.0(2.1)  33.8(2.0)  28.0(3.3)  BF  28.7(3.5)  29.4(4.2)  23.8(3.1)  14.2(1.9)  TA  37.9(3.9)  40.9(1.4)  37.5(1.5)  30.2(5.7)  SOL  26.3(1.8)  27.5(1.8)  31.8(2.5)  25.1(2.0)  Decline0.6m/s  VMO  35.4(2.7)  33.3(2.5)  43.1(2.1)  49.4(3.7)  BF  35.6(5.7)  32.6(6.6)  37.6(5.2)  26.9(3.8)  TA  31.4(3.4)  32.8(2.5)  32.9(3.4)  18.7(2.5)  SOL  42.2(5.7)  45.7(5.7)  42.5(6.5)  41.3(3.4)  Level0.6m/s  VMO  34.9(3.7)  35.8(4.0)  39.4(3.3)  35.9(2.4)  BF  24.2(1.5)  25.2(2.7)  22.8(3.3)  10.9(2.7)  TA  29.7(3.4)  30.7(2.9)  27.0(1.8)  18.5(3.1)  SOL  36.8(5.0)  33.7(3.4)  37.1(4.2)  27.0(3.3)  Incline0.6m/s  VMO  36.6(3.9)  33.8(2.7)  37.6(3.3)  36.3(7.0)  BF  37.3(5.3)  36.0(6.2)  43.7(4.5)  25.2(3.8)  TA  41.8(8.3)  36.9(2.4)  37.6(4.0)  27.7(6.1)  SOL  25.7(2.3)  29.2(2.5)  29.3(2.6)  31.2(3.6)\n']","
被动辅助模式与无辅助模式在胫骨前肌（TA）用力程度上的显著差异表明，TA在被动辅助中需求较低，说明该模式可能通过减少TA的主动参与来优化能量利用与运动协调性，从而实现更高效的外骨骼控制策略。
","
被动辅助模式与无辅助模式在胫骨前肌（TA）用力程度上的差异说明了被动辅助模式在外骨骼控制中能够优化肌肉用力分布，减少肌肉自主负荷，从而提升运动效率和稳定性，体现了其在降低肌肉疲劳与维持功能性运动方面的控制优势。
    ",0.4,0.9730514374327498,1.0
"
自适应前馈模型如何提升执行系统的力跟踪性能？
","['\n. CAN Communication was selected to satisfy the 1 kHz control loop rate requirement for a simpler implementation compared to Ethercat. In the top layer, a dell precision T3500 computer is configured as the real time target machine that runs Matlab Simulink for the control implementation. A PCI interface card for CAN (CAN-AC PCI, Softing AG, Haar, Germany) is installed on this computer to acquire sensor signals and send desired current to servomotor driver through the microprocessor. All sensors and actuator signals including load cell, IMU, actuator encoders command motor current and measured motor current are all logged on the real time target machine at the control loop frequency. An Arduino Due is selected as the microprocessor in the middle layer. It acts as a signal hub between real time target machine and servomotor driver while protecting the system from undesired behavior of the actuator due to anomalous errors of signals from real time target machine. In the bottom layer, Gold Twitter (Elmo Motion Control Ltd, Israel) with 55V maximum supply voltage and 60 A peak current is selected as the current servomotor driver. It tracks the checked current command from the microprocessor to drive the actuator at the desired speed and stiffness. With this control system structure, it keeps the possibility to make this actuation modular to be a self-contained actuation system without an external real time target machine similar to the off-board system in [22]. IV. SYSTEM MODELING To achieve accurate force tracking on a moving object through a soft interface, we need a high bandwidth control system. Feedforward ideas are shown to lead an increase in the effective bandwidth of a close-loop control and an improvement on tracking performance in previous studies [35], [36]. In this section, we present accurate models of suit stiffness, thigh motion, and actuator transmission. These models are integrated into our control architecture as feed forward models that significantly improved the force tracking performance of our actuation system. The detailed implementation of each FFM is described in Section V. A. Suit stiffness model The suit stiffness model is intended to enable the controller to compensate for the nonlinear deformation in the hip exosuit when assistance force is generated. Using desired reference force as the input to calculate the required cable position is the purpose of the suit stiffness model\n']","
自适应前馈模型通过提升系统带宽、补偿非线性特性以及增强动态响应能力，显著提升了执行系统的力跟踪性能。具体而言，前馈模型被集成到控制架构中，用于估计和补偿外骨骼刚度、大腿运动和执行器传动等非线性参数，从而实现高精度、高响应的力跟踪控制。
","
    自适应前馈模型通过建立执行系统的精确模型（包括外骨骼服刚度、大腿运动学及执行器传动特性），在闭环控制中引入预测机制，提前补偿非线性变形和动态响应误差，从而显著提升力跟踪性能与系统带宽。
    ",0.6666666666666666,0.994614550369356,1.0
"
BiLSTM相较于标准LSTM在外骨骼控制中的优势体现在哪些方面？
","['\n∑  ai =  (6)  i us)  ∑  v =  aihi  Recurrent neural networks (RNNs) have achieved extraordinary success in various IMU-based tasks [30]. The LSTM is an RNN with a structure called cell, and LSTM relies on three gates in the cell to choose useful information and discard unwanted information [31].  (7)  i  here, ωs denotes the weight matrix and bs denotes the bias matrix.  The aforementioned cell structure endows LSTM with higher accu- racy than RNN in processing medium and long-term dependencies in time series. However, the standard LSTM only considers the previous moment information, and omits the future information. Therefore, the standard LSTM is limited in dealing with complex tasks [32]. To over- come the drawbacks of the standard LSTM, the BiLSTM that consists of forward and backward LSTM networks was employed in the present  3.4. Baseline models  In order to compare the accuracy of different DL models, two most commonly used DL models, i.e., Conv1D and BiLSTM, were developed, and four recently published model architectures, i.e., ANN [10], Conv2D [9], TCN [16], and hybrid LSTM-ANN model [17], were reproduced. The influence of data source to the DL models was minimized by feeding  Fig. A2. Influence of different locomotive activities and IMU locations on the predicted (A) hip, (B) knee, and (C) ankle joint moments. * represents statistical difference (*p < 0.05, **p < 0.01, ***p < 0.001). LG: level-ground walking, TRE: treadmill walking and running.  BiomedicalSignalProcessingandControl86(2023)1053727  W. Liang et al.  the same training data into these models. The same data processing method was used to train ANN [10], Conv1D, Conv2D [9], TCN [16], BiLSTM, and LSTM-ANN [17] models.  attached IMU. The PCC and RMSE of the knee and ankle joint moment prediction results were influenced by the IMU location. In particular, in the ramp and stair locomotive activities, the accuracy of the predictions derived from the shank-attached IMU data was significantly higher than the accuracy of the predictions derived from the thigh-attached IMU.  a) ANN [10]: two fully connected hidden layers with 100 and 20 units were used. Features from the last fully connected layer were flat- tened and connected to the prediction layer.\n']","
BiLSTM相较于标准LSTM在外骨骼控制中的优势体现在：1）通过双向结构同时利用时间序列的前后信息，增强对中长期依赖的建模能力；2）提升IMU数据驱动的关节力矩预测准确性，尤其在处理复杂运动模式（如斜坡行走）时表现更优；3）文献实验证明其在膝关节和踝关节预测任务中具有更高的预测一致性与鲁棒性。
","
    BiLSTM相较于标准LSTM在外骨骼控制中的优势主要体现在其双向建模能力上，BiLSTM通过结合前向和反向LSTM，能够同时利用过去和未来时刻的信息，从而更全面地捕捉时间序列数据中的上下文依赖关系，提升对复杂运动模式的建模与预测能力。
    ",0.8,0.99402039059814,0.75
"
自适应连续扭矩控制器如何实现不同行走速度下膝关节力矩的准确估计？
","['\n1451  1452  IEEE TRANSACTIONS ON ROBOTICS, VOL. 38, NO. 3, JUNE 2022  TABLE V RMSE AND CORRELATION BETWEEN THE ESTIMATED MOMENT AND THE BIOLOGICAL MOMENT FOR DIFFERENT SPEEDS  TABLE VI RMSE AND CORRELATION BETWEEN THE ESTIMATED MOMENT AND THE BIOLOGICAL MOMENT UNDER 1.25 M/S WALKING SPEED  (a)Comparisonbetweenthekneemomentestimationbasedonthegait Fig.14. cycle and the proposed continuous torque controller (see Fig. 7). The proposed controllercanadapttowalkingspeedfrom0.8to1.5m/s,andtheestimatedknee moment is continuous, in contrast to the discontinuous proﬁle generated from the gait-cycle-based method. (b) Estimated moment versus the actual biological knee moment for four speeds (mean ± std of eight subjects’ data). We recorded 10 strides data for each subject/speed.  B. Human Subject Experiments  The objectives of the human experiments are the following: 1) to evaluate the movement synergy of our continuous torquecontrollerwithhumansatdifferentwalkingspeeds; 2) to evaluate the capability of the system to track the desired torque and show that our exoskeleton with the proposed controller does not cause a signiﬁcant change in knee kinematics;  3) to understand the effect on lower-limb muscle activities. 1) Accurate Biological Torque Estimation With Our Stiffness Model: To illustrate the beneﬁt of our proposed controller, the knee moment estimation from the continuous torque controller is shown in Fig. 14(a). As the treadmill velocity changed from 0.8 to 1.5 m/s, the gait cycle shrank, and our proposed method automatically adapted to the changing speed and generated a continuous knee moment because it only required the current knee joint angle to estimate the knee moment and thus did not explicitly rely on the gait phase estimation.\n']","
自适应连续扭矩控制器通过仅依赖当前膝关节角度估计力矩，结合闭环控制策略实现对不同行走速度的自适应调节，从而在不依赖步态相位信息的前提下，生成连续且准确的膝关节力矩估计，确保在 0.8–1.5 m/s 的行走速度范围内保持高精度与稳定性。
","
自适应连续扭矩控制器通过仅依赖当前膝关节角度而非步态相位估计，实现了在0.8至1.5 m/s不同行走速度下的膝关节力矩连续输出；实验结果表明其估计力矩与实际生物力矩之间具有较低RMSE和高相关性，从而确保了不同速度下的准确估计。
    ",0.5,0.9212281773488296,1.0
"
基于IMU传感器的数据驱动方法在外骨骼控制中如何实现髋、膝、踝关节力矩的估计？
","['\nAuthorized licensed use limited to: BEIJING UNIVERSITY OF TECHNOLOGY. Downloaded on January 15,2024 at 07:32:40 UTC from IEEE Xplore. Restrictions apply.  HOSSAIN et al.: ESTIMATION OF LOWER EXTREMITY JOINT MOMENTS AND 3D GRFS  [35], [35], [37] using data-driven methods with IMU sensors. Dorschky et al. [37] used 4 IMU sensors to estimate hip, knee, and ankle joint moments, anterior-posterior GRF, and vertical GRF in the level-ground and treadmill walking and running utilizing a 2D Convolutional Neural Network (CNN) based deeplearningmodelwiththedataaugmentationtechniqueswith musculoskeletal model simulation. Their approach is limited to the highly repeated level-ground or treadmill walking condition only. Leporace et al. [38] used a single accelerometer on the shank to predict the 3D GRFs during walking using a Multilayer Perceptron (MLP). However, the model was trained on limited samples (only 4 gait cycles per participant), and data was col- lected in level-ground walking condition only. Guo et al. [39] used only acceleration data from a single waist-mounted IMU sensortopredicttheverticalGRFinself-selectedwalkingspeeds in outdoor level-ground settings using Orthogonal Forward Re- gression (OFR) algorithm. All these studies are implemented in simple repetitive motion such as level-ground or treadmill walking and the use of conventional machine learning models. Toutilizeadatasetwithoutthepresenceofexperimentallycol- lected IMU sensors with motion capture and GRF data, Mundt et al. [31] placed virtual IMU sensors on the retrospectively collected walking model to predict hip, knee, and ankle joint momentsusingfeedforwardandLSTMbasedmodels.Molinaro etal.[28]alsousedamusculoskeleletalmodeltogeneratevirtual IMU sensor signals on the trunk and thigh to estimate hip joint momentusingTCN[40].Asthesestudiesareimplementedusing virtual IMU data, it is unclear how reliable the outcome of their methods is on real IMU applications with noise introduced from skin surface movements.\n']","
基于IMU传感器的数据驱动方法在外骨骼控制中通过采集关节运动学数据，并结合深度学习模型（如CNN、MLP、OFR、TCN、LSTM）进行非线性建模与预测，以估计髋、膝、踝关节力矩及地面反作用力（GRF）。典型方法包括：Dorschky等人使用4IMU+CNN模型；Leporace使用MLP预测GRF；Mundt和Molinaro等人使用虚拟IMU数据训练模型以估计关节力矩。然而，这些方法多依赖有限样本或虚拟数据，且在真实IMU应用中（如皮层运动或非重复步态）的可靠性尚未充分验证。
","
    基于IMU传感器的数据驱动方法中，Dorschky等人[37]通过部署4个IMU传感器采集运动数据，结合二维卷积神经网络（CNN）模型、数据增强技术及肌肉骨骼模型仿真，实现了对髋、膝、踝关节力矩的估计。该方法适用于平地和跑步机行走与跑步场景，但受限于高度重复的运动模式。Mundt等人[31]使用虚拟IMU数据结合前馈和LSTM模型预测三关节力矩，而Molinaro等人[28]基于虚拟IMU信号和TCN估计髋关节力矩，但均未使用真实IMU传感器。目前文献中尚无基于真实IMU、适用于复杂步态模式的完整数据驱动三关节力矩估计方案。
    ",0.8333333333333334,0.8936970402078123,0.5
"
软性可穿戴外骨骼系统（exosuit）如何通过辅助关节扭矩实现对人体肌肉工作的增强？
","['\n. Also, static misalignment of the biological and exoskeleton joints can result in dynamic misalignments of up to 10 cm during normal movement, causing pain and even injury to users [15]. One solution has been to include redundant, passive degrees of freedom to accommodate these misalignments [16]; however, this adds further weight to the system. It is partly for these reasons that these systems do not typically reduce the metabolic power required for locomotion. In order to address these issues there has recently been work on developing active soft orthotics [17, 18] that show great promise in reducing the impedance experienced by the wearer and allowing more natural movement. As an alternative to rigid exoskeletons, we present the design and evaluation of a soft wearable device, we call an “exosuit” (Fig. 1). This device was designed to augment the normal muscle work of healthy individuals by applying assistive torques at the wearer’s joints with the goal of reducing the metabolic cost of transport of the wearer. Figure 1. A lightweight, non-restrictive soft lower extremity exosuit that can provide gait assistance through pneumatic actuators (orange) that span the hip, knee and ankle joints.\n']","
软性可穿戴外骨骼系统通过在穿戴者关节处施加辅助扭矩（如气动执行器驱动的髋、膝、踝关节助力）增强肌肉工作，利用柔性结构减少干扰并提升自然运动能力，从而降低穿戴者的代谢成本。
","
软性可穿戴外骨骼系统（exosuit）通过在人体髋、膝、踝关节处施加外部辅助扭矩，减少肌肉自身所需产生的力量，从而增强肌肉工作的效率。该系统采用轻质柔性材料和气动执行器，提供非限制性辅助，降低穿戴者运动时的阻抗和代谢能量消耗，实现对人体肌肉功能的支持。
    ",0.6,0.8542188604135094,1.0
"
自适应频率振荡器（AdOs）在外骨骼控制器中用于估计步态周期的哪些关键参数？
","[""\nThe first stage of the assistive controller addresses the estimation of the current phase of the gait cycle. The gait cycle, i.e., stride period, is defined in the controller as the time between two consecutive left heel strike events, while the current phase inside each gait cycle (expressed as a percent of stride period) is obtained as the ratio between the time elapsed from the start of the current cycle, and the expected duration of the cycle. The expected duration of the gait cycle is estimated through an Adaptive Frequency  In this study we propose an alternative solution based on nominal torque profiles that approximate on-line the user's joint torque during walking. While walking at a constant  1 Note that given the substantial equivalence between over-ground and treadmill walking [46], the Winter’s torque profile can be used for experiment performed on treadmill.  Copyright (c) 2013 IEEE. Personal use is permitted. For any other purposes, permission must be obtained from the IEEE by emailing pubs-permissions@ieee.org.  This article has been accepted for publication in a future issue of this journal, but has not been fully edited. Content may change prior to final publication.  Oscillator (AdOs), a mathematical tool that was originally developed for other applications [45] and more recently used for estimating the high-level features of periodic human movements [42],[49]. Resistive foot-pressure sensors are embedded insoles (see [47] for implementation) and act as switches to detect the heel-strike and toe-off events. By combining the left foot heel strike detection with the estimated cycle-duration, the assistive controller can compute the current stride percent (Stride % in Fig. 2(a)).  in  the user’s shoe\n""]","
自适应频率振荡器（AdOs）在外骨骼控制器中用于估计步态周期的持续时间和当前相位，其中步态周期持续时间通过AdOs估计，当前相位则由该估计值与预期周期长度的比值计算得出。
","
    自适应频率振荡器（AdOs）在外骨骼控制器中用于估计步态周期的关键参数包括：1）步态周期的预期时长（expected duration of the gait cycle）；2）当前步态周期中的相位百分比（current phase expressed as a percent of stride period）；3）结合左脚跟触地事件检测与周期估计，生成步态百分比（Stride %），用于控制辅助时机。
    ",1.0,0.9100987636789604,0.5
"
推进和制动冲量在解释步态特征（如时空对称性和行走速度）中起到了哪些具体作用？
","['\nDirectly using the 12 prosthesis control parameters to explain gait temporal-spatial symmetry is inadequate as the symmetry measurements also involve motor behavior of the intact limb, which varies greatly across humans. Instead, we examined propulsive and braking AP impulses of both the prosthetic limb and the intact limb because AP impulses in walking are the results of interactions between both lower limbs and the environment. Furthermore, these impulses have previously explained gait characteristics, such as temporal- spatial symmetry [27], [32] and walking speed [48]. In ad- dition, the propulsive and braking impulses on the prosthetic  Fig. 5. Propulsive impulse and braking impulse of two TF subjects as examples.  1534-4320 (c) 2020 IEEE. Personal use is permitted, but republication/redistribution requires IEEE permission. See http://www.ieee.org/publications_standards/publications/rights/index.html for more information. Authorized licensed use limited to: Hong Kong Polytechnic University. Downloaded on March 22,2020 at 13:46:38 UTC from IEEE Xplore. Restrictions apply.  7  This article has been accepted for publication in a future issue of this journal, but has not been fully edited. Content may change prior to final publication. Citation information: DOI 10.1109/TNSRE.2020.2979033, IEEE Transactions on Neural Systems and Rehabilitation Engineering  IEEE TRANSACTIONS ON NEURAL SYSTEMS AND REHABILITATION ENGINEERING, VOL. , NO. , MARCH 2020  Fig. 6. The knee kinematics of all subjects at their best stance time SI. Each of knee kinematics as averaged across a few control parameter conditions whose stance time SI lies in the top 5 among all (∼500) control parameter conditions.\n']","
推进和制动冲量在解释步态特征（如时空对称性和行走速度）中起到了补充作用，能够更全面地反映下肢与环境交互的结果，尤其在解释个体间差异较大的完整肢体运动行为时，优于仅依赖假肢控制参数的方法。
","
推进和制动冲量在解释步态特征中起到了关键作用：它们作为双下肢与环境相互作用的综合指标，能够有效解释步态的时空对称性和行走速度。相比直接使用控制参数，这些冲量更全面地反映双侧肢体的协调性，尤其适用于评估健全肢体与假肢之间的动态平衡。
    ",0.8,0.9420805129381806,0.5
"
文中提到的脊髓反射控制模型如何通过本体感觉反射调控下肢九大肌群的激活状态？
","['\n2. METHODS  We select a range of unexpected disturbances used in human gait studies from the literature, replicate them in simulation with the neuromechanical model, and compare the models reactions to the reported human experimental data.  FIGURE 1 | Spinal reﬂex-control model of human locomotion. The sagittal plane components of a 3-D model (Song and Geyer, 2015a) are adopted for the current study. The model mainly uses proprioceptive reﬂexes to control nine major muscle groups per leg, including hamstrings (HAM), rectus femoris (RF), vasti (VAS), gastrocnemius (GAS), soleus (SOL), and tibialis anterior (TA). The activations of these muscles during normal walking of the model (black lines) and of humans (gray lines) are shown in the right panel. MN, motor neuron; IN, interneuron.  Frontiers in Computational Neuroscience | www.frontiersin.org  2  March 2017 | Volume 11 | Article 15  Song and Geyer  2.1. Experiment Selection Five disturbance experiments are selected from the literature: electrical stimulation of the lumbar spinal cord to evoke multisegmental monosynaptic responses (MMR; Courtine et al., 2007), mechanical tap of tendons to induce tendon tap reﬂexes (TR; Dietz et al., 1990; Faist et al., 1999), actuation of the ankle joint to induce stretch reﬂexes (SR; Sinkjaer et al., 1996), and tripping (TRIP) of the swing leg (Schillings et al., 1999), and slipping (SLIP) of the stance leg (Sloot et al., 2015; refer Video S2 for visual guidance). In these experiments, the reactions of the spinal control are assessed through the changes that occur in the leg muscle activations within a short time after the disturbances. Speciﬁcally, the activation changes are measured by surface electromyograms (EMGs) and their trend with respect to gait phase or disturbance magnitude is used to estimate the activity of spinal reﬂexes.\n']","
脊髓反射控制模型通过整合本体感觉信息（如肌肉长度、张力、关节角度等）生成适当的肌肉激活指令，从而实现对外骨骼或仿生系统中下肢肌群的精确调控。该模型采用三维人体运动模型评估不同扰动（如电刺激、腱反射、关节伸展反射、摆动腿滑步等）下肌肉激活的瞬态变化，并通过表面肌电图（EMG）测量其趋势，用于估计脊髓反射活动。文中提到的九大肌群（如股直肌、股四头肌、腓肠肌、比目鱼肌、胫骨前肌等）在正常行走与扰动响应中表现出相似的激活模式，表明本体感觉反射在调控这些肌群激活状态中起关键作用。
","
脊髓反射控制模型通过本体感觉反射调控下肢九大肌群（HAM、RF、VAS、GAS、SOL、TA等）的激活状态。模型在受到电刺激、肌腱敲击、踝关节拉伸及步态扰动（如绊倒和滑倒）等外部干扰后，快速产生肌肉激活变化，这些变化通过表面肌电图（EMG）测量并用于评估脊髓反射活动的趋势。本体感觉反射机制根据扰动强度和步态相位动态调节肌肉激活，实现对下肢运动状态的快速适应性控制。
    ",0.6,0.848403695656499,1.0
"
柔性滑动大腿支架设计如何兼顾外骨骼优势与可穿戴安全性？
","['\n. If such a rigid shape is fitted to the human body, there is high probability that it may injure the joints and contact locations. Consequently, much research is being conducted on methods of improving the wearability, such as recent work on developing active soft orthotic systems that can be tightly fitted. However, these devices are designed to augment muscle function by applying tension at the wearer’s joints similar to the direction of muscles. Therefore, they cannot support any device weight. Furthermore, with these devices, wearers would have to endure bone-on-bone forces amounting to more than several tens of kilograms. In this study, we propose the flexible sliding thigh frame, which has taken all the good points of exoskeletons and soft\n']","
柔性滑动大腿支架通过采用软性结构设计，减少了关节与接触部位的直接压力，避免了传统刚性支架可能引起的损伤；同时结合外骨骼的支撑能力，确保设备重量能够被有效承载，从而兼顾了穿戴安全性与外骨骼功能。
","
柔性滑动大腿支架通过结合刚性外骨骼的结构承载能力和柔性系统的贴合性，实现外骨骼功能与穿戴安全性的平衡。其设计可适应人体运动形态变化，减少对关节和软组织的压迫，同时有效分散设备重量，提升穿戴舒适度与支撑性能。
    ",1.0,0.9134596172080188,1.0
"
功能性电刺激（FES）在外骨骼系统中如何实现对腿部肌肉收缩的控制，并面临哪些主要挑战？
","['\nmotion in individuals with paraplegia, a number of researchers have investigated the use of functional electrical stimulation (FES) to artiﬁcially elicit and control leg muscle contraction, thereby utilizing the musculature and metabolic power supply of the paraplegic subject to generate legged locomotion. Some of the research efforts in this regard include [3]–[13]. In ad- dition to providing power for locomotion, FES-aided gait has also been shown to provide a number of associated physiolog- ical beneﬁts, some of which include increased muscle strength, increased bone density, decreased spasticity, and improved car- diovascular health [14]–[20]. Despite this, FES-based systems entail a number of challenges; most notably, muscles are difﬁ- cult to control, particularly in the absence of adequate sensory information, and muscle torque output tends to fatigue rapidly, as a byproduct of the synchronous activation and preferential recruitment of fast-twitch muscle ﬁbers associated with FES.  Index Terms—Cooperative controller, functional electrical stim- ulation (FES), hybrid FES, powered lower limb exoskeleton, spinal cord injury (SCI).  I. INTRODUCTION  O NE of the most signiﬁcant impairments resulting from  paraplegia is the inability to stand and walk [1]. In ad- dition to diminished mobility, spinal cord injury (SCI) and the inability to stand and walk can entail signiﬁcant health implica- tions, including loss of bone mineral content, pressure-induced skin problems, increased incidence of urinary tract infection, muscle spasticity, impaired lymphatic and vascular circulation, impaired digestive operation, and reduced respiratory and car- diovascular capacities [2]. In an effort to restore legged loco-\n']","
功能性电刺激（FES）通过外部电刺激激活瘫痪个体的腿部肌肉，实现对肌肉收缩的控制，但其在实现过程中面临的主要挑战包括：肌肉控制难度大，尤其在缺乏有效感官反馈的情况下；肌肉扭矩输出易因快肌纤维的同步激活而快速疲劳；此外，不同个体间的神经-肌肉耦合差异进一步增加了控制的复杂性和不确定性。
","
FES通过电刺激引发腿部肌肉收缩，利用瘫痪者的肌肉和代谢能量实现外骨骼系统中的步行控制，并具有增强肌肉力量、增加骨密度、减少痉挛和改善心血管健康的生理益处。其主要挑战包括肌肉控制困难（尤其在缺乏足够感觉反馈的情况下）以及因快肌纤维的同步激活与优先募集导致的快速疲劳。
    ",0.625,0.8318009004707826,1.0
"
文中采用的自定义McKibben执行器如何通过调整输入气压实现力输出控制？
","['\nAnkle Plantarflexion 25 100 0.06 1867  Ankle Dorsiflexion 10 5 0.06 67  Knee Flexion 60 25 0.07 457  Knee Extension -5* 25 0.07 457  Hip Flexion 35 80 0.12 750  Hip Extension 10 50 0.12 367  Maximum knee extension is less than zero (straight leg) during normal walking. B. Actuator Design and Characterization Actuators used for this study were constructed from latex tubing, expandable mesh, pinch clamps, and barbed fittings; all available commercially as previously described in [17]. While, commercial McKibbon actuators are available for purchase, custom actuators were made to minimize weight for the size and force requirements based on the biological specifications shown in Table I. As compressed air is supplied to the actuators, they expand radially, shortening in length and thereby providing actuation. Force can thus be modified by changing input pressure and the stroke length is determined based on the actuator length and properties. An actuator with an active length (excluding end hardware such as fittings and steel loops) of 200 mm was prototyped and force versus displacement data were recorded on an Instron 5544 load frame system for 1 to 5 bar (14.7 to 73.5 psi) input pressures (Fig. 2). Figure 2. Force versus displacement curves for a 200 mm long custom made McKibben actuator. Negative displacement indicates shortening. As shown, an actuator will generate a peak force when engaged at its rest length, from there, its force producing capabilities decrease with contraction. Increasing supply pressure increases the actuators force output and its amount of maximum contraction. For this prototype, 4 bar (58.8 psi) was chosen as an operating pressure to provide substantial actuating force, yet provide an additional safety measure, providing forces 38% lower than those at the maximum pressure of 5 bar (230 N vs 370 N). Air flow to the actuators was controlled by inline solenoid valves (Norgren, 2 position, 5/2 valve model E12), and air was supplied from the compressor to the system with 3/8 inch OD (1/4 ID) tubing, and distributed from the valves to the individual actuators with individual 1/4 inch OD (1/8 ID) tubes. When using these actuators for a dynamic application such as assisting with gait, inflation and deflation times must be considered as the actuators do not actuate instantaneously,  3363\n']","
文中采用的自定义McKibben执行器通过调节输入气压来控制力输出，气压越高，执行器内部弹性材料的压缩程度越大，从而输出更大的力。执行器的力输出与输入气压成正比，并受执行器主动长度和压缩能力的限制。在4 bar（58.8 psi）下输出230 N，5 bar（73.5 psi）下输出370 N，说明气压是实现力控制的核心参数。
","
文中采用的自定义McKibben执行器通过调节输入气压来控制力输出，气压越高，执行器产生的最大力和收缩量越大。实验表明在1至5 bar范围内，力输出随气压上升而增加，最终选择4 bar作为操作压力以在力输出与安全性之间取得平衡。
    ",0.6666666666666666,0.9625682818646326,0.75
"
不同深度学习模型在水平地面行走预测中的表现是否存在显著差异？依据是什么？
","['\n0.16 0.86 ±  0.30 ± 0.08  0.39 ± 0.10  0.28 ± 0.09  Ramp  0.12 0.76 ±  0.18 0.74 ±  0.09 0.79 ±  0.20 ± 0.03  0.33 ± 0.06  0.31 ± 0.05  Stair  0.06 0.88 ±  0.07 0.82 ±  0.06 0.88 ±  0.21 ± 0.07  0.18 ± 0.05  0.24 ± 0.10  Treadmill  0.08 0.80 ±  0.12 0.69 ±  0.12 0.87 ±  0.22 ± 0.08  0.22 ± 0.05  0.29 ± 0.07  Shank  Level- ground  0.15 0.80 ±  0.16 0.88 ±  0.06 0.92 ±  0.32 ± 0.06  0.26 ± 0.05  0.23 ± 0.04  Ramp  0.06 0.78 ±  0.04 0.86 ±  0.03 0.83 ±  0.20 ± 0.02  0.25 ± 0.06  0.28 ± 0.06  Stair  The present model was trained in Keras. Adam was used as the optimizer with a batch size of 100 [29]. RMSE loss function was used for model training. The initial learning rate was 0.0001. The learning rate decreased by 20 % when the RMSE of the validation set did not decline in 5 epochs. The training session was terminated when the RMSE on the validation set stops decreasing for 20 epochs.  0.05 0.95 ±  0.04 0.90 ±  0.06 0.92 ±  0.17 ± 0.04  0.14 ± 0.04  0.22 ± 0.07  Treadmill  0.02 0.78 ±  0.04 0.69 ±  0.05 0.88 ±  0.23 ± 0.08  0.23 ± 0.05  0.28 ± 0.07  Foot  Level- ground  0.13 0.81 ±  0.12 0.79 ±  0.06 0.91 ±  0.32 ± 0.06  0.34 ± 0.05  0.23 ± 0.05  Ramp  3.3.1. CNN-BiLSTM module  Previous studies have shown that CNN is more suitable for IMU data processing than the traditional machine-learning approach [9,11]. Conv1D was adopted to process the IMU data in the proposed model and the ReLU function was used as the activation function.  0.05 0.66 ±  0.06 0.79 ±  0.05 0.85 ±  0.23 ± 0.04  0.29 ± 0.05  0.27 ± 0.06  Stair  0.06 0.95 ±  0.05 0.89 ±  0.04 0.94 ±  0.15 ± 0.05  0.15 ± 0.05  0.21 ± 0.06  Treadmill  The computation of Conv1D is described as:  0.02  0.06  0.04  hi = Conv1(ωi,xi)+bi  (3)  yi = ReLU(hi)  (4)  Fig. 4. Influence of different locomotive activities and IMU setup and IMU numbers on the predicted (A) hip, (B) knee, and (C) ankle joint moments. * represents statistical difference (*p < 0.05, **p < 0.01, ***p < 0.001). LG: level-ground walking, TRE: treadmill walking and running.  BiomedicalSignalProcessingandControl86(2023)1053726  W. Liang et al.  Table 3 The prediction performance of different DL models during level-ground walking (mean ± standard deviation).  Models  The proposed model  Conv2D [9]  TCN [16]  ANN [10]  LSTM-ANN [17]  Bi-LSTM  Conv1D  0.79 ± 0.15 0.24 ± 0.07  0.78 ± 0.18 0.25 ± 0.09  0.75 ± 0.18 0.27 ± 0.09  0.76 ± 0.15 0.26 ± 0.09  0.68 ± 0.17 0.32 ± 0.15  0.77 ± 0.16 0.26 ± 0.09  0.75 ± 0.15 0.27 ± 0.09  PCC RMSE\n']","
不同深度学习模型在水平地面行走预测中的表现存在显著差异，主要体现在预测误差（RMSE）和相关性（PCC）指标上。例如，Conv1D模型在水平地面行走任务中的表现优于部分传统方法，但仍有提升空间；而某些模型（如Bi-LSTM）在趋势匹配和误差控制方面表现更优。模型结构（如CNN vs. Conv1D）对预测性能也有显著影响。
","
    根据参考文献中的实验结果，不同深度学习模型在水平地面行走预测中表现存在差异。所提出的模型在PCC（0.79 ± 0.15）和RMSE（0.24 ± 0.07）指标上优于Conv2D、TCN、ANN、LSTM-ANN、Bi-LSTM和Conv1D等模型，表明其具有更优的预测性能。尽管文献未提供统计显著性检验结果，但数值差异表明模型间存在性能差异。
    ",0.4444444444444444,0.9876310511360528,0.75
"
文中训练模型时采用的学习率调整策略对防止过拟合有何作用？
","['\n0.16 0.86 ±  0.30 ± 0.08  0.39 ± 0.10  0.28 ± 0.09  Ramp  0.12 0.76 ±  0.18 0.74 ±  0.09 0.79 ±  0.20 ± 0.03  0.33 ± 0.06  0.31 ± 0.05  Stair  0.06 0.88 ±  0.07 0.82 ±  0.06 0.88 ±  0.21 ± 0.07  0.18 ± 0.05  0.24 ± 0.10  Treadmill  0.08 0.80 ±  0.12 0.69 ±  0.12 0.87 ±  0.22 ± 0.08  0.22 ± 0.05  0.29 ± 0.07  Shank  Level- ground  0.15 0.80 ±  0.16 0.88 ±  0.06 0.92 ±  0.32 ± 0.06  0.26 ± 0.05  0.23 ± 0.04  Ramp  0.06 0.78 ±  0.04 0.86 ±  0.03 0.83 ±  0.20 ± 0.02  0.25 ± 0.06  0.28 ± 0.06  Stair  The present model was trained in Keras. Adam was used as the optimizer with a batch size of 100 [29]. RMSE loss function was used for model training. The initial learning rate was 0.0001. The learning rate decreased by 20 % when the RMSE of the validation set did not decline in 5 epochs. The training session was terminated when the RMSE on the validation set stops decreasing for 20 epochs.  0.05 0.95 ±  0.04 0.90 ±  0.06 0.92 ±  0.17 ± 0.04  0.14 ± 0.04  0.22 ± 0.07  Treadmill  0.02 0.78 ±  0.04 0.69 ±  0.05 0.88 ±  0.23 ± 0.08  0.23 ± 0.05  0.28 ± 0.07  Foot  Level- ground  0.13 0.81 ±  0.12 0.79 ±  0.06 0.91 ±  0.32 ± 0.06  0.34 ± 0.05  0.23 ± 0.05  Ramp  3.3.1. CNN-BiLSTM module  Previous studies have shown that CNN is more suitable for IMU data processing than the traditional machine-learning approach [9,11]. Conv1D was adopted to process the IMU data in the proposed model and the ReLU function was used as the activation function.  0.05 0.66 ±  0.06 0.79 ±  0.05 0.85 ±  0.23 ± 0.04  0.29 ± 0.05  0.27 ± 0.06  Stair  0.06 0.95 ±  0.05 0.89 ±  0.04 0.94 ±  0.15 ± 0.05  0.15 ± 0.05  0.21 ± 0.06  Treadmill  The computation of Conv1D is described as:  0.02  0.06  0.04  hi = Conv1(ωi,xi)+bi  (3)  yi = ReLU(hi)  (4)  Fig. 4. Influence of different locomotive activities and IMU setup and IMU numbers on the predicted (A) hip, (B) knee, and (C) ankle joint moments. * represents statistical difference (*p < 0.05, **p < 0.01, ***p < 0.001). LG: level-ground walking, TRE: treadmill walking and running.  BiomedicalSignalProcessingandControl86(2023)1053726  W. Liang et al.  Table 3 The prediction performance of different DL models during level-ground walking (mean ± standard deviation).  Models  The proposed model  Conv2D [9]  TCN [16]  ANN [10]  LSTM-ANN [17]  Bi-LSTM  Conv1D  0.79 ± 0.15 0.24 ± 0.07  0.78 ± 0.18 0.25 ± 0.09  0.75 ± 0.18 0.27 ± 0.09  0.76 ± 0.15 0.26 ± 0.09  0.68 ± 0.17 0.32 ± 0.15  0.77 ± 0.16 0.26 ± 0.09  0.75 ± 0.15 0.27 ± 0.09  PCC RMSE\n']","
文中训练模型时采用的学习率衰减策略（每5个epoch将学习率减少20%）有助于防止模型在训练后期陷入局部最优，从而提升模型泛化能力。该策略通过动态调整优化速度，使模型在训练过程中更精细地调整参数，降低过拟合风险。然而，文献未提供其他直接防止过拟合的机制。
","
文中采用的学习率调整策略为：当验证集RMSE在5个epoch内未下降时，学习率减少20%；当验证集RMSE连续20个epoch未下降则终止训练。该策略通过动态调整学习步长并结合早停机制，有效防止模型在训练数据上过拟合，从而提升泛化能力。
    ",0.4285714285714285,0.7255749259904517,0.5
"
文中提到的“patient-cooperative control”在步态康复外骨骼中是如何实现个性化辅助的？
","['\ncompared with walking without the exoskeletons14–16. Therefore, lighter-weight hardware and autonomous systems were developed and tested in goal-driven experiments, with single-joint systems tested to explore underlying biological mechanisms. These technological advances ultimately enabled exoskeletons to meet the envisioned objectives of reducing the metabolic cost during loaded or unloaded locomotion for military, industrial and recreational applications.  Alongside the development of exoskeletons to enhance the performance of load carriage, devices (in particular, the Lokomat17, Gait Trainer18, lower extremity powered exoskeleton (LOPES)19, active leg exoskeleton (ALEX)20,21 and Rutgers Ankle22) were designed to mechanize physical therapy for individuals re-learning to walk fol- lowing spinal-cord injury (SCI) or stroke. Common clinical practice calls for physical therapists to manually move the feet and legs of non-ambulatory patients through the motions of walking to facili- tate re-learning of movement patterns for functional improvement23. Robotic devices were developed to offload this burden from physical therapists and to improve patient outcomes by delivering precise interventions and training at optimal intensities, unconstrained by the limits of manual assistance. Exoskeletons initially failed to show clinical improvements that would justify their cost compared to traditional  1John A Paulson School of Engineering and Applied Sciences, Harvard University, Cambridge, MA, USA. 2Department of Physical Therapy, College of Health and Rehabilitation Sciences: Sargent, Boston University, Boston, MA, USA. 3These authors contributed equally: Christopher Siviy, Lauren M. Baker.  e-mail: walsh@seas.harvard.edu  Nature Biomedical Engineering  non-robotic gait-training methods24–30. However, a better understand- ing of the underlying biomechanics and physiology led to an improve- ment in exoskeleton design, including biologically inspired strategies for actuation and control31–36. For example, ‘patient-cooperative control’ has been implemented in devices for gait rehabilitation to allow for more individualized assistance37–43. Such ‘assist as needed’ approaches are particularly important for augmenting the gait of individuals with some residual walking function while encouraging their own contributions.  a  Unimpaired weight-bearing  b  Unimpaired joint-targeting\n']","
“patient-cooperative control” 是一种基于生物力学与个体运动特征的自适应控制策略，通过仿生驱动与“按需辅助”机制，实现对步态康复外骨骼的个性化辅助。该策略鼓励患者主动参与康复过程，在必要时提供助力，从而提升训练效果与功能性恢复潜力。
","
    “Patient-cooperative control”在步态康复外骨骼中通过“assist as needed”策略实现个性化辅助，依据患者的残余运动能力动态调整助力水平，鼓励其主动参与步态过程。该方法基于对生物力学和生理机制的理解，属于仿生启发式控制设计，旨在提升个体化康复训练效果。文献未详述其具体技术实现机制。
    ",0.4285714285714285,0.7210769224672502,1.0
"
文中提到的膝关节生物力学模型存在哪些局限性？
","['\nMedicine & Science in Sports & ExerciseT  131  force was 11–17 times BW, whereas estimated posterior shear force was 2–3 times BW. Although these knee forces appear inordinate, very few individuals other than compet- itive powerlifters are capable or willing to squat with a 382.5-kg external load.  Knee joint biomechanical models and anthropometric data used to estimate knee forces in Nisell and Ekholm (43) were based on 10 subjects from their previous studies (41,44), with a mean height of 180 cm and a mean body mass of 75 kg. This is one limitation in the study by Nisell and Ekholm (43), because their three subjects had a mean body mass 20 kg more than and a mean height 7 cm less (Table 1) than the 10 subjects used in their biomechanical models. Another limitation in their study was that the effect of co-contraction of the hamstring musculature was not considered. Because the calculated knee torque was the resultant torque (i.e., sum of all flexor and extensor torques), hamstring force, which generates a knee flexor torque, would cause greater quadriceps force and extensor torque. Consequently, all calculated knee forces in this study would be underestimated, because these forces are functions of quadriceps tendon and patellar tendon forces. Because the quadriceps tendon thickness is significantly greater than the patellar tendon thickness, it should be able to withstand a higher load before rupture. However, high magnitudes of compressive force and stress (force/area) between the fem- oral intercondylar notch and the quadriceps tendon may increase the injury potential of the quadriceps tendon. Tendofemoral compressive force between the quadriceps tendon and the femoral intercondylar notch began high at 6000 N at approximately 130° knee flexion, quickly de- creased to approximately 1750 N at 90° knee flexion and decreased to approximately 0 N at 60° knee flexion. As- suming a 3.4-cm2 tendofemoral contact area when the knee is flexed approximately 130° (24), tendofemoral compres- sive stress would be 17.6 MPa (6000 Nz0.00034 m-2). This large stress applied repetitively over time may cause degen- erative changes in the tendofemoral complex. Hence, per- forming the squat at knee flexion angles less than 90° will minimize tendofemoral stress and minimize injury potential to the tendofemoral complex.\n']","
文中提到的膝关节生物力学模型存在以下局限性：1）基于的受试者群体与研究人群（10名受试者）存在显著差异（体重和身高偏差），影响模型的泛化能力；2）未考虑腘绳肌的共激活效应，导致计算的膝关节力被低估；3）未涵盖动态运动任务中的生物力学特征，限制其在实际应用中的适用性；4）未提及是否基于个体化数据或考虑肌肉解剖变异，影响其临床与运动科学中的通用性。
","
文中提到的膝关节生物力学模型存在以下局限性：一是模型基于的受试者群体与实际研究对象在身高和体重参数上存在差异，影响力估计的准确性；二是未考虑腘绳肌共激活效应，导致股四头肌力及膝关节力的计算结果被低估；三是模型未充分反映不同膝关节屈曲角度下肌腱-股骨接触面积变化对压应力的影响，可能低估了损伤风险。
    ",0.3333333333333333,0.9982507616215552,0.5
"
文中设计的Android应用程序如何实现对不同类型任务的辅助水平个性化调节？
","['\n6.2 Methodology  6.2.1 Clinician-friendly android app (GUI) interface development  I designed an android app, or graphical user interface (GUI) in Android Studio using the Java language. This work involved two main aspects: 1) designing the front panel (or what the user sees and how they interact), and the background interface which provides the functionality of the GUI. We wished the front panel to be user friendly to the clinician who will ideally leverage the intuitive customizability of the controller to provide the appropriate assistance levels for each category of task or task phase to the patient based on their unique deficits. Four customization options were provided: as can be seen in Fig. 6.2, i.e., the ability to modulate the assistance for - 1) aiding in upward propulsion in ascent tasks, aiding bracing (energy absorption) in descent tasks, 3) aiding the strength of upward propulsion for sit-stand (or more generally closed chain squatting) tasks, and 4) leg clearance in general swing. With intuitive graphics, the on-site clinician was easily able to control the behavior of the controller. The GUI also provides a secondary feedback panel which receives data from the bilateral exoskeleton modules and displays them as live bar graphs. In this  76  case we displayed live commanded torques (normalized to the saturation torque of 25 Nm). This feature allows the clinician to monitor the behavior of the controller and can determine if more assistance may be needed in certain difficult tasks or task phases. Buttons on the bottom right of the screen are provided to easily switch back and forth between the two front panels.\n']","
文中通过设计直观的临床友好型Android应用程序界面，提供四种任务相关的辅助调节选项（向上推进、制动、坐站辅助、摆动腿部抬升），并实时反馈控制器行为，结合图形化操作与多任务切换功能，实现对不同类型任务的个性化辅助水平调节。
","
    文中设计的Android应用程序通过提供四个可调节的辅助模式（上坡推进、下坡支撑、坐站推进力量、摆动腿抬离）和直观图形界面，使临床医生可根据患者个体缺陷和任务类型实时调节外骨骼的辅助水平。结合实时扭矩反馈与界面切换功能，实现了对不同类型任务或任务阶段的个性化辅助控制。
    ",1.0,0.901495500938286,1.0
"
自适应阻抗控制如何实现人机协同中的代谢能量减少？
","['\nThorough clinical investigations are still ongoing to prove the usability of these assistive robots; besides technical problems, mainly related to autonomy and portability of assistive exoskeletons, a scientific challenge still remains open i.e., how to control the robot in order to promote the human motor-adaptation and provide an effective assistance to the user.  In this paper, we study the human locomotor adaptation to the action of assistive exoskeletons that provide additional torque at the user’s hip, with the goal of reducing the muscle activity during gait while still allowing users to control their joint kinematics.  A muscle effort reduction during walking may be desirable for many persons. Several pathologies can decrease the walking ability of affected persons by reducing their  Manuscript received July 20, 2012, This work was supported in part by  the CYBERLEGs project (FP7-ICT-2011-2.1 #287894)  T. Lenzi was with with The BioRobotics Institute, Scuola Superiore Sant’Anna, Pisa, Italy; now is with the Center For Bionic Medicine, Rehabilitation Institute of Chicago and the Feinberg School of Medicine, Northwestern University, Chicago IL 60611 USA (e-mail: lenzi@ieee.org). M.C. Carrozza is with The BioRobotics Institute, Scuola Superiore  Sant’Anna, 56025 Pisa, Italy (email: carrozza@sssup.it)  S. K. Agrawal is with the Department. of Mechanical Engineering, (e-mail:  Columbia sunil.agrawal@columbia.edu).  University,  NY  10027,  USA  Walking assistance requires a strong synergy between the user and the robot. While walking, the assistive exoskeleton provides the user’s joints with supplemental torques. At the same time, the user adapts his muscle activation patterns to exploit the available torques in a convenient way. If the assistance is effective, the motor adaptation process will result in lower muscle forces and thereby a less fatiguing walk for the user. A thorough understanding of the human adaptation process is therefore fundamental for designing an effective assistive device for walking [20].  Recent studies exploiting proportional EMG control and gait event detection have showed that when an assistive torque is provided, humans modulate their muscle activation in order to maintain the total torque profile, i.e., the sum of human muscular torque and assistive torque, unaltered along the gait cycle [21],[22]. As a consequence, the muscle torque decreases and the metabolic effort is reduced [23]\n']","
自适应阻抗控制通过动态调节外骨骼提供的髋关节辅助扭矩，使人体在行走过程中适应并优化肌肉激活模式，从而降低肌肉总扭矩输出。这种调节机制确保用户肌肉与外骨骼扭矩的总和保持不变，促使人体通过减少肌肉激活来维持运动，最终实现代谢能量的降低。
","
自适应阻抗控制通过调节外骨骼提供的辅助扭矩，使用户能够根据外力进行肌肉激活模式的适应性调整，从而维持总扭矩不变并降低肌肉负荷，最终实现代谢能量的减少。
    ",0.0,0.7936060323903747,1.0
"
文中提到的临床有意义的平均改善如何影响外骨骼设备在临床环境中的推广？
","['\n. An RCT must be suf- ficiently powered and contain a formal control group representative of usual care, to allow for comparisons of rehabilitation effects. If an RCT shows positive changes in some metrics but remains overall inconclu- sive, then progression to a multicentre RCT in phase 4 should be halted. Once clinically meaningful average improvements are obtained with the device (compared with the control group), a multicentre RCT can be conducted. Clinical effectiveness from such a study would motivate device implementation in clinical settings.\n']","
临床有意义的平均改善是外骨骼设备进入多中心随机对照试验（RCT）的必要条件，一旦获得该结果，可推动设备在临床环境中被采用和推广。
","
临床有意义的平均改善是外骨骼设备进入多中心随机对照试验阶段的前提条件，只有在确认该类改善后，才能进一步验证其临床有效性，进而推动设备在临床环境中的推广与应用。
    ",0.75,0.8951479661528875,1.0
"
自适应频率振荡器（AdOs）在外骨骼控制器中用于估计步态周期的哪些关键参数？
","[""\nThe first stage of the assistive controller addresses the estimation of the current phase of the gait cycle. The gait cycle, i.e., stride period, is defined in the controller as the time between two consecutive left heel strike events, while the current phase inside each gait cycle (expressed as a percent of stride period) is obtained as the ratio between the time elapsed from the start of the current cycle, and the expected duration of the cycle. The expected duration of the gait cycle is estimated through an Adaptive Frequency  In this study we propose an alternative solution based on nominal torque profiles that approximate on-line the user's joint torque during walking. While walking at a constant  1 Note that given the substantial equivalence between over-ground and treadmill walking [46], the Winter’s torque profile can be used for experiment performed on treadmill.  Copyright (c) 2013 IEEE. Personal use is permitted. For any other purposes, permission must be obtained from the IEEE by emailing pubs-permissions@ieee.org.  This article has been accepted for publication in a future issue of this journal, but has not been fully edited. Content may change prior to final publication.  Oscillator (AdOs), a mathematical tool that was originally developed for other applications [45] and more recently used for estimating the high-level features of periodic human movements [42],[49]. Resistive foot-pressure sensors are embedded insoles (see [47] for implementation) and act as switches to detect the heel-strike and toe-off events. By combining the left foot heel strike detection with the estimated cycle-duration, the assistive controller can compute the current stride percent (Stride % in Fig. 2(a)).  in  the user’s shoe\n""]","
自适应频率振荡器（AdOs）在外骨骼控制器中用于估计步态周期的两个关键参数：步态周期持续时间（stride period）和步态周期内的当前相位（stride %，即当前步态周期所占的百分比）。
","
    自适应频率振荡器（AdOs）在外骨骼控制器中用于估计步态周期的预期持续时间（expected duration of the gait cycle），从而支持对当前步态相位百分比（gait phase percentage）的实时计算与更新。
    ",0.6,0.9100987636789604,1.0
"
自适应阻抗控制如何提升外骨骼系统的人机协同性能？
","['\nData availability De-identiﬁed data relating to this study are available from the corresponding author upon reasonable request.  Results All 50 participants completed gait training and assessment (Pre/Mid/Post: n = 25 for FTST and SMA; Fol: n = 19 for FTST, n = 17 for SMA), with no adverse events in either intervention group. Stepping activity data were available for 24participantsineachgroup,andTMSdatawereavailablefor 15 participants in each group (ﬁgure 1).  Clinical assessments: comparison between time points One SMA participant was excluded from the 5XSST measure for having an outlying Pre score (121.5 seconds) compared with other time points (Mid: 29.7 seconds; Post: 41.6 sec- onds; Fol: 30.1 seconds). No reason was noted for the score. However, including the participant unfairly skews the average percentage changes for this outcome, so the SMA group appears to improve considerably in 5XSST. It is unlikely that such a drastic improvement at all other time-points could be attributed to the intervention at the participant’s stage of chronicity (5.1 years).  Figure 3 illustrates the progression of clinical outcome scores at Pre, Mid, Post, and Fol for the FTST and SMA groups. Table 2 reports the average percentage change in scores from Pre at Mid, Post, and Fol for each intervention group.  There was a main eﬀect of time on all outcome measures except pain rating and depression. There was also a main ef- fect of months since stroke on fastest walking speed (p = 0.023) and balance (p = 0.032). There was a main eﬀect of stroke subtype on balance (p = 0.002). Post hoc analyses revealed that both groups changed from Pre in walking speed, endurance, balance, and LE-FM at all other time points (p < 0.05). The primary outcome measure, self-selected walking speed, increased for the SMA group at Mid (0.14 ± 0.13 m/s, p < 0.001), Post (0.24 ± 0.14 m/s, p < 0.001), and Fol (0.22 ± 0.17 m/s, p < 0.001).  Only the SMA group exhibited changes in self-selected walking speed signiﬁcantly greater than MCID at Post. The number of participants with walking speed changes above MCIDatMid,Post,andFolwere6,14,and7inFTSTand12, 19, and 12 in SMA. Both groups had signiﬁcantly greater changes in walking endurance than MDC and MCID at Post and Fol, indicating that these improvements persist even 3 months after training. The number of participants with en- durance changes above MCID at Mid, Post, and Fol were 17, 23, and 15 in FTST and 20, 25, and 13 in SMA.\n']","
文献无相关内容。
","
文献无相关内容。
    ",1.0,0.0,1.0
"
本文提出的基于连续刚度模型的扭矩控制器如何实现不依赖步态相位估计的连续扭矩控制？
","['\nD. Conclusion and Future Work  In this work, a continuous-phase stiffness model and the corresponding stiffness-based continuous torque controller are proposed and evaluated on a portable knee exoskeleton with eight able-bodied subjects during treadmill walking. This stiff- nessmodelcanachievealargeandsufﬁcientstiffnessbandwidth (16 Hz) to cover the normal human walking frequency range, and the controller achieves a small torque tracking error (0.23 N·m) under different stiffness. Our continuous torque controller requires no gait phase estimation and can adapt to varying speeds and generate a continuous torque proﬁle. Reducing the muscle activity of able-bodied subjects for level-ground walk- ing using a portable knee exoskeleton has traditionally been considered a difﬁcult task [65]. However, by leveraging our lightweight portable knee exoskeleton and our proposed contin- uous stiffness-based torque controller, our neuromuscular walk- ing experiments demonstrate that both the rms and maximum EMGofalleightmusclesdecreased(remarkableforthreeexten- sors and two ﬂexors) in the powered condition relative to the un- powered condition and two out of eight lower extremity muscles have a signiﬁcant reduction in muscle activation in the powered condition relative to the baseline (no-exoskeleton) condition. ComparedwiththeresultofthebaselineconditioninTableVIII,  the results showed that the powered exoskeleton could reduce the maximum EMG of knee extensors (VM, VL, and RF), knee ﬂexors(BFandSEM),andanklemuscle(TA)andreducetherms of knee extensor (RF), knee ﬂexors (BF and SEM), and ankle muscle (TA). But the rms and maximum EMG of the ankle plan- tarﬂexors(MGandLG)wereincreasedby3.55%and2.18%,re- spectively.Therefore,itcanbeconcludedthatthekneeexoskele- ton can reduce the EMG signal of the knee ﬂexor and extensor muscles. In contrast, the weight of the exoskeleton might cause a slight increase in the EMG signal of the ankle plantar ﬂexors, and it cannot be mitigated by knee joint torque assistance.\n']","
本文提出的基于连续刚度模型的扭矩控制器通过其自身的刚度调节机制，在不依赖步态相位估计的前提下实现了连续扭矩控制。该模型具有足够宽广的刚度带（16 Hz），能够覆盖正常人体步行频率范围，并在不同步态速度条件下保持良好的控制性能。控制器通过肌肉与关节之间动态交互关系构建的连续刚度特性，实现对膝关节肌肉负荷的连续调节，从而显著降低肌电信号，验证了其无需步态相位估计即可实现稳定、连续控制的优势。
","
本文提出的基于连续刚度模型的扭矩控制器通过构建一个连续变化的刚度函数，替代传统控制中所需的步态相位估计，从而实现不依赖步态相位划分的连续扭矩控制。该模型具备16 Hz的刚度带宽，能够适应不同步行速度，并在实验中表现出0.23 N·m的低扭矩跟踪误差，验证了其连续控制的稳定性与适应性。
    ",0.8888888888888888,0.872436493985238,0.75
"
文中提出的混合FES系统如何实现代谢动力与机器人动力的有效协同控制？
","['\nDigital Object Identiﬁer 10.1109/TNSRE.2015.2421052  1534-4320 © 2015 IEEE. Personal use is permitted, but republication/redistribution requires IEEE permission. See http://www.ieee.org/publications_standards/publications/rights/index.html for more information.  455  456  IEEE TRANSACTIONS ON NEURAL SYSTEMS AND REHABILITATION ENGINEERING, VOL. 24, NO. 4, APRIL 2016  similarly do not leverage the presence of the metabolic power supply.  In this paper, the authors combine the use of an externally powered lower limb exoskeleton with FES, in order to form a powered hybrid FES system. The intent of the system is to combine the power and movement control advantages of the powered lower limb exoskeleton with the physiological bene- ﬁts provided by FES. The proposed system is of the same gen- eral class of systems as the hybrid FES systems previously cited (i.e., [21]–[28]), but incorporates two sources of motive power (metabolic and robotic), and therefore offers additional control authority with which to supplement the FES. Such an approach requires a control methodology that can effectively combine these dissimilar sources of motive power, which is the topic of this paper.  Some researchers have recently explored the notion of com- bining FES with powered exoskeleton systems for individuals with paraplegia, as described in [41] and [42]. In [41], the au- thors describe a feasibility study combining quadriceps stimu- lation with a lower limb exoskeleton that includes hip and knee joint actuation. In that work, the authors manually tune a quadri- ceps stimulation pulse on a single healthy subject, and show that once appropriately tuned, the quadriceps stimulation decreased the torque required from the knee actuator to achieve similar joint angle tracking. In [42], the authors also describe a control method for combining FES with a powered knee joint, and im- plemented this method on ﬁve healthy subjects. In that work, the knee joint motor is controlled by a variable-stiffness con- troller, with the stiffness controlled as a function of the interac- tion torque between the user and the exoskeleton. Concurrently, the knee extensor muscle stimulation is controlledby a PID con- troller, and knee ﬂexor muscle stimulation is controlled by an iterative learning controller.\n']","
文中提出的混合FES系统通过引入代谢动力与机器人动力的双源控制机制，实现代谢动力与机器人动力的有效协同控制。系统采用外骨骼膝关节的变刚度控制与FES的PID控制器及迭代学习控制器相结合的方式，动态调节两种动力源的输出，实现对下肢关节的精确辅助与运动协调，从而提升整体控制性能与用户适应性。
","
文中提出的混合FES系统通过将外骨骼系统与功能性电刺激（FES）结合，整合代谢动力（人体肌肉）与机器人动力（外源驱动），从而实现协同控制。系统采用多种控制策略，如PID控制器调节膝关节伸肌刺激，迭代学习控制器用于屈肌刺激，以及可变刚度控制器调节电机行为，以有效融合两种动力源。实验验证表明，适当调制FES可降低外骨骼执行器所需扭矩，从而实现代谢动力与机器人动力的协同优化。
    ",0.4,0.9323391770352698,1.0
"
本文通过运动学步态分析揭示了多发性硬化患者的哪些主要步态特征？
","['\nTo conclude, gait disturbances in a cohort of mildly- to moderately-affected patients with MS are typified by decreased knee and ankle flexion, reduced dynamic stability and increased variability of movements. Subgroup analysis highlighted three dominant walking patterns in these patients: spastic-paretic gait, ataxia-like gait and unstable gait. While sensitive kinematic gait analysis and clinical walking tests detected deterioration of walking function over 1 year, EDSS scores did not reveal any change in our cohort. These insights may help to inform rehabilitative gait training in patients and to develop deficit-specific and patient-tailored exercise programs.  Materials Participants. Thirty-seven patients diagnosed with relapsing-remitting, primary- or secondary-progres- sive MS and clinical walking impairment were assessed at University Hospital Zurich between 2012 and 2013 (FAMPKIN study; clinicaltrials.gov, NCT01576354). For inclusion, patients had to be able to cover a distance of at least 50 meters within 6 minutes and to walk independently on an instrumented treadmill. Healthy control par- ticipants were measured within the framework of a two-centre study (University Hospital Zurich and University Hospital Balgrist). Both studies were approved by the Zurich cantonal ethics committee (KEK-2011-0445, KEK- 2014-0004) and were conducted in accordance with the Declaration of Helsinki and Good Clinical Practice. All subjects gave written, informed consent.\n']","
本文通过运动学步态分析揭示了多发性硬化患者的三个主要步态特征：1）步态不稳定性和运动变异性增加；2）痉挛-肌张力减退步态；3）类似小脑共济失调的步态；4）不稳定的步态模式。这些特征提示MS患者存在多种核心步态缺陷，可用于指导康复训练和制定个性化康复策略。
","
本文通过运动学步态分析揭示了多发性硬化患者的以下主要步态特征：膝关节和踝关节屈曲减少、动态稳定性降低、运动变异性增加。亚组分析进一步识别出三种主要步态模式：痉挛性轻瘫步态、类共济失调步态和不稳定步态。尽管EDSS评分未显示变化，但运动学分析可检测出一年内行走功能的退化，提示其在评估步态障碍方面具有更高的敏感性，有助于制定个性化的康复训练方案。
    ",0.5714285714285714,0.899141979067286,0.5
"
柔性框架在辅助位置设计上采用了哪些策略以提升穿戴安全性与舒适性？
","['\nFigure 4. Free body diagram of 2D flexible sliding frame  Figure 3. The concept of flexible sliding frame  600  of the thigh frame. Thus, the concept of flexible frame is verified for the 1D and 2D frames. To connect the front side of the thigh fastener and the output of the actuator located next to the hip joint, as shown in Fig. 1, the shape of the flexible frame follows slightly reverse conic. The detailed 3D shape of flexible frames referred to those of the average old from KATS (Korean Agency for Technology and Standard) and they were made in three length. The loads transmitted from the device to the human interface produce contact pressures that can compromise safety and comfort. Hence, for assisting to reduce the force, the assisting position on the thigh is designed to be close to the knee, avoiding areas such as knee movement area, quadriceps tendon, etc. Figure 6 shows the detailed design of the flexible frame, which has an upper plate and a lower plate. These plates are bonded to each other at both ends, and can be moved in the middle portion to slide relative to each other with guidance from dovetail sliders. This structure of the dovetail sliders can increase the tensile/compressive stiffness and bending compliance at the same time. However, it has a limitation that the end rigidity may be insufficient for transmitting the force, because it is made of engineering plastics such as\n']","
柔性框架在辅助位置设计上采用了以下策略以提升穿戴安全性与舒适性：1）采用略呈反锥形的1D和2D结构以适应人体运动范围并减少局部压力；2）通过滑块引导的V型结构增强轴向刚度与弯曲顺应性；3）采用上板与下板相对滑动设计，提升力传递效率与穿戴灵活性。文献未提及具体关于皮肤接触面积或温度分布的优化策略。
","
    柔性框架在辅助位置设计上采用了以下策略以提升穿戴安全性与舒适性：（1）将辅助位置设计在靠近膝盖处，避开膝关节活动区域和股四头肌腱等敏感部位；（2）采用略呈反圆锥形状的结构以优化与大腿的贴合性；（3）采用由上板与下板组成的滑动结构，并通过燕尾槽导轨实现相对滑动，从而兼顾拉压刚度与弯曲顺应性；（4）基于KATS平均老年人人体数据进行3D建模，并提供三种长度规格以适配不同用户。
    ",0.3636363636363636,0.9994468668150294,0.5
"
文中提到哪些关键技术可用于估计关节力矩，各自存在哪些局限性？
","['\nThis work involved human subjects or animals in its research. Approval of all ethical and experimental procedures and protocols was granted by the Human Participants Ethics Committee from Wuhan University of Technology, and written informed consent was obtained from each participant.  The  authors  are with  of of Technology, Wuhan  the School  Information Engineering, (e-mail: 430070, China tianzunmei@whut.edu.cn; changzhu@whut.edu.cn;  Wuhan University weimeng@whut.edu.cn; qingsongai@whut.edu.cn; quanliu@whut.edu.cn).  The friendly rehabilitation assistance and avoidance of secondary injuries can be achieved through the application of the optimal torque. Currently, the primary methods for measuring human joint torque are to directly measure the torque or use reverse dynamics [5]. However, these meth- ods are not optimal for the real-time measurement of joint torque. The main techniques employed to estimate joint torque include biological models [6], various regression models, artiﬁcial neural networks [7]. Liu et al. [8] collected sEMG signals and used Hill’s musculoskeletal model to estimate joint torque esti- mation strategy that collected sEMG signals and obtained the envelope information through pre-processing. Machine learning is capable of extracting valuable key information from multimodal data, while also demonstrating good generalisation capabilities [10]. Truong et al. [11] adopted long and short memory network (LSTM), which extracted three groups of sEMG features as input and estimated joint torque of lower limbs. Gui et al. [12] adopted radial basis function neural networks combined with sEMG signals to estimate active joint torque for the custom lower limb exoskeleton. TCN employs dilated and causal convolution to encode temporal information and automatically extracts features. Molinaro et al. [13], [14] adopted TCN and achieved the average error of 0.131Nm/kg the sonomyography of for hip exoskeletons. Furthermore,  torque. Wu et al. [9] proposed a joint  Digital Object Identiﬁer 10.1109/TMRB.2024.3464671  2576-3202 c 2024 IEEE. Personal use is permitted, but republication/redistribution requires IEEE permission. See https://www.ieee.org/publications/rights/index.html for more information.  Authorized licensed use limited to: BEIJING UNIVERSITY OF TECHNOLOGY. Downloaded on December 12,2024 at 09:20:40 UTC from IEEE Xplore. Restrictions apply.  MENG et al.: OPTIMIZED IMPEDANCE CONTROL OF A LIGHTWEIGHT GAIT REHABILITATION EXOSKELETON\n']","
文中提到用于估计关节力矩的关键技术包括：生物模型（如Hill模型）、回归模型（如SVM）、人工神经网络（ANN）、长短期记忆网络（LSTM）、径向基函数神经网络（RBF）、时间卷积网络（TCN）等。这些技术各自存在以下局限性：生物模型依赖生物参数拟合精度，难以适应个体差异；回归模型对训练数据依赖强，泛化能力有限；ANN易过拟合，训练耗时；LSTM需大量计算资源，部署受限；RBF对初始参数敏感，非线性建模能力有限；TCN模型复杂度高，部署难度大。目前，这些技术尚未实现全面融合，尤其在实时性和个体适应性方面仍需优化。
","
文中提到的关键关节力矩估计技术包括：生物模型、回归模型、人工神经网络（如LSTM、RBFNN和TCN）。其局限性分别为：生物模型（如Hill模型）受限于复杂性和个体差异；LSTM依赖大量数据且可解释性差；RBFNN对输入信号质量敏感；TCN虽精度较高（平均误差0.131 Nm/kg），但模型复杂度高，可能影响实时性；直接测量与逆动力学方法不适合实时应用。
    ",0.4285714285714285,0.9768306919058224,0.5
"
本文中通过仿真分析得出了哪些关键指标（如 HLi、TLi 和 CLi）的变化趋势，从而验证了所提方法的可行性？
","['\n615 Authorized licensed use limited to: BEIJING UNIVERSITY OF TECHNOLOGY. Downloaded on December 09,2024 at 08:31:21 UTC from IEEE Xplore. Restrictions apply.  Table V. Rules for fuzzy inference systems Fuzzy tuner 1 (for pressed FSR) Fuzzy tuner 2 (for unpressed FSR)  Input Output Input Output  S PS S PS  M PM M NS  L PL L NL  11iiiHLHLDsSL\uf02d\uf02d\uf03d\uf02b\uf02d (6) iFiTLSLlHL\uf03d\uf02d\uf02d (7) Since the parameters in membership function can determine the performance of the fuzzy tuners, both output membership functions are parameterized by Ai and Bi (see Fig. 4, i = 1, and 2). With the first step length Ds1 for stairs descent (given by Eq. (2)) and parameters in Table VI, we simulate HLi , TLi , and CLi of various SL (28 cm, 30 cm, 32 cm, 34 cm) for ten continuous steps. In order to have the optimal performance, we optimize the Ai and Bi (positions of output triangle membership function) with the objective of minimum of HL and the constraint of enough value of CL (see Eq. (8)), and the optimized membership functions are shown in Fig. 4. 1122min (,,,)=min().. min()>23fABABHLstCL\uf02d\uf0ec\uf0ed\uf0ee (8) With the optimized parameters for fuzzy tuners, the simulated HLi, TLi and CLi of various SL (28 cm, 30 cm, 32 cm, 34 cm) for the following ten steps are shown in Fig. 5. We find that values of HLi are all positive, which means no heel-stair collision occurs; moreover, the values of CLi are about 25 cm, which means most area of the foot is in contact with the stair. Therefore, we conclude that the proposed method should be feasible.  Degree of membershipHL (cm)  Degree of membershipl\uf044(cm)  PSPMPL  1.25A1B1  3.13  Degree of membershipl\uf044(cm)  NLNSPS  1.44A2B2\n']","
本文通过仿真分析得出了 HLi（踝距）、TLi（脚距）和 CLi（接触长度）这三个关键指标的变化趋势。在步长 SL（28 cm、30 cm、32 cm、34 cm）下进行十次连续行走仿真，优化模糊调制器参数以最小化 HLi 并满足 CLi 的约束条件。结果显示，HLi 均为正值，表明无踝部与楼梯碰撞；CLi 均约为 25 cm，说明脚部接触面积良好，验证了所提方法的可行性。
","
    本文通过仿真分析得出了 HLi（脚跟离地高度）、TLi（脚尖着地位置）和 CLi（接触长度）的变化趋势。仿真结果显示，HLi 始终为正值，表明无脚跟与楼梯碰撞；CLi 约为 25 cm，表明脚部与楼梯有良好的接触面积。这些趋势验证了所提方法在保证行走安全与稳定性方面的可行性。
    ",0.9285714285714286,0.7710368517241455,0.5
"
如何利用股直肌（RF）和腘绳肌（HM）的MMG信号进行膝关节屈伸扭矩预测，文中采用了何种目标变量进行回归分析？
","['\nPradhan et al. proposed a linear regression technique that divides the EMG signal into frequencies to control a pros- thetic hand and stated that control by linear regression pre- diction provides accurate and robust control [15]. Similar to Pradhan et al., Smith et al. reported that linear regression control can be an alternative to conventional methods [16]. Chen et al. used polynomial regression to analyze joint torque and muscle activity using EMG, MMG, and sonography, respectively, and found that EMG and MMG had no effect on convergence speed [17]. Anders et al. used polynomial regres- sion analysis to identify patterns in EMG and MMG of the vastus lateralis muscle signals during leg extension and found that there were few intra-individual effects such as fatigue but observed that differences between individuals should be noted [18]. The best performance of MMG-based regression analysis is given in [19]. Estimating muscle torque with support vector regression (SVR) from MMG signals evoked by electrical stimulation showed a coefﬁcient of determination (R2) of 94% for training and 89% for testing. However, this study was conducted under limited conditions in which vibrations were induced by electrical stimulation.  Fig. 1. Overview of the signal processing.  rectus femoris (RF) muscle of the thigh, which is the main ﬂexion-extension muscle of the knee joint, and the hamstring (HM), which is the antagonist muscle group, from four direc- tions, and analyzed the feature values during the ﬂexion- extension movement. A regression analysis was performed using the number of ﬂexion and extension movements as objective variables. From the results of the regression analysis, the knee joint ﬂexion/extension joint torques was predicted from the MMG of the thigh, and the accuracy was veriﬁed.\n']","
文中采用线性回归方法，以“关节屈曲与伸展次数”作为目标变量进行回归分析，用于预测膝关节的屈伸扭矩。
","
该研究通过分析股直肌（RF）和腘绳肌（HM）的MMG信号特征，采用“屈伸动作次数”作为目标变量进行回归分析，从而预测膝关节屈伸扭矩，并验证了其预测精度。
    ",1.0,0.7736359731954853,0.75
"
文中提出的软体外骨骼设备如何结合刚性与柔性设计的优势以提升穿戴舒适性与关节对齐特性？
","['\nTo address the above issues, there has recently been work on developing active soft orthotics. A team at Harvard University has developed a soft exosuit to assist the wearer’s natural gait performance in the military and medical ﬁelds [11]–[13]. Unlike traditional rigid exoskeletons with rigid support frames, this exosuit uses soft materials, such as textiles and elastomers, so that it can be worn like clothing. However, until now this soft wearable device has presented its own inherent limitations, such as the absence of weight-support functionality. As shown in Fig.1(b), the device pulls the extremity of a human body by the wire directly without load-support frames to assist the joint torque. Considering the importance of the weight- support function for the elderly who have arthritis pain, the effectiveness of the device in assisting the elderly’s gait has not yet been proved.  To solve these limitations of conventional rigid and soft wearable devices, we proposed a novel wearable walking assis- tance device named Samsung walking-assist device for lower extremities (abbreviated as “S-Assist L-type”) for personal use. Its biomechanical design takes the best of the above two approaches, conjugating a ﬂexible load-support structure for increased wearability and comfort, with a multi-joint kinematics for compliance and self-alignment with anatomical joints.  We developed in this work the ﬁrst prototype of a novel, tightly ﬁtting, more comfortable walking assist device for per- sonal use. It was designed to support the geriatric population with moderate impairment to walk or stand. Our aim is to promote active daily living for the elderly and the inﬁrm, who require lower-body physical support without adverse social consequences. The S-Assist can transmit a maximum of 20Nm of torque to the hip and knee joints independently. As shown in Table II, considering the added mass of the device, it is approx- imately 11.4%–26% of the torque required for the wearer’s hip and knee joints during walking or single-leg standing based on a 70-kg bodyweight. Although these maximum assist torques  (a)  (b)  Fig. 2. System overview of the “S-Assist L-type”: (a) the front view of the S-Assist in the standing mode and (b) the side view of the S-Assist in the standing mode.\n']","
文中提出的 S-Assist L-type 软体外骨骼设备通过融合柔性负载支撑结构与多关节运动学控制，提升了穿戴舒适性与关节对齐特性。其柔性结构增强了贴合度与穿戴舒适性，同时多关节运动设计确保了与人体自然关节的顺应性与自对准能力，从而克服了传统刚性与软体设备的局限性。
","
    文中提出的软体外骨骼设备（S-Assist L-type）通过引入柔性负载支撑结构提升穿戴舒适性，并结合多关节运动学设计实现与人体解剖关节的自对齐，从而融合了刚性设计的关节对齐优势与柔性设计的舒适性与贴合性。
    ",1.0,0.8205905662524043,1.0
"
自适应助力控制算法中，如何通过权重矩阵Wj(U,Yj)调节外骨骼控制输入与人体关节力矩的协同关系？
","['\nj · [vGRF ·U(qj, pj,α) −Yj]  + [UB(qj, pj,α) −Y B  j ]TWk[UB(qj, pj,α) −Y B  j ]}  +U(q0, p0,α)TWrU(q0, p0,α) + Wsα  1  ,  (11)  where the subscript j represents the number of different walk- ing tasks, including level-ground walking, ramp walking, stair climbing, and stand-to-sit. The state vectors qj, pj ∈ Rm×1 comprise samples over time for the given task j with the number of time samples m.  The objective function comprises four parts, where the ﬁrst part corresponds to the least squares error of the exoskeleton control inputsU ∈ R2m×1 and the normalized able-bodied hu- man torquesYj ∈ R2m×1 for the ankle and knee joints with the weighting matrix Wj(U,Yj). The weighting matrix Wj(U,Yj) depends on the exoskeleton and human inputs (U,Yj) and adjusts the weights according to sign(U(i) ·Yj(i)), where i ∈ {1,...,2m} represents the sample index. We enlarge the weights when U(i) and Yj(i) have opposite signs to empha- size the importance of assisting rather than resisting human torques.  The second part of the objective function with UB and Y B aims to minimize the difference between the control inputs and normalized able-bodied torques during the initial 15%  20  VOLUME 1, 2022  and late 15% of stance phase boundaries with weighting ma- trix Wk, i.e., the early and late stance phases during the gait cycle, without the effect of GRFs. This helps regulate the exoskeleton torques u at endpoints of the stance phase. This also minimizes the dependence on vGRF for real-time imple- mentation to avoid aggressive torques when the custom force sensor in [24] returns inconsistent measurements of vGRF compared to the force plates in the dataset [33].\n']","
自适应助力控制算法中，权重矩阵 Wj(U, Yj) 根据外骨骼控制输入 U 与人体关节力矩 Yj 的符号乘积 sign(U(i)·Yj(i)) 进行动态调整。当两者符号相反时，权重被放大，以强调助力的重要性；当符号相同时，权重被减小，以减少对外骨骼与人体协同的干扰，从而实现更合理的自适应控制。
","
    在自适应助力控制算法中，权重矩阵 Wj(U,Yj) 通过分析外骨骼控制输入 U 和人体关节力矩 Yj 的符号乘积 sign(U(i)·Yj(i)) 动态调整权重，当二者符号相反时增大权重，以强调辅助作用并避免产生阻碍人体运动的力矩。该矩阵用于目标函数的第一部分，即最小化外骨骼控制输入与归一化人体关节力矩之间的误差，从而调节外骨骼与人体关节力矩的协同关系。此外，在步态周期的初始和末段支撑阶段，权重矩阵 Wk 进一步调节控制输入与人体力矩的匹配程度，确保外骨骼在关键时间点提供适当的助力。
    ",0.6666666666666666,0.8580391116298373,0.75
"
输出阻抗测试结果显示控制系统的阻抗峰值和频率分别是多少？与未控制系统相比有何改进？
","['\n2576-3202 (c) 2020 IEEE. Personal use is permitted, but republication/redistribution requires IEEE permission. See http://www.ieee.org/publications_standards/publications/rights/index.html for more information. Authorized licensed use limited to: City College of New York. Downloaded on May 08,2020 at 13:35:23 UTC from IEEE Xplore. Restrictions apply.  5  This article has been accepted for publication in a future issue of this journal, but has not been fully edited. Content may change prior to final publication. Citation information: DOI 10.1109/TMRB.2020.2981951, IEEE Transactions on Medical Robotics and Bionics  > REPLACE THIS LINE WITH YOUR PAPER IDENTIFICATION NUMBER (DOUBLE-CLICK HERE TO EDIT) <  Fig. 8. Three alignment conditions used during the experiment. Each subject was fitted with the exoskeleton in Ideal, Above, and Below alignment. The Ideal condition was set up by the experimenter visually aligning the exoskeleton and anatomical knee axes. Using a measuring tool, a misalignment of approximately 25 mm between the knee and the exoskeleton joints was introduced in both Above and Below conditions.  torque-to-speed ratios representing the output impedance. The standard deviation of both the impedance estimate and input frequency is shown in Fig. 6 as a measure of the test variability. The test was performed with the control on and off to estimate the controlled and uncontrolled system dynamics, respectively.  Fig. 10. Desired torque profile applied during sit-to-stand testing, averaged across all trials and subjects. Three assistance levels are shown: Zero torque, Low assistance level, and High assistance level. The X-axis represents normalized knee angle from initial to final angle during sit-to-stand.  B. Experimental Results  The results of the torque step response for the proposed closed-loop system are shown in Fig. 6(a). The rise time was 15.2 ms. The settling time was 69.2 ms. The overshoot was 17.5% (3.5 Nm). The steady-state error was 0.001 Nm. Based on the rise time and using a second-order model, the -3dB bandwidth of the closed-loop system is estimated to be 22.3 Hz. The results of the impedance test are shown in Fig. 6(b). The output impedance has a peak of 5.14 Nms/rad at 1.98 ± 0.05 Hz. On average, the output impedance was 49.2% lower for the controlled system than the uncontrolled system.  IV. HUMAN EXPERIMENTS  A. Experimental Protocol\n']","
输出阻抗测试结果显示，控制系统的阻抗峰值为 5.14 Nms/rad，频率为 1.98 ± 0.05 Hz。与未控制系统相比，控制系统的输出阻抗平均降低了 49.2%。
","
输出阻抗测试结果显示，控制系统的阻抗峰值为5.14 Nms/rad，频率为1.98 ± 0.05 Hz。与未控制系统相比，控制系统的输出阻抗平均降低了49.2%，表明控制系统显著提升了系统的动态性能和稳定性。
    ",1.0,0.8789500615441964,1.0
"
本文实验结果中展示的趋势为何被认为具有潜力，未来研究将如何验证其有效性？
","['\n. Here we presented a simple timing based control scheme; however, with the addition of sensors to the virtual anchor matrix, additional human-machine interaction control modalities can be examined. Specifically, we can examine those relevant and have been shown to be very important from a physiological perspective [31]. An extensive study of the full range of parameters of this device was beyond the scope of this paper, but we feel that this work opens the door to a broad range of biomechanics studies, not previously possible with other exoskeletons that have a significant effect on natural dynamics and kinematics. Further, we note that while no statistical analyses were performed here, the trends presented for this first case study are promising. Future work will also focus on statistically evaluating the efficacy of the exosuit with an increased number of human subjects. This new paradigm provides, for the first time, design rules, fabrication methodologies, and control strategies for\n']","
本文实验中趋势被认定具有潜力的原因在于其首次案例研究的初步趋势表现良好，尽管未进行统计分析。未来研究将通过增加参与者的数量并进行统计评估，以验证外骨骼系统的有效性，同时该研究为后续生物力学实验提供了新的研究范式和方法支持。
","
    本文实验结果中展示的趋势被认为具有潜力，是因为它们为未来生物力学研究和外骨骼控制提供了新可能性。未来研究将通过增加受试者数量并进行统计分析来验证其有效性。
    ",1.0,0.9490460966126042,1.0
"
为什么在摆动相中股二头肌（BF）激活度增加，这反映了控制器设计中的什么问题？
","['\nLastly, we observed some reductions in the quadriceps and the plantar-ﬂexors during the stance phase of level walking. The quadriceps have a high activation in bare mode primarily to dampen the impact of heel strike. The plantar-ﬂexors pro- vide the pushoff power during late stance to drive the COM  VOLUME 1, 2022  25  LIN ET AL.: OPTIMALLY BIOMIMETIC PASSIVITY-BASED CONTROL OF A LOWER-LIMB EXOSKELETON  FIGURE 7. Individual subject comparisons of mean effort across repetitions. Effort is compared between bare, active with PHI method, and active with WOP method for each muscle pair (VMO, RF, BF, TA, GM and SOL) and task {Stairs Ascent/Descent (7 in step height), Decline (−5.2◦,−12.4◦) at 0.6 m/s, level ground (1 m/s for s1 and s2, 0.8 m/s for s3), Incline (5.2◦,12.4◦) at 0.6 m/s, and Sit-Stand cycle (45 BPM)}. * represents statistical difference (p < 0.05). ** represents p <= 0.01. *** represents p <= 0.001.  forwards. Both our controllers provided appropriate knee ex- tension and plantar-ﬂexion assistance torques that resulted in noticeable reductions in VMO (s1) and SOL (s2) activity in the stance phase. Since the knee goes through a minimal range of motion during stance in level walking, our prior controller that utilized only potential energy shaping [24] was not ade- quate to provide assistance during this phase. With the PHI and WOP controllers developed in the present study, adequate knee extension assistance torques are provided to assist with impact absorption in early stance.  The TA activations for both PHI and WOP were higher than bare for all walking tasks. This is similar to the results in [41], where the TA during the swing phase had increased activity with decreasing gravity. One explanation is that we are not providing adequate torques to support the weight of the sensorized exoskeleton foot plate. It is also possible that the provided plantar-ﬂexion torques are excessive, necessitating the TA activation to compensate. Future work will model the passive dynamics of the muscle-tendon unit for all joints. This is especially important for the ankle, i.e., the Achilles tendon is known to provide signiﬁcant storage and release of energy, much like a spring.  The purpose of BF during swing is to lift the foot by ﬂexing the knee, aiding in leg clearance. Although we pro- vided marginal knee ﬂexion torques, we observed high ac- tivations for BF with the active modes compared to bare,\n']","
在摆动相中股二头肌（BF）激活度增加可能反映了控制器未能在该阶段提供足够的膝关节伸展辅助力矩，导致肌肉代偿性激活增加，说明控制器设计在摆动相中存在对膝关节动力学支持不足的问题。
","
在摆动相中股二头肌（BF）激活度增加，是因为控制器未能提供足够的膝关节屈曲辅助力矩以完成足部抬高任务，反映了当前控制器在摆动相膝关节动力学建模和力矩分配上的不足，尤其是缺乏对肌肉-肌腱单元被动动力学的有效整合。
    ",0.6666666666666666,0.863741154558205,0.5
"
膝关节外骨骼在疲劳后举升任务中表现出哪些显著的性能优势？研究中如何验证这些优势不受预疲劳工作量的影响？
","['\n61  For all metrics, we used linear mixed models (LMMs) with condition (bare, exo) and gender (male, female) being fixed effects and participant being treated as a random effect. For post- fatigue performance and posture metrics, we included additional effects of order (for the bare vs. exo condition) and pre-fatigue workload (number of pre-fatigue LL repetitions required to reach fatigue). Although our power analysis originally called for ten participants, we concluded our study early after completing eight participants due to 1) the unavoidable risk and discomfort of the fatiguing protocol, and 2) the strong trends observed in our primary metric. The p-values of all metrics tested were therefore corrected as per the early stoppage criteria (Pocock boundary) by scaling by a factor of 1.7. We also corrected for multiple testing (six tasks) for the quadriceps effort metric using the Holm Bonferroni method. Gender, order, and workload were found to be non-significant factors in all statistical tests reported below.  5.3.1 Performance and postural benefits in post-fatigue lifting-lowering  The results confirmed our hypothesis that the knee exoskeleton improves post-fatigue LL com- pletion time. Compared to bare, the bilateral knee exoskeleton induced a significant (p<0.001) 33% reduction, 95% CI [21%, 43%], in the time to complete 10 LL repetitions post-fatigue, corre- sponding to raw un-adjusted averages of 50 seconds (bare) and 35 seconds (exo). Fig. 5.2 shows the completion time distributions, and Fig. 5.3 shows the ensemble averaged durations for 10 LL repe- titions before and after fatigue was declared. We also found that the pre-fatigue workload (number of pre-fatigue LL repetitions performed in exo condition as a percentage of bare condition) was uncorrelated (r = −0.11) with the post-fatigue completion time (exo condition as a percentage of bare condition, Fig. 5.4). Hence, although the exo condition required fewer repetitions to reach fatigue than bare, this did not bias the post-fatigue results.\n']","
膝关节外骨骼在疲劳后举升任务中表现出显著的性能优势，具体表现为完成10次举升-下降（LL）任务所需时间平均减少33%（p < 0.001）。研究通过引入预疲劳工作量作为额外变量，发现其与疲劳后完成时间无显著相关性（r = −0.11），从而验证了外骨骼性能优势不受预疲劳工作量增加的影响。研究采用线性混合模型并进行多重检验校正，确保结果的可靠性。
","
膝关节外骨骼在疲劳后举升任务中显著提升了任务完成效率，表现为完成10次举升-下降任务的时间减少了33%（p<0.001，95% CI [21%, 43%]）。研究通过将预疲劳工作量作为协变量纳入统计模型，并发现其与疲劳后完成时间无显著相关性（r = −0.11），从而验证了这些性能优势不受预疲劳工作量的影响。
    ",0.8888888888888888,0.9430779400691196,1.0
"
基于积分均值减去的大腿角度相位空间在活动分类中的作用是什么？
","['\n𝑥(𝑡) = 𝜃𝑇 𝑦(𝑡) = ∫ [𝜃𝑇 − 𝑚𝑒𝑎𝑛(𝜃⃗𝑇)]𝑑𝑡  𝑡  0  where 𝜃𝑇 is the thigh angle input. The bounds of the integral coincide with the beginning and end of a stride (i.e., the integral is reset each stride). The vector notation indicates a vector containing the time-history of a particular signal over the course of a stride (i.e., the mean subtraction of the integral occurs once per stride to allow for stride-to-stride consistency in the phase space). Note that this method of using a subtracted mean that originally proposed and is integral implemented by [20]. Figure 1 shows the averaged thigh angle for seven healthy subjects for walking, stair ascent, and stair descent, plotted in the angle versus mean-subtracted integral phase space, as measured by a motion capture system. Note that, as required by the method, the locus of points for each activity forms a simple closed curve in this space for each limb segment input.  the same as  (LDA) pattern  II. ALGORITHM DESCRIPTION  A. Phase space  As previously mentioned, the method presented here is based on a phase variable (PV) representation, which requires that the variable input of interest be represented in a phase space (i.e., a signal as a function of its derivative). The methodology presented here further requires that the input variable form a simple closed curve in the phase space. Representation of a signal in a phase space (signal as a function of its derivative) as a simple closed curve requires that the signal be periodic and that each period be characterized by a single global maximum, a single global minimum, and no local extrema as a function of time.  Figure 1: Phase space for the thigh. The phase space consists of the integral of the mean-subtracted thigh angle plotted against the thigh angle. Thigh angle is calculated relative to the gravity vector in the sagittal plane. Walking (blue), stair descent (red), and stair ascent (green) stride data for healthy subjects form simple closed curves in this space.  B. Coordinate Frame Construction  The authors consider here the thigh angle with respect to the inertial reference frame (i.e., with respect to the vertical) in the sagittal plane as the input signal for activity classification. The thigh angle generally the corresponding phase in order to form a simple closed curve  requires an  integration of\n']","
基于积分均值减去的大腿角度相位空间用于将大腿角度信号转化为具有周期性和闭合曲线特性的相位图，从而在活动分类中提供一个具有区分性的相位空间表示。该方法通过积分均值减法消除个体差异和步态波动的影响，使不同活动在相位空间中形成可识别的几何轨迹，便于使用模式识别方法（如LDA）进行分类。
","
    基于积分均值减去的大腿角度相位空间在活动分类中的作用是将周期性下肢运动（如步行、上下楼梯）表示为相位空间中的简单闭合曲线，从而实现不同活动模式的区分。该方法通过积分并减去大腿角度信号的均值，确保每个步态周期内信号的一致性，并形成可由LDA等分类器识别的特征轨迹。
    ",0.8333333333333334,0.9481914618372904,1.0
"
文中推导的扭矩误差公式如何体现被动刚度对扭矩跟踪性能的影响？
","['\nτdes = −Kdes(θe − θ0),  (11)  we have  (1 + Kd)˙θp = −Kp[Kt(θpR − θe) + Kdes(θe − θ0)].  (12)  in which θ0 is maximum joint position for the device to exert torque on the human ankle, i.e., the intersection of torque-angle relationship with the angle axis.  Modeling exoskeleton-assisted walking after stabilization as an oscillation process made of N sinusoidal waves of the same frequency F, we get a proﬁle of the ankle angle in the form of  N  θe = c +  dn · exp(j2πFt + βn),  (13)  Xn=1  where c is an constant denoting the oﬀset of the proﬁle on torque axis, dn and βn are the magnitude and phase shift of the nth sinusoidal wave, and t represents the time elapsed within one stride since heel strike. The corresponding stabilized motor position should also oscillates with the same frequency. We can therefore construct a stabilized motor position by equal number of sinusoidal waves with the same phase shifts in the form of  N  θp = e +  fn · exp(j2πFt + βn),  (14)  Xn=1  in which e is a constant and fn is a complex number. Substituting Equations (13) and (14) into Equation (12), we get Equation (15).  N  (1 + Kd)j2πF + KpKtR  fn · exp(j2πFt + βn)      Xn=1  = −KpKtRe − Kp(Kdes − Kt)c + KpKdesθ0 N  (15)  −Kp(Kdes − Kt)  dn · exp(j2πFt + βn)  Xn=1  Frontiers in Neurorobotics | www.frontiersin.org  5  Optimal Passive Stiffness in Torque-Controlled Exoskeletons  Equating the coeﬃcients of the various sinusoidal waves and the oﬀset, we have  fn =  −Kp(Kdes − Kt) (1 + Kd)j2πF + KpKtR  dn  (16)  and  e = −  Kdes − Kt KtR  c +  Kdes KtR  θ0.  (17)  Motor position proﬁle in Equation (14) can thus be expressed in terms of the ankle position proﬁle and the controller as  θp = −  +  Kdes − Kt Kdes KtR KtR −Kp(Kdes − Kt) (1 + Kd)j2πF + KpKtR  c +  θ0  N  Xn=1  dn · exp(j2πFt + βn).  (18)  Combining the oscillator assumption with Equation (12), we get the expression of the torque error as  eτ  = τ − τdes  = Kt(θpR − θe) + Kdes(θe − θ0)  = KtRθp + (Kdes − Kt)θe − Kdesθ0 N  j2πF j2πF + Kp 1+Kd  = (Kdes − Kt)  KtR  Xn=1  dn · exp(j2πFt + βn)  (19)  It is clear that without considering the control gains, asserting  Kdes − Kt = 0  will minimize torque tracking error. Therefore, we make the following hypothesis:  Hypothesis 1. In lower-limb exoskeletons, the optimal passive stiﬀness of the series elastic actuator for torque tracking is  Kt,opt = Kdes  (20)\n']","
文中通过动力学模型推导出扭矩误差 eτ = KtRθp + (Kdes − Kt)θe − Kdesθ0，其中 Kt 是被动刚度，Kdes 是期望扭矩增益。当 Kdes − Kt = 0 时，扭矩跟踪误差最小，表明被动刚度 Kt 在适当匹配 Kdes 的条件下对提升扭矩跟踪性能具有关键作用。文中进一步提出，在下肢外骨骼中，最优的被动刚度应等于期望扭矩增益 Kt,opt = Kdes，从而实现最佳的扭矩跟踪性能。
","
扭矩误差公式通过包含 (Kdes − Kt) 项体现了被动刚度 Kt 对扭矩跟踪性能的影响，表明当被动刚度等于期望刚度（Kt = Kdes）时，扭矩误差最小，从而最优被动刚度为 Kt,opt = Kdes。
    ",0.8333333333333334,0.7554314540930983,1.0
"
相较于Lokomat系统，TPAD在自由度控制方面具备哪些技术优势以避免干预后出现侧向平衡问题？
","['\nmotion during gait such as reduced anterior-posterior acceleration of the center of mass (31). (ii) TPAD does not add rigid links on the hu- man body. This feature allows free movement of the limbs with no re- strictions on any degree of freedom (DOF) and reduces the therapist’s effort to align the joint axes of the device with the human limbs or to adjust the size of the rigid links to the child’s body. Because gait is a se- quential coordination of limbs in three dimensions, restriction of spe- cific DOFs can alter the entire gait pattern. For instance, the restriction of the leg in the sagittal plane, such as what Lokomat provides, can cause issues of lateral balance after the intervention, because the gait pattern is practiced within an artificial environment where the hip abduction/adduction muscles are not actively involved in the motor con- trol (32). (iii) TPAD imposes an overall external force during movement and allows the users to coordinate and control the limb DOF. Because CP is caused by impaired central nervous system (4), the type and level of lesion are quite different among individual children (33). Instead of providing assistance to each joint with a predefined phase-dependent torque or displacement, TPAD promotes variability among joints and provides flexibility to the users in learning, as suggested by theories of human motor learning (34).  Six children diagnosed with CP and exhibiting crouch gait under- went 15 training sessions of 16 min each, over a duration of 6 weeks. We hypothesized that, as the study participants raise their center of mass against the applied downward force from TPAD during walk- ing, they will improve control of their ankle plantar flexor muscles, especially the soleus, and improve their crouched posture. The mus- cle strength and coordination were investigated using electromyog- raphy (EMG) data from the first and after last sessions of training. Kinematics and GRF were monitored continuously throughout the training.  RESULTS In each TPAD training session, participants performed 4 min of free walking before training, 16 min of TPAD walking with continuous\n']","
TPAD在自由度控制方面相较于Lokomat系统具备以下技术优势：（1）不使用刚性链接限制肢体运动，避免了对特定自由度的干预；（2）通过整体外力影响运动轨迹，使用户能够自主协调肢体重构的自由度，从而减少因特定关节受限导致的侧向平衡问题；（3）不依赖预设阶段依赖的扭矩或位移辅助，而是通过促进运动变异性和用户自主学习能力，增强步态稳定性。
","
TPAD在自由度控制方面的技术优势包括：不引入刚性约束以保持所有自由度的自然运动、通过外部力引导而非固定轨迹控制以促进关节变异性、以及避免矢状面限制对髋关节肌群激活的影响，从而有效降低干预后侧向平衡问题的发生风险。
    ",1.0,0.922354719315699,1.0
"
文中提到的髋关节外骨骼在踩踏周期中的扭矩变化趋势是怎样的？
","['\nPeak flexion  Pedal stroke  Cycling directionAB  206080  0  Figure 3. (A) Definition of the pedal stroke timing based on ϕ from 0% to 100% and (B)hip exoskeleton p torque τ during the sweep session. Within the pedal stroke, peak extension (ϕ ext) and peak flexion (ϕ  p fle) torque timing change over the course of 15min from early (blue) to late (red).  2.3. Experimental Protocol  After fitting the spiroergometry system, the hip exoskeleton, and the seat position of the bicycle ergometer to the participants preference, participants began cycling at the nearest possible resistance to 1W/kg based on body mass (adjustable by 5W intervals) to become familiar with cycling with the hip exoskeleton without assistance (Figure 4). Participants were instructed to monitor their cadence on the screen and adjust it to maintain a cadence between 65 and 70rpm. This is below the preferred 80 to 90rpm found for young adults with no to moderate cycling experience [28]. However, increasing factors such as age, cycling duration, power output or gradient will decrease preferred frequencies [29]. About 55 to 60rpm were used for cycling training in patients with chronic stroke [30]. The resistance and the pedaling frequency were maintained throughout the entire experiment. To become acquainted with exoskeleton assistance, the exoskeleton was then activated, applying torque profiles that included peaks of 10Nm for both hip extension and flex- ion. Participants continued cycling for approximately five to ten minutes until they felt comfortable with the setup.\n']","
文中指出髋关节外骨骼在踩踏周期中根据踩踏角度（ϕ ext 和 ϕ fle）动态调整扭矩输出，表现为峰值扭矩在15分钟实验过程中从早期（蓝色）到晚期（红色）随时间变化，呈现动态适应趋势。
","
髋关节外骨骼在踩踏周期中的扭矩变化趋势表现为周期性波动，具有髋关节伸展和屈曲方向的峰值扭矩（约10Nm）。在15分钟的踩踏过程中，峰值扭矩的时间点从早期到晚期发生偏移，即髋关节最大伸展和屈曲扭矩的出现时间有所改变。
    ",1.0,0.9030721754652778,0.75
"
本文提出的优化能量成形控制框架相较于现有研究在关节力矩估计方面有哪些技术突破？
","['\nThe contributions of this paper are summarized as fol- lows. First, we generalize our optimization-based energy- shaping control framework based on the port-controlled Hamiltonian equations by incorporating global planar ori- entation and GRFs in the basis functions, while preserving  16  VOLUME 1, 2022  input-output passivity and stability for safe human-robot interaction. Second, this framework enables a single feedback controller to closely ﬁt normalized able-bodied human joint torques for all primary ADLs: level-ground walking, walking at variable inclines/declines, stair ascent/descent with vari- able step heights, and stand-to-sit. While recent work in [30] proposed a deep learning approach to estimating subject- independent hip joint torques for walking on level ground, ramps, and stairs, no prior work has estimated more compli- cated knee and ankle torque proﬁles for all primary ADLs (without switching or adaptation between tasks). Third, we assess the muscular effort of multiple able-bodied human subjects with an experimental implementation of this task- invariant control method on a (knee-ankle) exoskeleton to assist the primary ADLs.  The rest of this paper is organized as follows. Section II re- views the concepts of the port-controlled Hamiltonian systems and the corresponding matching conditions for the human- exoskeleton dynamics with contact constraints. In Section III, we design the desired closed-loop Hamiltonian system and the corresponding control law by incorporating the global orientation variable and GRF. We highlight passivity and sta- bility properties based on common human control policies. Section IV presents training and validation results for the optimized controller over a dataset of the primary ADLs. Section V then presents the hardware implementation and able-bodied human subject experiments. Finally, we summa- rize the limitation of the proposed study and provide possible future research directions.  II. REVIEW OF ENERGY SHAPING CONTROL FOR EXOSKELETONS This section brieﬂy reviews interconnection and damp- ing assignment passivity-based control (IDA-PBC) for the the solu- human-exoskeleton system in [29]. We present tion to the matching conditions with contact constraints, deﬁne the corresponding control law, and deﬁne input-output passivity.\n']","
本文提出的优化能量成形控制框架在关节力矩估计方面实现了以下技术突破：首先，通过引入全局平面上的旋转和平面力偶（GRFs）作为基函数，提升了控制方法对复杂地形和运动模式的适应能力；其次，保留了输入输出被动性和稳定性特性，确保了人机交互的安全性；再次，首次实现了对膝关节和踝关节在所有基本活动（ADLs）中复杂扭矩时序的估计，而此前研究仅能处理特定任务；最后，通过全局方向变量与GRF建模，增强了对坡道、楼梯等复杂地形的建模精度，从而提升了控制策略的泛化能力和任务不变性。
","
本文提出的优化能量成形控制框架在关节力矩估计方面的技术突破包括：1）首次将全局平面方向和地面反作用力引入端口控制哈密顿系统的能量成形控制框架中，提升了模型的物理一致性；2）实现了单一反馈控制器对所有主要日常活动（ADLs）中膝踝关节力矩的高精度拟合，无需任务切换或适应机制；3）保持了输入输出无源性和稳定性，确保人机交互安全性；4）通过膝踝外骨骼实验验证了控制方法在实际系统中的有效性，突破了现有方法（如文献[30]）在任务范围和控制稳定性方面的限制。
    ",0.75,0.9808989889936652,0.75
"
在考虑电机瞬态操作空间时，低占空比对外骨骼电机性能有何影响？
","['\nTorque  Angular speed Demag. Torque (~10X of cont. Torque)  Recommended operation space (from manufacturer)  Continuous torque  V= Vrecommended  Transient operation space  Extended continuous operation space Fig.2.TheEMmotorperformancediagramintorque-speedspace.ThepowerofEMmotorsisusuallydeterminedbytherecommendedvoltageprovidedbythemanufacturer.Therecommendedvoltageissetconcerningthethermalfailureinthecasethatuserscommandvoltagewithouttheknowl-edgeofthecoiltemperature.Thisisusuallynotusefulinacurrent-controlledsystemwherecurrentcanbelimitedunderthecontinuoustorqueorcoil.Withinthecontinuouscurrentlimit,themotorcangeneratemuchhigherpowerthantheratingprovidedbythemanufacturerwithaﬁxedvoltagelimit.Figure2showsoperationlimitsofmotorsintorque-speedspace.ConsideringthatelectricJouleheatingisproportionaltocurrentsquaredtimesresistanceandcurrentisdirectlyrelatedtotorque,notspeed,thepowercanbegreatlyincreasedbyincreasingspeedunderthecontinuouscurrentlimit.ThisisrepresentedintheblueareainFigure2.Speedcanbelimitedbyincreasedviscousdampingofbearingsandair,electriccommutationfrequencylimit,andsoon.Inmostroboticsapplicationsthedutyfactorofthemotoroperationislowandtheoperationtrajectoryintorque-speedspacechangesdependingonthesituation.Intheapplicationswheretherearefrequentphysicalinteractionswithenvironmentsincludingleggedlocomotion,thedutyfactoroftherobotissigniﬁcantlylow.Ifthedutyfactoroftheactuatoroperationisknown,wecanutilizethetransientoperationspaceshowninpinkinFigure2.Therobotsoftenneedtoproducetorqueshigherthanthecontinuousoperatingtorquelimitforashortperiodoftime.Onecanalwaysachievehigherpowerinhigh-speedbyprovidinghighervoltagebutthisrequireshighergearratiothatleadstoahigherimpedanceoftheactuator,reducingtheefﬁciencyandincreasingthetotalweight.Achievingahightorqueactuatorallowslowergearratioandlowermechanicalimpedance.Therefore,powerdensityofEMactuatorsisnotawelldeﬁnedmetricanddoesnotindicatetheactualdeliveredpowerifcombinedwithageartrain.Aclearermetrictomaximizeinactuatordesignforroboticsistorquedensity(massspeciﬁctorque).B.Gapradius:acriticalmetricinEMmotordesignThereareanumberofEMactuatordesignparametersthataffecttheoverallperformanceofthemotors.Oneofthecriticaldesignparameteramongthemisthegapradius.Thegapradiusisthedistancefromtherotatingaxistothecenterofthegapbetweenpermanentmagnetsandthestator.Figure  1971  rgap  Mass ~ rgap Torque ~ rgap Rotor inertia ~ rgap Torque density ~ rgap Torque/inertia ~ 1/ rgap  tstator trotor\n']","
低占空比对外骨骼电机性能的影响主要体现在其在连续电流限制下可提升输出扭矩，从而增强其在动态负载下的运行能力。然而，在瞬态操作中，低占空比可能限制电机的高响应能力，导致动态响应降低。因此，低占空比有助于提升连续运行的扭矩输出，但在瞬态条件下可能影响整体性能表现。
","
    在考虑电机瞬态操作空间时，低占空比使外骨骼电机能够在高于连续运行极限的转矩下短暂运行（即瞬态操作空间），从而满足短时高功率需求。这种操作模式通过利用已知的低占空比特性，在不持续超过热限制的前提下提升电机性能。文献未提及潜在的热累积或效率下降问题，但强调了该策略在提升瞬时功率输出方面的有效性。
    ",0.0,0.9085425372726382,0.5
"
自适应振荡器序列如何实现下肢外骨骼的基本步态学习与重建？
","['\nother control techniques, such as PID and impedance control, as discussed earlier [20], [21].  However, neural systems are complex and challenging to ac- curately simulate, which poses practical challenges. Commonly used models for CPGs can be categorized into bio-inspired half- center oscillator (HCO) models and abstract oscillator-based CPGs [22], [23]. HCO models consist of interconnected neural networks inspired by biology. Achieving optimal rhythmic pat- terns necessitates simulation, testing, and empirical parameter adjustments [24], [25], [26]. Consequently, exoskeletons may not be well equipped to handle unforeseen circumstances and unexpectedalterations.Moreover,HCOnetworksareinherently reactive and rely on continuous feedback to maintain stabil- ity [27]. On the other hand, CPGs of the abstract oscillator type have the capability to adjust parameters online [28], [29]. Their combination with dynamic movement primitives [30] appears to be a suitable strategy for lower limb exoskeletons. However, this approach requires a lengthy adaptation process and can only learn the gait patterns of pilots [31], [32], lacking true adaptability for the broader exoskeleton population. Hence, there is a clear need for targeted enhancements in existing CPG technology to better control exoskeletons.  The study concerns a bench-style lower limb exoskeleton as theapplicationplatform,whichiscomprisedofanexoskeleton,a treadmill,andaweightreductionbench.Thegaitgenerationsys- tem is utilized to synchronize the exoskeleton’s speed with that of the treadmill. Furthermore, preference learning algorithms are integrated for personalized gait customization.  The main contributions of this article are as follows. 1) A gait-generation strategy for lower limb exoskeleton  based on CPG is proposed.  2) An oscillator sequence with the ability to learn basic gait is proposed, and targeted modiﬁcations for gait recon- struction are made.  3) Variational controller coupling with oscillator sequences is proposed, achieving speed synchronization between exoskeletons and treadmills, as well as personalized gait customization.\n']","
自适应振荡器序列通过结合抽象振荡器模型与偏好学习算法，实现下肢外骨骼的基本步态学习与重建。该方法包括：1）基于CPG的步态生成策略，采用变分控制器实现与跑步机的速度同步；2）设计具备在线参数调整能力的振荡器序列，支持个性化步态定制；3）通过振荡器参数的动态更新与偏好学习机制，使外骨骼能够适应不同使用者的步态模式，从而实现真正的自适应控制与步态重建。
","
    自适应振荡器序列通过在线参数调整与结构设计实现基本步态学习，并结合变分控制器实现速度同步与个性化步态定制，从而实现下肢外骨骼的步态重建与适应性控制。
    ",0.6,0.8861683720503147,1.0
"
背驱式执行器在下肢外骨骼中的应用优势及其对代谢成本的影响机制是什么？
","['\n[2] S. A. Kolakowsky-Hayner, J. Crew, S. Moran, and A. Shah, “Safety and feasibility of using the EksoTM bionic exoskeleton to aid ambulation after spinal cord injury,” J. Spine, vol. 4, pp. 1–8, 2013.  [3] O. Harib et al., “Feedback control of an exoskeleton for paraplegics: Toward robustly stable, hands-free dynamic walking,” IEEE Control Syst. Mag., vol. 38, no. 6, pp. 61–87, Dec. 2018.  [4] T. Yan, M. Cempini, C. M. Oddo, and N. Vitiello, “Review of assistive strategies in powered lower-limb orthoses and exoskeletons,” Robot. Auton. Syst., vol. 64, pp. 120–136, 2015.  [5] M. R. Tucker et al., “Control strategies for active lower extremity pros- thetics and orthotics: A review,” J. Neuroeng. Rehabil., vol. 12, no. 1, pp. 1–30, 2015.  [6] Y. Kusuda, “In quest of mobility-Honda to develop walking assist de-  vices,” Ind. Rob., vol. 36 no. 6, pp. 537–539, 2009.  [7] L. M. Mooney, E. J. Rouse, and H. M. Herr, “Autonomous exoskeleton reduces metabolic cost of human walking during load carriage,” J. Neuroeng. Rehabil., vol. 11, no. 1, pp. 1–11, 2014.  VOLUME 1, 2022  [8] Y. Lee et al., “Flexible sliding frame for gait enhancing mechatronic system (GEMS),” in Proc. Annu. Int. Conf. IEEE Eng. Med. Biol. Soc., 2016, pp. 598–602.  [9] J. Wang et al., “Comfort-centered design of a lightweight and back- drivable knee exoskeleton,” IEEE Robot. Autom. Lett., vol. 3, no. 4, pp. 4265–4272, Oct. 2018.  [10] G. Lv, H. Zhu, and R. D. Gregg, “On the design and control of highly backdrivable lower-limb exoskeletons: A discussion of past and on- going work,” IEEE Control Syst. Mag., vol. 38, no. 6, pp. 88–113, Dec. 2018.  [11] H. Zhu, C. Nesler, N. Divekar, V. Peddinti, and R. Gregg, “Design principles for compact, backdrivable actuation in partial-assist pow- ered knee orthoses,” IEEE/ASME Trans. Mechatron., vol. 26, no. 6, pp. 3104–3115, Dec. 2021.  [12] S. Yu et al., “Quasi-direct drive actuation for a lightweight hip exoskele- ton with high backdrivability and high bandwidth,” IEEE/ASME Trans. Mechatron., vol. 25, no. 4, pp. 1794–1802, Aug. 2020.  [13] S. Chen et al., “Adaptive robust cascade force control of 1- DOF hydraulic exoskeleton for human performance augmentation,” IEEE/ASME Trans. Mechatron., vol. 22, no. 2, pp. 589–600, Apr. 2017. [14] U. Nagarajan, G. Aguirre-Ollinger, and A. Goswami, “Integral admit- tance shaping: A uniﬁed framework for active exoskeleton control,” Robot. Auton. Syst., vol. 75, pp. 310–324, 2016.\n']","
背驱式执行器在下肢外骨骼中的应用优势主要体现在其良好的可逆驱动特性，有助于提升系统的柔顺性与人机交互安全性，同时支持更高效的能量传递与控制策略。这些特性通过降低人体行走过程中的代谢负担，从而有效降低代谢成本。文献[7]、[9]、[11]和[12]均支持这一机制。
","
背驱式执行器在下肢外骨骼中的应用优势包括高顺应性、低摩擦损耗、良好的力控性能及被动运动能力，使其在辅助步态时更自然且安全。其通过减少非助力阶段的运动阻力和提升人机协同性，优化了外骨骼对人体运动的顺应性，从而降低代谢成本。相关机制主要体现在减少肌肉主动发力和提升能量利用效率。
    ",0.4444444444444444,0.9510127359297442,0.5
"
背驱式执行器在部分助力膝关节矫形器中的应用具有哪些设计优势？
","['\n23. Ryan, M.; Gregor, R. EMG profiles of lower extremity muscles during cycling at constant workload and cadence. J. Electromyogr. Kinesiol. 1991, 2, 69–80. [CrossRef]  24. Ericson, M.O.; Bratt, A.; Nisell, R.; Németh, G.; Ekholm, J. Load moments about the hip and knee joints during ergometer cycling. Scand. J. Rehabil. Med. 1986, 18, 165–172. [CrossRef]  25. Bini, R.R.; Diefenthaeler, F. Kinetics and kinematics analysis of incremental cycling to exhaustion. Sport. Biomech. 2010, 9, 223–235. [CrossRef]  26. Zhu, H.; Nesler, C.; Divekar, N.; Peddinti, V.; Gregg, R.D. Design principles for compact, backdrivable actuation in partial-assist powered knee orthoses. IEEE/ASME Trans. Mechatron. 2021, 26, 3104–3115. [CrossRef]  27. Nesler, C.; Thomas, G.; Divekar, N.; Rouse, E.J.; Gregg, R.D. Enhancing voluntary motion with modular, backdrivable, powered hip and knee orthoses. IEEE Robot. Autom. Lett. 2022, 7, 6155–6162. [CrossRef]  28. Marsh, A.P.; Martin, P.E.; Foley, K.O. Effect of cadence, cycling experience, and aerobic power on delta efficiency during cycling. Med. Sci. Sport. Exerc. 2000, 32, 1630–1634. [CrossRef]  13 of 14  Bioengineering 2024, 11, 683  29. Hansen, E.A.; Smith, G. Factors affecting cadence choice during submaximal cycling and cadence influence on performance. Int. J. Sport. Physiol. Perform. 2009, 4, 3–17. [CrossRef] Jin, H.; Jiang, Y.; Wei, Q.; Chen, L.; Ma, G. Effects of aerobic cycling training on cardiovascular fitness and heart rate recovery in patients with chronic stroke. NeuroRehabilitation 2013, 32, 327–335. [CrossRef]  29. Hansen, E.A.; Smith, G. Factors affecting cadence choice during submaximal cycling and cadence influence on performance. Int. J. Sport. Physiol. Perform. 2009, 4, 3–17. [CrossRef] Jin, H.; Jiang, Y.; Wei, Q.; Chen, L.; Ma, G. Effects of aerobic cycling training on cardiovascular fitness and heart rate recovery in patients with chronic stroke. NeuroRehabilitation 2013, 32, 327–335. [CrossRef]  31. Malcolm, P.; Rossi, D.M.; Siviy, C.; Lee, S.; Quinlivan, B.T.; Grimmer, M.; Walsh, C.J. Continuous sweep versus discrete step protocols for studying effects of wearable robot assistance magnitude. J. Neuroeng. Rehabil. 2017, 14, 72. [CrossRef]  32. Ding, Y.; Kim, M.; Kuindersma, S.; Walsh, C.J. Human-in-the-loop optimization of hip assistance with a soft exosuit during walking. Sci. Robot. 2018, 3, eaar5438. [CrossRef]\n']","
背驱式执行器在部分助力膝关节矫形器中的应用具有以下设计优势：1）高背驱性减少用户肌肉依赖，提升自然运动能力；2）紧凑结构与轻量化设计增强便携性与舒适性；3）支持模块化控制策略，实现个性化助力调节；4）促进人机协同优化，提升运动表现与康复效果。
","
    背驱式执行器在部分助力膝关节矫形器中的设计优势包括：提高系统的紧凑性和轻量化水平，增强穿戴舒适性；实现模块化设计，便于集成与扩展；支持自然的人机交互，提升用户的自愿运动控制能力；并具备较低的机械阻抗，有利于运动顺应性和安全性。
    ",0.1,0.9994574395453912,0.5
"
文中提到的下肢外骨骼辅助装置对稳定性极限和姿势摇摆有何影响？
","['\nGyeongnon 600-701, Korea.  [18] Polcyn, A. F., Bensel, C. K., Harman, E. A., Obusek, J. P., The Effects of Load Weight: A Summary Analysis of Maximal Performance, Physiological and Biomechanical Results from Four Studies of Load Carriage Systems, RTO HFM Specialits’meeting on “Soldiers Mobility: Innovation in Load Carriage System Design and Evaluation, Kingston (Canada), 13 pp., June 2000.  [19] Pons, J. L., Wearable Robots’ Biomechatronic Exoskeletons, ISBN: 978-0-470-51294-4, Wiley, 358  pp., March 2008.  [20] Schiffman, J. M., Gregorczyk, K. N., Bensel, C. K, Hasselquist, L., Obusek, J. P., The Effects of a Lower Body Exoskeleton Load Carriage Assistive Device on Limits of Stability and Postural Sway. Ergonomics, Vol. 51 (10): p. 1515 – 1529, 2008.  [21] Shephard, R. J., Bailey, D. A., Mirwald, R. L., Development of the Canadian Home Fitness Test,  Canadian Medical Association Journal, Vol. 114, p. 675 – 679, 1976  [22] Task Force Devil Combined Arms Assessment Team (Devil CAAT), The Modern Warrior Combat Load – Dismounted Operation in Afghanistan, US Army Center for Army Lessons Learned, Operation Endurance Freedom III, 119 pp., May 2003.  [23] Todd, L., Non-deployable Rate Could Reach 16 Percent by 2012, Army News Services, November 4th  2010.  [24] Tyson, A. S., Weight of Combat Gear is Taking Toll, The Washington Post, February 1st 2009.  RTO-MP-IST-099  UNCLASSIFIED  11 - 13\n']","
下肢外骨骼辅助装置可能在负载增加时影响稳定性极限，并通过改变步态模式影响姿势摇摆。文献中指出，该类装置可能对使用者的稳定性表现和姿势控制产生一定影响，但具体影响程度与装置设计、负载重量及个体差异密切相关。
","
    文中研究（Schiffman et al., 2008）表明，下肢外骨骼辅助装置在静态站立条件下对姿势摇摆无显著影响，同时在一定程度上限制了人体的稳定性极限，可能由于装置的结构限制了动态平衡能力。
    ",0.5714285714285714,0.855258907559667,0.5
"
相较于被动式假肢，主动假肢在舒适性和能量效率方面具有哪些优势？文中提供了哪些研究支持这一结论？
","['\nadjusts the impedance or position of the prosthetic joints based on gait phase and the users locomotor task (e.g. level walking, stair ascent and descent). The autonomous control cannot predict the user’s intent in terms of locomotor tasks and therefore cannot adapt to walking terrains. One solution is to build a neural-machine interface that predict the users intended locomotor task for prosthesis operation. Several groups have developed neural-machine interfaces (NMIs) for artiﬁcial legs to decipher neuromuscular signals (i.e. electromyographic (EMG) signals) and identify the user’s intended locomotor tasks and transitions [6], [7], [8], [9], [10], [11]. These approaches have been demonstrated to enable lower limb amputees to drive their prosthesis intuitively and switch locomotor tasks seamlessly. It has to been shown that active prostheses have the potential offer more comfort and less energy waste to the amputee compared to passive ones, [12], [13], [14]. The development of intelligent prosthetic devices has been done for a while as reported by [15]. Early investigations such as [12], [16], [17], implemented control and signal processing techniques to electromechanical systems in order to provide reliable systems that bring more comfort to the amputee. This type of research is still ongoing. Contemporary approaches make use of learning algorithms applied on exoskeletons and robotic limbs [18] with neural interfaces to the user for enhanced control, [19], [20], [21], [22], [23], [24] and response to human stimuli and intent, the so-called volitional control. For example, in order to give context awareness to the volitional control system for a prosthetic leg, [25] combined an inertial measurement unit (IMU) and a laser distance the terrain type and slope in front meter to reconstruct of the user [25]. Lately, context awareness strategies have gained an extra resource, the use of computer vision (CV). For example, deep learning techniques have been applied to prosthetic arms in order to enhance the grasp perception, independently of object forms or size [26]. However, the requirements and constraints to upper limbs prosthetics are very different than the ones to lower limbs, speciﬁcally in terms of response time and robustness.  This work is supported by the National Science Foundation (NSF) under  award CNS-1552828 and IIS-1361549.\n']","
文献中指出主动假肢相较于被动式假肢具有潜在的优势，包括提供更舒适的使用体验和减少能量浪费。然而，文中并未提供具体的研究数据或实验结果来支持这一结论，仅通过神经接口和自适应控制策略的描述暗示其潜在优势。
","
主动假肢相较于被动假肢在舒适性和能量效率方面具有优势，主要体现在提供更高的佩戴舒适性（supported by [12], [16], [17]）和减少能量浪费（supported by [12], [13], [14]）。这些结论得到了多项研究的支持，表明主动假肢能够通过控制和信号处理技术优化人机交互，从而提升性能。
    ",0.8,0.0,0.25
"
实验中如何评估GEMS对代谢能量消耗的影响？所采用的实验流程和测量设备分别是什么？
","['\nTABLE I. DESIGN SPECIFICATIONS OF THE ACTUATORS IN GEMS Specification Value  Gear Reduction 50  Max. Angular Velocity (rad/s) 6.5  Max. Assist Torque (Nm) 12  Continuous Torque (Nm) 8  Voltage (V) 24  Max. Ampere (A) 5  Max. Noise level (dB) 55  Figure 7. Angle/width adjustable hip brace  Figure 9. Configuration of the proposed actuator in the exploded view.  1061  estimate walking speed and to determine whether the user has started or stopped walking. The target output torque is determined as a function of the gait cycle, user weight, and walking speed. The gait cycle is estimated using our new algorithm called the particularly shaped adaptive oscillator [17], which is a modification of previous adaptive frequency oscillators in [14–16]. A reference torque pattern for assistance is predefined as a function of the gait cycle, speed, and slope. We identified a specific torque pattern for effective assistance after intensive trials. This pattern is illustrated in Fig. 10. IV. RESULTS As shown in Fig. 11, the maximum thickness is selected among values from the surfaces of the user to the maximum height of the device with a motion analysis system. The results are listed in Table II. The maximum thickness is less than 29 mm at the joint and 22 mm at the frame. To measure the performance of GEMS, 6 male participants with no known medical issues were recruited and 5 of them completed the assessment protocol. One person held the handrail due to apprehension and thus removed from the data. Therefore, we present results from only 5 subjects. All subjects were familiarized with the exoskeleton approximately 20 minutes a day before the experiment [18]. We used K4b2 (COSMED, Italy) to measure the volume of O2 and CO2 at the inlet and outlet to calculate the metabolic energy consumption, as shown in Fig. 12. During the experiment, the subjects performed the following activities [18]. \uf09f Stand for 5 min. \uf09f Free1: Walk on a treadmill for 10 min. \uf09f Rest sitting down for 5 min. \uf09f Wear the gait assistance device \uf09f Exo: walk on the treadmill for 10 min. \uf09f Take off the assistance device \uf09f Rest sitting down for 5 min. \uf09f Free2: Walk on the treadmill for 10 min. \uf09f Stand for 5 min. TABLE II. MAXIMUM HEIGHTS OF GEMS Measurement points Maximum height (mm)  Hip joint 28.9  Thigh frame @ thigh 22.0  Thigh fastener @ thigh 13.5\n']","
实验中通过测量用户吸入和呼出的氧气和二氧化碳体积，使用COSMED K4b2呼吸测量仪计算代谢能量消耗。实验流程包括站立、自由行走（Free1和Free2）、休息等任务，并在跑步机上进行行走任务以评估GEMS的影响。实验对象为5名熟悉设备的健康男性参与者，所有数据基于其在不同任务中的代谢参数进行统计分析。
","
实验中采用K4b2（COSMED, Italy）设备测量O2和CO2体积，从而计算代谢能量消耗。实验流程包括以下阶段：站立5分钟、自由行走10分钟（Free1）、休息5分钟、穿戴GEMS后行走10分钟（Exo）、取下设备后休息5分钟、再次自由行走10分钟（Free2）以及最后站立5分钟。实验前对受试者进行了约20分钟的熟悉训练，共5名男性参与者完成评估协议。
    ",0.875,0.8050098293864031,1.0
"
自适应增益比例肌电信号控制在机器人踝关节外骨骼中如何提升行走时的助力效果？
","['\nJang, J., Kim, K., Lee, J., Lim, B., and Shim, Y. (2015). “Online gait task recognition algorithm for hip exoskeleton,” in 2015 IEEE/RSJ International Conference on Intelligent Robots and Systems (IROS) (Hamburg), 5327–5332.  Kolakowsky-Hayner, S. A., Crew, J., Moran, S., and Shah, A. (2013). Safety and feasibility of using the EksoTM bionic exoskeleton to aid ambulation after spinal cord injury. J. Spine 1–8. doi:10.4172/2165-7939.S4-003  Koller, J., Jacobs, D., Ferris, D. P., and Remy, C. D. (2015). Adaptive Gain for Proportional Myoelectric Control of a Robotic Ankle Exoskeleton during Human Walking. Columbus, OH: American Society for Biomechanics.  Lamothe, D. (2014). Meet the Exoskeleton the Navy Is Testing to Make Sailors Stronger. The Washington Post. Available at: https://www.washingtonpost. com/news/checkpoint/wp/2014/09/03/meet-the-new-exoskeleton-the-navy- is-testing-to-make-sailors-stronger/?utm_term=.bff217abdb06  Lenzi, T., Carrozza, M. C., and Agrawal, S. K. (2013). Powered hip exoskeletons can reduce the user’s hip and ankle muscle activations during walking. IEEE Trans. Neural. Syst. Rehabil. Eng. 21, 938–948. doi:10.1109/TNSRE.2013.2248749 Lewis, C. L., and Ferris, D. P. (2011). Invariant hip moment pattern while walk- ing with a robotic hip exoskeleton. J. Biomech. 44, 789–793. doi:10.1016/j. jbiomech.2011.01.030  Malcolm, P., Derave, W., Galle, S., and De Clercq, D. (2013). A simple exoskeleton that assists plantarflexion can reduce the metabolic cost of human walking. PLoS ONE 8:e56137. doi:10.1371/journal.pone.0056137  Malcolm, P., Fiers, P., Segers, V., Van Caekenberghe, I., Lenoir, M., and De Clercq, D. (2009). Experimental study on the role of the ankle push off in the walk-to- run transition by means of a powered ankle-foot-exoskeleton. Gait Posture 30, 322–327. doi:10.1016/j.gaitpost.2009.06.002  Sawicki, G. S., Lewis, C. L., and Ferris, D. P. (2009). It pays to have a spring in your  step. Exerc. Sport Sci. Rev. 37, 130. doi:10.1097/JES.0b013e31819c2df6  Sczesny-Kaiser, M., Höffken, O., Lissek, S., Lenz, M., Schlaffke, L., Nicolas, V., et al. (2013). “Neurorehabilitation in chronic paraplegic patients with the HAL® exoskeleton – preliminary electrophysiological and fMRI data of a pilot study,” in Converging Clinical and Engineering Research on Neurorehabilitation. Biosystems & Biorobotics, vol 1, eds J. Pons, D. Torricelli, and M. Pajaro (Berlin, Heidelberg: Springer), 611–615.\n']","
自适应增益比例肌电信号控制通过动态调整助力输出以匹配用户的步态模式，从而显著提升行走时的助力效果。该控制策略基于肌电信号的实时识别，能够根据运动状态优化助力时机和强度，增强与人体运动的同步性，提高行走效率和舒适性。
","
自适应增益比例肌电信号控制通过实时监测肌肉激活水平动态调整踝关节外骨骼的助力输出，使助力与用户步态同步性增强，提升了行走时的平滑性与个性化控制效果。Koller等人（2015）研究表明该方法可改善关节力矩匹配和能量利用效率，从而提升行走助力性能。
    ",0.1111111111111111,0.8887098323429319,1.0
"
本文中所采用的背驱式扭矩控制执行器在设计上如何兼顾低反向驱动扭矩与高输出扭矩能力？
","['\n11  To address these gaps, our prior work [Lv and Gregg, 2018; Lv et al., 2018] developed a task-invariant exoskeleton control strategy that assists the user’s voluntary movements with ener- getic control objectives rather than kinematic objectives. This work implemented a control tech- nique called potential energy shaping in a unilateral knee-ankle exoskeleton (Comex 1) to reduce the perceived gravity of the user. The control strategy leverages the exoskeleton’s backdrivable, torque-controlled actuators, which comprise a high-torque motor with a low-ratio transmission (24:1). This design minimizes the backdrive torques (around 3 Nm) while being capable of out- put torques up to 60 Nm [Zhu et al., 2017], which is sufficient for rehabilitation of the primary ADLs post-stroke [Hidler et al., 2007; Ng and Hui-Chan, 2012]. However, the potential energy shaping approach in [Lv and Gregg, 2018; Lv et al., 2018] relies on a model that assumes the stance leg is fully loaded with the weight of the user, resulting in excessive plantar-flexor torques as weight transfers from the assisted leg to the contralateral leg during double support. This exces- sive plantar-flexion can aggravate the foot-drop problem later in swing, during both walking and stair climbing. For sit to stand, the controller provides double the required torque, as body weight should be equally shared between the two legs. During sitting, excessive ankle and knee torques are applied as most of the weight is supported by the seat. These limitations must be overcome before this control approach can serve patient populations.\n']","
本文中采用的背驱式扭矩控制执行器通过高扭矩电机与低速比传动（24:1）的组合设计，在反向驱动扭矩控制在约3 Nm以内的同时，具备高达60 Nm的输出扭矩能力，从而兼顾了低反向驱动扭矩与高输出扭矩需求。
","
本文中所采用的背驱式扭矩控制执行器通过采用高扭矩电机与低传动比（24:1）相结合的设计，在结构上实现了低反向驱动扭矩（约3 Nm）与高输出扭矩能力（最高达60 Nm）的兼顾，从而满足康复应用中对柔顺控制与动力支持的双重需求。
    ",1.0,0.987665697326882,1.0
"
反馈补偿器如何利用动态方程τm−τa=I¨θ实现踝关节力矩误差的补偿控制？
","['\n3545  DesiredTorque  ,mτθ&&dτmτ  +−  τ∆  ++  PIDController  Motor  Prosthesis  τ  Amputee  ProsthesisModel  DynamicModel  aτfτmaIττθ−=&&cτ  +−  PIDController  Iτ  The Low-level ControllerThe Feedback Compensator  The Forward Estimator  Fig.4.Thehierarchicaltorquecontrollerincludingtheforwardestimator,thefeedbackcompensator,aswellasthelow-leveltorquecontroller.B.ThefeedbackcompensatorBecauseofthemodelerror,thelow-leveltorquecontrolerror,andthetransmissionfrictions,theforwardestimatoralonecannotguaranteeanaccurateankletorquecontrol.Hencewedevelopedafeedbackcompensatortodealwiththeerrors.Theankletorquecannotbemeasureddirectlywiththeonboardsensors,butwecanestimatethetorquewiththefollowingdynamicequation,τm−τa=I¨θ(12)whereIreferstotheankleinertia.τmcanbecalculatedbythedrivingforcealongthesagittalplanemeasuredbytheloadcell.AsfortheinertiaI,itincludestwoparts:themotorinertiaseenthroughtheanklejointandtheshankinertia.Astheshankinertiaisnegligiblecomparedtotherelativelylargeeffectivemotorinertia,theankleinertiaI3canbeapproximatedwiththeequation:I=G2Im(13)whereGisthetransmissiongaininequation(11),andImisthemotorinertia,whichcanbeacquiredfromthedatasheetofthemotor.APIDcontrollerwasthendesignedtocalculatethecomplementarycontrolsignalτc,asshowninFig.4.Theforwardpredictionmodelworkstogetherwiththefeedbackestimationlooptoensureafastandaccuratetorquetrackingperformance.V.EXPERIMENTSPreliminaryexperimentswereperformedwithouttheam-puteestoevaluatetheperformanceoftheproposedcontroller.Asthelow-levelcontrollerlayafoundationforthehigh-levelcontroller,itwasevaluatedatﬁrst.  TestedMotorDrivingMotorCouplingEncoder  Current Control\n']","
反馈补偿器通过动态方程 τm − τa = I¨θ 实现踝关节力矩误差的补偿控制，其中 τm 由驱动力测量得出，I 为踝关节转动惯量（包括电机惯性与传动增益修正），¨θ 为角加速度。该方程用于估计实际踝关节力矩 τa，并将其与 τm 相减后作为控制误差输入 PID 控制器，与控制信号 τc 相加实现反馈补偿。
","
反馈补偿器通过动态方程 τm − τa = Iθ̈ 估计踝关节实际力矩 τa，其中 I 由传动增益 G 和电机惯量 Im 计算得到。将 τa 与期望力矩 τm,des 对比得到误差，输入 PID 控制器生成补偿信号 τc，与前馈信号结合实现踝关节力矩误差的闭环补偿控制。
    ",1.0,0.921336218954567,0.5
"
实验中如何通过运动分析系统获取地面反作用力和压力中心位置数据？
","['\nTel:+862552113597, e-mail: s966237@163.com  Received: August 9th, 2014 Accepted for publication: December 18th, 2014  14  between muscle fascicle behavior and joint biome- chanics in stair climbing at backpack load, we exam- ine the effects of backpack load on the muscle be- havior of lower limb.  2. Materials and method  2.1. Subjects  Ten college students (males) of similar body height (1.7 ± 0.03 m), weight (57 ± 6.5 kg) and age (25 ± 2 years) partipated in the measurements. All subjects gave their informed consent for the study. All of them were healthy, free from gait impairment or any musculo-skeletal or neurological dysfunction.  2.2. Staircase design  The staircase (rise = 170 mm, tread = 270 mm, width = 400 mm) was designed taking into considera- tion the walking safety and comfort ability. It was composed of three steps, as shown in Figs. 1 and 2. The lower three steps were instrumented with force plates  Fig. 1. Photograph of experiment scene  H. YALI et al.  each, the upper landing was used to stand after each trial. Each step in the staircase as well as the upper landing was constructed separately enabling forces to be recorded independently from each step. The ground reaction force, the ground reaction moment and the location of the center of pressure were out- putted by Motion Analysis system. No handrails were necessary because all participants were capable of ascending the staircase used in this study without using them.  Fig. 2. Schematic drawing of staircase with upper landing  2.3. Measurement of electromyographic activity\n']","
实验中通过运动分析系统获取地面反作用力和压力中心位置数据的方式是：在楼梯的每个步骤及上层平台分别安装力板以测量地面反作用力，同时利用运动分析系统记录人体接触地面时的压力中心位置。文献未提供关于数据处理或整合的具体方法。
","
    在实验中，通过在楼梯的每个台阶及上层平台分别安装力板，并连接运动分析系统（Motion Analysis system），可同步采集地面反作用力（GRF）与压力中心（COP）的位置数据。运动分析系统根据力板提供的力学信号进行处理，输出相应的力学参数。
    ",1.0,0.9706767305662686,0.75
"
本文为何选择采集健全人群的双侧下肢运动学和肌电信号用于外骨骼控制策略研究？
","['\n. Because exoskeletons serve as a supplement to the existing limb rather than a replacement, users have a “parallel” role in controlling LL movements. Exoskeleton users typically have biomechanically functional muscles (although neuropathologies may complicate the control of movement); exoskeletons are also often bilateral. Therefore, the objectives of this work were to (1) collect bilateral lower limb kinematic and myoelectric signals hypothetically accessible for exoskeleton control from an able-bodied population freely performing various locomotor activities, and (2) apply intent recognition for offline prediction to demonstrate the baseline viability of translating this type of control strategy from active LL prostheses to exoskeletons. Using bilateral lower limb kinematic and myoelectric signals to predict locomotor activities: A pilot study Blair H. Hu, IEEE Student Member, Elliott J. Rouse, IEEE Member, and Levi J. Hargrove, IEEE Member\n']","
本文选择采集健全人群的双侧下肢运动学和肌电信号，是因为外骨骼作为现有肢体的补充而非替代，要求用户在控制外骨骼运动时保持与自身肢体的“并行”作用；健全人群具备生物力学功能的肌肉，能够提供可靠的肌电信号；外骨骼通常为双侧结构，因此需要基于双侧下肢信号实现运动意图识别与控制；通过该研究可构建基线模型，验证外骨骼控制策略在真实场景中的可行性。
","
本文选择采集健全人群的双侧下肢运动学和肌电信号，是因为外骨骼作为辅助装置依赖用户残存的肌肉功能，且通常为双侧系统；通过采集此类信号，可模拟外骨骼控制中可能获得的输入，并用于运动意图识别，从而验证将主动假肢控制策略迁移至外骨骼的可行性。
    ",0.625,0.9157408935545024,0.75
"
基于机器人辅助训练的方法在中风患者肩肘运动康复中的作用机制是什么？
","['\nthis practice is also becoming more widespread in Japan(2). Extensive research has been done on compensating for this lack of muscular strength using robotic technology, and on power assist technologies that would further boost muscular strength. Devices have also been developed that measure the amount of force the individual wishes to generate using electromyographs and force sensors, and boost their strength with power assist(3).  Meanwhile, some reports have indicated that the level of stress associated with a particular amount of exercise can be reduced simply by altering the way in which the individual moves(4)-(7). Rather than exerting force constantly from the beginning to the end of a movement, concentrating force at the appropriate time and then relying on inertia reduces heart rate, blood pressure, energy consumption(4)-(7).  In the case of walking also, research has commenced on a two-axis walk, which effectively uses changes in the center of gravity(7). In this mode of walking, virtual axes passing through the foot making contact with the ground, the knee, the hip joint, and the shoulder blade, move forward alternately on the left and right like a pair of stilts. The center of gravity moves forward without the upper and lower bodies twisting. This two-axis walk has  Fundamental Technology Research Center  ** Automobile R&D Center  – 57 –  Honda R&D Technical Review  October 2009  recently been used by Japanese athletes who have been said to be at a disadvantage in terms of physique and muscular strength. This technique has enabled them to supplement their muscular strength with gravity and inertia, and to achieve good results in world championships(8).  Robots are also being used while patients who have been paralyzed by strokes are being retrained in how to move their shoulders and elbows, in this case not to increase muscular strength but to teach patients the correct movements(9). The robot assists patients in moving their shoulders and elbows in the correct trajectory to enable them to grasp objects, generating a load if they move outside the appropriate trajectory. In this type of training process, results achieved using a robot are indicated as being superior to those achieved by normal training(9).\n']","
基于机器人辅助训练的方法在中风患者肩肘运动康复中的作用机制是：通过引导患者进行精确的运动轨迹训练，增强其对动作的控制能力；在偏离正确轨迹时施加负载，促使患者主动修正动作，强化运动学习过程；相较于传统训练，该方法在训练效果上更具优势，尤其在促进神经可塑性与功能恢复方面具有积极作用。
","
基于机器人辅助训练在中风患者肩肘运动康复中的作用机制主要涉及运动控制再学习，通过机器人引导患者在正确轨迹上完成肩肘动作，纠正错误运动模式并抑制代偿行为；同时优化运动时序以减少生理负荷，从而提高康复效率和运动控制精度，其优势在于优于传统训练方式的运动学习促进效果。
    ",0.625,0.9995763793887288,1.0
"
自适应优化算法如何提升基于IMU的关节角度估计精度？
","['\nComponent technology Control Accurate joint-angle estimation has proven invaluable in planning assistance. Most rigid systems use encoders on actuated joints to deter- mine joint angles; however, devices without rigid joints cannot rely  Nature Biomedical Engineering  Ref.  179  177  175  178  172  171  173  174  163  158  159  160  162  165  161  191  112  113  176  122  168  109  110  164  on encoders and thus must use other sensors (for example, inertial measurement units; IMUs192,193) to determine joint angles. IMUs are lightweight, inexpensive and easy to integrate into robotic systems, but also particularly sensitive to their physical alignment with biological joints (a challenge that rigid devices do not face). Furthermore, ori- entation measurements from IMUs suffer from inherent inaccuracies owing to bias (a constant offset compared to the true IMU orientation) and drift (a history-dependent change in orientation), which render measurements unusable within minutes if left uncorrected. Therefore, ensuring consistent alignment without first making precise measure- ments is difficult, hence IMU-based joint angles can be highly variable depending on placement. Importantly, asking wearers to take precise measurements each time they put on an exoskeleton hinders com- mercial applications, for which usability is crucial. Misalignments can be corrected by optimization algorithms that automatically estimate the location of the IMU relative to a biological joint, greatly improving joint-angle estimation accuracy194–197. Integrating these algorithms with wearable devices may enable the development of controllers that leverage joint-angle estimates for targeted assistance without requiring rigid joints. Such motion sensing could also be a valuable tool in the evaluation of a wearer’s kinematic performance outside of laboratory settings and could allow for the assessment of interventions at home or in the community. Furthermore, small IMUs worn during walking could inform an algorithm that determines the primary joint (or joints) at which a person experiences a gait deficit, along with the severity of that deficit. A clinician could then recommend a device appropriate for this specific deficit.\n']","
自适应优化算法通过自动估计IMU相对于生物关节的位置，克服了其物理对准敏感性和测量漂移问题，从而显著提升了基于IMU的关节角度估计精度。该方法减少了对穿戴者进行额外测量的依赖，增强了外骨骼系统在实际应用中的可靠性和实用性。
","
    自适应优化算法通过自动估计IMU相对于生物关节的位置，校正IMU的物理对准偏差，从而减少偏置和漂移引起的误差，显著提升基于IMU的关节角度估计精度。该方法无需用户每次穿戴时手动进行精确校准，增强了系统的实用性，适用于无刚性关节的可穿戴外骨骼控制。
    ",0.7142857142857143,0.9562749959653654,1.0
"
文中提到的基于工作空间加速度的多自由度运动控制方法如何实现冗余机械臂的实时运动生成？
","['\nSystems. Vol. 1. IEEE, 2003.  [12] A.Suzumura and Y.Fujimoto,“ Real-Time Motion Generation and Control  Systems for High Wheel-Legged Robot Mobility,”IEEE Trans. on Industrial  Electronics, vol. 61, no. 7, pp. 3648-3659, 2014.  [13] K. Ohnishi, M. Shibata, and T. Murakami,“ Motion Control for Advanced Mechatronics,”IEEE/ASME Transactions on Mechatronics, Vol. 1, Issue 1,  pp. 56-67, Mar. 1996  [14] T. Murakami, F. Yu, and K. Ohnishi,“ Torque Sensorless Control  Multidegree-of-Freedom Manipulator, ”IEEE Transactions on Industrial  Electronics, Vol. 40, No. 2, pp. 259-265, Apr. 1993  22  in  Figure 5: Falling down motion.  23  Figure 6: Block diagram of proposed controller.  Figure 7: Device joint command generation.  24  Figure 8: A photograph of the proposed device in normal walking motion.  25  電気学会産業応用部門論文誌投稿中のため省略します． Figure 9: Machine legs rotate angle and contact force in normal walking motion.  26  電気学会産業応用部門論文誌投稿中のため省略します． Figure 10: ZMP tracking performance in normal walking motion.  27  電気学会産業応用部門論文誌投稿中のため省略します．  Figure 11: Machine legs rotate angle and contact force in falling down motion.  28  電気学会産業応用部門論文誌投稿中のため省略します．  Figure 12: ZMP tracking performance in falling down motion.  29  JKA26-103  学会等への発表  1. Nobuhiro Kobayashi and Toshiyuki Murakami, ""Workspace Acceleration Based MDOF Motion  Control in Redundant Manipulators"", 2014 IEEE International Symposium on Industrial  Electronics, pp293-298, Istanbul, Turkey, 2014  2. Miyuki Kamatani and Toshiyuki Murakami, ＂Traveling Control of Two-wheel Wheelchair  Using Variable Command″, IEEE IECON2014, pp5278-5282, 2014  3. Ynag Chuan and Toshiyuki Murakami, ＂An Approach to Walking Assist Control by a  Multi-Legged System in Human Gait Motion″, IEEE IECON2014, pp5236-5241, 2014  事業内容についての問い合わせ先  慶應義塾大学 理工学部 システムデザイン工学科 村上俊之研究室  〒２２３－８５２２  横浜市港北区日吉３－１４－１  教授 村上俊之  E-mail: mura@sd.keio.ac.jp  URL: www.fha.sd.keio.ac.jp  JKA26-103\n']","
基于工作空间加速度的多自由度运动控制方法通过实时反馈工作空间加速度信息，动态调整冗余机械臂各自由度的关节角速度与加速度，从而实现高精度、高响应的实时运动生成与控制。该方法结合了运动学与动力学补偿机制，并通过扭矩无源感控制提升系统稳定性，适用于复杂动态任务。
","
基于工作空间加速度的多自由度运动控制方法通过在加速度层面设计控制律，实现冗余机械臂的实时运动生成。该方法利用工作空间中的加速度信息进行运动规划与控制，能够快速响应轨迹变化，并通过优化策略处理冗余自由度，从而在动态环境中生成稳定且自然的运动轨迹。尽管具体实现细节未在参考文本中披露，但其在IEEE工业电子会议上的发表表明该方法具备实时性和工程应用潜力。
    ",0.0,0.8762182538835389,0.5
"
文中提出的三层助力控制器分别解决了哪些关键问题？
","['\nFor the purpose of the experiment, the controller has been implemented on a modified version of the ALEX II gait trainer (Fig. 1) [47] and experimentally tested on ten healthy subjects. Muscle activation and joint kinematics were recorded while subjects walked on a treadmill at a constant speed in three different conditions: free walking (i.e., no exoskeleton worn by the user), zero torque (i.e., exoskeleton working in transparent mode) and assisted (i.e., exoskeleton providing additional torque). Experimental results show that the controller successfully assisted the user as evidenced by a marked decrease of muscle activations, measured through electromyography, compared to free walking. Despite providing assistance only to the hip joint, both hip and ankle muscles significantly reduced their activation, demonstrating a clear tradeoff between these two joints in propelling gait.  Preliminary results have been reported in a conference [48].  II. METHODS  This section provides details of the assistive controller and its implementation on ALEX II gait trainer. Then, this section describes the experiment protocol and data analysis.  A. The Assistive Controller  In this paper, we explore this hypothesis by designing and testing a novel assistive controller that provides additional torque at the hip joint only, while allowing users to control their own kinematics.  The proposed assistive controller (Fig. 2(a)) is composed of three stages that address the following issues: (1) on-line estimate of the current phase of the gait cycle, (2) planning of the assistive torque, and (3) effective transfer of the desired assistive torque to the user’s leg.  Assistive controllers usually define the additional torque provided by the exoskeleton based on an estimate of the user’s joint torque [34],[35]. This approach allows having assistive torques that are coherent in direction and amplitude with the mechanical action of muscles. Following this approach, assistive torque profiles have been estimated through electromyography [36]-[38], solving the inverse- dynamic problem [39], or by applying algorithms based on inertia reduction [40], gait segmentation [41] and position- based force fields [42].\n']","
文中提出的三层助力控制器分别解决了以下关键问题：第一层实现了对步态周期当前相位的在线估计，以确保助力时机的精准；第二层规划了与肌肉作用方向一致的助力扭矩，以实现协调助力；第三层确保了所期望的助力能够有效传递至用户腿部，提升控制的实用性与肌肉激活的改善效果。
","
文中提出的三层助力控制器分别解决了以下三个关键问题：(1) 在线估计步态周期相位，以实现对运动状态的实时感知；(2) 规划与用户肌肉作用协调一致的助力扭矩；(3) 将规划的助力扭矩有效传递至用户的腿部，以实现实际助力效果。
    ",0.4285714285714285,0.9987038281427196,1.0
"
参与者在实验中进行的地面行走与跑步机行走训练有何不同作用？
","['\nMethods Study and Participant Information. Approval for this study was granted by the National Institutes of Health (NIH) Institutional Review Board under protocol #13-CC-0210. All research was carried out in accord- ance with the guidelines and regulations of the NIH. We recruited children and adolescents with a diagnosis of crouch gait from spastic diplegic CP. Seven participants met our inclusion criteria and completed our exploratory clinical study, which included the Gross Motor Function Classification System (GMFCS) level of I or II and the absence of any health condition, besides CP, that could impact safety. We obtained informed assent from each participant and consent from their parents. Participant information is listed in Table 1.  Participants completed six visits at the NIH Clinical Center over the course of 8–12 weeks (Fig. 1a). The first visit included a clinical evaluation and lower-extremity casting for fabrication of custom thermoplastic braces. For subsequent training visits, each lasting 2–3 hours, the participants practiced walking with the exoskeleton over-ground and on a treadmill (Fig. 1b) with and without assistance as tolerated. Seated breaks, lasting approx- imately 5–15 minutes, were provided as frequently as needed to minimize fatigue. Actual walking duration for each participant is presented in Fig. 1c. The experimental biomechanics data presented in this study were col- lected on the sixth visit during treadmill walking. Treadmill speed and level of exoskeleton extension torque were established based on participant preference over the course of the training visits.\n']","
参与者在实验中进行的地面行走与跑步机行走训练分别用于评估外骨骼在真实环境和可控环境中的人机交互性能。地面行走训练侧重于运动表现评估，而跑步机行走则用于采集生物力学数据并进行个性化设置，两者共同用于研究外骨骼在不同行走条件下的功能适应性。
","
在实验中，地面行走训练主要用于实际功能适应与训练，帮助参与者在真实环境中使用外骨骼；而跑步机行走则用于标准化数据采集，便于生物力学分析。文献未明确描述两者在运动控制或康复机制上的具体差异。
    ",0.5,0.8455285470928834,0.75
"
软体外骨骼系统在改善中风患者步态对称性方面采用了哪些关键控制方法？
","['\n258. Reisman, D. S., Wityk, R., Silver, K. & Bastian, A. J. Split-belt  treadmill adaptation transfers to overground walking in persons poststroke. Neurorehabil. Neural Repair 23, 735–744 (2009).  259. Day, K. A., Leech, K. A., Roemmich, R. T. & Bastian, A. J.  Accelerating locomotor savings in learning: compressing four training days to one. J. Neurophysiol. 119, 2100–2113 (2018).  Author contributions C.S. and L.M.B. contributed equally to the writing and revision of the manuscript. C.S., L.M.B. and B.T.Q. drafted the section ‘Reduction of metabolic cost’. C.S., L.M.B. and F.P. drafted the section ‘In-clinic validation’. K.S. provided input to the ‘Component technology’ and ‘Outlook’ sections. C.J.W. and L.N.A. provided input on the overall manuscript. All authors approved the final version of the manuscript.  260. Dhawale, A. K., Smith, M. A. & Ölveczky, B. P. The role of variability  in motor learning. Annu. Rev. Neurosci. 40, 479–498 (2017). 261. Marchal-Crespo, L., Lopez-Oloriz, J., Jaeger, L. & Riener, R.  Optimizing learning of a locomotor task: amplifying errors as needed. Annu. Int. Conf. IEEE Eng. Med. Biol. Soc. 2014, 5304– 5307 (2014).  262. Sombric, C. J. & Torres-Oviedo, G. Augmenting propulsion  Competing interests Harvard University has entered into a licensing-and-collaboration agreement with ReWalk Robotics. C.J.W., C.S. and B.T.Q. are co-inventors on licensed patents and are paid consultants for ReWalk Robotics. L.N.A. is a paid consultant for MedRhythms. The other authors declare no competing interests.  demands during split-belt walking increases locomotor adaptation of asymmetric step lengths. J. Neuroeng. Rehabil. 17, 69 (2020).  263. Porciuncula, F. et al. Targeting paretic propulsion and walking  Additional information Supplementary information The online version contains supplementary material available at https://doi.org/10.1038/s41551-022-00984-1.  speed with a soft robotic exosuit: a consideration-of-concept trial. Front. Neurorobot. 15, 689577 (2021).  Correspondence should be addressed to Conor J. Walsh.  264. Jonsdottir, J. et al. Task-oriented biofeedback to improve gait in individuals with chronic stroke: motor learning approach. Neurorehabil. Neural Repair 24, 478–485 (2010).  265. Parker, C. J., Guerin, H., Buchanan, B. & Lewek, M. D. Targeted verbal cues can immediately alter gait following stroke. Top. Stroke Rehabil. 29, 382–391 (2022).\n']","
软体外骨骼系统在改善中风患者步态对称性方面采用的关键控制方法包括：基于split-belt treadmill训练的步态适应策略、任务导向的生物反馈、推进力变异性调节以及定向言语引导。这些方法通过动态调整步态参数和提供结构化反馈，促进患者的步态对称性改善。
","
    软体外骨骼系统在改善中风患者步态对称性方面采用的关键控制方法包括：任务导向的生物反馈（task-oriented biofeedback）、分裂带（split-belt）跑步机训练、推进力增强（augmenting propulsion）策略以及目标导向的言语提示（targeted verbal cues）。这些方法通过促进步态适应、增强患侧推进力和实时调整步态参数，共同提升步态对称性。
    ",0.6,0.9993366325693004,1.0
"
本文中提到的膝关节外骨骼辅助对人体运动表现有哪些具体提升？
","['\nTzu-Hao Huang, Sainan Zhang, Shuangyue Yu, Junxi Zhu, Antonio Di Lallo, Chunhai Jiao, and Hao Su are with the Laboratory of Biomechatronics and Intelligent Robotics, Department of Mechanical and Aerospace Engineering, NorthCarolinaStateUniversity,Raleigh,NC27695USA(e-mail:d95522013@ gmail.com; szhang007@citymail.cuny.edu; yushuangyue0221@gmail.com; jzhu35@ncsu.edu; antoniodilallo.89@hotmail.it; cjiao000@citymail.cuny.edu; hsu4@ncsu.edu).  MhairiK.MacLeaniswiththeLaboratoryofBiomechatronicsandIntelligent Robotics, 57522 Enschede, The Netherlands, and also with the Department of Mechanical Engineering, University of Twente, 57522 Enschede, The Nether- lands (e-mail: mmaclean@ccny.cuny.edu).  Thomas C. Bulea is with the Functional and Applied Biomechanics Section, Rehabilitation Medicine Department, Clinical Center, National Institutes of Health, Bethesda, MD 20892 USA (e-mail: buleatc@cc.nih.gov).  Minghui Zheng is with the Department of Mechanical and Aerospace Engineering, University at Buffalo, Buffalo, NY 14260 USA (e-mail: mhzheng@buffalo.edu). article  This  supplementary material  has  provided or more ﬁgures  the  by available  and  versions  color  thors https://doi.org/10.1109/TRO.2022.3170287.  one  of  au- at  8.60%–15.22% relative to the unpowered condition and two knee ﬂexors and one ankle plantar ﬂexor by 1.92%–10.24% relative to the baseline (no exoskeleton) condition.  Index Terms—Force/torque control, knee exoskeleton, quasi-  direct-drive actuation, stiffness control.  I. INTRODUCTION  P ORTABLE lower-limb exoskeletons have great potential  for mobility restoration and human augmentation [1]–[3]. Compliance, low mass, and the ability to assist a diverse array of movements are key requirements for an exoskeleton to be viable indailylife.Thereisawealthofliteratureonankleexoskeletons to augment human walking [4]–[7] and a substantial amount of literatureonhiporankleexoskeletonsforwalkingaugmentation [8]–[13]. Comparably, there is little research study on knee exoskeletons for augmentation [14], [15], likely because the positiveworkdoneatthekneeinlevelwalkingislessthanthatat theankleorhip[16].However,thekneeiscrucialinlocomotion, and there is a compelling need to investigate the beneﬁts of a knee exoskeleton on human performance and understand the human–robot interaction.\n']","
本文中提到的膝关节外骨骼辅助对人体运动表现的提升主要体现在膝关节伸肌力量增加了8.60%–15.22%，踝关节跖屈肌力量增加了1.92%–10.24%。这些提升表明外骨骼辅助增强了下肢关键肌群的功能，从而可能改善整体运动表现。
","
    本文中提到的膝关节外骨骼辅助对人体运动表现的具体提升包括：两个膝关节屈肌和一个踝关节跖屈肌的相对助力提升了1.92%–10.24%。文献未提供关于步态、能耗或其他性能指标的具体提升数据。
    ",0.5,0.970631986046648,0.0
"
动态深蹲作为闭链运动被广泛应用于膝关节康复，文中提到哪些具体的康复应用场景？
","['\nThe dynamic squat exercise is an integral part of  strength and conditioning programs for many sports that require high levels of strength and power, such as football, track and field, powerlifting, and Olympic weightlifting. The squat primarily strengthens hip, thigh, and back musculature, which are very important muscles in running, is commonly believed among athletes and coaches that the squat enhances athletic performance and minimizes injury potential. Because the dynamic squat has been classified as a closed kinetic chain exercise (17,58,65,71), it is also appropriate and commonly used in knee rehabilitation settings. Several studies have demonstrated the favorable use of the squat exercise during knee rehabilitation (21,32,39,47,52,58,71), such as after cruciate ligament reconstructive surgery. Consequently, an understanding of knee biomechanics during the squat is helpful to therapists, trainers, sports medicine physicians,  jumping, and lifting. It  0195-9131/01/3301-0127/$3.00/0 MEDICINE & SCIENCE IN SPORTS & EXERCISE® Copyright © 2001 by the American College of Sports Medicine  researchers, coaches, and athletes who are interested in closed kinetic chain exercises, knee rehabilitation, and train- ing for sport.  The bodyweight (BW) squat, barbell squat, and machine squat are the most common methods employed while per- forming the dynamic squat in training and rehabilitation. The squat begins with the individual in the upright position with the knees and hips fully extended. The individual then squats down in a continuous motion until a desired squat depth is obtained and then in a continuous motion ascends back to the upright position. The barbell squat is performed with the barbell across the back (back squat) slightly above (high bar squat) or below (low bar squat) the level of the acromion, or with the barbell held in front of the chest approximately at the level of the clavicles (front squat). The back squat is usually preferred and performed by most athletes in sport, although the front squat is commonly performed by bodybuilders and Olympic weightlifters. The front squat is simulated during the clean and jerk exercise by Olympic weightlifters. The machine squat is also performed in training and rehabilitation. The machine squat is typically performed using a special barbell that moves within a fixed groove (e.g., the Smith Machine squat) or by using padded  Received for publication February 2000. Accepted for publication March 2000.  127\n']","
文中明确指出动态深蹲被用于膝关节康复的具体应用场景是“after cruciate ligament reconstructive surgery”（重建前交叉韧带手术后）。其他康复场景未在参考文本中提及。
","
    文中提到动态深蹲作为闭链运动被广泛应用于膝关节康复，具体应用场景包括前十字韧带重建术后康复，并通过徒手深蹲、杠铃深蹲和器械深蹲等形式进行康复训练。
    ",1.0,0.9369854427708976,1.0
"
文中提到SMA组和FTST组在皮质运动兴奋性变化上表现出哪些差异，这可能与步态功能改善有何关联？
","['\nPrevious studies have noted the eﬀects of other gait inter- ventions on corticomotor responses after stroke, particularly in the TA. Body-weight-supported treadmill training the paretic TA,8 whereas high- improves excitability of intensity interval treadmill training appears to suppress ex- citability of the paretic TA.18 In the current study, the SMA group exhibited greater changes in excitability of the RF, whereas the FTST group exhibited greater, though non- signiﬁcant, changes in excitability of the TA. At present, we can only hypothesize how these diﬀerential CME responses between interventions translate into functional movement. Perhaps improved excitability at the RF means that the SMA increases hip ﬂexion or knee extension, supported by our previousﬁndingthattheSMAgroupshowedgreaterincreases in step length on the impaired limb.4 Conversely, without hip assist, the FTST group may have become more practiced at dorsiﬂexion to ensure ground clearance of the foot during walking, thereby strengthening connectionsof the paretic TA. Kinematic data would be beneﬁcial to further quantify these gait-related changes.  guided setting. Future work will examine community mobility and clinical outcomes in a long-term study of individuals wearing the device in the real world, as a potential tool to improve mobility and facilitate at-home and community rehabilitation.\n']","
SMA组在股直肌（RF）兴奋性上表现出更显著的增强，可能反映髋关节屈曲能力的提升，从而改善步长；而FTST组在胫骨前肌（TA）兴奋性上变化更显著但不显著，可能反映踝背屈动作增强以改善足部离地控制。这些CME差异可能与步态功能改善相关，但文献未提供直接证据支持，推测SMA通过增强髋部驱动改善步态，FTST通过增强踝部控制促进稳定行走。
","
    SMA组在股直肌（RF）表现出更显著的皮质运动兴奋性（CME）变化，可能增强髋关节屈曲或膝关节伸展，从而改善患肢步长；FTST组在胫前肌（TA）的兴奋性变化趋势更大，可能通过增强踝关节背屈提高步行时足部离地能力。这些差异可能反映了两种干预方式对步态功能改善的不同神经调控机制。
    ",1.0,0.0,0.75
"
研究中采用了哪些定量和定性评估方法来全面分析外骨骼辅助对不同病理特征患者的运动功能改善效果？
","['\nWe investigated two highly impaired cases of MS and PPS. The manual muscle test (MMT) and clinician assessment of the PPS patient revealed that he had a highly impaired (atrophied) right  75  leg from the hip down, and quadriceps weakness in his left side. Accordingly, discussion with the patient and on-site clinician highlighted the need to assist knee extension especially during sit- stand-sit and stairs ascent which the patient found the most challenging. Performance assessments during sit-stand and stair ascent were therefore our primary metrics. We hypothesized that after appropriate controller customization for the PPS patient, our novel bilateral exoskeleton would improve the results of the five times sit to stand (5xSTS) test, and time to ascend a 5-step staircase. The MMT and clinician assessment of the MS patient revealed he had reduced knee flexion strength (greatly exacerbated by quadriceps spasticity) and severely hampered hip flexion capa- bility. Functionally, his prominent deficit was leg clearance (worse on the left side) leading to compensatory circumduction. Accordingly, our primary metrics were sagittal knee and frontal shank kinematics. We hypothesized that after appropriate controller customization, exoskeleton assistance would increase the MS patient’s peak knee flexion angle (assessing leg clearance), and reduce peak shank abduction angle (assessing circumduction).  For both patients, we performed a battery of assessments to explore the effects of exoskeleton assistance for a wide array of tasks (including exploratory assessments beyond the primary out- comes described above). We performed two common gait tests: the timed up and go (TUG) test and six meter walk test (6MWT). We also assessed the times to ascend and descend a staircase and ramp. Finally we acquired subjective feedback on exoskeleton effectiveness for the various tasks completed using a modified QUEST questionnaire.  6.2 Methodology  6.2.1 Clinician-friendly android app (GUI) interface development\n']","
研究中采用定量评估方法包括：五次坐站测试（5xSTS）、五步楼梯时间、TUG测试、6MWT以及膝关节和胫骨的矢状面与额状面运动学参数；定性评估方法包括手动肌肉测试（MMT）、临床医生评估、改良 QUEST 问卷以及个性化控制器设置的主观反馈收集。
","
    研究中采用的定量评估方法包括：五次坐立试验（5xSTS）、上下楼梯时间测试、计时起立行走测试（TUG）、六米步行测试（6MWT）以及运动学分析（如膝关节屈曲峰值角度和小腿外展峰值角度）。定性评估方法为改良版QUEST问卷，用于收集患者对外骨骼辅助效果的主观反馈。这些方法共同构成了一个涵盖功能表现、运动控制和患者体验的全面评估体系。
    ",0.8181818181818182,0.6813100694594895,0.5
"
文献中综述的活动识别技术在惯性传感应用于医疗健康和体育领域时面临哪些挑战？
","['\n𝑚 =  ‖𝑎⃗⃗−𝛽⃗⃗⃗‖  ‖𝑏⃗⃗−𝛽⃗⃗⃗‖  ACKNOWLEDGMENT  The authors would like to thank Robert D. Gregg for his advice regarding the phase space used in this work, and Brian E. Lawson for his contributions to the methodology.  REFERENCES  [1]  [2]  [3]  [4]  [5]  [6]  [7]  S. J. Preece, J. Y. Goulermas, L. P. Kenney, D. Howard, K. Meijer, and R. Crompton, ""Activity identification using body-mounted sensors—a review of classification techniques,"" Physiological measurement, vol. 30, p. R1, 2009. A. Avci, S. Bosch, M. Marin-Perianu, R. Marin-Perianu, and P. Havinga, ""Activity recognition using inertial sensing for healthcare, wellbeing and sports applications: A survey,"" in Architecture of computing systems (ARCS), 2010 23rd international conference on, 2010, pp. 1-10. O. D. Incel, M. Kose, and C. Ersoy, ""A review and taxonomy of activity recognition on mobile phones,"" BioNanoScience, vol. 3, pp. 145-171, 2013. S. J. Preece, J. Y. Goulermas, L. P. Kenney, and D. Howard, ""A comparison of feature extraction methods for the classification of dynamic activities from accelerometer data,"" IEEE Transactions on Biomedical Engineering, vol. 56, pp. 871-879, 2009. H.-Y. Lau, K.-Y. Tong, and H. Zhu, ""Support vector machine for classification of walking conditions using miniature kinematic sensors,"" Medical & biological engineering & computing, vol. 46, pp. 563-573, 2008. H. Huang, F. Zhang, L. J. Hargrove, Z. Dou, D. R. Rogers, and K. B. Englehart, ""Continuous locomotion-mode identification for prosthetic legs based on neuromuscular–mechanical fusion,"" Biomedical Engineering, IEEE Transactions on, vol. 58, pp. 2867- 2875, 2011. I. C. Gyllensten and A. G. Bonomi, ""Identifying types of physical activity with a single accelerometer: evaluating laboratory-trained algorithms in daily life,"" IEEE Transactions on Biomedical Engineering, vol. 58, pp. 2656-2663, 2011. A. Mannini and A. M. Sabatini, ""Gait phase detection and discrimination between walking–jogging activities using hidden  (13)  (14)  [9]  [10]  [11]  [12]  [13]  [14]  [15]  [16]  [17]  [18]  [19]  [20]  [21]\n']","
文献中综述的活动识别技术在惯性传感应用于医疗健康和体育领域时面临的主要挑战包括：数据噪声干扰影响分类准确性、特征提取方法在不同运动模式下的适用性有限、运动状态的复杂性增加识别难度，以及实验室环境下表现不佳难以适应真实场景。
","
    文献中指出，惯性传感应用于医疗健康和体育领域的活动识别技术面临如下挑战：动态活动的复杂性与相似性导致分类困难；传感器放置位置与个体差异影响算法泛化能力；传感器噪声与环境干扰影响识别稳定性；算法在实时性与计算复杂度之间难以平衡；此外，缺乏统一的评估标准和公开数据集。
    ",0.6,0.9880747187787328,0.5
"
根据文献数据，行走与慢跑状态下髋关节和踝关节的平均角速度变化分别达到多少？
","['\n. The required assistive torque for ankle and hip are around 130 Nm and 104 Nm respectively for an 80 kg subject walking at 1.25 m/s, and 75 Nm and 29 Nm for 30% of biological ankle and hip joint moment of jogging at 2.3 m/s. The average angular speed of hip and ankle joint reach up to 2.8 rad/s and 2.5 rad/s for walking, 6.7 rad/s and 4.5 rad/s for jogging respectively. To translate torque and rotational motion into cable force  and speed, the moment arm for each joint was estimated based on the design of our current soft exosuit. Using the soft exosuit stiffness model  evaluated in Section IV, the minimum required Figure 2. Diagram (left) and photo (right) of a person wearing the hip exosuit with sensor implementation. TABLE I. DESIGN REQUIREMENTS OF ACTUATION SYSTEM FROM BIOLOGICAL DATA Walking (1.25 m/s) Jogging (2.3 m/s)\n']","
在行走状态下，髋关节和踝关节的平均角速度分别为 2.8 rad/s 和 2.5 rad/s；在慢跑状态下，髋关节和踝关节的平均角速度分别为 6.7 rad/s 和 4.5 rad/s。
","
根据文献数据，行走状态下髋关节和踝关节的平均角速度分别为2.8 rad/s和2.5 rad/s；慢跑状态下则分别达到6.7 rad/s和4.5 rad/s。
    ",1.0,0.967623109760725,1.0
"
文中提到的气动下肢助力外骨骼如何通过可穿戴气源系统实现便携性与驱动效率的平衡？
","['\nSasaki, D., Noritsugu, T., and Takaiwa, M. (2013). “Development of pneumatic lower limb power assist wear driven with wearable air supply system,” in IEEE/ RSJ International Conference on Intelligent Robots and Systems (IROS), Tokyo, 4440–4445.  Kozlowski, A., Bryce, T., and Dijkers, M. (2015). Time and effort required by persons with spinal cord injury to learn to use a powered exoskeleton for assisted walking. Top. Spinal Cord Inj. Rehabil. 21, 110–121. doi:10.1310/ sci2102-110  Kwak, N.-S., Muller, K.-R., and Lee, S.-W. (2014). “Toward exoskeleton control based on steady state visual evoked potentials,” in International Winter Workshop on Brain-Computer Interface, Gangwon province, 1–2.  Lajeunesse, V., Vincent, C., Routhier, F., Careau, E., and Michaud, F. (2016). Exoskeletons’ design and usefulness evidence according to a systematic review of lower limb exoskeletons used for functional mobility by people with spinal cord injury. Disabil. Rehabil. Assist. Technol. 11, 535–547. doi:10.3109/ 17483107.2015.1080766  Lamothe, D. (2014). Meet the Exoskeleton the Navy is Testing to Make Sailors Stronger. The Washington Post. Available at: https://www.washingtonpost. com/news/checkpoint/wp/2014/09/03/meet-the-new-exoskeleton-the-navy- is-testing-to-make-sailors-stronger/?utm_term=.579eb2ab7b12  Laurence, M., Freeman, M., and Swanson, S. (1969). Engineering considerations in the internal fixation of fractures of the tibial shaft. J. Bone Joint Surg. Br. 51, 754–768.  Lenzi, T., Carrozza, M., and Agrawal, S. K. (2013). Powered hip exoskel- etons can reduce the user’s hip and ankle muscle activations during walking. IEEE Trans. Neural Syst. Rehabil. Eng. 21, 938–948. doi:10.1109/ TNSRE.2013.2248749  Sawicki, G., and Khan, N. (2015). A simple model to estimate plantarflexor muscle- tendon mechanics and energetics during walking with elastic ankle exoskele- tons. IEEE Trans. Biomed. Eng. 63, 914–923. doi:10.1109/TBME.2015.2491224 Sawicki, G. S., and Ferris, D. P. (2008). Mechanics and energetics of level walking with powered ankle exoskeletons. J. Exp. Biol. 211, 1402–1413. doi:10.1242/ jeb.009241  Sawicki, G. S., and Ferris, D. P. (2009). Mechanics and energetics of incline walking with robotic ankle exoskeletons. J. Exp. Biol. 212, 32–41. doi:10.1242/ jeb.017277  Sawicki, G. S., Lewis, C. L., and Ferris, D. P. (2009). It pays to have a spring in your  step. Exerc. Sport Sci. Rev. 37, 130. doi:10.1097/JES.0b013e31819c2df6\n']","
气动下肢助力外骨骼通过集成可穿戴气源系统实现便携性，该系统可集成于穿戴设备中，减少外部能源供应依赖；同时采用高效气动驱动机制（如气动马达）提升驱动效率。文中可能通过优化气源存储与释放策略，减少能量损耗，从而在便携性与驱动效率之间取得平衡。
","
    气动下肢助力外骨骼通过将可穿戴气源系统集成到外骨骼结构中，实现便携性与驱动效率的平衡。该系统采用轻量化设计和优化气动执行器，降低整体重量并提升能量利用效率。同时，通过动态气压控制策略调节助力水平，确保在不同运动状态下提供高效驱动，兼顾便携性与功能性。
    ",0.375,0.8838791316634929,0.5
"
TPAD外骨骼系统相较于其他步态训练设备在惯性负载方面具有哪些优势？
","['\nRecently, robotic training paradigms for CP children have been proposed. The most widely used device is Lokomat, which is a rigid robot that moves the lower limbs in the sagittal plane using position control (25). Studies with this device have shown mixed outcomes in gait improvements, and this was attributed to lack of the child’s active participation in the study (25–27). An overground gait train- er, “CPWalker,” was used to apply partial body weight support with control of hip flexion-extension and knees in position mode (28). Training with CPWalker was performed for 5 weeks with three CP children, but the outcomes for the posture were inconsistent (29). Another study conducted by Lerner et al. (30) used a robotic exo- skeleton that provides torque assistance to change the posture during walking and enhance the muscle’s ability to extend the limbs. Wearing the exoskeleton changed the muscle patterns and joint angles positive- ly, but the training effects without the exoskeleton were not presented. Compared with other robotic devices that could be potentially used for gait training of children with CP, TPAD offers some unique advan- tages: (i) TPAD does not add inertia to the human body. TPAD only adds 320 g on the child, which is 10 to 20 times smaller compared with other devices (24). This is important for children with small body size and weight. Added inertia on the child’s body can result in undesirable\n']","
TPAD外骨骼系统相较于其他步态训练设备在惯性负载方面具有显著优势，其仅在儿童身上增加了320克的惯性负载，是其他设备的10至20倍。这种低惯性设计有助于改善肌肉激活模式和关节角度，提升训练效果，同时不会干扰儿童的自然运动控制与参与，从而在CP儿童的步态训练中展现出更优的适应性与安全性。
","
TPAD外骨骼系统相较于其他步态训练设备在惯性负载方面的主要优势在于其轻量化设计，仅增加320克负载，比其他设备减少10至20倍的惯性负载，从而更适应儿童较小的身体尺寸和较低的体重承受能力。
    ",0.25,0.8719489633509364,0.75
"
本文如何通过训练提升穿戴者对外骨骼膝关节支撑期屈曲的适应性？
","['\nignored stance ﬂexion [50], [51] due to the wearer’s pref- erence. This was because the wearers might have already adapted to their previous daily passive devices, which usually locked the knee joint to a full extension for weight support during stance. In addition, some wearers reported a sense of instability when the prosthesis knee ﬂexed during stance [52]. In our study, training of the subjects helped them to become conﬁdent and comfortable with the prosthesis knee stance ﬂexion in walking. More importantly, we noted knee stance ﬂexion during early stance across all subjects from those tests that rendered the best stance time symmetry (Fig. 6). Since shock absorption after foot contact is pertinent to breaking impulse, the observation further conﬁrmed the importance of prosthesis knee control in early stance. Generating knee stance ﬂexion with eccentric torque in early stance might be necessary for prosthesis control to improve gait symmetry. However, there is no clear relationship between the prosthesis features and the gait symmetry index, and the target knee kinematics in this study cannot guarantee the best stance time symmetry for each participant. Hence, personalizing the target knee features may be necessary in order to minimize gait asymmetry.\n']","
本文通过训练穿戴者使其适应假体膝关节在步行支撑期的屈曲状态，增强了其信心与舒适度，并观察到早期站立初期生成膝关节屈曲有助于提升步态对称性。虽然文中未明确说明训练方法，但指出个性化目标膝关节特征可能是减少步态不对称的关键，表明适应性训练需根据个体差异进行优化。
","
    本文通过训练提升穿戴者对外骨骼膝关节支撑期屈曲的适应性，具体方法是让受试者在行走过程中逐渐适应假肢膝关节在支撑期的屈曲行为，从而增强其信心与舒适感。研究发现，训练后受试者在支撑期早期表现出膝关节屈曲，并在获得最佳支撑时间对称性的测试中实现该行为，这表明训练有效促进了适应性。尽管未发现假肢特征与步态对称性之间的明确关系，但结果提示个性化调整目标膝关节运动参数可能是提升适应性、减少步态不对称性的关键。
    ",0.8333333333333334,0.85991493816675,1.0
"
RMS转矩跟踪误差在确定最优控制增益过程中起到了怎样的作用？
","['\nFor each combination of desired and passive stiﬀnesses, the initial session had fairly low proportional and damping gains. The gains were gradually increased across trials until perceptible oscillations were detected with maximum damping gain. Depending on the initial gains and step sizes of gain tuning, number of trials varies for each stiﬀness combination. Sometimes, the gains are lowered in the ﬁnal sessions to achieve better gain tuning resolution. On average, around ten trials were conducted for each stiﬀness combination.  Identiﬁcation of the best torque tracking performance for a speciﬁc desired and passive stiﬀness combination is crucial. The step-wise root-mean-squared (RMS) torque tracking errors averagedovertheonehundredsteadystepsforeachexperimental trial was calculated as its performance indicator. For each combination of desired and passive stiﬀnesses, the RMS error values of all trials with diﬀerent gains were compared. The lowest of them was recorded as the estimate of optimal torque error for the corresponding stiﬀness combination. The control gains of the corresponding data set were recorded as the estimates of optimal control gains.  December 2017 | Volume 11 | Article 68  Zhang and Collins  Optimal Passive Stiffness in Torque-Controlled Exoskeletons  FIGURE 3 | All eight tested desired torque vs. ankle angle curves used to realize different desired quasi-stiffness values. (A) Three linear curves achieved by scaling unit curve deﬁned by Table 1 with scaling factors of 0.4, 1, and 1.7. (B) Five piece-wise linear curves by achieved by scaling unit curve deﬁned by Table 2 with scaling factors of 0.4, 0.7, 1, 1.3, and 1.7.  TABLE 3 | List of springs used in experiments with assigned ID.  Passive stiffness ID  S1  S2  S3  S4  S5  S6  Spring Part No.  DWC-148M-13  DWC-162M-12  DWC-187M-12  DWC-225M-13  DWC-250M-12  No Spring  Length (m) Spring rate (N/m × 103)  0.0635  15.1  0.0508  27.5  0.0508  50.1  0.0635  103.1  0.0508  235.7  –  –  Max load (N)  413.7  578.3  778.4  1641.4  2246.4  –  desired and passive stiﬀness values to test the hypotheses. This process is demonstrated in Figure 5, which presents the control gains, experimental sequence, resulting RMS torque errors and the corresponding oscillation levels of measured torques for each data set with one combination of desired and passive stiﬀness.\n']","
RMS转矩跟踪误差在确定最优控制增益过程中起到了关键作用，通过计算不同增益设置下的平均误差，并选择最小误差值作为该组合的最优控制增益估计，从而实现对控制参数的系统优化。
","
    RMS转矩跟踪误差在确定最优控制增益过程中起到了性能评估与优化指导的关键作用。它是通过计算100个稳定步态周期内的均方根误差来评估每次试验的跟踪性能，并用于比较不同增益组合下的控制效果，最终选取使RMS误差最小的控制增益作为最优增益。
    ",0.75,0.9979848540462318,0.75
"
背驱式执行器与传统执行器相比，在动力学响应方面有哪些优势？
","['\nIn treating individuals with disorders like crouch gait from CP, which has multiple potential contributing factors, it is realistic that not all individuals would respond in the same way to robotic assistance. Not surprisingly, there was a clear variation in walking ability, both with and without exoskeleton assistance, across our cohort. Qualitatively, some individuals were able to walk more naturally in the exoskeleton assist-on condition than others. The additional challenge posed by walking on the treadmill may have also contributed to this spectrum of comfort. While P5 and P6 demonstrated clinically significant improvements in knee extension for at least one parameter (e.g. peak knee extension or knee extension at initial contact) for at least one of their limbs during the exoskeleton assisted treadmill walking trials, they exhibited greater improvement during over-ground walking32. One participant (P7) visibly struggled with walking on the treadmill at baseline with only 4 strides available for analysis (Table 1). P7 also struggled to acclimate to the exoskeleton during treadmill and over-ground walking as she exhibited increased knee flexion in both the assist-on and assist-off conditions, a posture that she likely adopted to increase stability and comfort level. As a result, she also showed an increased biological knee exten- sor moment across the stance phase with the exoskeleton (Supplemental Fig. 1). It should be noted that even in this more crouched posture, the biological knee moment was reduced with the exoskeleton assist-on compared  8  to assist-off. This participant had greatly increased dorsiflexion during walking in the exoskeleton compared to baseline, suggesting that combining motorized knee assistance with an ankle condition that more closely resem- bled her prescribed AFO during typical walking would have improved outcomes. In this study, we chose to use a free ankle for all participants to isolate the effects of robotic assistance at the knee. In the future, combining the exoskeleton with an AFO at the ankle may give improved results for individuals in whom ankle dorsiflexion also contributes to crouch. Furthermore, additional walking practice with the exoskeleton would likely also improve outcomes.\n']","
文献无相关内容。
","
文献无相关内容
    ",1.0,0.0,1.0
"
文中提到的15次训练会话后，胫骨前肌和腓肠肌的EMG信号变化趋势有何不同？
","['\nChanges in gait during treadmill walking after multiple training sessions: Representative participant Figure 3 shows different parameters during free walking before (green line) and after 15 training sessions (red line). In these plots, the tread- mill speeds before and after 15 training sessions were set the same to remove the effect of walking speed on gait pattern (36). Figure 3A shows changes in EMG signals. Both EMG signals were scaled with the maximum value of baseline at the first session (before the first training). The soleus shows higher peaks during stance phase of the gait, and the curve of gastrocnemius is shifted more toward terminal stance phase. These trends were also observed during the training and just after train- ing in session 1; however, the changes are more dominant after the 15th training session. The child showed straighter posture after training. His knee and hip are more extended during the mid-stance phase. Ankle plantar flexion is also increased during push-off with the toes against the ground. The increased ROM of the pelvis in the vertical direction\n']","
在15次训练会话后，胫骨前肌的EMG信号峰值在支撑相显著增强，而腓肠肌的EMG信号变化趋势相对平缓，其曲线向终端支撑相偏移的趋势不如胫骨前肌明显。
","
    文中未提供胫骨前肌EMG信号变化趋势的具体信息，因此无法判断其变化趋势；而腓肠肌的EMG信号在15次训练后更明显地向终端站立相偏移。
    ",0.0,0.9373623644588092,0.0
"
TCN-LSTM模型中如何利用关节注意力机制提升关节力矩估计精度？
","['\nThe dynamic characteristics of the knee exoskeleton can be  described as follow:  M(θ)¨θ + C(θ, ˙θ) ˙θ + G(θ) = T  (1)  M(θ) =   (m1 + m2)l1 m2l2  2 + m2l2 2 + m2l1l2 cos θ2  2 + 2m2l1l2 cos θ2 m2l2  2 + m2l1l2 cos θ2 2  m2l2  (2)    C(θ) =    −2m2l1l2 sinθ2 ˙θ2 −m2l1l2 sinθ2 ˙θ2  m2l1l2 sinθ2 ˙θ1  0    (3)  G(θ) =   (m1 + m2)gl1 sinθ1 + m2gl2 sin(θ1 + θ2) m2gl2 sin(θ1 + θ2)    (4)  where M(θ) is the joint-space inertia matrix. C(θ, ˙θ) is the Coriolis and centrifugal matrix. G(θ) is the gravity matrix. θ is the joint angle, and T = [T1 ,T2]T represents the torque.  Eq.(1) is used to calculate the joint torque based on the Lagrange dynamic model, and the calculated joint torque is employed in the TCN-LSTM model based on joint attention mechanism, which adopts multi-sensor data to estimate the joint torque. In order to calculate the joint torque, the joint velocity and acceleration are typically obtained through Qual- isys motion capture system. The length of the thigh and calf can be measured directly. The mass of the thigh and calf can be estimated in accordance with the national standard about inertial parameters of Chinese adults [21].  m = B0 + B1 × X1 + B2 × X2  where X1 represents individual weight (kg), X2 represents height (mm), and B0, B1 and B2 are the corresponding regression coefficients.  III. TCN-LSTM MODEL BASED ON JOINT ATTENTION MECHANISM  The bottleneck attention module (BAM) was proposed by Park et al. [22]. BAM integrates the dual advantages of spatial attention mechanism and channel attention mechanism, which can focus not only on the importance of spatial features but also significantly enhance the representation ability of features. The image has three dimensions. C, H, and W represent the number of channels, the height of features, and the width of features for image processing, respectively. The time series is one-dimensional, and C represents the step size of the time series. Therefore, the width of features is 1, and H represents the number of features in the time series. The input feature F ∈ RC×H is transformed through one 1×1 convolution, two 3 × 3 dilation convolutions, and one 1 × 1 convolution. The dimension of output feature is C × 1, as shown in Fig. 4.\n']","
在TCN-LSTM模型中，关节注意力机制通过引入瓶颈注意力模块（BAM）结合时序卷积网络（TCN）实现对关节力矩的高效估计。BAM融合了空间与通道注意力机制，增强关键特征的表示能力；TCN则通过卷积操作处理时序数据，提升对动态变化的建模能力。两者协同作用，使模型能够自适应关注关节状态变化，从而提升关节力矩估计精度。
","
    在TCN-LSTM模型中，关节注意力机制通过瓶颈注意力模块（BAM）结合空间与通道注意力机制，对时间序列中的关节特征进行加权，突出对关节力矩估计贡献较大的特征，从而提升关节力矩估计精度。具体而言，模型利用1×1卷积与膨胀卷积提取特征，并通过注意力权重增强关键时间步与关键关节的输入表示，实现更精确的力矩预测。
    ",0.375,0.9382329174333752,0.75
"
外骨骼在骑行辅助中，如何通过对称的伸展和屈曲运动实现扭矩控制？
","['\nAB  Figure 2. GuroX hip exoskeleton developed for lower limb assistance, perturbations, and training shown for scenarios of assisted (A) walking and (B) cycling.  We parameterized the exoskeleton hip torque pattern as a function of the crank angle  p ext (Figure3). The torque pattern is defined as   with one control parameter ϕ  \uf8f1    −cosπ ϕ ϕ  p ext  A 2  + 1  0 < ϕ ≤ ϕ  \uf8f4\uf8f4\uf8f4\uf8f4\uf8f4\uf8f4\uf8f4\uf8f4\uf8f4\uf8f4\uf8f2 \uf8f4\uf8f4\uf8f4\uf8f4\uf8f4\uf8f4\uf8f4\uf8f4\uf8f4\uf8f4\uf8f3  p ext p ext p ext      p ext < ϕ ≤ 0.5 ϕ  ϕ−ϕ 0.5−ϕ cosπ ϕ−0.5 p fle−0.5 ϕ p ϕ−ϕ fle p fle  A 2  + 1  cosπ  τ =      p fle  A 2  0.5 < ϕ ≤ ϕ  − 1      p fle < ϕ ≤ 1  A 2  −cosπ  − 1  ϕ  1−ϕ  where A is a constant denoting the maximum hip torque, which was set to 10Nm for both hip flexion and extension, ϕ = θ/2π is the normalized crank angle (pedal stroke in percentage), and θ is the crank angle. An angle of zero is defined as the position where  4 of 14  (1)  Bioengineering 2024, 11, 683  p the pedal is at the highest point (TDC). ϕ fle denote the normalized angle of the peak extension torque and the peak flexion torque, respectively. Considering the extension p ext + 0.5. motion and the flexion motion are symmetric during cycling, we defined ϕ The exoskeleton was fit to the participant using a modified hip orthosis made from polypropylene and a thigh brace at each thigh made from carbon fiber. All interfaces were cushioned on the inside. A carbon fiber rod on the outside of each thigh is used to transfer the torque to the thigh. Exoskeleton torque is transmitted through the end of each carbon fiber rod to the middle of each thigh brace via a rigid connecting lever.  p ext and ϕ  p fle = ϕ  Time [% pedal stroke]040100  100% | 0%50%25%75%  10 min  ExoskeletonTorque [Nm]  10 min  10-10Peak extension  Peak flexion  Pedal stroke  Cycling directionAB  206080  0  Figure 3. (A) Definition of the pedal stroke timing based on ϕ from 0% to 100% and (B)hip exoskeleton p torque τ during the sweep session. Within the pedal stroke, peak extension (ϕ ext) and peak flexion (ϕ  p fle) torque timing change over the course of 15min from early (blue) to late (red).  2.3. Experimental Protocol\n']","
外骨骼通过将髋关节扭矩 τ 参数化为归一化踏板行程 ϕ 的函数，采用对称区间设计实现伸展与屈曲扭矩的同步控制。其中，伸展扭矩与屈曲扭矩在 ϕ = 0.5 ± ϕ_0 处对称达到峰值，并通过 cos(π(ϕ - 0.5)) 函数确保对称性。该控制策略使外骨骼能够根据踏板运动周期自动调节髋关节扭矩输出，实现骑行过程中的对称伸展与屈曲辅助。
","
在骑行辅助中，外骨骼通过对髋关节扭矩的参数化控制实现对称的伸展和屈曲运动。定义ϕ_fle = ϕ_ext + 0.5确保了屈曲与伸展扭矩的对称分布，其中A为最大髋扭矩（10Nm），ϕ为归一化曲柄角度。扭矩函数τ在不同ϕ区间采用分段表达式，保证在踏板行程中对称地施加辅助扭矩。外骨骼通过碳纤维杆将扭矩传递至大腿中部，从而实现对称运动辅助。该方法确保了骑行过程中髋关节的协调辅助。
    ",0.625,0.8365800000090085,0.75
"
实验结果表明该混合系统在髋关节和膝关节运动中表现出哪些控制一致性与适应性特征？
","['\n[7] P. Gallien et al., “Restoration of gait by functional electrical stimula- tion for spinal cord injured patients,” Paraplegia, vol. 33, no. 11, pp. 660–664, Nov. 1995.  [8] R. Dai, R. B. Stein, B. J. Andrews, K. B. James, and M. Wieler, “Appli- cation of tilt sensors in functional electrical stimulation,” IEEE Trans. Rehabil. Eng., vol. 4, no. 2, pp. 63–72, Jun. 1996.  V. CONCLUSION  The authors have presented a control approach that enables the cooperative control of a powered lower limb exoskeleton in combination with FES. The intent of the hybrid system is to provide the physiological beneﬁts associated with FES, with the reliability and control beneﬁts associated with the exoskeleton. The control approach treats the muscle stimulation as a distur- bancetoahigh-bandwidthmotorcontrolloop,andincorporatesa step-wise adaptation that shapes the stimulation proﬁle based on thetorque measurementfrom previous steps toshape the muscle “disturbance” in such a way that minimizes the required motor torque. Experimental results from testing the cooperative con- trol system on three motor-complete thoracic-level paraplegic subjects indicatedhighlyconsistenthipandknee movement;the ability of the controller to actively adapt the muscle stimulation despite substantial variability in muscle dynamics, both within and between subjects; and the effective reduction of motor torque and power as a result of muscle stimulation.  [9] R. Kobetic, R. J. Triolo, and E. B. Marsolais, “Muscle selection and walking performance of multichannel FES systems for ambulation in paraplegia,” IEEE Trans. Rehabil. Eng., vol. 5, no. 1, pp. 23–29, Mar. 1997.  [10] D. Graupe and K. H. Kohn, “Functional neuromuscular stimulator for short-distance ambulation by certain thoracic-level spinal-cord-injured paraplegics,” Surg. Neurol., vol. 50, no. 3, pp. 202–207, Sep. 1998.  [11] M. M. Skelly and H. J. Chizeck, “Real-time gait event detection for paraplegic FES walking,” IEEE Trans. NeuralSyst. Rehabil. Eng., vol. 9, no. 1, pp. 59–68, Mar. 2001.  [12] X.Zhaojun,W.Dahai,M.Dong,andW.Baikun,“Newgaitrecognition technique used in functional electrical stimulation system control,” in Proc. 6th World Congr. Intell. Control Automat. (WCICA), 2006, pp. 9421–9424.  [13] A. Dutta, R. Kobetic, and R. Triolo, “Walking after partial paralysis assisted with EMG-triggered or switch-triggered functional electrical stimulation—Two case studies,” in Proc. IEEE Int. Conf. Rehabil. Robot. (ICORR), 2011, pp. 1–6.\n']","
实验结果表明，该混合系统在髋关节和膝关节运动中表现出高度一致的运动表现，并具备主动适应肌肉动力学变化的能力；同时，控制策略有效降低了所需的电机扭矩和功率输出，从而提升了能量效率。
","
    实验结果表明，该混合系统在髋关节和膝关节运动中表现出高度一致的运动控制能力，并具备基于扭矩反馈逐步调整刺激剖面的适应性机制，从而有效减少电机扭矩需求，展现出良好的控制一致性与适应性特征。
    ",0.5,0.791675206028053,0.75
"
研究中使用KT-1000关节测量仪评估膝关节稳定性的测试方法有哪些？
","['\nPanariello et al. (49) examined the effect of the squat exercise on anteroposterior knee translation in professional football players. Thirty-two subjects with normal knees participated in a 21-wk off-season conditioning program involving the parallel squat. Two periodization training cy- cles were utilized during the 21 wk. The first cycle was 12 wk in duration, immediately followed by a 9-wk cycle. The squat was performed twice a week, with subjects performing an average of 32 repetitions per session and lifting an average of 130–200% BW. A knee ligament arthrometer KT-1000 (Medmetric Corp., San Diego, CA) was used to measure anteroposterior knee stability. Both knees of each subject were tested passively and actively at 30° and 90° knee flexion before the start of the training program, at the end of the 12-wk cycle, and at the end of the 9-wk cycle. Passive anterior drawer tests were conducted with 67 N (15 lbs), 89 N (20 lbs), and 133 N (30 lbs) of force, whereas passive posterior drawer tests were conducted with 67 N and 89 N of force. Active tests were conducted with maximum voluntary isometric contractions of the quadriceps and ham- strings. Mean anterior and posterior drawer measurements were compared between the start of the training program and the end of the 12-wk cycle, between the end of the 12-wk cycle and the end of the 9-wk cycle, and between the start of the training program and the end of the 9-wk cycle. There were no significant differences between any pair of pre- and post-exercise measurements, and no significant differences in anteroposterior knee translations in athletes using the squat as part of their training regimen. Hence, it was deduced that the squat is a safe exercise to include in an athlete’s training program.  CONCLUSIONS  This review examined knee biomechanics during the dy- namic squat exercise. Low to moderate posterior shear forces were generated throughout the squat, restrained primarily by  http://www.acsm-msse.org\n']","
研究中使用KT-1000关节测量仪评估膝关节稳定性的测试方法包括：被动与主动两种方式；被动测试分别在30°和90°膝关节屈曲下进行，包括前抽屉（67 N、89 N、133 N）和后抽屉（67 N、89 N）测试；主动测试通过股四头肌和腘绳肌的最大自主等长收缩来评估主动稳定性。所有测试均在训练前后进行比较。
","
    使用KT-1000关节测量仪评估膝关节稳定性的测试方法包括被动和主动测试。被动测试分别在膝关节屈曲30°和90°下进行，前抽屉试验使用67 N、89 N和133 N的载荷，后抽屉试验使用67 N和89 N的载荷。主动测试通过股四头肌和腘绳肌最大自主等长收缩进行。测试在训练开始前、12周周期结束和9周周期结束时进行，用于评估动态负荷对膝关节前后稳定性的影响。
    ",0.8571428571428571,0.9910653474618352,1.0
"
在连续变化任务试验中，参与者对不同控制器（HKIC与FSMC）的依赖手扶栏杆情况有何差异？说明了什么控制效果？
","['\n6  (21)  SS-Level SS-Incline SS-Decline  CV-Incline CV-Decline  (a) Steady-state task trials  (b) Continuously-varying task trials  Fig. 5. Diagrams indicating the locations of the task space sampled during each trial. Each transparent marker indicates the treadmill’s task feedback, sampled at 2 Hz. Each black dot indicates the task combination commanded to the treadmill for a duration of 45 seconds in (a) and 20 seconds in (b).  criteria were instantiated for each joint (i.e., one set for level ground, one set for declines, and one set for inclines). The controller selected between impedance parameter sets based on the estimated incline ˆγ (Appendix Fig. 13b). In total, the FSMC required 96 tunable parameters, including 45 impedance parameters per joint and 6 FSM transition criteria.  B. Experimental Methods  A participant with an above-knee amputation (sex: male, age: 26 years, mass: 116 kg, height: 1.9 m, K-level: 4, cause of amputation: congenital, time since amputation: 26 years) was recruited to participate in the experiment. The protocol was approved by the Institutional Review Board of the University of Michigan (HUM00166976) and the participant wore a ceiling-mounted safety harness while walking on the treadmill. The proposed HKIC and the comparison FSMC were im- plemented on a backdrivable, powered knee-ankle prosthesis, shown in Fig. 4 and described in depth in [39]. A licensed prosthetist ﬁt the prosthesis to the participant and ensured proper alignment. The participant was instructed on the ex- pected high-level behavior of each controller and given time to acclimate to each while walking overground within parallel bars. Following this overground acclimation, 5 trials with each controller were conducted on an in-ground split-belt treadmill (Bertec, Columbus, Ohio, USA). The treadmill had instru- mented handrails on either side for safety, and the participant was instructed to limit handrail body weight support when possible to maximize the realism of the experiment. The instrumented handrail data showed that the subject did not heavily rely on the handrails with either controller.\n']","
在连续变化任务试验中，参与者对不同控制器（HKIC与FSMC）的依赖手扶栏杆情况均未出现显著差异，表明两种控制器均具备良好的地形适应性和稳定性控制能力，能够在任务空间中实现稳定步态，减少对环境辅助设备（如手扶栏杆）的依赖，说明其控制性能优异。
","
    在连续变化任务试验中，参与者对HKIC与FSMC控制器均未表现出明显的扶栏依赖，说明两种控制器均能有效支持行走稳定性。然而，文献未提供两者在扶栏依赖程度上的具体差异，因此无法判断其控制效果是否具有区别。
    ",0.2,0.982738078890891,0.75
"
实验结果显示不同助力模式对外骨骼代谢成本的影响有何差异？
","['\n[50] K. E. Zelik, K. Z. Takahashi, and G. S. Sawicki, “Six degree-of-freedom analysis of hip, knee, ankle and foot provides updated understanding of biomechanical work during human walking,” J. Exp. Biol., vol. 218, no. 6, pp. 876–886, 2015.  Authorized licensed use limited to: BEIJING UNIVERSITY OF TECHNOLOGY. Downloaded on December 12,2024 at 09:15:44 UTC from IEEE Xplore. Restrictions apply.  1457  1458  IEEE TRANSACTIONS ON ROBOTICS, VOL. 38, NO. 3, JUNE 2022  [51] M. A. Ergin and V. Patoglu, “A self-adjusting knee exoskeleton for robot- assisted treatment of knee injuries,” in Proc. IEEE/RSJ Int. Conf. Intell. Robots Syst., 2011, pp. 4917–4922.  [52] Z. F. Lerner, D. L. Damiano, H.-S. Park, A. J. Gravunder, and T. C. Bulea, “A robotic exoskeleton for treatment of crouch gait in children with cerebral palsy: Design and initial application,” IEEE Trans. Neural Syst. Rehabil. Eng., vol. 25, no. 6, pp. 650–659, Jun. 2016.  [53] C.A.McGibbonetal.,“EvaluationoftheKeeogoexoskeletonforassisting ambulatory activities in people with multiple sclerosis: An open-label, randomized, cross-over trial,” J. Neuroeng. Rehabil., vol. 15, no. 1, 2018, Art. no. 117.  [54] J. C. Mcleod, S. J. Ward, and A. L. Hicks, “Evaluation of the KeeogoTM dermoskeleton,” Disabilily Rehabil., Assistive Technol., vol. 14, no. 5, pp. 503–512, 2019.  Sainan Zhang received B.S. degree in automation from Xi’an University of Posts and Telecommunica- tions, in 2015, the M.S. degree in control science of engineeringfromtheUniversityofElectronicScience and Technology of China, Sichuan, China, in 2018. She is currently working towards the Ph.D. degree in the ﬁeld of wearable robot supervised by Dr. Hao Su at the Department of Mechanical Engineering at the City University of New York, New York, USA. She is also a visiting scholar in the Department of Mechanical and Aerospace Engineering at the North Carolina State University. Her current research interests include the control and optimization of lower-limb wearable robots.  [55] K. Tamai, H. Kawamoto, and Y. Sankai, “Weight-supported walking assist device for knee osteoarthritis patients,” in Proc. IEEE 16th Int. Conf. Rehabil. Robot., 2019, pp. 374–379.  [56] Y. Ding, M. Kim, S. Kuindersma, and C. J. Walsh, “Human-in-the-loop optimization of hip assistance with a soft exosuit during walking,” Sci. Robot., vol. 3, no. 15, 2018, Art. no. eaar5438.\n']","
文献无相关内容。
","
文献无相关内容。
    ",0.0,0.0,1.0
"
实验如何验证髋关节助力时机与步行代谢成本之间的关系？主要实验结果指标是什么？
","['\nRecent work with hip and ankle exoskeletons has focused on the goal of reducing the metabolic cost of walking, and research- ers have succeeded in a number of experiments (Ronsse et al., 2011; Mooney et al., 2014; Ding et al., 2016a,b; Ruiz Garate et al., 2016; Seo et al., 2016). Research groups have used both rigid exoskeletons (Ruiz Garate et al., 2016), as we use in our experiment, and soft exoskeletons to test the effect of different hip assistance strategies on metabolic output (Ding et al., 2016a; Panizzolo et al., 2016). A wide variety of control systems have been proposed (Aguirre-Ollinger, 2013; Jang et al., 2015; Koller et al., 2015; Oh et al., 2015; Takahashi et al., 2015; Wu et al., 2015; Yan et al., 2015; Ao et al., 2016; Chen et al., 2016; Ding et al., 2016b; Zhang et al., 2016), but typically tests are done on a unique device with only one controller. Oscillator-based controllers tend to be popular for hip exoskeletons due to the reliance on only hip joint angle sensing for control (Ronsse et al., 2011; Giovacchini et al., 2014; Seo et al., 2016; Yan et al., 2016; Sugar et al., 2017). More recent exoskeletons are becoming completely autonomous, using oscillation-based approaches to provide walking assistance that reduces the metabolic cost of walking (Seo et al., 2016).  The overall aim of this work was to determine the optimal tim- ing for supplying hip power using an exoskeleton to assist human walking. This is a useful goal to aid the field in understanding the relationship between hip assistance timing and metabolic cost of walking. The experiment aimed to identify separately the value of hip flexion and hip extension assistance and determine the best timing interval during the gait cycle for supplying powered assistance for both movement types. The primary outcome meas- ure was the metabolic cost of walking. We hypothesized that the controller timings that generated a pattern of exoskeleton torque most similar to the biological torque pattern would produce  the largest reduction in metabolic cost (Malcolm et al., 2013). A secondary outcome measure was user preference. We tested the hypothesis that users would prefer conditions with powered assistive timing that incurred a lower metabolic cost on the user. The primary aim achieved was assessing the effects of hip timing on human performance using an exoskeleton.  MaTerials anD MeThODs\n']","
实验通过测量不同助力时机下步行代谢成本的变化，并结合用户偏好评估其对髋关节助力时机与代谢成本之间关系的验证。主要实验结果指标为步行代谢成本，次要指标为用户对助力时机的主观偏好。
","
    实验通过在不同步态周期提供髋关节助力，测量其对步行代谢成本的影响，主要结果指标为代谢成本（通常通过氧气消耗量计算），次要指标为用户偏好。实验使用基于髋关节角度的振荡器控制器调节助力时机，并分别评估髋屈与髋伸阶段的助力效果，以确定最佳助力时机窗口。
    ",1.0,0.5513432753999629,1.0
"
相较于传统的物理治疗方法，TPAD训练在改善屈膝步态方面具备哪些潜在优势？
","['\n5 of 11  f r o m h t t p : / / r o b o t i c s . s c e n c e m a g . o r g / b y  i  g u e s t  o n  J u y  l  3 0 ,  2 0 1 7  Clinical evaluations were conducted twice, 1 week before the first training and 2 weeks after the last training. Six Minute Walk test (be- fore: 361 ± 28.56 m; after: 403.67 ± 46.38 m), Pediatric Berg Balance Scale (BBS) (before: 49.67 ± 3.98; after 49.50 ± 3.83), and Timed Up and Go (TUG) test (before: 9.26 ± 2.58; after: 8.97 ± 1.95) were eval- uated, but no significant improvement was found after the training for BBS (P = 0.785 with r = 0.079) and TUG test (P = 0.345 with r = 0.272). Six Minute Walk test showed significant improvement (P = 0.028 with r = 0.635). Individual values are presented in table S1.  DISCUSSION This study shows the feasibility that training with TPAD using down- ward pull force can improve walking of CP children with crouch gait. The lower limbs have increased extension after the training, showing stronger soleus muscles. Improved vertical pelvic ROM and decreas- ing trend of trunk angle are also observed. In addition, children who participated in this study showed improvements in walking ability, for example, step length, walking speed, symmetry, and foot clearance. Currently, there is no well-established physical therapy or strengthen-  ing exercise for the treatment of crouch gait (39); TPAD training with downward pelvic pull could be a promising intervention for these children.\n']","
TPAD训练相较于传统物理治疗方法，在改善屈膝步态方面具备以下潜在优势：1）通过主动肌肉刺激增强比目鱼肌力量；2）改善下肢伸展能力；3）提升步行参数如步长、行走速度和对称性；4）提供系统性、动力学调节的干预手段，相较于传统疗法更具针对性与有效性。
","
    TPAD训练相较于传统物理治疗方法，在改善屈膝步态方面具备以下潜在优势：通过向下的骨盆牵引力增强下肢伸展能力，改善腓肠肌功能；提升步长、步行速度、对称性及足部离地高度；优化垂直骨盆运动范围并降低躯干倾斜趋势；且作为一种新型干预手段，其在尚无标准治疗方案的背景下展现出可行性和潜力。
    ",0.3333333333333333,0.9249696790768892,0.5
"
自对准外骨骼设计中的伪力和力矩是如何受关节轴线不对准影响的？实验数据如何支持这一结论？
","['\nThe goal of the pDOFs is to prevent the spurious forces and torques on the user’s limb that can result from misalignments. the proposed self-aligning We hypothesized exoskeleton, misalignments between the exoskeleton joint axes will not result in an increase of spurious forces and torques on the user. To test this hypothesis, we have measured the interaction forces between the exoskeleton and the user across different alignment and assistance conditions. The analysis of the interaction forces (Fig. 11 and Fig. 13) shows that the spurious forces (Fx and Fy) and torques (Tx, Ty, Tz) were not visibly affected by the assistance level. On the other hand, Fz increased with the level of assistance. This result is not surprising given that Fz is roughly perpendicular to the user shank, and, therefore, it is not a spurious load. Relatively large standard deviations were observed in measured interaction forces (Fig. 11). The large standard deviation in Fz is likely due to inter-subject variability in sit-to-stand timing as our controller allows the subjects to stand up at their preferred speed. The standard deviations in all other forces and torques, are large relative to the value of the mean because the measured values themselves are small. The linear regression analysis showed that no forces or torques other than Fz were significantly correlated to the assistive joint torque. The measured peaks of the spurious forces and torques were 5 N and 0.5 Nm, respectively (Fig. 11). To put these numbers in perspective, a previous study [11] testing similar misalignment conditions using a powered exoskeleton with no self-aligning mechanism showed spurious forces and torques up to 50 N and 10 Nm, respectively. Thus, the analysis of the interaction forces and torques supports our hypothesis.  that,  in  the user and  B. Design and Control  The pDOFs in a self-aligning mechanism should be designed to work smoothly under the high load generated by the actuation system during assistance. The pDOFs should also be lightweight and unobtrusive, as adding significant weight or dimension to the exoskeleton may negate its assistive function [30]. The proposed design includes two pDOFs in the Sagittal\n']","
自对准外骨骼设计中，伪力（Fx、Fy）和伪力矩（Tx、Ty、Tz）不会因关节轴线不对准而显著增加。实验数据表明，无论辅助水平如何变化，伪力和伪力矩均未表现出与对准状态相关的显著变化。此外，Fz方向的力由于与用户小腿方向垂直而未被归类为伪力，进一步支持了该结论。实验测得的伪力和伪力矩峰值（5 N 和 0.5 Nm）远低于无自对准机制外骨骼中的水平（50 N 和 10 Nm），表明自对准机制有效减少了伪力和伪力矩的产生。
","
    自对准外骨骼设计中的伪力（Fx, Fy）和力矩（Tx, Ty, Tz）在实验中未因关节轴线不对准而显著增加，实验数据显示其峰值分别为5 N和0.5 Nm，远低于无自对准机制的外骨骼（50 N和10 Nm）。线性回归分析进一步表明，除Fz外，其他力和力矩与辅助关节力矩无显著相关性，验证了自对准机制有效抑制了伪力和力矩的产生。
    ",0.875,0.9020905700325256,1.0
"
IHMC外骨骼系统在步态规划与运动控制方面如何实现稳定性与适应性？
","[""\ninclude  [32] Y. Hasegawa, J. Junho, and Y. Sankai, “Cooperative walk control of paraplegia patient and assistive system,” in Proc. IEEE/RSJ Int. Conf. Intell. Robots Syst. (IROS), 2009, pp. 4481–4486.  [33] A. Tsukahara, Y. Hasegawa, and Y. Sankai, “Standing-up motion sup- port for paraplegic patient with Robot Suit HAL,” in Proc. IEEE Int. Conf. Rehabil. Robot. (ICORR), 2009, pp. 211–217.  [34] K. Hian Kai, J. H. Noorden, M. Missel, T. Craig, J. E. Pratt, and P. D. Neuhaus, “Development of the IHMC mobility assist ex- oskeleton,” in Proc. IEEE Int. Conf. Robot. Automat. (ICRA), 2009, pp. 2556–2562.  [35] A.Tsukahara,R.Kawanishi,Y.Hasegawa,andY.Sankai,“Sit-to-stand and stand-to-sit transfer support for complete paraplegic patients with robotsuitHAL,”Adv.Robot.,vol.24,no.11,pp.1615–1638,2010. [36] P. D. Neuhaus, J. H. Noorden, T. J. Craig, T. Torres, J. Kirschbaum, and J. E. Pratt, “Design and evaluation of Mina: A robotic orthosis for paraplegics,” in Proc. 2011 IEEE Int. Conf. Rehabil. Robot. (ICORR), 2011, pp. 1–8.  Michael Goldfarb (S'93–M'95) received the B.S. degree in mechanical engineering from the Univer- sity of Arizona, Tucson, AZ, USA, in 1988, and the S.M. and Ph.D. degrees in mechanical engineering from MIT, Cambridge, MA, USA, in 1992 and 1994, respectively.  Since 1994, he has been at Vanderbilt University, Nashville TN, USA, where he is currently the H. Fort Flowers Professor of Mechanical Engineering, Professor of Electrical Engineering, and Professor of Physical Medicine and Rehabilitation. His technical specialization is in the design and control of robotic systems that interact physically with people, and his primary research interest is to apply this spe- cialization towards the development of assistive devices to improve quality of life for people with physical disabilities. Recent work includes the development of multigrasp upper extremity prostheses, powered lower extremity prostheses, and powered lower limb orthoses for individuals with mobility deﬁcits.\n""]","
IHMC外骨骼系统通过人机协同控制、环境感知与力控策略实现步态规划与运动控制的稳定性与适应性。系统结合传感器数据实时调整步态参数，支持站立-行走与坐-站转换，并采用闭环控制机制调节下肢关节力矩与角度，确保动态平衡与地形适应性。
","
IHMC外骨骼系统通过任务驱动的步态规划、多层控制结构、传感器融合与参数自适应机制，结合动态稳定性判据（如ZMP或捕获点），实现了在复杂环境下的稳定行走与良好适应性。文献[34]指出其系统设计目标为提升步态稳定性，而类似系统如HAL的研究表明，融合生物信号与外部传感器反馈的控制策略是增强适应性的关键技术手段。
    ",0.0,0.9549073257223308,0.5
"
本文中基于QDD驱动的膝关节外骨骼在连续扭矩控制中需满足哪些关键设计与控制要求？
","['\nB. Requirements for Design and Control  Inthissection,wepresentthemechatronicdesignofaportable knee exoskeleton by leveraging our custom high-torque-density motor and low gear ratio transmission for QDD actuation. This platform is the foundation for the two contributions of this work, namely, stiffness modeling of a torque-controlled QDD exoskeleton and continuous torque control.  Portable exoskeletons should be lightweight to reduce the en- ergeticpenalty ofwearingtheexoskeleton anddiminishimpacts on the inertial properties of legs [56]. For our design, we set desired parameters such that it exceeds the performance deﬁned by knee biomechanics at 1.25 m/s walking speed to ensure the versatility of the exoskeleton, e.g., providing assistance across different walking speeds and not impeding natural movements (e.g., squatting and stair climbing). The requirements are sum- marized in Table II. Exoskeleton joint stiffness is required to span the range of biological stiffness (0–176 N·m/rad). It is  A. QDD Actuation  To meet the design and control requirements, our actuator is designed to be lightweight, compliant, and with a high band- width. Leveraging our high-torque-density motor [23], [24] and gear-embedded actuator design method [28], we customize a compact QDD actuator with fully integrated control electronics components (see Fig. 3). The actuator is lightweight (485 g) and compact (Φ100 mm × 37 mm height) and can generate  Authorized licensed use limited to: BEIJING UNIVERSITY OF TECHNOLOGY. Downloaded on December 12,2024 at 09:15:44 UTC from IEEE Xplore. Restrictions apply.  1445  1446  IEEE TRANSACTIONS ON ROBOTICS, VOL. 38, NO. 3, JUNE 2022  Fig. 4. Model of the coupled human–knee exoskeleton system. It includes a QDD actuator, wearable structures, and human limbs (represented by the blue bars).  Fig. 3. Electronic hardware architecture and QDD actuator (6:1 planetary gear) of the knee exoskeleton. The fully integrated architecture of the actuator includes a motor, a gearbox, and control electronics. We implement high-level control with a Teensy microcontroller. The robot could wirelessly communicate with a remote PC for data logging.\n']","
本文中基于QDD驱动的膝关节外骨骼在连续扭矩控制中需满足以下关键设计与控制要求：（1）轻量化设计以降低穿戴能耗并减少对腿部惯性的影响；（2）高带宽与低惯性特性以实现快速动态响应；（3）关节刚度需覆盖生物刚度范围（0–176 N·m/rad），以确保与人体膝关节行为一致；（4）具备高扭矩输出能力（如485 g质量、Φ100 mm × 37 mm尺寸）以支持不同行走速度下的辅助需求；（5）支持连续扭矩控制以实现多样化的膝关节辅助功能。
","
    基于QDD驱动的膝关节外骨骼在连续扭矩控制中需满足以下关键设计与控制要求：1）系统应轻量化、紧凑，以减少穿戴的能耗负担并避免影响人体腿部惯性特性；2）膝关节刚度需覆盖生物膝关节的刚度范围（0–176 N·m/rad）；3）QDD驱动系统应具备高扭矩密度、低传动比及高带宽特性；4）驱动器需集成控制电子组件，并通过高性能微控制器实现高层控制，同时支持无线数据通信；5）性能参数应设定为超过1.25 m/s行走速度下所需的生物力学要求，以适应多种步态任务。
    ",0.6666666666666666,0.9943420532785532,0.5
"
自主式关节靶向外骨骼如何在不承重的前提下实现高效的力矩传递？
","['\nThe mechanical designs and control strategies of joint-targeting exoskeletons with offboard actuation can be easily modified to explore the different physiological impacts of the designs; however, these sys- tems are restricted to treadmill-based studies, which may not reflect typical features of walking (such as changes in speed, direction or terrain). By contrast, autonomous systems allow the wearer to freely navigate unconstrained environments. The aim of joint-targeting exoskeletons is not to bear weight, hence autonomous devices do not require large rigid structures. However, rigid components are benefi- cial for efficiently transferring torques to the body; for example, rigid  Nature Biomedical Engineering  components and a distal actuator at the ankle decrease the metabolic cost of loaded and unloaded walking in unimpaired individuals69,70,87. Rigid devices have also been developed for assisting other joints, in particular the hip88–91 and the knee92,93, and for multijoint assistance94 (for example, the Cyberlegs project95). Moreover, rigid joint-targeting autonomous exoskeletons have been commercially developed for industrial, recreational and clinical applications, such as the Stride Management Assist (SMA)96–98 and the Gait Enhancing and Motivation System (GEMS)99,100. These autonomous bidirectional hip exoskeletons have been used to investigate new control schemes101–103, the augmen- tation of performance in unimpaired individuals104–106, the restoration of gait function in elderly adults107,108, improvements in gait and other mobility in people with CP109–111 and clinical effects post-stroke112,113.\n']","
自主式关节靶向外骨骼通过采用刚性结构和远端执行器，在不承重的前提下实现高效的力矩传递。该设计利用刚性元件确保动力稳定传递，结合控制策略优化关节辅助效果，同时支持自主移动环境，避免传统研究局限。
","
自主式关节靶向外骨骼通过采用局部刚性结构（如关节处的刚性连接与远端执行器）实现高效的力矩传递，同时避免整体承重需求，从而在自由环境中提供精准的关节辅助。
    ",0.6,0.9276224042833112,1.0
"
如何通过表面肌电图（EMG）数据评估多地形任务中股四头肌的整体肌肉用力？
","['\n5.2.2.3 Multi-terrain Quadriceps Effort  In session 2, after appropriate skin preparation, we secured five electromyography (EMG) electrodes (Trigno Avanti and Snap, Delsys, Massachusetts, USA) onto the subject’s right vas- tus medialis oblique (VM), vastus lateralis (VL), rectus femoris (RF), biceps femoris (BF), and  59  semitendinosus (ST) to assess muscle activation. Participants performed a maximum voluntary contraction (MVC) procedure comprising explosive jump squats (eliciting maximal dynamic con- traction) and maximal isometric contraction against manual resistance, which enabled EMG data to be normalized to %MVC.  To assess muscular effort we calculated the mean of the MVC-normalized RMS signal for each gait/task cycle. The RMS signal provided by the Delsys EMG acquisition software was used for this purpose (RMS window length: 125 ms, 122 ms overlap). The muscle recruitment pattern of the individual quadriceps muscles varies both intra- and inter-participant, but the force exerted by these muscles is similar for the same level of neural activation (due to similar cross-sectional areas). Since we were interested in gross quadriceps effort, and to reduce the number of degrees of freedom in our statistical analysis, we averaged the muscle efforts of the 3 quadriceps muscles that we recorded to get a gross quadriceps effort metric.  5.2.3 Statistical Analysis  We first confirmed normality of our data using QQ-plots. Muscular effort was analyzed using a linear mixed model (LMM) in MATLAB with restricted maximum likelihood estimation of pa- rameters. Data from our eight subjects were tabulated with information consisting of quadriceps muscle effort, condition (bare, exoskeleton), and gender (male, female). We defined exoskeleton conditions and gender as categorical variables and fit a separate LMM for each task, where the condition and gender are fixed effects and subject is a random effect:  Effort ∼ Condition+Gender+(1|Subject).\n']","
通过记录股四头肌（VM、VL、RF、ST、BF）的表面肌电图信号，进行最大自主收缩（MVC）归一化处理后，计算每个步态周期内各肌群的均方根（RMS）信号，并对三个主要股四头肌的RMS值进行平均，从而获得整体股四头肌用力指标。该方法结合EMG信号分析与统计建模，可系统评估多地形任务中股四头肌的总体肌肉用力。
","
    通过表面肌电图（EMG）数据评估多地形任务中股四头肌的整体肌肉用力，首先对股四头肌的三个主要部分（VM、VL、RF）进行皮肤准备并贴附EMG电极，随后通过最大自主收缩（MVC）测试对EMG信号进行%MVC归一化处理。接着，利用125 ms窗口长度（122 ms重叠）的均方根（RMS）信号计算每个任务周期的平均肌肉用力。为评估整体股四头肌用力，将三个肌肉的用力值取平均，以减少统计自由度并反映整体用力趋势。最终，使用线性混合模型（LMM）分析不同任务条件和性别对整体股四头肌用力的影响。
    ",0.875,0.9250519997770476,0.5
"
自适应阻抗控制如何实现人机协同中的动态稳定性调节？
","['\nactivity during the  Knee Stability  Knee stability is paramount in enhancing an athlete’s performance and training, minimizing injury potential, or improving a patient’s knee rehabilitation. Normal tibial in- ternal rotation in knee flexion and tibial external rotation in knee extension (i.e., the screw home mechanism) that occurs when the foot is free to move changes during the squat exercise. Instead, the femur tends to rotate externally during knee flexion and internally during knee extension. As the femur externally rotates during the descent, the tibia also attempts to externally rotate. This is supported Costigan and Reid (12), who demonstrated that during the squat the tibia generated an external rotation torque against the ground during knee flexion and an internal rotation torque during knee extension. The flexion, extension, internal rotation, and external rotation knee movements that occur during the squat are supported in part by cruciate and collateral knee ligaments, which help provide knee stability. The ACL and PCL provide anteroposterior knee stability, while the MCL and LCL provide mediolateral knee stability. Knee ligament arthrometers can be employed to quantify anteroposterior  http://www.acsm-msse.org  and mediolateral knee stability by measuring anteroposte- rior and mediolateral tibial translation relative to the femur. This is important because excessive anteroposterior or me- diolateral knee translation measurements may indicate knee instability due to damage to the cruciate or collateral liga- ments. To date, there are seven known studies that examined how the dynamic squat affects anteroposterior or mediolat- eral knee stability (5,10,21,28,37,49,57).\n']","
文献无相关内容。
","
文献无相关内容。参考文本聚焦于膝关节在动态深蹲中的生物力学稳定性，未涉及自适应阻抗控制或其在人机协同中实现动态稳定性调节的方法。
    ",0.0,0.0,1.0
"
文中通过结合健康人体运动学与动力学数据及凸约束优化方法，构建了哪些与步行速度和地面坡度相关的支撑期阻抗模型参数？
","['\n1  eliminated tuning altogether by using able-bodied kinematic data to generate continuous impedance parameter functions this method was limited to the knee of phase. However, joint, did not consider joint kinetics, and was never experi- mentally validated. Recently, [29] proposed a similar variable impedance controller where ankle stiffness and damping were deﬁned as polynomials in phase, and the coefﬁcients deﬁn- ing the polynomials were identiﬁed using constrained least squares with an able-bodied kinematic and kinetic dataset. The authors utilized piecewise-constant equilibrium angles and demonstrated continuous stiffness and damping expressions that produced satisfactory gait with a post-optimization tuning protocol. This work was later extended to include variable inclines and a phase variable parameterization of stiffness and damping based on the phase portrait of the thigh angle and its integral [30]. However, this phase variable is known to have challenges with non-steady walking [33], and changes in impedance associated with walking speed were not considered. The authors of [30] also note that their method of identifying the impedance parameters is non-convex, which does not guarantee a globally optimal solution [34] for their controller. This paper addresses these limitations by presenting a new phase-based, task-adaptive walking controller built on a hy- brid combination of continuously-variable impedance control during stance and kinematic control during swing (Fig. 1). Stance impedance control allows the controller to regulate the dynamic interaction between the user and the ground while swing kinematic control provides the user with indirect volitional control over foot position. We use an able-bodied kinematic and kinetic dataset [21] with constrained convex optimization to create a continuous model of stance joint stiffness, damping, and equilibrium angle, each parameterized by phase, walking speed, and ground incline. Paired with an analogous model of swing joint kinematics, our hybrid controller produces a biomimetic gait across varying tasks based on real-time phase and task estimates.\n']","
文中通过结合健康人体运动学与动力学数据及凸约束优化方法，构建了支撑期关节的刚度、阻尼和平衡角参数，这些参数分别由相位、步行速度和地面坡度进行连续参数化。
","
    文中基于健康人体运动学与动力学数据及凸约束优化方法，构建了作为步态相位、步行速度与地面坡度函数的支撑期阻抗模型参数，包括关节刚度（stiffness）、阻尼（damping）与平衡角（equilibrium angle）。
    ",1.0,0.7160606809261593,1.0
"
TPAD控制器在三个方向上的力控制精度分别达到了什么水平？如何体现其控制性能？
","['\ny F  5  C  0  0  5  10  15 Time (sec)  20  25  )  W B %  10  (  z F  20 0  5  10  15 Time (sec)  20  25  Fig. 7. TPAD controller performance for three force components. (A) Fx in medial- lateral direction satisfies to be within ±1.5% BW. (B) Fy in anterior-posterior di- rection is within ±1.5% BW. (C) Fz in vertical direction is controlled to be at −10% BW.  30  30  Feedback from parents and children involved in this study was con- sistent: They reported improved posture, stronger legs, and faster walking speeds. Our results show that intensive and well-designed paradigms of gait training with robotic devices, such as TPAD, can yield im- provements in gait, as has been postulated in previous studies with CP children (49, 58). Our study confirms these observations, as EMG mag- nitudes and the pattern of muscles improved after 15 sessions of gait training. Future works should investigate more stable and permanent functional recovery through longer interventions.  Fig. 8. TPAD training protocol. Training consists of 15 training sessions over 5 weeks. Pre-evaluation was conducted 1 week before the first session, and post-evaluation was conducted 2 weeks after the last training session. The 16th session was added after the 15th training session to record free walking on the treadmill with the same speed as session 1.  Week 1st  Pre program Evaluation  6 mins Walk - Berg Balance - Time Up and Go  2nd  Session1  Session 2  Session 3  3nd  Session 4  Session 5  Session 6  ∙∙∙ ···  7th  Session 16  8th  Post program Evaluation  6 mins Walk - Berg Balance - Time Up and Go  Pre Training (4 mins)  Training (8 mins)  Training (8 mins)  Post Training (4 mins)  7 of 11  D o w n o a d e d  l  f r o m h t t p : / / r o b o t i c s . s c e n c e m a g . o r g / b y  i  g u e s t  o n  J u y  l  3 0 ,  2 0 1 7\n']","
TPAD控制器在三个方向上的力控制精度分别为：Fx在前后方向满足±1.5% BW，Fy在矢状方向满足±1.5% BW，Fz在垂直方向控制在−10% BW以内。其控制性能通过图7的实验结果验证，表现出良好的力响应精度与稳定性。
","
    TPAD控制器在三个方向上的力控制精度分别为：medial-lateral方向（Fx）±1.5% BW；anterior-posterior方向（Fy）±1.5% BW；vertical方向（Fz）−10% BW。其控制性能通过训练后肌肉活动（EMG magnitudes）和肌肉模式的改善以及用户反馈（改进的姿势、更强的腿部力量和更快的行走速度）得以体现。
    ",0.6666666666666666,0.8806163905885799,0.5
"
该研究在版权许可方面遵循了哪些具体规定？
","['\nConflict of Interest Statement: The authors declare that the research was con- ducted in the absence of any commercial or financial relationships that could be construed as a potential conflict of interest.  Copyright © 2017 Young, Gannon and Ferris. This is an open-access article distrib- uted under the terms of the Creative Commons Attribution License (CC BY). The use, distribution or reproduction in other forums is permitted, provided the original author(s) or licensor are credited and that the original publication in this journal is cited, in accordance with accepted academic practice. No use, distribution or reproduction is permitted which does not comply with these terms.  Frontiers in Bioengineering and Biotechnology | www.frontiersin.org  17  June 2017 | Volume 5 | Article 37\n']","
该研究在版权许可方面遵循了Creative Commons Attribution License (CC BY)协议，允许在遵守引用原始作者和原始出版物的前提下进行使用、分发和再创作。
","
该研究遵循了Creative Commons Attribution License (CC BY)，允许在注明来源和原始出版信息的前提下进行使用、分发或复制，且不允许违反该许可条款的行为。
    ",1.0,0.9519573456656916,1.0
"
文中提到坐站转换过程中的助力水平由实验者手动调节，未来需要根据用户需求进行个性化调整。文中提出了哪两种可能的个性化调整方法？
","['\nThe Utah ExoKnee uses a PID controller with a DOB after [35]. Bench top testing (Fig. 5) show that the performance of the proposed torque controller (i.e., 22.3 Hz -3dB bandwidth) should be sufficient to assist common activities of daily living based on the data in [36], [37]. However, in this paper, we only focused on sit-to-stand transitions, which require high torque and low speed (Fig. 4). Additional experiments should be performed to validate the performance of the torque controller on ambulation activities that require low torque and high speed, such as walking.  C. Limitations  The interaction torque in the X-axis (Tx, parallel to the user’s shank) was not compensated for by a pDOF. Given the symmetric design of the proposed exoskeleton, it should be possible to add a rotational pDOF in the X-axis while still being able to transfer assistive torque in the sagittal plane. This pDOF could be implemented, for example, using a custom curvilinear guide as done in [12], [38]. Further studies are necessary to investigate the viability and effect of adding this additional pDOF.  For the purpose of this study, the peak torque during sit-to- stand transitions was regulated by the experimenter. However, customization of assistance level to the user needs is necessary. Future work should investigate scaling the assistance levels by  2576-3202 (c) 2020 IEEE. Personal use is permitted, but republication/redistribution requires IEEE permission. See http://www.ieee.org/publications_standards/publications/rights/index.html for more information. Authorized licensed use limited to: City College of New York. Downloaded on May 08,2020 at 13:35:23 UTC from IEEE Xplore. Restrictions apply.  10  This article has been accepted for publication in a future issue of this journal, but has not been fully edited. Content may change prior to final publication. Citation information: DOI 10.1109/TMRB.2020.2981951, IEEE Transactions on Medical Robotics and Bionics  > REPLACE THIS LINE WITH YOUR PAPER IDENTIFICATION NUMBER (DOUBLE-CLICK HERE TO EDIT) <  body weight or level of impairment. In addition, in our experiments, the sit-to-stand mode was activated by the experimenter. Although the subject could decide when to stand up, and the sit-to-stand transitions could be performed at subjects self-selected speed, to automatically detect the user’s intention to transition into the sit-to-stand mode, as previously done in powered prostheses [39].  it would be valuable\n']","
文中提出的两种可能的个性化调整方法为：1）根据用户的体重或功能障碍程度调节助力水平；2）通过自动检测用户意图来实现坐站转换的个性化控制。
","
文中提出的两种可能的个性化调整方法是：1）根据用户的体重（body weight）调整助力水平；2）根据用户的损伤程度（level of impairment）调整助力水平。
    ",1.0,0.7612872141029133,0.75
"
文中提到Minghui Zheng的研究兴趣主要包括哪些机器人系统的控制与规划？
","['\nan NIH Director’s Award.  Minghui Zheng (Member, IEEE) received the B.E. degree in engineering mechanics and the M.E. de- greeincontrolscience andengineeringfromBeihang University, Beijing, China, in 2008 and 2011, respec- tively, and the Ph.D. degree in mechanical engineer- ing, in 2017, from University of California, Berkeley, CA, USA.  In 2017, she joined University at Buffalo, Buf- falo, NY, USA, where she is currently an assistant Professor in mechanical and aerospace engineering. Her research interests include learning, planning, and control for multiple robotic systems, such as collaborative manipulators for remanufacturing and drones for disaster resilience.  Dr. Zheng was the recipient of the NSF CAREER Award in 2021.  Authorized licensed use limited to: BEIJING UNIVERSITY OF TECHNOLOGY. Downloaded on December 12,2024 at 09:15:44 UTC from IEEE Xplore. Restrictions apply.  1459\n']","
Minghui Zheng的研究兴趣主要包括协作机械臂和无人机等多机器人系统在控制与规划方面的应用。
","
Minghui Zheng的研究兴趣主要包括协作机械臂和无人机等多机器人系统的控制、规划与学习算法，特别应用于再制造和灾害恢复等场景。
    ",1.0,0.7811964559402506,0.5
"
基于时序信息的意图识别方法在动力型下肢假肢中如何提升模式切换的准确性？
","['\n[6] A.J.Young,A.M.Simon,N.P.Fey,andL.J.Hargrove,“Intentrecognition in a powered lower limb prosthesis using time history information,” Ann. Biomed. Eng., vol. 42, no. 3, pp. 631–641, 2014.  [7] H. A. Varol, F. Sup, and M. Goldfarb, “Multiclass real-time intent recog- nition of a powered lower limb prosthesis,” IEEE Trans. Biomed. Eng., vol. 57, no. 3, pp. 542–551, Mar. 2010.  [8] H. Huang, F. Zhang, L. J. Hargrove, Z. Dou, D. R. Rogers, and K. B. Englehart,“Continuouslocomotion-modeidentiﬁcationforprostheticlegs based on neuromuscular–mechanical fusion,” IEEE Trans. Biomed. Eng., vol. 58, no. 10, pp. 2867–2875, Oct. 2011.  [29] M. D. Zeiler and R. Fergus, “Visualizing and understanding convolutional networks,” in Proc. Eur. Conf. Comput. Vision, 2014, pp. 818–833. [30] M.R.Tuckeretal.,“Controlstrategiesforactivelowerextremityprosthet- ics and orthotics: A review,” J. Neuroengineering Rehabil., vol. 12, no. 1, pp. 1–29, 2015.  [31] K. Englehart and B. Hudgins, “A robust, real-time control scheme for multifunction myoelectric control,” IEEE Trans. Biomed. Eng., vol. 50, no. 7, pp. 848–854, Jul. 2003.  [32] F. Zhang, M. Liu, and H. Huang, “Investigation of timing to switch control mode in powered knee prostheses during task transitions,” PLOS one, vol. 10, no. 7, 2015, Art. no. e0133965.  Authorized licensed use limited to: University of Canberra. Downloaded on July 19,2020 at 14:00:45 UTC from IEEE Xplore. Restrictions apply.  5447\n']","
基于时序信息的意图识别方法通过捕捉动作发生的时序特征和持续时间，提高了动力型下肢假肢在任务切换期间对控制模式的识别能力，从而提升模式切换的准确性和实时响应性能。
","
    基于时序信息的意图识别方法通过引入用户运动过程中的时间序列生理与机械信号，提升动力型下肢假肢在模式切换中的识别准确性。该方法利用历史数据增强对过渡状态的理解，结合神经肌肉与机械信号的融合分析，并优化切换控制模式的时机判断，从而实现更自然、稳定和实时的运动意图识别，显著提高假肢在复杂任务转换中的适应能力与控制性能。
    ",0.5,0.9511653888584308,0.5
"
人体实验中M-TOES控制器在哪些外骨骼配置和任务场景下进行了验证，结果体现出怎样的稳定性与任务不变性？
","['\n30  the active modes in most tasks—VMO, GM, and SOL for treadmill and stairs tasks, and VMO for sit-stand. Fig. 3.3 quantifies this trend for EMG effort and provides intra-subject statistics for the various muscles and tasks.  3.5 Synopsis: Study 2  This study introduced and validated an improved, modular version of the optimized energy-shaping controller framework developed in study 1 above to cater to the different configurations of M- BLUE and other exoskeleton designs. First, we introduced a general-purpose, modular, convex- optimization-based framework for multi-task optimized energy shaping (M-TOES). This frame- work extended our previous optimization framework (in study 1) by adding certain key features of modular energy bases, convex penalties on incorrect torque sign, and unification of stance and swing controllers by use of the vertical GRF. Second, we rigorously analyzed the behavior of the target energy resulting from these controllers, including all possible power leaks due to practical relaxations of the matching conditions (criteria that determine the allowable kinematic inputs to the basis functions) and passivity. Third, we empirically validated the stability, modularity, and task-invariance of the resulting controllers with N = 8 able-bodied participants performing the pri- mary activities of daily life with four different configurations of the M-BLUE system: unilateral hip, bilateral hip, unilateral knee, and bilateral knee. For each modular configuration of the de- vice, the M-TOES controller is optimized across multiple tasks (including multi-speed walking, ramps, stairs, start-stop, and sit-to-stand tasks) from able-bodied datasets [Camargo et al., 2021; Laschowski et al., 2021]. The human subject experiments are detailed below.  3.6 Human Subject Methods: Study 2  In study 2, the M-TOES controller was generalized for different joint modules, and implemented on the M-BLUE exoskeleton system. The experimental methods for validating different configurations with healthy human subjects performing multiple ADLs are presented next.  3.6.1 Hardware Implementation: Study 2\n']","
M-TOES控制器在单侧髋关节、双侧髋关节、单侧膝关节和双侧膝关节四种外骨骼配置下，针对多速步行、斜坡、楼梯、启动-停止和坐-站等任务进行了验证。实验结果显示，控制器在不同任务和外骨骼配置下保持了良好的稳定性，并具备任务不变性，表明其在多种运动模式和外骨骼模块中具有良好的适应性和一致性。
","
    M-TOES控制器在人体实验中于M-BLUE外骨骼系统的四种配置下进行了验证：单侧髋、双侧髋、单侧膝和双侧膝。验证任务涵盖多速度步行、坡道、楼梯、起停及坐站任务等主要日常生活活动（ADLs）。实验结果实证验证了控制器在不同配置与任务下的稳定性、模块性以及任务不变性。
    ",1.0,0.9233296024668318,1.0
"
文中提到的股四头肌腱最大断裂力估计值与髌腱相比如何？
","['\n. The peak quadriceps tendon force observed was the same as the 8,000 N peak force reported by van Eijden et al. (63). How much force the quadriceps tendon can generate before rupture is unclear. However, because Nisell and Ekholm (42) found that the thickness and breadth of the quadriceps tendon to be 35–40% greater than the thickness and breadth of the patellar tendon, it is likely that the ultimate strength of the quadriceps tendon is greater than the 10,000–15,000 N estimate for the ultimate strength of the patellar tendon. The peak posterior shear force reported by Nisell and Ekholm (43) is similar to the peak PCL tensile force calcu- lated by Escamilla et al. (17,18) and Wilk et al. (65) (Table 1), who also used powerlifters as subjects and quantified muscle forces. At approximately 60° knee flexion, the pos- terior shear force changed to an anterior shear force. This force increased fairly linearly throughout the remainder of the ascent. It is interesting that even though tremendous muscle forces were generated in the three subjects due to the large loads lifted, tensile forces in the PCL and ACL were only approximately 50% and 25%, respectively, of the es-\n']","
股四头肌腱的最大断裂力估计值高于髌腱的10,000–15,000 N估计值。
","
文中认为股四头肌腱的断裂力很可能高于髌腱的10,000–15,000 N估计值，依据是其厚度和宽度比髌腱大35–40%，从而推测其具有更高的承载能力。
    ",1.0,0.9800889298851349,1.0
"
文中提到的脑瘫患者步态特征主要存在哪些异常表现？
","['\nIndex Terms—Adaptive control, ankle assistance, cerebral palsy, exoskeleton, metabolic cost of transport, over-ground walking, plantarﬂexion, walking speed, soleus muscle activity.  I. INTRODUCTION  CEREBRAL palsy (CP)  child-onset is neuromuscular disorders and is the most common motor disability in childhood [1]. Individuals with CP have abnormal and inefﬁcient walking patterns [2] that can worsen with age until ambulatory ability is lost [3]. Surgical intervention for pathological walking patterns in individuals with CP, such as tendon lengthening, have proven to be only moderately effective in improving long-term mobility [4], [5]. Ankle- foot-orthoses (AFOs), commonly prescribed for ambulatory children with CP, also only have limited long-term beneﬁts on gait and mobility [6], [7].  a  set of  associated with CP are characterized by signiﬁcantly reduced positive ankle joint power during push-off [8], increased hip and knee joint ﬂexion, and reduced ankle plantarﬂexion and plantar-ﬂexor [9]. These inefﬁcient gait mechanics drastically power decrease walking speed [10], increase the energy cost of walking [11], and reduce levels of physical activity [12]. There is clear need for effective interventions that can improve free-living mobility, walking speed, and efﬁciency.  Pathological  gait  patterns  Powered ankle exoskeletons have demonstrated potential to reduce metabolic cost of transport during controlled treadmill walking. Several studies utilizing different exoskeleton designs during treadmill walking have reduced metabolic cost of trans- port in unimpaired adults [13]–[16]. In a feasibility study with CP participants, powered plantarﬂexion assistance provided by an untethered exoskeleton during treadmill walking improved net metabolic cost of transport in CP participants by 19 ± 5% compared to walking without wearing the device [17].  Manuscript received September 13, 2019; revised November 22, 2019 and December 28, 2019; accepted January 3, 2020. Date of publication January 8, 2020; date of current version February 12, 2020. This work was supported in part by the NSF under Grant 1756029 and in part by the NIH under Grant 1R15HD099664. (Correspondingauthor: ZacharyF.Lerner.)  Greg Orekhov, Ying Fang, and Jason Luque are with the Mechanical Engineering Department, Northern Arizona University, Flagstaff, AZ 86011 USA.\n']","
脑瘫患者的步态特征主要包括：1）推进阶段正踝关节功率显著降低；2）髋关节和膝关节过度屈曲；3）踝关节跖屈能力显著减弱；4）跖屈肌群活动水平降低。这些异常表现为行走速度下降、代谢成本升高和日常活动受限。
","
脑瘫患者的步态特征主要异常表现为：推进阶段踝关节正向动力显著降低、髋关节和膝关节屈曲增加、踝关节跖屈减少及跖屈肌群功能减弱，这些异常导致步行速度降低、能量消耗增加及身体活动水平下降。
    ",1.0,0.9284745636776686,1.0
"
如何通过用户压力中心投影位移触发外骨骼步态周期的切换？
","[""\nin [38], each successive step is initiated by a shift in the loca- tion of the projection of the user's estimated center of pressure (CoP) alongthe groundinthe sagittal plane, relative to the user's forward foot (i.e., when the CoP projection shifts forward to a sufﬁcient extent, the subsequent step will be triggered). When a right step is triggered (i.e., when state 1 is entered), predeter- mined joint angle proﬁles (given in [38]) are used as input in the controlloopsfortherightkneeandhipcontrolloops(forswing), and for the left hip control loop (for stance), while the left knee is locked. Additionally, the most recent right quadriceps stim- ulation proﬁle is used as input to the right knee control loop, and the most recent left hamstrings stimulation proﬁle is used asinputtothelefthipcontrolloop.Once the rightstephasended (i.e., the joint trajectories are complete), the FSM enters state 2, and motors alone are used to hold the double-support posture. When a left step is triggered based on the projected CoP (i.e., when state 3 is entered), the predetermined joint angle proﬁles (given in [38]) are used as input in the control loops for the left knee and hip control loops (for swing), and for the right hip con- trol loop (for stance), while the right knee is locked. Addition- ally, the most recent left quadriceps stimulation proﬁle is used as input to the left knee control loop, and the most recent right hamstrings stimulation proﬁle is used as input to the right hip control loop. Note that in the states for which a given joint does not utilize stimulation, the control structure remains as shown in Fig. 1, with the stimulation proﬁle set to zero (i.e., the controller simply tracks a given trajectory with motors only).  As previously described, upon initiation of walking, the ini- tial ﬁve steps (of each cooperatively-controlled joint) occurred withoutstimulation,andthemeasuredmotortorqueproﬁlefrom each step was averaged to establish a nominal torque proﬁle. Note that the ﬁve-step averaging was implemented to account  459  460  IEEE TRANSACTIONS ON NEURAL SYSTEMS AND REHABILITATION ENGINEERING, VOL. 24, NO. 4, APRIL 2016\n""]","
用户压力中心（CoP）投影位移通过在矢状面内相对于用户前脚向前移动一定距离来触发外骨骼步态周期的切换。当CoP投影达到触发阈值时，系统识别为下一步开始，进而激活相应的控制回路：右步触发时使用右膝和左髋控制回路（摆动期与支撑期），并激活右膝与左髋刺激；左步触发时则激活左膝与右髋控制回路，同时激活相应的刺激。步态切换后，系统根据预设的关节角度轮廓和最新刺激轮廓进行控制，支撑期仅使用电机，摆动期则结合刺激与电机驱动。前五个步未使用刺激，系统通过平均扭矩建立基准，为后续步态周期提供输入。
","
通过检测用户压力中心（CoP）在矢状面地面投影的位移变化，可触发外骨骼步态周期的切换。当CoP前移至特定阈值时，系统识别为步态切换信号，并根据当前步态状态（如右步或左步）选择相应的预定义关节角度轮廓与肌肉刺激信号输入至对应控制回路。在双支撑阶段，仅通过电机维持姿态。初始五步用于建立平均电机扭矩轮廓，以优化后续控制性能。
    ",0.8461538461538461,0.9552681199828622,1.0
"
在楼梯行走任务中，关节角度位移相较于平地行走有哪些显著差异？
","['\nA fundamental consideration, already pointed out in the work of McFadyen and Winter [10] is that the ascending task consists primarily of a transfer of mus- cle energy into potential (gravitation) energy of the body. Our experiment results also showed that muscle activity generally increased with backpack load in- creasing, the RMS of gastrocnemius, tibialis anterior, hamstring and rectus femoris are significantly greater with the maximum loads compared to the no-load condition.  Table 1 showed that the stride time increased with increasing load during stair climbing and level walk- ing. The explanation for this prolonged stance phase might come from the requirement to maintain good body balance. The load carried on the back raised the center of gravity of the locomotor system, thus di- minishing the stability of equilibrium. The subjects were forced to adjust their gait to compensate for this change by lengthening the stance duration (or reduc- ing the swing duration) [6], [8].  joint angular displacements during stair climbing are similar to those reported by Nadeau and Riener et al. [12], [14]. In comparison to level walk- ing, the lower limbs were observed to be more flexed at the beginning of the foot strike and less extension at the hip was observed at toe-off. These observations reflected specific adaptations to the staircase envi- ronment. The knee and hip need to be flexed at foot contact to place the leg on the step. At the end of the stance phase of stair climbing, the hips do not need to extend as much as in level walking because the con- tralateral step length is reduced by the geometry of the staircase, as opposed to level walking where there is no such constraint. As supported by previous studies [14], these differences in the range of motion between stair climbing and level walking may depend of the staircase configuration and subject characteristics. The angular displacements at the hip and knee were simi- lar to those reported in studies using two-dimensional analyses [11].  The\n']","
在楼梯行走任务中，关节角度位移相较于平地行走表现出以下显著差异：1）在脚跟触地时，膝关节和髋关节需要更明显的屈曲以适应台阶结构；2）步态对称性受到楼梯几何约束影响，支撑相末期髋关节的伸展幅度小于平地行走；3）起始阶段下肢整体屈曲更多，膝髋关节的伸展幅度更小；4）这些差异依赖楼梯配置和个体运动特征，表明楼梯行走对下肢关节的运动适应性更强。
","
在楼梯行走任务中，相较于平地行走，髋关节在足接触时表现出更高的屈曲角度，且在支撑阶段末期不需要充分伸展；膝关节同样需要在足接触时保持更大的屈曲角度以适应台阶高度；这些角度位移的变化是由于楼梯几何结构对步态的约束所致。文献未明确提及踝关节角度位移的显著差异。
    ",0.7272727272727273,0.9962226968004144,0.75
"
文中提出的自适应阻抗控制方法如何实现人机协同的稳定性？
","['\n827  Authorized licensed use limited to: City College of New York. Downloaded on January 01,2021 at 16:09:55 UTC from IEEE Xplore. Restrictions apply.  providescorrespondingassistancetorque.2)Velocity-torquecontrolloop:Forthevelocity-torqueloop,thevelocityiscontrolledinsuchawaythatitisinverselyproportionaltotheresistancetorque.Thus,whenthepositionoftheanklejointgetsclosedtotheextremepositionofROM,theincreasingresistanceslowsdownthemotorgraduallyandatthesametimetheinvolvedmuscle-tendonsarestretchedslowlyandsafely.InthemiddleofROMwheretheresistanceisusuallylow,themotorstretchestheslackmusclesathigherspeed.Ifinsomecasestheresistanceishighinthemiddle,themovementwillalsobesloweddownaccordingly.Speciﬁcally,qdandqparetheextremepositionofthejointROMinankledorsiﬂexionandplantarﬂexion,respectively(botharepositivevalues).Inthelow-levelcontrol,whenthepositionq(t)isinthemiddleofROM,themotorvelocityv(t)iscalculatedbyv(t)=8>><>>:vminvt6vminC1+C2\n']","
文中提出的自适应阻抗控制方法通过速度-扭矩环路实现人机协同的稳定性，其核心机制是在关节接近极限运动范围（ROM）时，随着阻力扭矩的增加，电机速度逐渐降低，实现安全、平稳的肌肉-肌腱拉伸；在中段ROM区域则以较高速度响应，确保高效运动；若出现异常高阻力，系统自动降低运动速度，防止协同性下降或运动受限，从而实现动态适应与稳定协同。
","
    文中提出的自适应阻抗控制方法通过速度-扭矩控制环实现人机协同的稳定性，具体机制为：将电机速度控制为与阻力扭矩成反比，当踝关节接近ROM极限位置或检测到高阻力时自动降低速度，从而平稳拉伸肌肉-肌腱系统；同时根据关节位置动态调整速度函数v(t)，确保在不同运动阶段维持人机交互的稳定性和安全性。
    ",0.5,0.9218886017919546,1.0
"
Smart Crutch 相较于传统 Forearm Crutch 在人机交互稳定性方面有哪些技术改进？
","['\nemail: whliao@cuhk.edu.hk) are with the Department of Mechanical and Automation Engineering, The Chinese University of Hong Kong, Shatin, Hong Kong, China. F. Y. Liang is with the Department of Biomedical Engineering, The Chinese University of Hong Kong, Shatin, Hong Kong, China.  Proceedings of the 2019 IEEE/ASME International Conference on Advanced Intelligent Mechatronics Hong Kong, China, July 8-12, 2019  612 Authorized licensed use limited to: BEIJING UNIVERSITY OF TECHNOLOGY. Downloaded on December 09,2024 at 08:31:21 UTC from IEEE Xplore. Restrictions apply.  978-1-7281-2493-3/19/$31.00 ©2019 IEEE  2  BackpackHip ActuatorKnee ActuatorPassive AnkleSmart Crutch  Hip actuatorKnee actuatorPassive ankleForearm crutch Blue tooth moduleIMUFSRMotion mode control buttonBackpackBatteryControllerMotor driver  _swK\uf071tlslFlanlSLSH  Hip jointKnee joint  Floor/i-1thstair  ithstair(i+1)thstair\n']","
文献无相关内容，无法确认Smart Crutch相较于传统Forearm Crutch在人机交互稳定性方面的具体技术改进。
","
    Smart Crutch 在人机交互稳定性方面的主要技术改进包括集成 IMU 和 FSR 传感器以提升姿态感知能力，并通过蓝牙模块实现与控制器的实时通信，从而动态调整运动模式。然而，文献未提供关于其在稳定性控制算法或实验验证方面的具体内容。
    ",0.0,0.0,0.0
"
该外骨骼系统如何实现针对不同用户的步态个性化适应？
","['\nThis work involved human subjects or animals in its research. Ap- proval of all ethical and experimental procedures and protocols was granted by Beihang University, and performed in line with the Declaration of Helsinki.  Wen Duan, Jingmeng Liu, and Zhongcai Pei are with the School of Automation Science and Electrical Engineering, Beihang University, Beijing 100191, China, and also with Hangzhou Innovation Institute, Beihang University, Hangzhou, Zhejiang 310051, China (e-mail: duan- wen@buaa.edu.cn; ljm@buaa.edu.cn; peizc@buaa.edu.cn).  Weihai Chen is with the School of Electrical Engineering and Automation, Anhui University, Hefei, Anhui 230601, China (e-mail: whchen@buaa.edu.cn).  Jianhua Wang is with the Hangzhou Innovation Institute, Beihang University, Hangzhou, Zhejiang 310051, China, and also with the School of Automation Science and Electrical Engineering, Beihang University, Beijing 100191, China (e-mail: jhwangbuaa@126.com).  Jianer Chen is with the Department of Geriatric Rehabilitation, The Third Afﬁliated Hospital of Zhejiang Chinese Medical University, Hangzhou, Zhejiang 310052, China (e-mail: chenje@zcmu.edu.cn).  control system. The results indicated that our system can overcome the limitations of ﬁxed training modes in bench-type lower limb exoskeletons and can adapt to the unique gait characteristics of various users, thereby facilitating gait customization.  lower limb exoskeleton, optimal control, speed change, walking gait.  Index Terms—Central pattern generator (CPG),  I. INTRODUCTION  L OWER limb exoskeleton has attracted signiﬁcant research\n']","
该外骨骼系统通过采用最优控制策略和步态特征识别技术，实现对不同用户步态的个性化适应。系统能够识别用户的独特步态特性，并据此调整控制参数，从而克服固定训练模式的局限性，实现个性化辅助。
","
    该外骨骼系统通过其适应性控制能力实现对不同用户步态的个性化适应，能够克服传统固定训练模式的局限性，从而支持针对个体步态特征的定制化控制。文献未具体描述实现该适应性的技术细节。
    ",1.0,0.996372179979883,0.5
"
如何通过自适应阻抗控制实现外骨骼系统中人机协同的稳定性？
","['\ning exercise for the treatment of crouch gait (39); TPAD training with downward pelvic pull could be a promising intervention for these children.  After training, children presented increased extension of the knee and plantar flexion of the ankle. This is explained by the increased activity of the soleus muscle, which prevents the progression of the tibia during the stance and allows the knees to extend due to momen- tum of the center of mass. The improved timing of the gastrocnemius also contributed to knee extension, because the gastrocnemius acti- vated less during the early stance phase to prevent knee flexion of the crouch gait. Improved muscle activation of soleus and gastrocnemius also increased the plantar flexion of the ankle during the push-off phase. However, hip extension cannot be directly explained by those two muscles. Hip extension can increase due to activation of the muscles that were not measured in the present study, such as gluteus maximus, adductor magnus, semimembranosus, and semitendinosus. Another possible explanation is that the changed posture of the knee and ankle enabled the hip to extend more easily. In crouch gait, the hip requires larger torque for extension because the knee is leaning forward, and the body weight vector creates a larger moment arm to flex the hip (9).  C  B1  ri  Bm  ˆ ,l T 1 1  Bi  ˆ ,ml Tm  We  ˆ ,il Ti  P1  . . .  Pi  . . .  Pm  Pi : attachment point of ith cable on the frame : attachment point of ith cable on the pelvis Bi ˆ li : unit cable length vector ri : vector from point C to ith cable on the pelvis Ti We C : point of action of wrench  : tension of ith cable : external wrench  Fig. 5. Cable-driven system diagram for structure matrix. The TPAD is a cable-driven parallel system with m actuated cables connected to the participant’s pelvis having n = 6 DOFs. One end of each cable is attached to the pelvis, and the other end is attached to an electrical motor, shown as points Bi and Pi, respectively. These cables together exert an external wrench, We, on the pelvis.\n']","
文献无相关内容，无法基于其推导自适应阻抗控制实现外骨骼系统中人机协同稳定性的具体方法。
","
    文献无相关内容。
    ",0.0,0.0,1.0
"
文中通过添加不同传感器输入对深度学习模型进行了优化，其在髋关节和膝关节的RMSE统计结果分别是什么？并指出任务类型（周期性与非周期性）对模型性能的影响。
","[""\n( 1 )  III. RESULTS  Our two-way ANOVA across sensor additions and task types (with subjects as a fixed effect) revealed statistically significant decreases in RMSE from adding different sensor inputs in the deep learning model for both the hip (F=91.70, dfM=3, dfE=33, p < 0.01) and knee (F=204.64, dfM=3, dfE=33, p < 0.01). It also revealed a statistically significant difference between cyclic and non-cyclic tasks at both the hip (F=32.49, dfM=1, dfE=11, p < 0.01) and knee (F=34.51, dfM=1, dfE=11, p < 0.01) and a significant interaction effect between sensors and task type at both the hip (F=45.43, dfM=3, dfE=33, p < 0.01) and knee (F=16.49, dfM=3, dfE=33, p < 0.01). Because of these significant effects, we further explored these differences with simple main effects ANOVAs across sensor additions for different task types (all, cyclic, and non-cyclic) each of which showed statistical significance at both the hip and knee (p < 0.01). These were followed up by pairwise multiple comparisons tests as shown in Fig. 4a&b. When comparing results across all tasks, the models with EMG (Hip RMSE: 0.233 Nm/kg, Knee RMSE: 0.154 Nm/kg), simulated insoles  Authorized licensed use limited to: BEIJING UNIVERSITY OF TECHNOLOGY. Downloaded on July 02,2024 at 03:55:35 UTC from IEEE Xplore. Restrictions apply.  © 2024 IEEE. Personal use is permitted, but republication/redistribution requires IEEE permission.  See https://www.ieee.org/publications/rights/index.html for more information.  5  This article has been accepted for publication in IEEE Transactions on Biomedical Engineering. This is the author's version which has not been fully edited and  content may change prior to final publication. Citation information: DOI 10.1109/TBME.2024.3388874  TBME-00180-2024  Fig. 5. Results broken down by task groups for the hip (a) and the knee (b). This is shown based on the performance for each left out task from a model trained on the other tasks. Lines above the bars show the standard deviation across the 12 subjects. Statistically significant comparisons as determined by controlling the false rate of discovery are indicated with colored bars above each task.\n""]","
文中通过添加不同传感器输入优化了深度学习模型，在髋关节和膝关节的RMSE统计结果分别为0.233 Nm/kg和0.154 Nm/kg。任务类型（周期性与非周期性）对模型性能具有显著影响，两者之间存在显著差异（F值均小于0.01）。此外，传感器输入与任务类型之间也表现出显著交互效应（F值均小于0.01），说明任务类型不仅影响模型性能，还影响传感器输入对模型性能的贡献。
","
添加不同传感器输入后，髋关节和膝关节的RMSE统计结果分别为0.233 Nm/kg（髋）和0.154 Nm/kg（膝）。任务类型（周期性与非周期性）对模型性能具有显著影响（p < 0.01），且传感器输入与任务类型之间存在显著交互效应，表明模型在周期性和非周期性任务中的表现存在差异。
    ",0.7142857142857143,0.6930186095220497,1.0
"
在存在重力的情况下，外骨骼的运动平面约束如何影响股四头肌的EMG活动？
","['\n1 34μV 202% 80%  2 32μV 186% 51%  3 66μV 41 % 32%  configuration in the presence of gravity). As such, it is hypothesized that a portion of the elevated EMG seen in the gravity compensation experiment was due to the (sagittal plane) constraints on motion imposed by the exoskeleton. Specifically, slight changes in the plane of movement may increase the level of muscular co-contraction required to flex the hip joint, and therefore the presence of the exoskeleton may slightly increase quadriceps EMG during hip flexion due to secondary factors. Although the exoskeleton is easily capable of providing additional gravity compensation (which can offset the increase in EMG), the authors chose instead to maintain the level of gravity compensation that is appropriate in the absence of a subject, and thus used the settings indicated in Fig. 4 (and Table I) in the level walking experiments described subsequently. B. Inertia and Friction Compensation In order to reduce the effects of added inertia, hip and knee joint torques are supplemented in proportion to the respective angular acceleration of the joint,  ( ) (2) where θ is the angular position of that joint, and where the constant of proportionality (i.e., the effective rotational inertia) was determined experimentally by iteratively increasing the value. In order to reduce the effects of added friction, hip and knee joint torques are supplemented in proportion to the respective angular velocity of the joint,  ( ) (3) where the constant of proportionality (i.e., the damping coefficient) was determined experimentally by iteratively increasing the value. The total passive dynamics compensation therefore consists of the application of equation 1 at the hip joints, and the sum of equations 2 and 3 at the knee joint.  1914\n']","
在外骨骼存在重力的情况下，其运动平面约束可能通过增加髋关节屈曲所需的肌肉协同收缩来影响股四头肌的EMG活动。尽管外骨骼具备提供额外重力补偿的能力，但其对运动平面的限制可能仍导致股四头肌EMG的轻微升高，这种效应在实验中被观察到。
","
在存在重力的情况下，外骨骼的矢状面运动平面约束增加了髋关节屈曲时所需的肌肉共激活水平，从而间接提高了股四头肌的EMG活动。尽管外骨骼可提供额外重力补偿以抵消该效应，但实验中维持了无受试者状态下的补偿水平，导致该EMG增强效应未被消除。
    ",0.75,0.9919580022894112,1.0
"
在步态活动转换评估中，PV+CS分类方法相较于LDA和PV单独使用有哪些性能优势？
","['\nIf the switching sensitivity gain as described in (7) is too high, the classifier may be resistant to switching states in order to classify a new activity. If this gain is too low, the confidence- based switching will provide no additional benefit over the phase variable approach alone. The switching sensitivity gain was chosen by tuning the gain in order to maximize the classification accuracy on a single subject using subject- specific training data. This gain value was then used in all other applications of the hysteretic switching algorithm. To assess the activity switching aspect of the proposed algorithm, gait activity transitions were simulated by concatenating gait data from steady state activities into a single set of data. All six possible transitions between the three gait activities (see Fig. 3) were simulated in this way and the strides were classified by all three classification algorithms: linear discriminant analysis (LDA), the phase variable classifier (PV), and the phase variable classifier supplemented with the confidence-based switching (PV+CS). Gait transition data was classified using subject-specific training data and non-subject-specific training data via the previously described method of leave-one-out cross validation.  IV. RESULTS  Although each element in the classification vector nominally corresponds to the RMS of the divergence rate over an entire stride, the classification vectors for the thigh input were calculated using only the final 75% (i.e., 0.25 ≤ 𝑝 ≤ 1.0) of the stride (i.e., the first 25% of each stride was excluded from consideration in all activities due to the relatively large inter- stride variability observed in the thigh input). If not excluded, the high variability in thigh motion specifically associated with the beginning of stair ascent would negatively affect classifier accuracy, which depends on gait consistency. Following computation of the respective classification vectors, the accuracy of the classifier was assessed by calculating the percentage of accurately classified strides for each individual gait activity. In each case, the stride was classified in the class corresponding to the smallest element in the classification vector. In all accuracy calculations, all walking data was considered regardless of cadence to determine if the approach is robust to variations in step frequency.\n']","
PV+CS相较于LDA和PV在步态活动转换评估中展现出更高的个体适应性，因其分类器的切换敏感度增益经过调参以最大化单个受试者的分类准确率。然而，文献未提供具体性能对比数据，仅指出其在个体适应性方面优于PV单独使用。
","
在步态活动转换评估中，PV+CS分类方法相较于LDA和PV单独使用具备更高的分类稳定性与准确性。其优势体现在：1）通过引入基于置信度的切换机制，提升了在活动转换时的分类鲁棒性；2）在面对步态起始阶段高变异性（如楼梯上升初期）时，相较于PV单独使用，PV+CS能更有效地避免误分类；3）相比LDA，PV+CS结合了相位变量动态特征与置信度反馈，更适用于动态步态转换场景。文献中通过模拟六种步态转换并比较三种方法的分类性能验证了该优势。
    ",0.5,0.9491911065682772,0.5
"
自对准外骨骼设计中的伪力和力矩是如何受关节轴线不对准影响的？实验数据如何支持这一结论？
","['\nThe goal of the pDOFs is to prevent the spurious forces and torques on the user’s limb that can result from misalignments. the proposed self-aligning We hypothesized exoskeleton, misalignments between the exoskeleton joint axes will not result in an increase of spurious forces and torques on the user. To test this hypothesis, we have measured the interaction forces between the exoskeleton and the user across different alignment and assistance conditions. The analysis of the interaction forces (Fig. 11 and Fig. 13) shows that the spurious forces (Fx and Fy) and torques (Tx, Ty, Tz) were not visibly affected by the assistance level. On the other hand, Fz increased with the level of assistance. This result is not surprising given that Fz is roughly perpendicular to the user shank, and, therefore, it is not a spurious load. Relatively large standard deviations were observed in measured interaction forces (Fig. 11). The large standard deviation in Fz is likely due to inter-subject variability in sit-to-stand timing as our controller allows the subjects to stand up at their preferred speed. The standard deviations in all other forces and torques, are large relative to the value of the mean because the measured values themselves are small. The linear regression analysis showed that no forces or torques other than Fz were significantly correlated to the assistive joint torque. The measured peaks of the spurious forces and torques were 5 N and 0.5 Nm, respectively (Fig. 11). To put these numbers in perspective, a previous study [11] testing similar misalignment conditions using a powered exoskeleton with no self-aligning mechanism showed spurious forces and torques up to 50 N and 10 Nm, respectively. Thus, the analysis of the interaction forces and torques supports our hypothesis.  that,  in  the user and  B. Design and Control  The pDOFs in a self-aligning mechanism should be designed to work smoothly under the high load generated by the actuation system during assistance. The pDOFs should also be lightweight and unobtrusive, as adding significant weight or dimension to the exoskeleton may negate its assistive function [30]. The proposed design includes two pDOFs in the Sagittal\n']","
自对准外骨骼设计中的伪力（spurious forces）和伪力矩（spurious torques）在关节轴线不对准时并未显著增加，实验数据显示这些伪力和伪力矩在辅助水平变化下保持稳定，最大值仅为5 N和0.5 Nm。Fz（垂直方向力）因与用户胫骨方向一致，未被归类为伪载荷，且其变化与辅助水平相关，但文献指出该方向不被视为伪力或伪力矩。实验还通过线性回归分析验证，除Fz外，其他力和力矩均与辅助关节力矩无关，进一步支持了伪力和伪力矩受关节轴线不对准影响较小的结论。
","
    自对准外骨骼设计中的伪力（Fx、Fy）和力矩（Tx、Ty、Tz）在关节轴线不对准的情况下未显著增加，实验数据显示其峰值分别为5 N和0.5 Nm，远低于无自对准机制的外骨骼（50 N和10 Nm）。Fz方向的力随辅助力度增加而增加，但属于预期的支撑力而非伪力。线性回归分析显示除Fz外，其他力和力矩与辅助关节力矩无显著相关性，支持自对准机制有效降低伪力和力矩的结论。
    ",0.875,0.9282650342236458,1.0
"
尽管实验对象产生了巨大的肌肉力，为何前交叉韧带（ACL）和后交叉韧带（PCL）的张力仅分别为其估计极限强度的25%和50%？
","['\n. The peak quadriceps tendon force observed was the same as the 8,000 N peak force reported by van Eijden et al. (63). How much force the quadriceps tendon can generate before rupture is unclear. However, because Nisell and Ekholm (42) found that the thickness and breadth of the quadriceps tendon to be 35–40% greater than the thickness and breadth of the patellar tendon, it is likely that the ultimate strength of the quadriceps tendon is greater than the 10,000–15,000 N estimate for the ultimate strength of the patellar tendon. The peak posterior shear force reported by Nisell and Ekholm (43) is similar to the peak PCL tensile force calcu- lated by Escamilla et al. (17,18) and Wilk et al. (65) (Table 1), who also used powerlifters as subjects and quantified muscle forces. At approximately 60° knee flexion, the pos- terior shear force changed to an anterior shear force. This force increased fairly linearly throughout the remainder of the ascent. It is interesting that even though tremendous muscle forces were generated in the three subjects due to the large loads lifted, tensile forces in the PCL and ACL were only approximately 50% and 25%, respectively, of the es-\n']","
尽管实验对象产生了巨大的肌肉力，ACL和PCL的张力仅分别为其估计极限强度的25%和50%，因为韧带主要承受剪切力而非直接的肌肉拉力，且其受力机制在膝关节伸展过程中呈现线性增加趋势，从而限制了其达到极限强度的能力。
","
尽管实验对象产生了巨大的肌肉力，ACL和PCL的张力分别仅为估计极限强度的25%和50%，这可能归因于膝关节肌肉-韧带系统的力学分布特性及肌肉协同作用对韧带的保护机制。实验数据显示，股四头肌腱可能具有较高的极限强度，而PCL和ACL所承受的张力受膝关节角度变化和肌肉力动态分布的影响，从而未达到其断裂阈值。
    ",0.5,0.8211019214451508,0.5
"
生成的关节轨迹在楼梯运动的不同阶段表现出哪些运动学特征？
","['\nFC 1 PS 1 SW 2 SW 3 FC 2  stairs ascent type A  FC 2 PS 2 SW 1 SW 2 SW 3 FC 2  stairs ascent type B  FC 2 PS 2 SW 1 SW 2 FC 1  stand-to- stairs decent transition  FC 1 PS 1 SW 4 FC 3 FC 4  stairs decent motion  FC 4 PS 3 SW 4 FC1  613 Authorized licensed use limited to: BEIJING UNIVERSITY OF TECHNOLOGY. Downloaded on December 09,2024 at 08:31:21 UTC from IEEE Xplore. Restrictions apply.  stair dimensions can vary in both indoor and outdoor environments in the real word. In order to enable the exoskeleton adapt to various stairs, multiple sensors for detecting dimensions and motion adaption strategy are developed.  Motion percentage (%)Joint Angle (degree)Horizontal axis (cm)Vertical axis (cm) (a)  Motion percentage (%)Joint Angle (degree)Horizontal axis (cm)Vertical axis (cm)  Knee-stance  Knee-swingHip-stanceHip-swing  (b)  Motion percentage (%)Joint Angle (degree)Horizontal axis (cm)Vertical axis (cm) (c)  Motion percentage (%)Joint Angle (degree)Horizontal axis (cm)Vertical axis (cm)(d)  Motion percentage (%)Joint Angle (degree)Horizontal axis (cm)Vertical axis (cm)(e) Fig. 2 Generated joint trajectories and lower limb movement stick figures (a) stand-to-upstairs; (b) stairs ascent type A; (c) stairs ascent type B; (d) stand-to-stairs decent; (e) stair descent Table III. Dimensions for simulation Human limb Foot lF Shank ls Thigh lt Stair length (SL) Stair height (SH)  Length (cm) 28 38.5 38.5 28 12\n']","
楼梯运动的不同阶段表现出膝关节和髋关节的周期性屈伸运动，并在楼梯高度（SH）和长度（SL）影响下，在水平和垂直轴上呈现动态调整。stairs ascent type A 和 B 的关节轨迹显示出相似的膝-髋关节阶段性运动模式，而 stairs decent 阶段则通过 stand-to-stairs decent 和 stair descent 分阶段表现下肢运动轨迹的变化。
","
    在楼梯运动的不同阶段，生成的关节轨迹表现出以下运动学特征：在stand-to-upstairs阶段，膝关节和髋关节在支撑相和摆动相呈现角度变化，伴随水平与垂直位移；在stairs ascent type A和type B中，膝关节和髋关节在支撑与摆动阶段的角度变化趋势存在差异，且运动百分比与位移相关；在stand-to-stairs decent阶段，关节角度随运动阶段变化并伴随空间位移；在stair descent阶段，膝髋关节角度变化与下肢位移特征同步。文献未提供角速度、角加速度等动力学参数及具体数值。
    ",0.8,0.8049601757725164,0.5
"
缺少踝关节主动自由度的外骨骼系统为何难以实现重心自动转移？
","['\nAuthorized licensed use limited to: BEIJING UNIVERSITY OF TECHNOLOGY. Downloaded on December 02,2024 at 08:02:19 UTC from IEEE Xplore. Restrictions apply.  10099  10100  IEEE ROBOTICS AND AUTOMATION LETTERS, VOL. 9, NO. 11, NOVEMBER 2024  t = tb, tb is a custom-deﬁned parameter that can be adjusted empirically to modify the path shape.  In this case, the control point Pcs is deﬁne as:  Fig. 3(a.1) and (a.2) illustrate the stick ﬁgures depicting the generated lower limb movement in IS and RS, respectively. Due to the variation in the starting position of the swing foot between these two transitions, the resulting trajectory exhibits a slight difference.  Pcs =  0 0 0 1  P0 +  1 0 0 0  P1  where P0, P1 are the start and end positions of the swing foot.  The stick ﬁgures are shown in Fig. 3(d).  2) COG Forward Transfer Gait Planning: In (HM (SS−→PL), the human-exoskeleton system transfers the COG forward and shifts the support from the posterior foot to the anterior foot. Although the upper body tilts forward with sup- porting crutches, the COG cannot be shifted automatically from one foot to another without the help of an exoskeleton. The reasons are that the exoskeleton may have an uncoordinated weight ratio and lack active DOFs in the ankle joints [12]. The taskisaccomplishedbyplanningakneeﬂexiontodrivetheCOG forward and ensure its position and velocity satisfy the inverted pendulum’s orbital energy [21]. According to the inverted pendulum model and the law of  2) COG Forward Transfer Gait Planning: In (HM (SS−→PL), the human-exoskeleton system transfers the COG forward and shifts the support from the posterior foot to the anterior foot. Although the upper body tilts forward with sup- porting crutches, the COG cannot be shifted automatically from one foot to another without the help of an exoskeleton. The reasons are that the exoskeleton may have an uncoordinated weight ratio and lack active DOFs in the ankle joints [12]. The taskisaccomplishedbyplanningakneeﬂexiontodrivetheCOG forward and ensure its position and velocity satisfy the inverted pendulum’s orbital energy [21]. (2)\n']","
缺少踝关节主动自由度的外骨骼系统难以实现重心自动转移，因为其缺乏协调足部之间重量分配的主动控制能力，导致重心转移过程受限，无法满足倒立摆模型的能量需求，从而无法实现足间重心的动态转移。
","
    缺少踝关节主动自由度的外骨骼系统难以实现重心自动转移，主要原因是其无法协调支撑转换过程中的重量分布与地面反作用力调控，导致COG无法在双足之间自然转移。文献指出，踝关节自由度的缺失需通过膝关节屈曲策略来补偿，但该方法无法实现与自然步态相当的自动重心转移效果。
    ",1.0,0.997382055802165,0.75
"
S-Assist采用钢缆驱动的下肢关节在刚度特性上达到了怎样的性能指标？
","['\nThe proposed ADP mechanism extends the RCM charac- teristic not only to the parallelogram structure, but also to the general tetragonal structure. Using this tetragon’s char- acteristics, we can remove the symmetrical constraint of a general double parallelogram. As shown in Fig. 6(b), based on the ADP mechanism, we designed the coaxial internal RCM axis for the inversion/eversion joint while minimizing its bulge height.  C. Tendon-Driven Remote Actuation  Four active joints (one hip ﬂexion/extension and one knee ﬂexion/extension joint per leg) are remotely controlled by tendon-driven actuators. This enables the proposed S-Assist to tightly ﬁt so that the it can be worn under clothing. Instead of mounting each actuator beside the wearer’s lower limb joint as in conventional exoskeletons, the actuators are packed inside a backpack. Compared to direct-driven actuation, including a motor/reducer at each joint, the lower limb of the S-Assist can be designed to be slimmer and more compact in the proposed design.  Tendon-driven actuation provides several advantages, in- cluding low mass/inertia, and stiff transmission via arbitrarily ﬂexible and complex pathways. The joints of the S-Assist are actuated by highly efﬁcient and back-drivable ball-screw linear actuators (Fig. 7(a)), which give the wearer natural inertia for the lower limb without adding considerable impedance. By using a steel cable (2096 by Carl Stahl SAVA Industries, Inc.) of diameter 2.4mm, the joint stiffness of the hip can be increased up to 233Nm/rad, which is sufﬁcient for human- robot interaction devices.  A Maxon EC-4 pole 90W brushless motor (36V) along with a 190:1 reducer consisting of a timing pulley and a linear ball screw are attached to the actuator pack. The ball screw translates the rotational motion into a linear movement. The actuator is designed for a linear stroke of 85mm and a maximum pulling force of 750N to satisfy its ROM and maximum torque. These values are based on the moment arm of the corresponding joint, desired joint ranges, torques, and velocities listed in Table II. The volume of the whole actuator package is about 230mm×240mm×40mm, and it totally weighs 2.4kg.  The operation of the proposed ADP can be explained by  1083-4435 (c) 2016 IEEE. Personal use is permitted, but republication/redistribution requires IEEE permission. See http://www.ieee.org/publications_standards/publications/rights/index.html for more information.  6\n']","
S-Assist采用钢缆驱动的髋关节在刚度特性上达到了233 Nm/rad的性能指标，满足人机交互设备的要求。
","
S-Assist通过钢缆驱动方式实现了髋关节的刚度性能指标达到233Nm/rad，该指标足以满足人机交互设备的需求；文献中未提供膝关节或其他关节的刚度数值。
    ",1.0,0.8363044889346135,1.0
"
实验中如何验证RARS-CP系统的透明模式控制性能？
","['\nFig.4.ThecustomizedroboticgamedesignedfortheRARS-CPsystem:KungFuPanda.Thehorizontalpositionofpandaismappedtotheanglejoint.Thefootballdroppedinpredeﬁnedpositionandwhenthepandaalignswiththeball,pandaareheadingtheballtothesky.IV.EXPERIMENTSANDRESULTSTheusabilityofthesystemwasassessedthroughanexperimentalcharacterizationoftheRARS-CPinsubsectionA,BandCwherewetestedthelow-levelcontrol.Thereinto,ahealthsubject(Height:153cm,Weight:33kg,Age:11-year-old,Male)participatedtheexperimentforthecontrollertuning.Preliminaryvalidationofthehigh-levelcontrollayerwascarriedoutthroughthetreatingofaCPchildpatientwithanklespasticity(Height:123cm,Weight:23kg,Age:8-year-old,Male).Hereceiveapassivestretchingtreatmentandagame-basedtrainingandtheresultspresentedinsubsectionDandE.A.TorquecontrolTransparentmode(zerotorquecontrol)isemployedinthisexperiment.Foraclosed-loopsystem,thebandwidthreﬂectsthespeedofsystemresponse.Thehealthsubjectwasaskedtopullandpullthefootplaterepetitivelyfromalittlerangetoalargerangeandfromalowspeedtoahighspeedgradually.Thechangesofjointangle(top)andtheangularvelocity(middle)arepresentedintheFig.5.Atypicalproﬁleoftheinteractiontorquefeltbythesubject  828  Authorized licensed use limited to: City College of New York. Downloaded on January 01,2021 at 16:09:55 UTC from IEEE Xplore. Restrictions apply.  0  2  4  6  8  10  12  14  16  18  20  −50  0  50  Angle(Deg)  Joint Angle (Raw)  Filtered  0  2  4  6  8  10  12  14  16  18  20  −500  0  500  Velocity(deg/s)  Joint velocity  0  2  4  6  8  10  12  14  16  18  20  −3  0  3  Time(Second)Torque(Nm)  Joint Torque (Raw)  Filtered\n']","
实验通过在透明模式下进行闭环控制验证，通过调节足部平台的拉力范围和速度，并采集关节角度、角速度及交互扭矩数据，分析系统带宽与响应性能，从而评估RARS-CP系统在零扭矩控制下的控制性能。
","
    在实验中，RARS-CP系统的透明模式控制性能通过健康受试者反复拉动脚踏板的动作进行验证，系统采集关节角度、角速度与交互力矩数据，以评估其在低交互力下动态响应能力与控制精度。
    ",1.0,0.7937977223618221,0.5
"
腓肠肌在深蹲动作的下降和上升阶段分别起到什么力学作用，其活动如何影响股四头肌的发力需求？
","['\n134  Official Journal of the American College of Sports Medicine  greater hip extensor torque and less knee extensor torque compared with the high-bar squat. Mean peak knee extensor torques are typically between 100 and 300 Nzm during the barbell squat (3,17,30,36,43,58,66,68,69). Because these torques are resultant (i.e., net) torques, they represent the sum of all flexor and extensor knee torques. For example, a 500-Nzm extensor torque and a 300-Nzm flexor torque yield a 200-Nzm resultant torque. Hence, it cannot be deduced that lower knee extensor torque equates to less quadriceps force being produced in the powerlifters, although it is enticing to do so. Less quadriceps force would indeed explain why peak patellofemoral compressive force was less in powerlifters, because quadriceps tendon force and patellar tendon force would also be less. However, EMG data from Wretenberg et al. (68) show greater quadriceps and hamstring activity in the low-bar squat compared to the high-bar squat. Because the hamstrings produce a knee flexor torque, a greater knee extensor torque would be needed. Hence, greater quadriceps force would be needed to generate this force. In addition, gastrocnemius force can also cause the quadriceps to gen- erate more force during the squat, because the gastrocne- mius also generates a knee flexor torque by their duel role as knee flexors and ankle plantar flexors. Moderate gastroc- nemius activity has been observed during the squat (13,17,18), which is needed during the squat to control ankle dorsiflexion during the descent and cause ankle plantar flexion during the ascent.\n']","
腓肠肌在深蹲动作的下降阶段主要作为膝关节屈肌，控制踝关节 dorsiflexion，防止膝关节过度屈曲；在上升阶段则通过与胫骨前肌协同作用，产生膝关节屈曲力矩。其活动水平在下降阶段有助于控制下肢运动范围，上升阶段则促进膝关节伸展。腓肠肌的力学作用间接影响膝关节负荷，进而可能在一定程度上影响股四头肌在上升阶段的发力需求。
","
    腓肠肌在深蹲下降阶段通过其膝屈作用增加股四头肌的发力需求以维持膝伸稳定，同时控制踝背屈；在上升阶段通过踝跖屈促进身体上升，但仍需股四头肌提供额外膝伸扭矩以抵消腓肠肌的膝屈作用。因此，腓肠肌的活动在两个阶段均提高了股四头肌的发力需求。
    ",0.625,0.7748394544683842,0.5
"
MBLUE外骨骼相较于早期外骨骼（如Comex 1和Comex 2）在机械设计和背驱性能方面有哪些改进？这些改进对实现部分助力控制有何意义？
","['\n6-5-4-3-2-10123Frontal shank angle (o) Exo  020406080100Level walking gait cycle (%)  Figure 6.8: MS frontal global shank angles for bare and exo conditions. The figure shows the ensemble averaged frontal plane global shank angle profiles for bare and exo conditions (adduction angles are positive) for the left (highly impaired) leg.  92  CHAPTER 7  Conclusions and Future Work  The focus of this dissertation is on the control and pre-clinical validation of lower-limb partial assist exoskeletons, i.e., developing and assessing assistance schemes applicable to improving mo- bility in broad populations that retain a certain level of voluntary motion. More specifically, the dissertation’s goal was twofold and constituted: 1) designing an intuitive, and customizable “task- invariant” controller for lower limb backdrivable exoskeletons to assist both healthy and impaired users over multiple terrain in multiple activities; and 2) performing pre-clinical in-vivo experi- ments designed to investigate the effect of this partial assistance scheme on critical, multifaceted human variables.  The primary justification for this goal arose from both mechanical, and controls related gaps in the state-of-the-art lower limb robotic assistance technologies for individuals with remnant vol- untary ability. Mainly, this group of individuals requires control schemes that command assistive torques based on live kinematic feedback of their limbs; and thereby require a mechanical actuation system that least impedes this voluntary motion. However, at the start of my dissertation several years ago, partial assistance exoskeleton technology was in an early transition phase from a dis- tinctly different exoskeleton class—bulky, powerful exoskeletons with highly geared (and thereby stiff) actuators for “driving” the limbs of paralyzed individuals with negligible voluntary force pro- duction capability [van Kammen et al., 2020]. Accordingly, my research lab progressed through three major versions of exoskeletons (Comex 1, Comex 2, and MBLUE), with each subsequent version being lighter and more backdrivable. In order to address the first part of the goal, it was important to firstly assess the existing partial assist controllers on available hardware (related to the second part of the goal).\n']","
MBLUE外骨骼相较于早期外骨骼（如Comex 1和Comex 2）在机械设计上更轻且更背驱，减少了对使用者下肢的干扰，提升了系统的背驱性能。这些改进使得MBLUE能够支持更自然、更精确的部分助力控制，尤其适合在多种地形和活动中实现对保留自主运动能力用户的有效辅助。
","
MBLUE外骨骼相较于Comex 1和Comex 2在机械设计上实现了更轻量化与更高背驱性能。这些改进减少了对外部助力控制的依赖，提升了用户自主运动的自由度，从而更适用于基于实时运动反馈的部分助力控制策略，支持具有残余运动能力用户的自然运动调节。
    ",0.4285714285714285,0.8380882602507983,0.75
"
自适应能量成形控制框架如何通过引入垂直地面反作用力和全局平面方向信息提升助力效果？
","['\nThis work was supported in part by the National Science Foundation under Grants 1652514 and 1949869, and in part by the National Institute of Biomedical Imaging and Bioengineering of the NIH under Grant R01EB031166. This article has supplementary downloadable material available at https://doi.org/10.1109/OJCSYS.2022.3165733, provided by the authors.  ABSTRACT Task-speciﬁc, trajectory-based control methods commonly used in exoskeletons may be ap- propriate for individuals with paraplegia, but they overly constrain the volitional motion of individuals with remnant voluntary ability (representing a far larger population). Human-exoskeleton systems can be represented in the form of the Euler-Lagrange equations or, equivalently, the port-controlled Hamil- tonian equations to design control laws that provide task-invariant assistance across a continuum of activities/environments by altering energetic properties of the human body. We previously introduced a port-controlled Hamiltonian framework that parameterizes the control law through basis functions related to gravitational and gyroscopic terms, which are optimized to ﬁt normalized able-bodied joint torques across multiple walking gaits on different ground inclines. However, this approach did not have the ﬂexibility to reproduce joint torques for a broader set of activities, including stair climbing and stand-to-sit, due to strict assumptions related to input-output passivity, which ensures the human remains in control of energy growth in the closed-loop dynamics. To provide biomimetic assistance across all primary activities of daily life, this paper generalizes this energy shaping framework by incorporating vertical ground reaction forces and global planar orientation into the basis set, while preserving passivity between the human joint torques and human joint velocities. We present an experimental implementation on a powered knee-ankle exoskeleton used by three able-bodied human subjects during walking on various inclines, ramp ascent/descent, and stand-to-sit, demonstrating the versatility of this control approach and its effect on muscular effort.  INDEX TERMS Biomedical, optimization, robotics.\n']","
自适应能量成形控制框架通过引入垂直地面反作用力和全局平面方向信息，扩展了控制律的基函数集合，使其能够更灵活地拟合多种行走模式和任务需求。该改进保留了人体关节力矩与速度之间的能量保性关系，确保了系统稳定性与可控性，同时实现了跨任务的生物拟态助力，从而提升了助力效果。
","
    自适应能量成形控制框架通过引入垂直地面反作用力和全局平面方向信息，增强了对人类与环境交互状态的感知能力，从而在保持输入-输出无源性的前提下，扩展了基函数的表达能力。这使得控制律能够更灵活地适应多样化的运动任务（如不同坡度行走、上下坡、坐站转换等），实现更符合生物运动特征的助力策略，从而提升助力效果与适用范围。
    ",0.7,0.8781046035132367,1.0
"
文中提出的连续相位刚度模型如何实现膝关节力矩估计的平滑性和连续性？
","['\nD. Evaluation of the Continuous-Phase Stiffness Model  Wetestedthegeneralizationofourmodelbytrainingwithdata from 22 subjects and then testing it on a new subject (not from the training set) to evaluate the knee moment estimation. The estimated knee moment for this subject walking at three speeds is shown in Fig. 9. The rms errors (and percentage) of the torque tracking at slow speed, self-selected speed, and fast speed are 0.0583 N·m/kg (13.68%), 0.0585 N·m/kg (8.27%), and 0.0874 N·m/kg (8.40%), respectively. The results demonstrate that the estimatedkneemomentswereclosetotheactualkneemoments, andthegeneratedmomentproﬁleswerecontinuousandsmooth. The black dashed line in the right column of Fig. 9 depicts the value of the sigmoid function S(θk,r,θk,l) ∈ [01] in (11) across the entire gait cycle. It shows that the stiffness model is more inclined to the stance-phase model (S (θk,r,θk,l) = 0) during the ﬁrst double-support and single-support phases, whereas the swing-phase stiffness model has a higher weight during the second double support and swing phases (S (θk,r,θk,l) = 1).  2018-0885) and NC State University (eIRB # 24675). Our study was performed in line with the CCNY IRB and NC State IRB Guidance.  A. Benchtop Experiments  1) High-Backdrivability Demonstration: We conducted a dynamicbackdrivabilitytesttocharacterizebackdrivability.The actuator’s output shaft was manually rotated between −30° and 20° at frequencies between 0.5 and 2 Hz. A loadcell measured the backdrive torque in unpowered mode, which was ﬁltered (ﬁrst-order, 1-Hz cutoff, low-pass Butterworth ﬁlter) to elimi- nate sensor noise. The measured rotation angle and backdrive torque are presented in Fig. 10. The results indicated that our exoskeletonexhibitedaverylowbackdrivetorque(∼0.22N·m), indicating signiﬁcantly better backdrivability than advanced SEA (8.5 N·m) [10] and other QDD-based exoskeletons (1.32 N·m) [29].  VI. EXPERIMENTS  To characterize the knee exoskeleton and evaluate controller performance, we conducted both benchtop and human sub- ject experiments. Benchtop experiments aimed to evaluate the performance of the robot and its controller. The experiment with eight able-bodied subjects aimed to evaluate the tracking performance of the torque controller during walking at different speeds and muscle activity responses to exoskeleton assistance. Our protocol was approved by the City University of New York Institutional Review Board (CCNY IRB, application no.\n']","
连续相位刚度模型通过在步态周期中根据相位函数S(θk,r,θk,l)动态调节各阶段的刚度权重，使膝关节力矩估计具有自然过渡和连续分布特性。模型在支撑相赋予较低刚度权重（S=0），在摆动相赋予较高刚度权重（S=1），从而确保力矩估计波形连续平滑，且在不同行走速度下均保持良好的估计精度与一致性。
","
文中提出的连续相位刚度模型通过在步态周期中引入一个S型函数S(θk,r,θk,l) ∈ [0,1]，动态调整支撑相与摆动相刚度模型的权重，在第一双支撑/单支撑阶段倾向于支撑相模型（S=0），在第二双支撑/摆动阶段倾向于摆动相模型（S=1），从而实现膝关节力矩估计在不同步态阶段间的连续和平滑过渡，避免了传统分段模型中的不连续性。
    ",0.5714285714285714,0.8628809430988423,1.0
"
本文提到的步态训练如何影响卒中患者大脑皮质运动兴奋性的半球间对称性？
","['\nImproving walking ability is a high-rated priority for individuals with stroke,1 and a central focus of physical therapy inter- ventions. Powered robotic exoskeletons are promising tools to deliver high-dosage, high-intensity, and progressive therapy, and to enable greater stepping workloads during therapy while po- tentially reducing strain on therapists. The Stride Management Assist (SMA) exoskeleton, developed by Honda R&D Co., Ltd. (Tokyo, Japan), has a low weight (;6 pounds) and simpliﬁed, modular design relative to other clinically tested exoskeletons to date. Gait training with the SMA has been shown to improve muscle eﬃciency,2 energetic cost,3 and poststroke paretic step length and spatial asymmetry.4 At present, it is uncertain how long-term training with the SMA aﬀects traditional poststroke clinical measures (e.g., walking speed, endurance, balance).  Insuﬃcient central drive and an imbalance of between- hemispheresymmetryofcorticomotorexcitability(CME)are also a well-established benchmark after stroke.5,6 However, there is limited information about the eﬀect of gait training on changes in cortical activity. Several studies have shown that improvements in walking and lower limb motor performance are related to cortical reorganization occurring after stroke— speciﬁcally, improvements in excitability of the paretic lower limb muscle representations.7,8 Thus, it is expected that inter- ventions enabling greater stepping dosage and intensity would strengthen connections between the motor areas of the brain and muscles of the lower limb.\n']","
步态训练通过增强中枢神经系统的重新组织和下肢运动兴奋性的改善，可能促进脑皮质运动兴奋性（CME）的半球间对称性恢复，从而提升卒中患者的运动协调性和步行能力。
","
本文未提供关于Stride Management Assist外骨骼辅助步态训练对卒中患者大脑皮质运动兴奋性半球间对称性影响的具体研究结果，文献无相关内容。尽管已有研究表明步态训练可能促进皮质重组并改善兴奋性，但文中仅提出该训练可能通过增强运动皮层与下肢肌肉连接来促进恢复的理论预期，尚未有实证支持。
    ",1.0,0.6198265975370555,0.25
"
文中使用大腿和小腿IMUs时膝关节力矩估计误差是多少？该结果如何体现模型的准确性？
","[""\nfor an independent model with only thigh IMUs [42] whereas our results for a similar activity are lower at 0.0143 but with both thigh and shank IMUs. Thus, while our model can estimate many more tasks than previous deep learning approaches, it still maintains comparable accuracy for similar activities, showing the great extensibility of deep learning. Beyond comparisons to deep learning approaches, our results can be compared to both analytical and EMG-driven approaches with similar restrictions as above prohibiting a direct comparison. To compare to analytical models, Wang et al. present results using IMUs and insoles for several cyclic and non-cyclic instrumented activities. Across subjects their error was 0.37 Nm/kg at the knee and 0.85 Nm/kg at the hip which are much higher than those presented here even with only kinematic sensors [19]. To compare to EMG-driven models, Sartori et al. reported their lowest errors of 23.75 Nm at the knee and 26.06 Nm at the hip for the stance phase of walking, side-stepping, cross-stepping, and running combined. Although there is no direct comparison, our results averaged across running and walking for the entire gait cycle are 17.9 Nm for the hip and 12.0 Nm for the knee  Authorized licensed use limited to: BEIJING UNIVERSITY OF TECHNOLOGY. Downloaded on July 02,2024 at 03:55:35 UTC from IEEE Xplore. Restrictions apply.  © 2024 IEEE. Personal use is permitted, but republication/redistribution requires IEEE permission.  See https://www.ieee.org/publications/rights/index.html for more information.  8  This article has been accepted for publication in IEEE Transactions on Biomedical Engineering. This is the author's version which has not been fully edited and  content may change prior to final publication. Citation information: DOI 10.1109/TBME.2024.3388874  TBME-00180-2024  with kinematics and EMG. These results demonstrate that the key contributions from our analyses rest upon baseline results that fit well within the current literature.\n""]","
使用大腿和小腿IMUs时膝关节力矩估计误差为0.0143 Nm/kg，相较于仅使用大腿IMUs时更低。该结果通过与文献中基于EMG驱动和运动学传感器的方法进行对比，显示出文中模型在膝关节力矩估计上的高准确性，且误差远低于传统方法，体现了其模型的准确性和任务泛化能力。
","
文中使用大腿和小腿IMUs时膝关节力矩估计误差为0.0143 Nm/kg。该结果通过与先前分析模型（0.37 Nm/kg）和EMG驱动模型（23.75 Nm）对比，显示出更高的准确性，体现了模型的良好性能与扩展性。
    ",0.8,0.9596357745496992,1.0
"
输出阻抗测试结果显示控制系统的阻抗峰值和频率分别是多少？与未控制系统相比有何改进？
","['\n2576-3202 (c) 2020 IEEE. Personal use is permitted, but republication/redistribution requires IEEE permission. See http://www.ieee.org/publications_standards/publications/rights/index.html for more information. Authorized licensed use limited to: City College of New York. Downloaded on May 08,2020 at 13:35:23 UTC from IEEE Xplore. Restrictions apply.  5  This article has been accepted for publication in a future issue of this journal, but has not been fully edited. Content may change prior to final publication. Citation information: DOI 10.1109/TMRB.2020.2981951, IEEE Transactions on Medical Robotics and Bionics  > REPLACE THIS LINE WITH YOUR PAPER IDENTIFICATION NUMBER (DOUBLE-CLICK HERE TO EDIT) <  Fig. 8. Three alignment conditions used during the experiment. Each subject was fitted with the exoskeleton in Ideal, Above, and Below alignment. The Ideal condition was set up by the experimenter visually aligning the exoskeleton and anatomical knee axes. Using a measuring tool, a misalignment of approximately 25 mm between the knee and the exoskeleton joints was introduced in both Above and Below conditions.  torque-to-speed ratios representing the output impedance. The standard deviation of both the impedance estimate and input frequency is shown in Fig. 6 as a measure of the test variability. The test was performed with the control on and off to estimate the controlled and uncontrolled system dynamics, respectively.  Fig. 10. Desired torque profile applied during sit-to-stand testing, averaged across all trials and subjects. Three assistance levels are shown: Zero torque, Low assistance level, and High assistance level. The X-axis represents normalized knee angle from initial to final angle during sit-to-stand.  B. Experimental Results  The results of the torque step response for the proposed closed-loop system are shown in Fig. 6(a). The rise time was 15.2 ms. The settling time was 69.2 ms. The overshoot was 17.5% (3.5 Nm). The steady-state error was 0.001 Nm. Based on the rise time and using a second-order model, the -3dB bandwidth of the closed-loop system is estimated to be 22.3 Hz. The results of the impedance test are shown in Fig. 6(b). The output impedance has a peak of 5.14 Nms/rad at 1.98 ± 0.05 Hz. On average, the output impedance was 49.2% lower for the controlled system than the uncontrolled system.  IV. HUMAN EXPERIMENTS  A. Experimental Protocol\n']","
输出阻抗测试结果显示控制系统的阻抗峰值为 5.14 Nms/rad，频率为 1.98 ± 0.05 Hz。与未控制系统相比，其输出阻抗平均降低了 49.2%，表明控制系统在动态响应和力-速度控制方面具有显著改进。
","
控制系统的输出阻抗峰值为5.14 Nms/rad，频率为1.98 ± 0.05 Hz。与未控制系统相比，输出阻抗平均降低了49.2%，表明控制系统显著提升了系统的柔顺性与动态响应性能。
    ",0.4,0.866507117332168,1.0
"
M-BLUE膝关节模块在双边控制器框架中如何利用反馈传感器数据实现协同控制？
","['\n6.1 M-BLUE wireless networking setup. The figure shows the wireless communication between the different devices involved in the experimental setup. The two M-BLUE knee modules are configured in a paired TCP mode to establish an easy interface to exchange feedback sensor data which is critical in the bilateral controller framework. The experimental laptop communicates with each M-BLUE module, also via TCP. The push button is configured in broadcast UDP mode and is used to soft-toggle the exo power. The android GUI subscribes to and publishes to the two M-BLUE modules via UDP, and is used to update controller coefficients and display exoskeleton related . . . . . . . . . . . . . . . . . . . . . . . . . information to the user (see Fig. 6.2). 6.2 Clinician friendly android GUI for controller customization and visual feedback. On the left is the main panel of the GUI which allows the user to update key controller coefficients (assistance levels) for the corresponding tasks depicted with pictures. The main screen can also soft-stop the exo and switch to the next panel shown on the right. On the right is the secondary panel responsible for displaying live commanded torque values from the two (left and right) actuators of the bilateral M-BLUE knee module. Exoskeleton torques and knee angles for all tasks for PPS patient. The figure shows the ensemble averaged knee angles and exoskeleton torques for level walking (LW), stairs ascent (SA), stairs descent (SD), ramp ascent (RA), ramp descent (RD), and sit-stand (STS) normalized to the task cycles of both left (less impaired) and right (severely impaired and atrophied) legs. Positive values represent knee extension angles and knee extension torques. .  6.3  .  .  . . . . . . . . . . . . . . . . . . . . . . . . . . . . . . . 89  xi  . 74  . 74  . 78  . 88  6.4  Exoskeleton torques and knee angles for all tasks for MS patient. The figure shows the ensemble averaged knee angles and exoskeleton torques for level walking (LW), stairs ascent (SA), stairs descent (SD), ramp ascent (RA), ramp descent (RD), and sit- stand (STS) normalized to the task cycles of both left (highly impaired) and right (less impaired) legs. Positive values represent knee extension angles and knee extension torques.  .  .  . .  . .  . .  . .  .  . . . . . . . . . . . . . . . . . . . . . . . . . . . . . . . 90\n']","
M-BLUE膝关节模块在双边控制器框架中通过TCP协议实现左右膝关节的无线数据通信，用于传输反馈传感器数据。该数据被Android GUI用于更新控制器参数、调整任务状态，并显示实时扭矩与关节角度信息，从而支持闭环控制与协同控制策略的实现。
","
M-BLUE膝关节模块在双边控制器框架中通过配置为成对TCP模式，实现两个膝模块间的反馈传感器数据交换，从而支持协同控制。反馈数据包括膝关节角度和扭矩信息，用于同步控制左右膝关节行为。实验主机通过TCP与模块通信进行监控，而Android GUI则用于控制器参数更新和状态显示，不直接参与闭环控制。
    ",0.3333333333333333,0.9124833662534012,0.5
"
输出阻抗测试结果显示控制系统的阻抗峰值和频率分别是多少？与未控制系统相比有何改进？
","['\n2576-3202 (c) 2020 IEEE. Personal use is permitted, but republication/redistribution requires IEEE permission. See http://www.ieee.org/publications_standards/publications/rights/index.html for more information. Authorized licensed use limited to: City College of New York. Downloaded on May 08,2020 at 13:35:23 UTC from IEEE Xplore. Restrictions apply.  5  This article has been accepted for publication in a future issue of this journal, but has not been fully edited. Content may change prior to final publication. Citation information: DOI 10.1109/TMRB.2020.2981951, IEEE Transactions on Medical Robotics and Bionics  > REPLACE THIS LINE WITH YOUR PAPER IDENTIFICATION NUMBER (DOUBLE-CLICK HERE TO EDIT) <  Fig. 8. Three alignment conditions used during the experiment. Each subject was fitted with the exoskeleton in Ideal, Above, and Below alignment. The Ideal condition was set up by the experimenter visually aligning the exoskeleton and anatomical knee axes. Using a measuring tool, a misalignment of approximately 25 mm between the knee and the exoskeleton joints was introduced in both Above and Below conditions.  torque-to-speed ratios representing the output impedance. The standard deviation of both the impedance estimate and input frequency is shown in Fig. 6 as a measure of the test variability. The test was performed with the control on and off to estimate the controlled and uncontrolled system dynamics, respectively.  Fig. 10. Desired torque profile applied during sit-to-stand testing, averaged across all trials and subjects. Three assistance levels are shown: Zero torque, Low assistance level, and High assistance level. The X-axis represents normalized knee angle from initial to final angle during sit-to-stand.  B. Experimental Results  The results of the torque step response for the proposed closed-loop system are shown in Fig. 6(a). The rise time was 15.2 ms. The settling time was 69.2 ms. The overshoot was 17.5% (3.5 Nm). The steady-state error was 0.001 Nm. Based on the rise time and using a second-order model, the -3dB bandwidth of the closed-loop system is estimated to be 22.3 Hz. The results of the impedance test are shown in Fig. 6(b). The output impedance has a peak of 5.14 Nms/rad at 1.98 ± 0.05 Hz. On average, the output impedance was 49.2% lower for the controlled system than the uncontrolled system.  IV. HUMAN EXPERIMENTS  A. Experimental Protocol\n']","
输出阻抗测试结果显示控制系统阻抗峰值为 5.14 Nms/rad，频率为 1.98 ± 0.05 Hz。与未控制系统相比，输出阻抗平均降低了 49.2%，表明控制系统有效提升了动态响应性能并增强了对外部扰动的适应能力。
","
输出阻抗测试结果显示控制系统的阻抗峰值为5.14 Nms/rad，对应的频率为1.98 ± 0.05 Hz。与未控制系统相比，控制系统的输出阻抗平均降低了49.2%，表明控制系统有效降低了机械阻抗，提升了人机交互的柔顺性和安全性。
    ",0.6,0.8233824377536542,1.0
"
如何通过自适应阻抗控制实现人机协同？
","['\n2 of 14  Bioengineering 2024, 11, 683  efficient methods such as human-in-the-loop (HITL) optimization. For example, it has been demonstrated that tailored assistance based on HITL optimization can decrease the net metabolic cost of walking by up to 50% using metabolic cost as feedback [9].  In this study, we aimed at demonstrating that a hip exoskeleton, initially developed for walking assistance, can be effectively repurposed to substantially lower the metabolic cost of cycling as measured by the net metabolic cost. To explore a range of assistance strategies, we employed two methods: (1) a brute force search with a sweep protocol that evaluates a large range of solutions and (2) human-in-the-loop optimization. The sweep protocol linearly adjusted the timing of a 10Nm peak extension torque ranging from 10% to 40% of the pedal stroke and a 10Nm peak flexion torque ranging from 60% to 90% of the pedal stroke. The HITL optimization used the peak timing of extension and flexion torque as a free parameter and the net metabolic cost as the optimization criterion. HITL optimization was performed to validate the results of the sweep protocol and to explore its potential to identify an individualized assistance strategy in cycling. We hypothesized that both methods are able to identify similar solutions that reduce the net metabolic cost of cycling. While maintaining the peak torque, we assumed that the fixed kinematics of the bicycle and the predefined cycling cadence favor assistance strategies with rapid increases in the exoskeleton torque and therefore provide increased average motor power to assist the participants.  2. Materials and Methods  Three male participants with an average age of 34 ± 7.9years, height of 1.86 ± 0.02m and mass of 75.7 ± 12.7kg participated in the study. The participants had not undergone professional cycling training and possessed low to moderate experience in cycling, pri- marily in commuting and recreational settings. Exoskeleton experiments were approved by the Ethics Committee of TU Darmstadt (EK06/2024). The experiment was conducted in accordance with the principles outlined in the Declaration of Helsinki. Participants provided written informed consent.  2.1. Experimental Setup\n']","
通过将人机协同优化（HITL optimization）与扫频协议结合，研究实现了自适应阻抗控制以提升人机协同性能。具体方法包括：1）设定外骨骼辅助扭矩的峰值时序（伸展和屈曲）作为自由参数，以净代谢成本为目标函数进行优化；2）结合个体代谢反馈调整控制参数，使外骨骼输出的阻抗特性动态匹配人体运动需求；3）通过两种方法验证个体化辅助策略的有效性，从而在骑行任务中显著降低净代谢成本。该方法依赖于外骨骼固定运动学模型与预设骑行节奏，以支持快速增加辅助扭矩的策略，从而增强人机协同效率。
","
通过自适应阻抗控制实现人机协同的关键在于采用人机闭环优化（HITL）策略，以生理反馈（如净代谢成本）为优化目标，动态调整外骨骼的扭矩时序和阻抗参数，从而实现个性化、实时适应的辅助。虽然文献未直接描述“自适应阻抗控制”，但其 HITL 优化机制和参数自适应调整方法提供了实现协同控制的理论基础和实验验证路径。
    ",0.6666666666666666,0.8283248182384825,1.0
"
不同峰值扩展扭矩相位（P1-P5）对曲柄角速度的一致性有何影响？
","['\n3. Results 3.1. Crank Angle and Angular Velocity  During cycling, the crank angle exhibited a consistent linear increase throughout both exoskeleton-assisted and unassisted conditions (Figure 5A). Although the torque varied throughout the sweep session, no alterations due to the exoskeleton torque were observed during phases P1 through P5. The average crank angular velocity was similar between conditions, ranging from 409 ± 13°/s (68.2rpm) without the exoskeleton to 424°/s (70.7rpm) in the Optimal and in P3 of the sweep session (Table 1).  7 of 14  Bioengineering 2024, 11, 683  Ave. crank ang. vel. [°/s] Max. motor torque [Nm] Ave. motor power [W]  8 of 14  0 90 180270360Crank angle [°]  P2  P3  300-200-1000100200300Motor velocity [°/s] ExtensionFlexionB  P1  100102030405060Motor power [W] D  A  P5  P4  10-50510Motor torque [Nm] 0 20 40 60 80 100Time [% pedal stroke]  Figure 5. Average crank angle (A), motor velocity (B), motor torque (C), and motor power (D) during the pedal stroke for the five phases P1 to P5 (peak extension torque P1 10–13%, P2 16.75–19.75%, P3 23.5–26.5%, P4 30.25–33.25%, P5 37–40%, and peak flexion torque with 50% offset). Dotted vertical lines indicate the earliest and latest applied peak extension torque. Dashed lines indicate the middle of the time of the pedal stroke as well as the crank angle at bottom dead center (BDC). For the crank angle, the results of P1 to P5 overlap each other.  Table 1. Group means (±standard deviation) of the average crank angular velocity, maximum motor torque, and average motor power for the analyzed conditions of the sweep (peak extension torque P1 10–13%, P2 16.75–19.75%, P3 23.5–26.5%, P4 30.25–33.25%, P5 37–40%) and the human-in-the-loop (HITL) sessions.  Sweep Session  HITL Session  Transp. 420 ± 10 - -  P1 415 ± 11 10.6 ± 0.2 13.1 ± 0.4  P2 418 ± 11 10.3 ± 0.2 13 ± 0.3  P3 424 ± 20 10.2 ± 0.1 12.8 ± 0.1  P4 423 ± 21 10.3 ± 0.1 12.4 ± 0.2  P5 420 ± 31 10.3 ± 0.0 11.5 ± 0.3  Optimal 424 ± 13 10.4 ± 0.3 13.9 ± 1.1  Transp. 420 ± 6 - -  w/o Exo 409 ± 13 - -  Bioengineering 2024, 11, 683  3.2. Motor Torque and Power\n']","
不同峰值扩展扭矩相位（P1-P5）对曲柄角速度的一致性无显著影响，其平均曲柄角速度在P1至P5相位中保持基本一致，未因相位设置出现显著差异。曲柄角速度主要受骑行过程中自然的线性增加趋势主导。
","
在不同峰值扩展扭矩相位（P1-P5）下，曲柄角速度表现出高度一致性，未因外骨骼施加的扭矩而发生显著变化。各相位下的平均角速度均接近409–424°/s范围，且曲柄角轨迹在各条件下相互重叠，表明相位变化对曲柄角速度的一致性无明显影响。
    ",0.75,0.991500876462258,1.0
"
文中对MS患者的膝关节屈曲力量和髋关节屈曲能力评估结果表明其存在哪些显著运动缺陷？研究团队据此设定了哪些主要运动学评估指标？
","['\nWe investigated two highly impaired cases of MS and PPS. The manual muscle test (MMT) and clinician assessment of the PPS patient revealed that he had a highly impaired (atrophied) right  75  leg from the hip down, and quadriceps weakness in his left side. Accordingly, discussion with the patient and on-site clinician highlighted the need to assist knee extension especially during sit- stand-sit and stairs ascent which the patient found the most challenging. Performance assessments during sit-stand and stair ascent were therefore our primary metrics. We hypothesized that after appropriate controller customization for the PPS patient, our novel bilateral exoskeleton would improve the results of the five times sit to stand (5xSTS) test, and time to ascend a 5-step staircase. The MMT and clinician assessment of the MS patient revealed he had reduced knee flexion strength (greatly exacerbated by quadriceps spasticity) and severely hampered hip flexion capa- bility. Functionally, his prominent deficit was leg clearance (worse on the left side) leading to compensatory circumduction. Accordingly, our primary metrics were sagittal knee and frontal shank kinematics. We hypothesized that after appropriate controller customization, exoskeleton assistance would increase the MS patient’s peak knee flexion angle (assessing leg clearance), and reduce peak shank abduction angle (assessing circumduction).  For both patients, we performed a battery of assessments to explore the effects of exoskeleton assistance for a wide array of tasks (including exploratory assessments beyond the primary out- comes described above). We performed two common gait tests: the timed up and go (TUG) test and six meter walk test (6MWT). We also assessed the times to ascend and descend a staircase and ramp. Finally we acquired subjective feedback on exoskeleton effectiveness for the various tasks completed using a modified QUEST questionnaire.  6.2 Methodology  6.2.1 Clinician-friendly android app (GUI) interface development\n']","
MS患者的膝关节屈曲力量下降（尤其是受股四头肌痉挛影响）和髋关节屈曲能力受限是其显著的运动缺陷。研究团队据此设定了两个主要运动学评估指标：矢状面膝关节屈曲角度最大值（peak knee flexion angle）和前向面胫骨外展角度最大值（peak shank abduction angle）。
","
文中指出MS患者存在膝关节屈曲力量减少（受股四头肌痉挛加重）和髋关节屈曲能力严重受限的显著运动缺陷。据此，研究团队设定了两个主要运动学评估指标：矢状面膝关节运动学（用于评估腿部清空能力，如峰值膝关节屈曲角度）和额状面小腿运动学（用于评估代偿性外展步态，如峰值小腿外展角度）。
    ",1.0,0.7364238011008641,1.0
"
传统下肢假肢阻抗控制方法在步态周期分相中存在哪些局限性？
","['\n(1)  where K, B, and θeq are parameters deﬁning the joint’s stiffness, damping, and equilibrium angle, respectively.  Traditional methods of impedance control for lower-limb prostheses involve segmenting the gait cycle into discrete sub- phases, where each sub-phase has its own constant values of K, B, and θeq. Researchers manually tune the impedance parameters in each sub-phase until the observed gait is sat- isfactory [5], [11], [14]–[17]. Switching between sub-phases is controlled by a ﬁnite state machine (FSM) with transition criteria based on sensor readings (e.g., elapsed time, leg loading, joint angles, etc.). Like the impedance parameters, these transition criteria are often experimentally tuned for an individual’s gait by a technical expert. More elaborate impedance value representations have been suggested [16]– [19], but these methods still required manual, expert tuning. Joint kinematics and kinetics vary based on the ground incline and walking speed [20], [21] (together termed the user’s task). Therefore, the necessary impedance parameters and state machine transition criteria also vary. For a standard FSM impedance controller to operate over a wide array of tasks, many tunable parameters are required. For example, one state-of-the-art impedance controller for ﬁve ambulation modes required a total of 140 tunable parameters [16]. While only a portion of these parameters were considered necessary to tune, the device’s conﬁguration and tuning still required the researchers up to ﬁve hours to complete. To avoid the expert tuning burden, other work aimed to eliminate manual tuning by using biological quasi-stiffness curves [17], [22]–[24] or using machine learning to perform online parameter tuning [25], [26]. However, many of these approaches were limited to level-ground walking. Further, while [24]–[26] addressed the problem of tuning the impedance parameters, their approaches still required tuning the FSM switching criteria.\n']","
传统下肢假肢阻抗控制方法在步态周期分相中存在以下局限性：其一，依赖手动调整每个子阶段的固定阻抗参数（K、B、θeq），缺乏自适应能力；其二，难以适应因地面坡度、行走速度等任务变量变化而引起的关节动力学差异；其三，为覆盖多种行走模式需配置大量可调参数，调参耗时且依赖专家经验；其四，现有替代方法（如生物刚度曲线、在线机器学习）仍受限于对FSM切换准则的调参需求，无法全面替代传统方法。
","
传统下肢假肢阻抗控制方法在步态周期分相中存在以下局限性：1）依赖手动调参，需专家经验且耗时；2）使用有限状态机控制相位切换，切换标准需实验调优；3）地面坡度与行走速度变化导致阻抗参数与切换标准需动态调整，传统方法难以适应多种任务；4）参数数量庞大，如某五模式控制器需140个可调参数，配置复杂；5）虽有研究尝试引入生物拟刚度曲线或机器学习减少调参负担，但多限于平地行走，且仍需调整FSM切换逻辑，适应性受限。
    ",0.9166666666666666,0.9993127114811488,1.0
"
与传统周期训练方法相比，分期训练技术在外骨骼控制应用中的主要优势是什么？
","['\nThe rate of increase in compressive force is maximum between approximately 50–80° knee flexion (17,18), thus generating proportionately greater patellofemoral force compared with lower knee flexion angles. Therefore, per- forming the squat within the functional range of 0–50° knee flexion will minimize patellofemoral compressive force and stress, and may be effective for athletes or patients with patellofemoral pathologies. For athletes with healthy knees, performing the squat at higher knee flexion angles (approx- imately 90–110°) should not be problematic, as long as heavy loads are not used excessively. This can be a potential problem for powerlifters and football players, who often train with heavy loads for long periods of time. Periodiza- tion techniques should be employed when performing the squat, in which training is divided into light, medium, and heavy intensity cycles throughout the year.  Muscle Activity  To determine which muscles are being developed during the squat and to what degree, it is helpful to quantify muscle activity through the use of EMG. To date, there are 16 known studies that  KNEE BIOMECHANICS OF THE DYNAMIC SQUAT EXERCISE  havequantifiedmuscleactivityaboutthekneeduringthedynamic squat (6,13,17,18,25,27,34,38,40,54,55,58,65,68–70). Eleven of these studies performed the barbell squat with an external load (17,18,34,40,54,55,58,65,68–70), whereas the remaining five studies (6,13,25,27,38) performed the BW squat. The pri- mary knee muscles utilized during the squat are the quad- riceps, hamstrings, and gastrocnemius, and co-contractions among these muscles are believed to enhance knee stability (15,16,31,46,47,73,74).  Escamilla et al. (17) and Wilk et al. (65) quantified quadriceps, hamstring, and gastrocnemius activity using a 12-RM load for 10 male subjects experienced in the squat. Quadriceps activity progressively increased as the knee flexed and decreased as the knees extended, with peak activity occurring at approximately 80–90° knee flexion. Similar results were observed in several other studies (18,27,40,55,58,69). Quadriceps activity remained fairly constant beyond 80–90° knee flexion, which has also been observed in other studies (58,68,69). Hence, descending beyond 90° knee flexion, which is near the parallel squat position, may not enhance quadriceps development.\n']","
文献无相关内容。
","
    分期训练技术相较于传统周期训练方法在外骨骼控制应用中的主要优势包括：通过系统性划分训练强度周期（轻、中、重），实现更精确的负荷管理，从而优化肌肉适应性、降低过度训练导致的损伤风险，并提升训练的长期效果与个体适应性，尤其适用于不同膝关节状态（如康复与高性能训练）下的外骨骼辅助训练控制策略。
    ",0.0,0.0,0.0
"
研究通过自适应助力控制算法优化外骨骼在步态周期中的力输出，使其在关键运动阶段提供适当的助力，从而减少用户肌肉激活水平和能量消耗。实验结果显示，该方法在步行过程中显著降低了用户的代谢能量需求。
","['\n[3] T. Lenzi, D. Zanotto, P. Stegall, M. C. Carrozza, and S. K. Agrawal, “Reducing muscle effort in walking through powered exoskeletons,” Proc. Annu. Int. Conf. IEEE Eng. Med. Biol. Soc. EMBS, pp. 3926–3929, 2012.  [4] S. Lefmann, R. Russo, and S. Hillier, “The effectiveness of robotic- assisted gait training for paediatric gait disorders: Systematic review,” J.  [27] T. Lenzi, M. C. Carrozza, and S. K. Agrawal, “Powered hip exoskeletons can reduce the user’s hip and ankle muscle activations during walking,” IEEE Trans. Neural Syst. Rehabil. Eng., vol. 21, no. 6, pp. 938–948, 2013. [28] R. M. Ehrig, W. R. Taylor, G. N. Duda, and M. O. Heller, “A survey of formal methods for determining functional joint axes,” J. Biomech., 2007. [29] M. B. Näf, K. Junius, M. Rossini, C. Rodriguez-Guerrero, B. Vanderborght, and D. Lefeber, “Misalignment Compensation for Full  2576-3202 (c) 2020 IEEE. Personal use is permitted, but republication/redistribution requires IEEE permission. See http://www.ieee.org/publications_standards/publications/rights/index.html for more information. Authorized licensed use limited to: City College of New York. Downloaded on May 08,2020 at 13:35:23 UTC from IEEE Xplore. Restrictions apply.  11  This article has been accepted for publication in a future issue of this journal, but has not been fully edited. Content may change prior to final publication. Citation information: DOI 10.1109/TMRB.2020.2981951, IEEE Transactions on Medical Robotics and Bionics  > REPLACE THIS LINE WITH YOUR PAPER IDENTIFICATION NUMBER (DOUBLE-CLICK HERE TO EDIT) <  Human-Exoskeleton Kinematic Compatibility: State of the Art and Evaluation,” Appl. Mech. Rev., vol. 70, no. 5, p. 050802, 2019.  [30] L. M. Mooney, E. J. Rouse, and H. M. Herr, “Autonomous exoskeleton reduces metabolic cost of human walking during load carriage,” J. Neuroeng. Rehabil., vol. 11, 2014.  [31] J. L. Contreras-Vidal et al., “Powered exoskeletons for bipedal locomotion after spinal cord injury,” Journal of Neural Engineering. 2016.  [32] T. Yan, M. Cempini, C. M. Oddo, and N. Vitiello, “Review of assistive strategies in powered lower-limb orthoses and exoskeletons,” Rob. Auton. Syst., vol. 64, pp. 120–136, 2015.  [33] M. K. Shepherd and E. J. Rouse, “Design and Validation of a Torque- Controllable Knee Exoskeleton for Sit-to-Stand Assistance,” IEEE/ASME Trans. Mechatronics, vol. 22, no. 4, pp. 1695–1704, 2017.\n']","
研究通过自适应助力控制算法优化外骨骼在步态周期中的力输出，使其在关键运动阶段提供适当的助力，从而有效降低用户肌肉激活水平和代谢能量消耗。实验结果验证了该方法在步行过程中显著降低代谢需求的可行性。
","
    本研究通过自适应助力控制算法优化外骨骼在步态周期中的力输出，使其在关键运动阶段提供适当的助力，从而减少用户肌肉激活水平和能量消耗。实验结果显示，该方法在步行过程中显著降低了用户的代谢能量需求。该研究延续了现有文献中关于外骨骼助力策略优化与代谢成本降低的研究方向，并通过自适应控制提升了人机协同性能，其结论在已有研究中具有实验支持。
    ",0.2,0.8598098560466679,1.0
"
文中实验结果显示FES对膝关节外骨骼电机扭矩有何影响？
","['\n. Fig. 4 shows the overlaid knee joint trajectories and torques during the series of leg lifts. Specifically, the top row in Fig. 4 shows the overlaid trajectories from 42 leg lifts without FES, along with the exoskeleton motor torque required to achieve these trajectories. The middle row in Fig. 4 shows the overlaid trajectories from 42 leg lifts with FES, along with the exoskeleton motor torque required to achieve these trajectories. Finally, the bottom row in Fig. 4 shows the average of the overlaid trajectories and torques, along with a plus and minus one standard deviation for each case. As indicated in the bottom left plot, the trajectory tracking is essentially the same in both cases, although somewhat better with FES than without. The bottom right plot shows the average torque required by the exoskeleton knee motors for both cases, with and without FES. The average motor torque required without FES was approximately 25 N·m, while the average motor torque required with FES was approximately 13 N·m. By computing the energy delivered by the knee motor (i.e., by computing power and integrating over the duration of the trajectory), one finds that on average, the knee motor\n']","
文中实验结果显示，功能性电刺激（FES）可显著降低膝关节外骨骼电机在腿部抬升任务中所需的平均扭矩，从无FES条件下的25 N·m降至约13 N·m。
","
实验结果显示，FES的应用显著降低了膝关节外骨骼电机所需的平均扭矩。在无FES情况下，平均电机扭矩约为25 N·m，而在有FES情况下，该值降低至约13 N·m。这表明FES有效减少了外骨骼系统在轨迹跟踪过程中对电机扭矩的需求。
    ",0.75,0.8698426070399696,1.0
"
本文指出当前外骨骼控制系统存在哪些不足，影响其在日常生活中广泛应用？
","['\nSpecialty section: This article was submitted to Bionics and Biomimetics, a section of the journal Frontiers in Bioengineering and Biotechnology  Keywords: powered orthosis, robotic control, metabolic cost, biomechanics, human walking, hip exoskeleton  Received: 15 September 2016 Accepted: 18 January 2017 Published: 08 March 2017  Citation: Young AJ, Foss J, Gannon H and Ferris DP (2017) Influence of Power Delivery Timing on the Energetics and Biomechanics of Humans Wearing a Hip Exoskeleton. Front. Bioeng. Biotechnol. 5:4. doi: 10.3389/fbioe.2017.00004  inTrODUcTiOn  A number of research and industry groups are developing powered lower limb exoskeletons to help people in industry (Hodson, 2014; Lamothe, 2014), military (Zoss et al., 2006; Gregorczyk et al., 2010; Raytheon XOS 2 Exoskeleton, Second-Generation Robotics Suit: Army-Technology, 2010; France’s Slender Hercule Exoskeleton Is No Lightweight, 2012; Asbeck et al., 2015), and healthcare settings (Gancet et al., 2012; Zeilig et al., 2012; Kolakowsky-Hayner et al., 2013; Sczesny-Kaiser et al., 2013; Farris et al., 2014). Progress in hardware development has been rapid and widespread (Huo et al., 2014), but control over these advanced devices still needs significant improvement for exoskeletons to be adopted widely in everyday use (Yan et al., 2015). Hip and ankle muscles are  Frontiers in Bioengineering and Biotechnology | www.frontiersin.org  1  March 2017 | Volume 5 | Article 4  Young et al.\n']","
本文指出当前外骨骼控制系统存在控制策略不够优化、与人体运动同步性不足、影响能效与生物力学适配性等问题，这些不足限制了其在日常生活中广泛应用。
","
    本文指出尽管外骨骼硬件发展迅速，但其控制系统仍需显著改进，以实现广泛日常应用。当前控制系统的不足主要体现在尚无法有效满足日常使用需求，具体表现为控制策略的适应性与实用性仍存在局限，但文献未进一步详细说明具体的技术瓶颈。
    ",0.5,0.9165954709751856,0.75
"
文中提到的平均皮尔逊相关系数（PCC）值分别对应哪些关节及其运动状态？这些数值反映了模型在哪方面的应用潜力？
","['\n. The only exception is the setup for the ankle joint moment prediction during stair negotiation, in which three IMUs were needed to derive a better per- formance than a single IMU. Of note, the results for predicting the hip, knee, and ankle joint moment during walking and running with a single IMU is quite promising, which is nearly equivalent to the performance of multiple IMUs. Moreover, the average PCC of hip, knee, and ankle joint moments reach up to 0.95, 0.90, and 0.92 during running at different speeds. Accurate estimation of joint moment with the proposed model during walking and running is critical for the injury assessment in daily life. The hip and knee joint moment can be predicted with satisfied ac- curacy using a single shank-attached IMU. However, using an extra foot- attached IMU could very likely improve the estimation performance of the proposed model, when predicting the ankle joint moment during stair negotiation.\n']","
文中提到的平均皮尔逊相关系数（PCC）分别为髋关节0.95、膝关节0.90、踝关节0.92，分别对应跑步状态下不同速度下的关节力矩预测。这些高PCC值表明模型在髋、膝、踝关节力矩估计方面具有高度准确性，反映了其在运动损伤评估和姿态分析等应用中的潜力。
","
文中提到的平均皮尔逊相关系数（PCC）值0.95（髋关节）、0.90（膝关节）和0.92（踝关节）分别对应跑步过程中这些关节的力矩预测。这些数值表明模型在动态运动状态下（如不同速度的跑步）对关节力矩具有高度准确的预测能力。模型在仅使用单个IMU的情况下即可实现高精度估计，尤其适用于髋和膝关节的力矩预测，且在步态分析与损伤评估方面具有潜在应用价值。
    ",1.0,0.8311344466914354,1.0
"
为了提供20Nm的辅助扭矩，文中采用了哪些材料和结构参数，对应的铰链段载荷和缆索张力分别是多少？
","['\n(c)  Fig. 8. Experimental/simulation results for the buckle-free support frame: (a) experimental setup for evaluating the buckle-free capability, (b) experimental results for the motion trajectory of the last link, and (c) the ﬁnite element analysis of the buckle-free support frame with Nastran simulator.  We also performed the stress analysis of the buckle-free support frame with Nastran ﬁnite element analysis software. The material of the links and the connection pins were set to aluminum 7075-T6, and Cr-Mo steel (SCM-445), respectively. The diameter of the two connection pins was designed to be 3mm. Fig. 8(c) represents the simulation results of the stress analysis. A vertical force of 500N was applied to the upper buckle-free link. We can observe that a maximum stress of 365.7 MPa was applied to the connection pins. Considering that the tensile yield strength of SCM445 reaches up to 950 MPa, the proposed buckle-free support frame can reduce the wearer’s joint loading sufﬁciently regardless of its bending.  B. Tight-Fitting Characteristic Regardless of Ankle Movement  can be applied to other rotating pivots in common. In contrast to a generic rigid plate of equivalent thickness, to provide evenly distributed interaction forces, the moment arm c should be increased, as the pivot moves closer to its proximal end.  Considering the diameter of a thigh of a person aged 50 the fastener should years, transmit approximately 100N of total resulting force F to the wearer. It was assumed that the number of pivots was 10, and maximum c was 20mm. Based on these mechanical design parameters, the resulting loads on the hinged segments and the corresponding cable tension reached up to 10N and 370N, respectively. Each link and pivot pin was made of PEEK materials and 304 stainless steel, respectively.  to provide 20Nm assist  torque,  IV. VALIDATION BY SIMULATIONS AND EXPERIMENTS  the performance of individual elements and of the system are evaluated by sevaral simulations and experiments.  In this section,  A. Load-Supporting Functionality with Flexibility\n']","
为了提供20Nm的辅助扭矩，文中采用了PEEK材料作为铰链段，304不锈钢作为铰链销钉。结构参数包括铰链数量为10，偏心距c为20mm。对应的铰链段载荷为10N，缆索张力为370N。
","
为了提供20Nm的辅助扭矩，文中采用的材料为PEEK（连杆）和304不锈钢（销轴），结构参数中最大力臂c为20mm，对应的铰链段载荷为10N，缆索张力为370N。
    ",0.6666666666666666,0.8836354639414353,1.0
"
文中提到的分段线性力矩-角度曲线如何模拟人类踝关节在行走中的正功循环？
","['\nwhere (θ0,l,τ0,l) is an anchor node in torque-angle space and Kdes is the resulted desired stiﬀness. S is a scaling factor on the unit curve with desired quasi-stiﬀness of Kdes,0 to get diﬀerent values of desired quasi-stiﬀness.  Another type of curve tested was a piece-wise linear torque- angle curve with the format of Equation (8) as shown in Figure 2B.  2.3. Theoretical Analysis and Hypotheses We conducted theoretical analysis based on the analytic expressions of the testbed system dynamics, desired torque, and torque controller and made hypotheses about the optimum of passive stiﬀness of series elastic actuators in lower-limb ankle exoskeletons and the interactions between optimal gains, desired stiﬀness and passive stiﬀness.  τdes = S ·  τi,p − τi−1,p θi,p − θi−1,p  (θe − θi−1,p)  τdes = max(τdes, 0)  for i = {1,2,3,4},  Here, (θi,p,τi,p) deﬁnes a node in torque-angle space (Figure 2B). is i denotes currently in. The node (θ2,p,τ2,p) marked the transition from the dorsiﬂexion phase, in which ankle velocity was negative, to the plantarﬂexion phase, in which ankle velocity transition point varied on was positive. Since the exact each stride, we used the angle and torque at the moment of transition, (θ′ 2,p,τ′ 2,p), when calculating desired torque in the ﬁrst portion of Plantarﬂexion, the curve.  the phase number on the curve the gait  i.e., phase 3 of  Note that the piece-wise linear curve mimics the positive work loop produced by human ankle torque-angle relationship during walking, which was commonly used by lower-limb exoekeletons and prostheses in high level control (Caputo and Collins, 2013). The linear model is a special case for the piec-wise linear model, and a simpliﬁed version, which will be used in theoretical analysis in this article.  later  (8)\n']","
分段线性力矩-角度曲线通过构造节点集（θi,p, τi,p）并在不同运动阶段内进行线性插值，模拟踝关节在行走中从背屈到跖屈的正功循环。每个阶段的力矩由角度变化驱动，公式为 τdes = S × [τi,p − τi−1,p] / [θi,p − θi−1,p] × (θe − θi−1,p)，其中 S 为缩放因子，用于调整期望刚度。该模型在理论上用于分析踝关节控制策略的最优被动刚度，适用于外骨骼和假肢的高阶控制设计。
","
文中所述的分段线性力矩-角度曲线通过定义多个节点（θi,p, τi,p）并在线性段之间过渡，模拟了人类踝关节在步态周期中产生的正功循环。曲线在跖屈阶段根据实际运动过渡点动态调整角度和力矩值，从而更准确地再现踝关节的生物力学特性。该方法被广泛用于下肢外骨骼和假肢的高层控制中，能够有效复现行走过程中的正功行为。
    ",1.0,0.9448177740083435,1.0
"
文中提到的基于单加速度计的人体活动识别深度学习方法在资源受限设备上的实现效果如何？
","['\n[13] Y. Chen and Y. Xue, “A deep learning approach to human activity recog- nition based on single accelerometer,” in Proc. IEEE Int. Conf. Syst., Man, Cybern., 2015, pp. 1488–1492.  [14] A. Zunino et al., “Predicting intentions from motion: The subject- adversarial adaptation approach,” Int. J. Comput. Vision, vol. 128, no. 1, pp. 220–239, 2020.  [15] D. Ravi, C. Wong, B. Lo, and G.-Z. Yang, “Deep learning for human activity recognition: A resource efﬁcient implementation on low-power devices,”inProc.IEEE13thInt.Conf.WearableImplantableBodySensor Netw., 2016, pp. 71–76.  [16] T.T.Umetal.,“Dataaugmentationofwearablesensordataforparkinson’s disease monitoring using convolutional neural networks,” in Proc. 19th ACM Int. Conf. Multimodal Interaction, 2017, pp. 216–220.  [17] R. Zhang and C. Li, “Motion sequence recognition with multi-sensors using deep convolutional neural network,” in Intelligent Data Analysis and Applications, Berlin, Germany: Springer, 2015, pp. 13–23.  [18] B.-Y. Su, J. Wang, S.-Q. Liu, M. Sheng, J. Jiang, and K. Xiang, “A CNN- based method for intent recognition using inertial measurement units and intelligent lower limb prosthesis,” IEEE Trans. Neural Syst. Rehabil. Eng., vol. 27, no. 5, pp. 1032–1042, May 2019.  [19] K.Zhang,J.Wang,C.W.DeSilva,andC.Fu,“Unsupervisedcross-subject adaptation for predicting human locomotion intent,” IEEE Trans. Neural Syst. Rehabil. Eng., vol. 28, no. 3, pp. 646–657, Mar. 2020.  [20] B.Hu,E.Rouse,andL.Hargrove,“Benchmarkdatasetsforbilaterallower- limb neuromechanical signals from wearable sensors during unassisted locomotion in able-bodied individuals,” Frontiers Robot. AI, vol. 5, no. 14, pp. 1–5, 2018.  ACKNOWLEDGMENT  [21] D. Anguita, A. Ghio, L. Oneto, X. Parra, and J. L. Reyes-Ortiz, “A public domain dataset for human activity recognition using smartphones,” in Proc. Eur. Symp. Artif. Neural Netw., Comput. Intell. Mach. Learn., 2013, vol. 3, pp. 437–442.  The authors would like to thank Dr. Gray Thomas of the  Neurobionics Lab for his input on statistical analyses.  [22] K. J. Piczak, “Environmental sound classiﬁcation with convolutional neu- ral networks,” in Proc. IEEE 25th Int. Workshop Mach. Learn. Signal Process., Sep. 2015, pp. 1–6.  [23] D. A. Winter, Biomechanics and Motor Control of Human Movement.  REFERENCES  Hoboken, NJ, USA: Wiley, 2009.  [24] B. McFee et al., “LibROSA: Audio and music signal analysis in python,”\n']","
文献无相关内容，文中未提供基于单加速度计的人体活动识别深度学习方法在资源受限设备上的具体实现效果评估。
","
    文中提到的基于单加速度计的人体活动识别深度学习方法在资源受限设备上实现了资源高效的部署，通过优化模型结构和计算策略，降低了计算复杂度和内存占用，从而适应硬件限制，表明其具备良好的实现效果。
    ",1.0,0.0,0.0
"
在外骨骼控制中，不同频率振荡器间的耦合机制如何影响相位差的动态收敛特性？
","['\nof each oscillator in the sequence can be modiﬁed in the form  ˙φi = ωi +   16  Hij(φj − φi)  j=i  then each oscillator possesses the capability to synchronize with external signals. Replacing H with its ﬁrst Fourier term and considering the smooth convergence of the frequency, the mathematicaldescriptionoftheoscillatorsequencecanbegiven  Authorized licensed use limited to: BEIJING UNIVERSITY OF TECHNOLOGY. Downloaded on March 15,2024 at 00:46:05 UTC from IEEE Xplore. Restrictions apply.  5  (7)  (8)  (9)  This article has been accepted for inclusion in a future issue of this journal. Content is final as presented, with the exception of pagination.  6  IEEE/ASME TRANSACTIONS ON MECHATRONICS  However, consistently maintaining vx = v0 is not feasible during the operational process. Therefore, the objectives of speed matching are twofold: one is to keep the torso up- right, which can be done by resetting the phase of oscillators, and the other is to make vx roughly consistent with v0, i.e., vx ≈ v0.  To reset the phase of the oscillator, we introduced a reference oscillator as the state observer, the phase of which is reset to 0 when the left leg makes contact with the ground. This reference oscillator is deﬁned as follows:  Fig. 8. Body posture at different speed relationships.   ˙φref = ωref ˙ωref = ˙ω1  by    ˙φi = ωi +  i ¨ωi = i 4    j∈D(i) ij sin(φj − Ωj  Ωi φi − ¯Φij)    (Ωi − ωi) − ˙ωi  where ij and i are constants. The discrete set D(i) includes oscillators from which the ith oscillator receives couplings. Ωj/Ωi isusedforcouplingoscillatorswithdifferentfrequencies. φj − Ωj/Ωi · φi deﬁnes the scaled phase difference, and ¯Φij is described by    ¯Φij = φj(0) − Ωj ¯Φij = 0,j /∈ D(i).  Ωi φi(0),j ∈ D(i)  The values of φi(0) and Ωi depend on the convergence results in the previous section. Then, the angle of each joint (left hip: θ1, left knee: θ2, right hip: θ3, and right knee: θ4) can be set as a combination of serval oscillators, deﬁned as follows:  4i  θi = ri(t)  α0  j sin(φj(t)), i = 1,...,4  j=4i−3  where α0 j is the amplitude of the jth oscillator and can be considered as the stable value of αj; r1,r2,r3,r4 ∈ [0,1] are state variables.\n']","
不同频率振荡器间的耦合机制通过缩放相位差和频率比例关系影响相位差的动态收敛特性，同时参考振荡器的引入增强了系统在速度匹配任务中的自适应能力，从而优化整体收敛性能。
","
    在外骨骼控制中，不同频率振荡器间的耦合机制通过引入参考振荡器和缩放相位差φj − Ωj/Ωi · φi实现同步控制。该机制通过调节耦合项中的频率比Ωj/Ωi来影响相位差的动态收敛特性。相位差的收敛依赖于初始相位差¯Φij及耦合结构，且系统可实现频率的平滑收敛。然而，文献未提供关于不同耦合强度下收敛速率或稳定性的具体分析。
    ",0.25,0.8118647383293828,0.75
"
注意力机制在所设计的CNN-BiLSTM网络结构中起到了什么作用？它是如何通过Permute和Multiply层实现的？
","['\n3. Method  In the present study, IMU data and joint moment data during different locomotive activities were adopted from a public Dataset [22]. An attention-based CNN-BiLSTM model, consisting of Conv1D, BiLSTM, and attention mechanism, followed by a dense layer, was developed for joint moment prediction. A block diagram of the proposed method was shown in Fig. 1. For model training pipeline, the IMU data and joint moment data was segmented by single gait cycle based on the GRF data. The sample size per gait cycle depends on the gait stride time, as indi- cated with ‘Size: unknown * 9’ in Fig. 1. Downsampling was used to  In the present study, the IMUs were visually aligned with the long axis of the limb. To resolve the potential misalignment between the IMU and the anatomical long axes of the limb, the instantaneous resultant (L2) and average accelerometer (ACC) and gyroscope (GYR) signals were extracted and combined with the three-axis ACC and GYR signals as the IMU features to overcome the potential calculation error due to the misalignment [24].  The instantaneous resultant and average ACC and GYR signals were  computed using the following equations:  BiomedicalSignalProcessingandControl86(2023)1053724  W. Liang et al.  Fig. 2. Architecture of the proposed attention-based CNN-BiLSTM model. IMU data was segmented, filtered, extracted features, and then transformed to time slice data (Xt), and inputted to the proposed model. Each time slice (Xt) included five samples and each sample had 10 * n features (n denotes the number of IMUs).  ̅̅̅̅̅̅̅̅̅̅̅̅̅̅̅̅̅̅̅̅̅̅̅̅̅ y + a2 x + a2 a2 z  √  √  ̅̅̅̅̅̅̅̅̅̅̅̅̅̅̅̅̅̅̅̅̅̅̅̅̅̅̅̅ y + ω2 ω2 z  L2ACC =  x + ω2  L2GYR =  (1)  Table 1 Details of the proposed attention-based CNN-BiLSTM model.  ACC = (ax + ay + az)/3GYR = (ωx + ωy + ωz)/3  (2)  Layer type  Detail  where ax, ay, az, ωx, ωy, ωz represent the three-axis accelerometer and  InputLayer Conv1D Dropout BiLSTM Dropout Permute Dense Permute Multiply Flatten Dense  Size: N * 5 * 10 Num filter = 128; Kernel size = 1; Padding = 0; Activation = ReLU Dropout = 0.5 Num filter = 64 Dropout = 0.5 Permute Num filter = 5; Activation = Softmax Permute Multiply Flatten Num filter = 1  gyroscope signals.  3.3. Proposed subject-independent attention-based CNN-BiLSTM model\n']","
注意力机制在所设计的CNN-BiLSTM网络中起到了增强模型对关键时间步或特征重要性的作用。该机制通过Permute层调整输入数据的维度顺序，使其符合Multiply层的计算需求；Multiply层则通过元素相乘对BiLSTM输出进行加权，从而实现注意力机制对重要信息的强调与提取。
","
注意力机制在所设计的CNN-BiLSTM网络中用于增强关键时间步的特征表示，通过Permute层调整注意力权重的维度，并与BiLSTM输出通过Multiply层进行逐元素相乘，实现对输入序列中重要信息的加权强调，从而提升关节力矩预测的准确性。
    ",1.0,0.9221861289799852,1.0
"
实验中为何仅在膝关节伸展方向应用协同控制？其生理和控制依据是什么？
","['\ncθeθ and T  cKθ . By replacing the previous result in (2) we find the appropriate rate of change of K and τ as a function of measurable variables: K    γcTθeθKθTγθeθKθ. (4) Note that in (4) we define γγc, which is an adaptation control gain that influences the rate of adaptation. IV. EXPERIMENTAL IMPLEMENTATION The previously described control approach was implemented on a paraplegic subject wearing the previously described lower limb exoskeleton. These experiments were conducted using electrical stimulation of the quadriceps muscle, therefore only the knee joint utilized cooperative control, and only when requiring a torque in knee extension (i.e., the quadriceps cannot provide a knee flexion torque). The subject was a T10 ASIA A (i.e., complete) paraplegic male, was 36 years old, 9 years post injury, 1.85 m (6 ft 1 in) tall, and weighed 73 kg (160 lb). All experiments were conducted at the Shepherd Center in Atlanta GA USA, a hospital specializing in spinal cord injury. All experiments required the presence of a physical therapist, as per the experimental protocol approved by the Vanderbilt Institutional Review Board. A. Electrical stimulation Electrical stimulation was provided by a custom module that plugs into the main exoskeleton control board. As implemented, the same microcontroller that controls the joint actuator also controls the electrical stimulator. The stimulator provides a biphasic square-wave stimulation waveform. In the experiment described here, the stimulation frequency was set to a constant 50 Hz, and the pulse width set to 200 μs. As previously described, the stimulation amplitude was set by the structure of the adaptive controller. Note that, for safety purposes the stimulation amplitude was saturated at 120 mA. A pair of surface electrodes was placed on each of the right and left quadriceps. The stimulation leads were run proximally, through the waistband of the subject’s pants, where they connected with mating leads from the previously described stimulator. B. Experimental setup A series of trajectory-controlled leg lifts were used to assess the efficacy of the cooperative controller to adapt to  3361\n']","
实验中仅在膝关节伸展方向应用协同控制，是因为股四头肌主要负责膝伸展，其在膝屈曲时会主动收缩提供反向扭矩，避免在实验中产生不必要的膝屈曲。生理依据在于膝关节屈曲与伸展的协调控制对维持下肢稳定性至关重要；控制依据则来自实验中采用的自适应协同控制策略，在膝伸展方向实现对肌肉输出的精确调节。
","
    实验中仅在膝关节伸展方向应用协同控制的生理依据是股四头肌仅能提供膝关节伸展扭矩，无法实现屈曲动作；控制依据是系统安全性与任务目标的一致性，确保控制策略作用于可测量和可调节的方向。
    ",0.5,0.9807435352366412,0.5
"
为何在模型拟合中采用凸优化问题近似求解非线性非凸问题？
","['\nFirst, we deﬁne task-speciﬁc polynomial functions that represent how the parameters vary during stance for a set of ﬁxed tasks. For convenience, let sst be the stance phase (i.e., sst = s/sTO, where sTO is the phase at toe-off). Then, the impedance parameters for the p-th ﬁxed task χp are  Kχp =  d   kipsi  st, Bχp =  d   bipsi  st, θeq,χp =  d   eipsi st,  i=0  i=0  i=0  (2) where κχp = {(kip,bip,eip) | i ∈ {0,...,d}} is a set of constant coefﬁcients. Then, the coefﬁcients κνγ deﬁning the impedance parameter trajectories for an arbitrary task (ν,γ) are calculated through bilinear interpolation of its four nearest neighboring tasks κνn,γn, where νn ∈ {ν1,ν2},γn ∈ {γ1,γ2}. For all j elements in κνγ, this interpolation is  κj νγ =  ν2 − ν (ν2 − ν1)(γ2 − γ1)  ν − ν1    κj κj  ν1γ1  ν2γ1  κj κj  ν1γ2  ν2γ2  γ2 − γ γ − γ1    .  Finally, using κνγ and (2) evaluated at the current stance phase sst, the impedance parameters are calculated. Therefore, the model is fully deﬁned once each task-speciﬁc set of coefﬁcients κχp is calculated.  B. Model Fitting  We use an optimization-based approach to ﬁt the model for each task χp to a dataset of able-bodied walking [21]. The dataset contains kinematic and kinetic joint information from 10 participants walking at steady-state at 15 distinct points in the task space (γ ∈ {−10,−5,0,5,10} deg,ν ∈ {0.8,1.0,1.2} m/s). Therefore, for each task χp, we con- structed an optimization problem to identify the set of impedance parameter coefﬁcients κ∗ χp that, when used in (2) and the impedance control equation, best reproduced the mass- normalized joint torques τ in the dataset given the dataset kinematics (θ, ˙θ) over all n data points at χp:  κ∗ χp  where ˆτ = Kχp  1 ||τ − ˆτ||2 2, = argmin n θeq,χp − θ − Bχp ˙θ.  1) Solution Approximation: As written, (4) is difﬁcult to solve, as the product Kχpθeq,χp is nonlinear in the unknown parameters, and the overall objective function is non-convex. To avoid this problem, we solve a similar, convex problem and use its solution to approximate a solution to (4). First, we combine the product of Kχp and θeq,χp into a new, higher- order polynomial δχp with independent coefﬁcients δip: (5)\n']","
在模型拟合中，由于非线性非凸优化问题难以直接求解，研究者通过将原问题转化为高阶多项式形式并构建凸优化问题，从而近似求解该问题。这一方法通过构造凸函数目标和约束条件，提升了求解的可行性与稳定性。
","
    在模型拟合中采用凸优化问题近似求解非线性非凸问题的原因在于：原始问题中 Kχpθeq,χp 的乘积项导致目标函数在未知参数上是非线性的，使整体优化问题为非凸，难以求解。为克服此困难，研究通过将乘积项转化为一个新的高阶多项式 δχp，并赋予其独立系数 δip，从而构造一个可解的凸优化问题。使用该问题的解来近似原问题的解，能够在保证计算效率的同时获得可行的参数估计。
    ",0.6,0.9281687727805398,1.0
"
如何通过Bowden电缆和McKibben型气动人工肌肉实现外骨骼系统远端质量的优化与代谢代价的降低？
","['\nActuators Actuator choice for exoskeletons is targeted towards limiting the dis- tal mass and its costly metabolic impact218. Accordingly, actuators have been designed to minimize weight and to maximize power. For example, conventional motors can be applied to actuate rigid links and to establish sophisticated interfaces between exoskeletons and the body104,219,220. Bowden cables, which can transmit forces from a heavy actuator to lighter-weight distal components, have been applied in both autonomous117,118,145 and offboard devices77,79,82,85,115. Alterna- tively, McKibben-type pneumatic artificial muscles can distally apply sagittal-plane assistance34, with updated versions demonstrating metabolic benefit67,68,138,207. Other artificial-muscle technologies have also shown promise for reducing drop foot in people post-stroke221. Such soft inflatable actuators have been integrated into research devices for lateral ankle support222,223 and in commercial devices for recreational knee-injury prevention224. As a semi-active extension of a passive exoskeleton45, a proof-of-concept electroadhesive clutch has been designed to actively engage or disengage a spring when voltage is applied across a stack of thin electrode sheets225,226. These contrast with traditional mechanical clutches, which require a physical latch to engage or disengage a spring, requiring much more elaborate mech- anisms. Electrostatic clutches could allow for the design of passive joint-targeting exoskeletons that adapt to changes in speed, movement and the environment.  Simulation of forward dynamics High-fidelity simulations are an important tool for estimating the meta- bolic benefit of exoskeleton devices. Empirical techniques, such as HIL optimization, can optimize assistance in response to real-time  Nature Biomedical Engineering\n']","
通过将Bowden电缆与McKibben型气动人工肌肉结合，可以实现远端质量的优化：Bowden电缆将高质量的驱动部分与低质量的远端组件分离，McKibben型气动肌肉则在远端提供必要的助力，从而降低远端质量并优化代谢代价。此外，高保真度动力学仿真可进一步评估该系统在降低代谢成本方面的性能表现。
","
Bowden电缆通过将重载执行器的力传递至较轻的远端结构，减少穿戴者感知的远端质量，从而降低其代谢负担；McKibben型气动人工肌肉则通过在矢状面提供柔性辅助力，并已被研究证实可带来代谢效益。因此，两者协同应用可实现外骨骼系统远端质量的优化与代谢代价的降低。
    ",0.8,0.8980470477743672,1.0
"
文中提出的自适应助力控制算法如何降低代谢能量消耗？
","['\nA 2 minute recovery phase followed the squatting exercise. After the last series the subject was asked to give an opinion on which of the control methods he thinks were most helpful.  4. Results  Figures 2 – 5 show the measured oxygen consumption (VO2), minute ventilation (VE), heart rate (HR) and blood oxygen saturation (SpO2), respectively. All four ﬁgures show the responses for the 4 different squat- ting series – without the knee exoskeleton, and with  REST  1  2  3  4  5  REC  0  500  1000  1500  2000  2500  t[min]VO2[ml/min]  Free  Gravity  Oscilator  Position  Fig. 2. Average subject oxygen consumption during the  squatting exercises. Values before the exercise (REST) and during recovery (REC) are also shown. The + denotes signiﬁcant difference between Free and other methods.  all three control methods (gravity, oscillator, position). The physiological responses without the knee exoskele- ton were higher than the responses with the knee ex- oskeleton, regardless of the control method, as shown in Figures 2 – 4. We can see that the responses of blood saturation SpO2 were not affected by the exercise (Fig. 5).  The statistical analysis has shown that for oxygen consumption (VO2) there is a signiﬁcant difference (p< 0.01) between not using the knee exoskeleton (Free) and using the knee exoskeleton in the 3rd, 4th, 5th minute and in the recovery phase, regardless of the  3  5  20  10  REC  30  60  50  40  4  REST  70  90  80  2  1  Gravity  t[min]VE[l/min]  Free  Position  Oscilator  Fig. 3. Average subject minute ventilation during the squatting exercises. Values before the exercise (REST) and during recovery (REC) are also shown. The * denotes signiﬁcant difference between Free and both gravity and oscillator methods.  4  4  5  80  180  160  140  120  100  Free  Oscilator  t[min]HR[beats/min]  Gravity  2  3  1  REST  REC  60  Position  Fig. 4. Average subject heart rate during the squatting  exercises. Values before the exercise (REST) and during recovery (REC) are also shown. The * denotes signiﬁcant difference between Free and both gravity and oscillator methods.  used control method. Figure 6 shows a relative dif- ference in oxygen consumption when using the knee exoskeleton, compared to not using the knee exoskele- ton (Free). Statistically, no difference can be observed between the three control methods.  Minute ventilation (VE) is signiﬁcantly different (p<\n']","
文中提出的自适应助力控制算法通过提供主动助力，降低蹲起运动中身体肌肉的负荷，从而减少氧气消耗（VO2）和通气量（VE），心率（HR）也显著下降，表明该算法有效降低了代谢能量消耗。
","
文献无相关内容，无法确定文中提出的自适应助力控制算法如何降低代谢能量消耗。
    ",0.0,0.7547874628357341,0.0
"
文中提到外骨骼辅助如何影响疲劳前后LL重复时间？具体数据支持是什么？
","['\n66  0.200.20.40.60.811.2Normalized Sagittal Thorax Lean postfat active-exo  020406080100LL cycle (%)  Figure 5.7: Pre- and post-fatigue thorax lean profiles for LL in bare vs. exo conditions. The figure shows the across subject ensemble averaged thorax lean (sagittal thorax angle) profiles normalized to the peak value in the pre-fatigue bare condition. The prefat (pre-fatigue) plots consider the 10 LL repetitions before fatigue was declared, and similarly the postfat (post-fatigue) plots consider the 10 LL repetitions after fatigue declaration. The lifting and lowering repetitions are combined and time normalized from 0 to 100% of the squat cycle. The shaded regions show the SD about the mean.  in quadriceps activation was found with just 16 Nm peak assistance torque in a recent squat-only exoskeleton study [Arefeen and Xiang, 2023]. However, the posture of the subjects in [Arefeen and Xiang, 2023] was highly bent-over during the squat lifts, suggesting a much lower net knee extension torque was required for their task (for which 16 Nm is a higher percentage).  A fatiguing squat study reported a 25% decline in maximal quadriceps force after fatiguing exercises [Longpr´e et al., 2015], but we did not measure maximal quadriceps forces pre- and post- fatigue in our study. If we make relatively broad assumptions of a linear relationship between EMG and force [Staudenmann et al., 2010], and consider fast LL as a maximal activity for the quadri- ceps, the 33% savings in peak quadriceps force afforded by the exoskeleton was likely sufficient to fully overcome the supposed 25% deficit in force from the induced fatigue. This could explain how the exoskeleton assistance enabled the subjects to significantly reduce their time to complete 10 LL repetitions post-fatigue by 33% and with better posture (3 degrees decrease in global tho- rax angle), see Fig. 5.5. In fact, the exoskeleton assistance practically maintained the pre-fatigue LL duration levels in post-fatigue (Fig. 5.3), suggesting a full replenishment of the post-fatigue quadriceps force deficit. On the other hand, the LL durations in the bare condition increased with post-fatigue repetitions, indicating an increasing trend in fatigue. The mean LL repetition dura- tions prior to declaring fatigue have quite similar magnitudes for both conditions, suggesting the  67\n']","
文中指出外骨骼辅助显著降低了疲劳后完成10次LL重复所需的时间，减少了33%。此外，外骨骼改善了胸骨前倾角（减少3度），表明姿态优化与肌肉力量恢复相关。该结论基于图5.5和图5.7中胸骨前倾角变化的间接推导。
","
外骨骼辅助显著减少了疲劳后完成10次LL重复的时间，具体表现为33%的时间节省，并使LL重复时间维持在疲劳前水平；相比之下，无外骨骼条件下疲劳后LL重复时间延长。该效果归因于外骨骼提供的33%峰值股四头肌力量节省，足以弥补疲劳引起的约25%力量下降。
    ",0.8333333333333334,0.8536074459865359,0.5
"
非升力型弹簧刚度函数是如何根据膝关节角度和角速度实现自适应调节的？
","['\n) is the non-ascent spring stiffness function based on θmax  kd  kd  ) = kna ·σ(θmax  kd  kd  At the core, the LL spring is a standard virtual torsion spring at the knee with a fixed neutral point of 0 degrees knee flexion. The spring stiffness is however tapered in a nonlinear fashion dependent on knee angular velocity and knee angle itself. At a high level, the spring was designed to become more compliant with higher magnitudes of knee flexion angular velocity, such that it minimally impedes the intentional lowering (knee flexion) portion of LL but also provides a strong boost for the intentional lifting (knee extension) portion. Further, we modified the angular velocity dependence by the depth of the squat, i.e., the amount of knee flexion angle. For deeper squats the spring stiffness is less sensitive to knee flexion angular velocity. This feature helped to provide a bracing effect at the bottom of the squat (a biomechanically compromised position) as the knee flexion velocity decreased. The LL spring has the form  τLL = kLL·θk·σ( ˙θk,mLL1,x1·σ(θk,mLL2,dLL)+x2)·Fipsi  GRF  where kLL is the spring constant of the LL spring, x1, x2 ∈ R scale and shift the knee angle- modulating sigmoid respectively, and Fipsi GRF is the GRF normal to the ipsilateral foot normalized by body weight.  45  (4.3)  (4.4)  The basis function for partial gravity compensation during stance has the form  τgravst = gst·sin(θth)·Fipsi  GRF·step(θth)  where gst scales the magnitude of gravity compensation for stance, and θth is the global thigh segment angle. The unit step function restricts the torque to only flexion torques which were found to be helpful in propelling the body forward in late stance and allow a smooth transition to the flexion torque required for foot clearance in early swing.  4.2.0.2 Task sensitization\n']","
非升力型弹簧刚度函数通过结合膝关节角度和角速度的模态调节，实现自适应控制。其刚度函数形式为 τLL = kLL·θk·σ( ˙θk,mLL1,x1·σ(θk,mLL2,dLL) + x2 )·Fipsi GRF，其中 sigmoid 函数 σ 对角度和角速度进行非线性映射，使弹簧在不同运动阶段（如深蹲初期和末期）表现出不同的刚度特性：在屈曲速度较低时提供制动支撑，在屈曲速度较高时增强柔顺性，从而实现对膝关节助力与限制的动态调节。
","
    非升力型弹簧刚度函数通过膝关节角度（θk）和角速度（θ̇k）的双依赖机制实现自适应调节：在膝关节屈曲角速度较高时降低刚度以减少运动阻碍，在蹲姿更深时减弱对角速度的敏感性以增强支撑作用。其刚度函数形式为 τLL = kLL·θk·σ(θ̇k, mLL1, x1·σ(θk, mLL2, dLL)+x2)·Fipsi_GRF，其中包含了对膝角和角速度的非线性调制。
    ",1.0,0.9280492479773488,1.0
"
文中提到的基于sEMG信号与Hill型肌肉模型结合的神经网络如何实现关节力矩估计？
","['\nREFERENCES  [21] J. Liu, “Establishment of national standard about inertial parameters of chinese adults,” Ph.D. dissertation, Beijing Sport University, 2004. [22] J. Park, S. Woo, J.-Y. Lee, and I. S. Kweon, “Bam: Bottleneck attention  module,” arXiv preprint arXiv:1807.06514, 2018.  [1] X. W. Z. D. Shi, “Novel lightweight lower limb exoskeleton design for single-motor sequential assistance of knee and ankle joints in real world,” IEEE Robotics and Automation Letters, vol. 3, pp. 2391–2398, 2024.  [2] Z. Wu, M. Yang, Y. Xia, and L. Wang, “Mechanical structural design and actuation technologies of powered knee exoskeletons: A review,” Applied Sciences, vol. 13, no. 2, p. 1064, 2023.  [3] Y. J. Pak, A. Koike, H. Watanabe, T. Terai, H. Kubota, M. Takahashi, H. Konno, J. Kato, I. Nishi, A. Sato et al., “Effects of a cyborg-type robot suit hal on cardiopulmonary burden during exercise in normal subjects,” European Journal of Applied Physiology, vol. 119, pp. 487–493, 2019. [4] C. Siviy, L. M. Baker, B. T. Quinlivan, F. Porciuncula, K. Swaminathan, L. N. Awad, and C. J. Walsh, “Opportunities and challenges in the de- velopment of exoskeletons for locomotor assistance,” Nature Biomedical Engineering, vol. 7, no. 4, pp. 456–472, 2023.  [23] Q. Wang, B. Wu, P. Zhu, P. Li, W. Zuo, and Q. Hu, “Eca-net: Efficient channel attention for deep convolutional neural networks,” in Proceedings of the IEEE/CVF conference on computer vision and pattern recognition, 2020, pp. 11534–11542.  [24] S. Bai, J. Z. Kolter, and V. Koltun, “An empirical evaluation of generic convolutional and recurrent networks for sequence modeling,” arXiv preprint arXiv:1803.01271, 2018.  [25] N. Q. K. Le, J. Yao, Z. Cai, Z. Qian, and B. Yang, “A noval approach based on tcn-lstm network for predicting waterlogging depth with waterlogging monitoring station,” Plos One, vol. 18, no. 10, p. 0286821, 2023.  [26] S. Liu, T. Xu, X. Du, Y. Zhang, and J. Wu, “A hybrid deep learning model based on parallel architecture tcn-lstm with savitzky-golay filter for wind power prediction,” Energy Conversion and Management, vol. 302, p. 118122, 2024.  [5] C. A. Doorenbosch and J. Harlaar, “Accuracy of a practicable emg to force model for knee muscles,” Neuroscience letters, vol. 368, no. 1, pp. 78–81, 2004.  [6] D. Xu, Q. Wu, and Y. Zhu, “Development of a semg-based joint torque estimation strategy using hill-type muscle model and neural network,” Journal of Medical and Biological Engineering, vol. 41, pp. 34–44, 2021.\n']","
基于sEMG信号与Hill型肌肉模型结合的神经网络实现关节力矩估计的步骤如下：首先，采集用户的sEMG信号作为输入特征，该信号反映肌肉的激活程度；其次，利用Hill型肌肉模型对肌肉力-长度和力-速度关系进行建模，以获得肌肉的输出力矩；随后，将sEMG信号与肌肉模型参数输入神经网络，通过非线性映射关系估计目标关节的力矩输出；最后，该估计结果可用于外骨骼系统的控制决策中。
","
    基于sEMG信号与Hill型肌肉模型结合的神经网络通过将表面肌电信号作为输入特征，并融合Hill型肌肉模型所提供的生物力学先验知识，构建非线性映射关系，从而实现对关节力矩的准确估计。sEMG信号经预处理后输入神经网络，同时Hill型模型模拟肌肉力动态，辅助提升估计精度与生理合理性。
    ",0.125,0.9662898857213414,1.0
"
在包含复杂反射回路的CPG控制结构中，如何实现对全身扰动和其他扰动的响应选择性增强？
","['\nmodulated by sensory feedback (Figure 4C). For example, phase shifts in CPG activations in response to perturbations, which is called phase resetting (Figure 4C-a), have been observed in cats (Conway et al., 1987; Schomburg et al., 1998) and have been proposed to increase the robustness of human walking (Yamasaki et al., 2003; Aoi et al., 2010). However, the responses observed in the disturbance experiments considered in this study do not seem to originate from phase resetting of CPGs since they are transient responses rather than persistent phase shifts. Finally, CPGs have also been proposed to be continuously modulated by sensory feedback in many models, where the muscle responses result from more complicated CPG dynamics (Taga et al., 1991; Ogihara and Yamazaki, 2001; Hase and Yamazaki, 2002; McCrea and Rybak, 2008; Figure 4C-b). CPGs are usually modeled to consist of mutually inhibiting neurons with internal dynamics (Matsuoka, 1985), and many human walking models (Taga et al., 1991; Ogihara and Yamazaki, 2001; Hase and Yamazaki, 2002) incorporate continuous sensory feedback modulation of CPGs by adding aﬀerent signals to this internal dynamics (for example, in the form of τ ˙u = −u + other-terms + feedback, where τ is a time constant and u is the neural output). In this case, the muscle responses are likely to be slower and smaller, since the disturbance signals need to be integrated to appear in the neural outputs of the CPGs. Therefore, in order to explain both steady and reactive behaviors during human walking with control structures in which CPGs generate muscle activations, more complicated reﬂex circuits may be necessary that selectively amplify the responses not only for the whole body disturbances but also for the other disturbances.\n']","
在包含复杂反射回路的CPG控制结构中，全身扰动和其他扰动的响应选择性增强主要通过引入额外的反馈机制或反射回路实现。这些机制能够增强特定扰动在CPG动态中的作用，从而提升对全身扰动和其它扰动的适应性响应。文献表明，CPG通常由相互抑制的神经元组成，并通过在内部动力学中加入感觉反馈信号（如τ˙u = −u + 其他项 + 反馈）实现调节，但这种方式导致肌肉响应较慢，因此需要额外的反射回路来增强扰动响应。
","
    在包含复杂反射回路的CPG控制结构中，为实现对全身扰动和其他扰动的响应选择性增强，需引入具有独立动态的复杂反射回路。这些回路能够快速响应扰动信号，并选择性地放大特定扰动引发的神经输出，从而增强对不同扰动类型的适应性反应。
    ",1.0,0.9766509892450322,0.75
"
文中提到的自适应助力控制算法如何降低代谢能量消耗？
","['\nFollowing this, the sweep session began with a reference sitting condition lasting three minutes. After completing a five-minute cycling warmup in transparent mode (zero motor current), a two-minute interval followed where data from cycling in the transparent mode were gathered for analysis. Subsequently, the sweep [31] was executed, comprising several stages: (1) a constant phase lasting two minutes with the earliest peak torque timing, (2) a rising phase lasting ten minutes with increasing timing, (3) another constant phase lasting two minutes with the latest timing, (4) a falling phase lasting ten minutes with decreasing timing, and (5) a final constant phase lasting two minutes with the earliest timing. During the rising phase, the timing of the peak extension torque was adjusted from 10% to 40% of the pedal stroke, and for the peak flexion torque, it was adjusted from 60% to 90%. We notably standardized the peak flexion torque to consistently maintain a 50% offset relative to the peak extension torque. This adjustment accommodates the inherent offset in muscle activity between flexors and extensors, thereby effectively minimizing the number of control parameters for both the sweep and HITL sessions. The timing adjustments  5 of 14  Bioengineering 2024, 11, 683\n']","
自适应助力控制算法通过动态调整峰值伸展扭矩和峰值屈曲扭矩的时序（从10%-40%和60%-90%变化），并保持其50%的时序偏移关系，减少了控制参数数量，优化了肌肉激活与助力输出的匹配性，从而降低代谢能量消耗。
","
文献无相关内容。
    ",0.8333333333333334,0.9317050999442378,0.0
"
文中重力补偿任务敏感控制的基函数形式及其在步态周期中的作用机制是什么？
","['\n) is the non-ascent spring stiffness function based on θmax  kd  kd  ) = kna ·σ(θmax  kd  kd  At the core, the LL spring is a standard virtual torsion spring at the knee with a fixed neutral point of 0 degrees knee flexion. The spring stiffness is however tapered in a nonlinear fashion dependent on knee angular velocity and knee angle itself. At a high level, the spring was designed to become more compliant with higher magnitudes of knee flexion angular velocity, such that it minimally impedes the intentional lowering (knee flexion) portion of LL but also provides a strong boost for the intentional lifting (knee extension) portion. Further, we modified the angular velocity dependence by the depth of the squat, i.e., the amount of knee flexion angle. For deeper squats the spring stiffness is less sensitive to knee flexion angular velocity. This feature helped to provide a bracing effect at the bottom of the squat (a biomechanically compromised position) as the knee flexion velocity decreased. The LL spring has the form  τLL = kLL·θk·σ( ˙θk,mLL1,x1·σ(θk,mLL2,dLL)+x2)·Fipsi  GRF  where kLL is the spring constant of the LL spring, x1, x2 ∈ R scale and shift the knee angle- modulating sigmoid respectively, and Fipsi GRF is the GRF normal to the ipsilateral foot normalized by body weight.  45  (4.3)  (4.4)  The basis function for partial gravity compensation during stance has the form  τgravst = gst·sin(θth)·Fipsi  GRF·step(θth)  where gst scales the magnitude of gravity compensation for stance, and θth is the global thigh segment angle. The unit step function restricts the torque to only flexion torques which were found to be helpful in propelling the body forward in late stance and allow a smooth transition to the flexion torque required for foot clearance in early swing.  4.2.0.2 Task sensitization\n']","
文中重力补偿任务敏感控制的基函数形式为 τgravst = gst·sin(θth)·Fipsi_GRF·step(θth)，其中 gst 为步态阶段重力补偿比例因子，θth 为股骨段角度，Fipsi_GRF 为内侧足部正向地面反作用力，step(θth) 限制屈曲方向力矩。该基函数在支撑阶段根据步态角度变化动态调节重力补偿，实现对支撑末期身体推进和摆动初期足部离地的敏感控制。
","
文中重力补偿任务敏感控制的基函数形式为 τgravst = gst·sin(θth)·Fipsi_GRF·step(θth)，其中 gst 为补偿幅度因子，θth 为大腿段角度，Fipsi_GRF 为归一化地面反力，step(θth) 限制扭矩仅在屈曲方向作用。该机制在支撑相后期提供推进力，并在支撑向摆动过渡时辅助足部离地，实现任务敏感控制。
    ",0.875,0.8922921654494705,1.0
"
生物膝关节在步态周期中如何通过能量传递影响髋关节的功率生成？
","['\nIn addition to the observed changes at the knee joint, walking with knee extension assistance substantially affected joint dynamics at the hip. To maintain the whole-body base of support and avoid falling forward, the increase in knee extension was coupled with an increase in extension at the hip. This was evidenced by the fact that the participants who exhibited greater improvements in knee extension also exhibited greater improvements in hip extension, and offers one possible explanation for the increase in activity for the hip extensor muscles (i.e. semitendinosus). The increased hip extension was combined with a reduction in the hip extensor moment (shift of the hip moment in the flexor direction), leading to an overall more favorable dynamic posture.  Together, the observed biomechanical changes explain the proximal shift in joint power across the lower extremity during walking with knee extension assistance. During early-mid stance, the increase in semitendino- sus activity combined with increased hip extension suggests that the hamstrings acted concentrically to improve posture and aid forward progression of the center of mass. During late stance of typical gait patterns, the hip flexors provide a propulsive force during “pull-off” and energy flows from the knee to the hip via bi-articular muscles41. While there were no changes in biological knee joint energy generation or absorption during early and late stance, mechanical energy absorption from the exoskeleton during late stance (pre-swing) likely contributed to the increase in biological hip joint energy generation. This was corroborated by the increase in rectus femoris muscle activity in terminal stance during walking with assist on compared to baseline and assist off.  Walking with knee extension assistance resulted in minimal changes in ankle function. With the foot planted on the ground, the external torque from the exoskeleton acted to rotate the thigh away from the shank, rather than the shank from the thigh, as demonstrated by the lack of change in ankle plantar-flexion angle, which likely contributed to the lack of increased energy generation at the ankle for exoskeleton assist-on while the additional inertia from the exoskeleton likely resulted in elevated energy absorption and generation during late stance at  9\n']","
生物膝关节在步态周期中通过提供膝关节伸展辅助，影响髋关节的功率生成主要体现在：在早期-中期支撑期，膝伸展辅助与髋伸展增强耦合，改善重心前移趋势；在晚期支撑期，机械能从膝关节经二头肌等跨关节肌群传递至髋关节，促进髋关节能量生成；此外，外骨骼在髋关节处的惯性效应也增强了髋关节的能量输出。
","
    在步态周期中，生物膝关节通过双关节肌肉（如股直肌和半腱肌）将机械能传递至髋关节，尤其在支撑末期促进髋关节的能量生成。尽管膝关节自身在生物能量方面无显著变化，外骨骼在支撑末期对膝关节的机械能吸收有助于提升髋关节的功率输出，同时股直肌活动增强进一步支持该能量传递机制。这种跨关节的能量流动导致下肢功率生成向近端转移，表现为髋关节功率增加。
    ",0.5,0.9779245005704256,0.5
"
混合控制器中基于阻抗模型的支撑相控制与基于运动学模型的摆动相控制是如何协同工作的？
","['\nThe remainder of this paper is organized as follows. Section II details the optimization process for calculating the continu- ous impedance parameter models for stance. Then in Section III, we deﬁne the hybrid controller based on this impedance model for stance and our previous kinematic model [20] for swing. We further deﬁne a new task-invariant phase variable and incline and speed estimation methods that allow the controller to operate fully autonomously. Section IV describes the experiments in which a participant with an above-knee amputation compared the controller proposed in this work with a hand-tuned FSM impedance controller. Finally, in Section V, we discuss the results, study limitations, and future work.  II. VARIABLE IMPEDANCE MODEL FOR STANCE  A. Model Framework  To use impedance control for the stance phase of the gait cycle in a continuous, phase-based control framework, we require a model analogous to the kinematic model developed in [20] that describes how the impedance parameters (K,B, and θeq) evolve during stance. Speciﬁcally, we require the impedance parameter model to be continuously parameterized by both gait phase s and task χ = (ν,γ), where task is deﬁned by the current walking speed ν and ground incline γ over the range −10 ≤ γ ≤ 10 deg and 0.8 ≤ ν ≤ 1.2 m/s.  A model that meets these criteria can be constructed from linear combinations of phase-varying polynomials, where the linear combination weights depend on task. Polynomial func- to model parameter progression tions of phase are useful during stance because they are simply parameterized and can represent arbitrary aperiodic signals. We use fourth order polynomials (d = 4), as they allow sufﬁcient ﬂexibility to model the parameter behavior without overﬁtting. Once the appropriate polynomial functions are identiﬁed for individual  2  tasks in a dataset, bilinear interpolation can be used to create a uniﬁed, continuous model with task and phase inputs  First, we deﬁne task-speciﬁc polynomial functions that represent how the parameters vary during stance for a set of ﬁxed tasks. For convenience, let sst be the stance phase (i.e., sst = s/sTO, where sTO is the phase at toe-off). Then, the impedance parameters for the p-th ﬁxed task χp are  Kχp =  d   kipsi  st, Bχp =  d   bipsi  st, θeq,χp =  d   eipsi st,  i=0  i=0  i=0\n']","
在混合控制器中，基于阻抗模型的支撑相控制与基于运动学模型的摆动相控制通过共享一个任务不变的相位变量协同工作。支撑相采用由步态相位和任务参数（如行走速度和坡度）驱动的连续阻抗参数模型，使用四阶多项式函数建模参数变化；摆动相则基于运动学模型估计关节状态并进行控制。两者通过融合任务不变的相位变量实现自适应调节，使控制器在步态周期中实现连续、自主的协同控制。
","
    混合控制器中，支撑相采用基于阻抗模型的控制，通过四阶多项式连续参数化阻抗参数（K, B, θeq），并依赖于步态相位 s 和任务参数 χ（ν, γ）；摆动相则基于文献[20]的运动学模型，描述关节运动模式。两者通过任务不变相位变量协调，并结合坡度与速度估计方法，实现步态周期内的无缝切换与自适应控制。
    ",0.6666666666666666,0.9081515633000924,0.75
"
在评估外骨骼服组件的刚度时，为何使用刚性假人而不直接在人体上进行测试？
","['\nFIGURE 5. TESTING CONDITIONS USED TO ANALYZE THE STIFFNESS OF THE EXOSUIT COMPONENTS: (A) RAW TEXTILE, (C) EXOSUIT ON (B) BOWDEN CABLE, MANNEQUINM, AND (D) EXOSUIT ON HUMAN.  FIGURE 6. STRAINS IN THE TEXTILES VS. APPLIED FORCE. ARROWS INDICATE THE DIRECTION OF THE HYSTERESIS LOOPS.  For the subsequent three tests (Figure 5B-D), the multi-joint actuation unit was used to create forces in the suit via a Bowden cable [20]. The system, previously described in [20], is equipped with several sensors logging data at 1 kHz to track the displacement of the actuator and the force applied to the suit. The Bowden cable actuator contains a linear potentiometer (P3 America, Inc.) with a resolution of 0.1 mm to measure  4  Copyright © 2015 by ASME  displacement of the actuation cable. A Futek load cell with a measuring range of ±445 N (2N resolution) is placed at the distal end of the Bowden cable to measure the force applied. All subsequent the cable displacement at the actuator and the force at the distal load cell. To assess the stiffness of the cable and actuation system itself, both ends of the Bowden cable were fixed and a force of 300 N was applied and removed linearly over a period of 3 seconds, as shown in Figure 5B.  tests used  these measurements of  The stiffness of each structured functional textile component was characterized by placing the suit component on a mannequin, as shown in Figure 5C. Using a rigid mannequin permits the stiffness of the finished suit component to be measured without including the compliance of the human underneath. The component was placed on the vertical leg (mid- stance of gait cycle) of a fixed fiberglass mannequin. The distal end of the Bowden cable sheath was fixed on a rigid testing frame, and the inner cable was anchored to the component (right side). A maximum force of 250 N was applied and removed linearly over a period of 3 seconds. This process was repeated three times for each component, donning and doffing the component each time.\n']","
在评估外骨骼服组件的刚度时，使用刚性假人而非直接在人体上进行测试的原因包括：避免个体生理差异带来的测试结果不稳定；排除人体组织的弹性影响，确保测量的准确性；便于实现重复性、可控制的力-位移实验；以及提高测试数据的一致性和可重复性。
","
    使用刚性假人评估外骨骼服组件刚度是为了排除人体柔顺性对测量结果的干扰，确保测试条件的一致性和可重复性，从而准确反映组件本身的刚度特性。文献明确指出，这种方法能够独立于人体的顺应性进行刚度评估。
    ",1.0,0.9959876951222688,1.0
"
文中列举了哪些外骨骼设备被用于脊髓损伤或中风患者的步态康复训练？
","['\ncompared with walking without the exoskeletons14–16. Therefore, lighter-weight hardware and autonomous systems were developed and tested in goal-driven experiments, with single-joint systems tested to explore underlying biological mechanisms. These technological advances ultimately enabled exoskeletons to meet the envisioned objectives of reducing the metabolic cost during loaded or unloaded locomotion for military, industrial and recreational applications.  Alongside the development of exoskeletons to enhance the performance of load carriage, devices (in particular, the Lokomat17, Gait Trainer18, lower extremity powered exoskeleton (LOPES)19, active leg exoskeleton (ALEX)20,21 and Rutgers Ankle22) were designed to mechanize physical therapy for individuals re-learning to walk fol- lowing spinal-cord injury (SCI) or stroke. Common clinical practice calls for physical therapists to manually move the feet and legs of non-ambulatory patients through the motions of walking to facili- tate re-learning of movement patterns for functional improvement23. Robotic devices were developed to offload this burden from physical therapists and to improve patient outcomes by delivering precise interventions and training at optimal intensities, unconstrained by the limits of manual assistance. Exoskeletons initially failed to show clinical improvements that would justify their cost compared to traditional  1John A Paulson School of Engineering and Applied Sciences, Harvard University, Cambridge, MA, USA. 2Department of Physical Therapy, College of Health and Rehabilitation Sciences: Sargent, Boston University, Boston, MA, USA. 3These authors contributed equally: Christopher Siviy, Lauren M. Baker.  e-mail: walsh@seas.harvard.edu  Nature Biomedical Engineering  non-robotic gait-training methods24–30. However, a better understand- ing of the underlying biomechanics and physiology led to an improve- ment in exoskeleton design, including biologically inspired strategies for actuation and control31–36. For example, ‘patient-cooperative control’ has been implemented in devices for gait rehabilitation to allow for more individualized assistance37–43. Such ‘assist as needed’ approaches are particularly important for augmenting the gait of individuals with some residual walking function while encouraging their own contributions.  a  Unimpaired weight-bearing  b  Unimpaired joint-targeting\n']","
文中列举的用于脊髓损伤或中风患者步态康复训练的外骨骼设备包括：Lokomat、Gait Trainer、lower extremity powered exoskeleton (LOPES)、active leg exoskeleton (ALEX) 和 Rutgers Ankle。
","
文中列举的用于脊髓损伤或中风患者步态康复训练的外骨骼设备包括：Lokomat、Gait Trainer、下肢动力外骨骼（LOPES）、主动腿部外骨骼（ALEX）以及Rutgers Ankle。
    ",1.0,0.9877026624640348,1.0
"
M-BLUE外骨骼系统在测量关节角度时为何优先选择IMU而非编码器？技术依据是什么？
","['\n3.6 Human Subject Methods: Study 2  In study 2, the M-TOES controller was generalized for different joint modules, and implemented on the M-BLUE exoskeleton system. The experimental methods for validating different configurations with healthy human subjects performing multiple ADLs are presented next.  3.6.1 Hardware Implementation: Study 2  The controller was implemented on M-BLUE shown in Fig. 3.4 (see [Nesler et al., 2022] for de- tails). The unilateral knee and hip modules weigh 2.36 kg and 2.15 kg, respectively, including the battery. M-BLUE combines commercial off-the-shelf orthoses with a quasi-direct drive actuator— the T-motor AK80-9 which comprises a high-torque electric motor with an internal 9:1 planetary gearbox. This actuator is highly backdrivable with less than 0.5 Nm static backdrive torque. It can  31  Figure 3.4: M-BLUE hip-only and knee-only exoskeleton configurations worn by a healthy user (with an unpowered ankle brace in the knee-only configuration to support the mass of the knee actuator).  32  provide 9 Nm continuous torque and 18 Nm peak torque according to the manufacturer, though we verified up to 30 Nm peak torque using the Dephy FASTER ActPack driver in our own bench- top calibration [Nesler et al., 2022]. This modular exoskeleton facilitates bilateral/unilateral knee and/or hip configurations to match different use cases.  The high-level control loop ran at ∼ 200 Hz on an 8 GB RAM Raspberry Pi 4B for each leg, where bilateral configurations communicated with each other through ZeroMQ, a TCP based package. Sagittal-plane joint angles and global segment angles were measured by two 6-axis Mi- crostrain IMUs attached to the brace straps around each limb segment. The joint angles were obtained by taking the difference between the global angles of adjacent segments, which mostly bypassed the compliance between the actuator and limb segment to give more accurate joint mea- surements than the actuator encoders. In fact, soft-tissue and strap compliance caused vibrations when using the joint encoders, which was avoided by using the IMU-based joint measurements. M-BLUE was powered by a 24 V, 2 Amp-hour Kobalt powertool battery (∼ 470 g) attached to a 3D printed adapter mounted on the side of each orthosis.\n']","
M-BLUE外骨骼系统在测量关节角度时优先选择IMU而非编码器，是因为IMU能够避免执行器与肢体段之间的顺应性引起的振动，从而获得更准确的关节角度测量。文献中指出，关节角度是通过相邻肢体段的全局角度差计算得出，而这种方式绕过了执行器与肢体段之间的顺应性，因此在使用IMU时无需依赖关节编码器的高精度信号，同时避免了因编码器引起的振动问题。
","
    M-BLUE外骨骼系统优先选择IMU而非编码器用于关节角度测量的技术依据包括：IMU能够绕过执行器与肢体之间的机械柔顺性，从而提供更准确的关节角度；避免了因软组织和绑带柔顺性引起的振动问题；并能通过相邻肢体段全局角度差直接获取真实的人体关节角度，具有更高的稳定性和动态适应性。
    ",0.8333333333333334,0.9894420171553304,1.0
"
文中提到的基于ARM Cortex-M4F的MCU在外骨骼控制系统中承担了哪些关键任务？
","['\nEmbedding the CV methods is a critical point for an active prosthesis design. The required computational power is a major concern not only to perform activities such as feature extraction and classiﬁcation but also to save power for longer operation. From the mentioned approaches, [28], [27], [26] have applied their methods to real-time process- ing but carried on in a laptop with no critical constraints in terms of CPU bandwidth and power consumption. On the other hand, [19] developed the embedded CV method supported by a digital signal processor (DSP) and an analog to digital converter (ADC) of 16,000 samples per second to perform high ﬁltering, feature extraction, multiplications and calculation of a max function. The work shown by [20] employed a myoelectric pattern recognition system (MPR) with low power micro-controller unit (MCU) of 32 bits with an embedded ﬂoating point unit based on ARM Cortex- M4F. The MCU was utilized to perform pattern recognition. The system developed in [21] made use of two evaluation boards, one with a 16-bit ADC and another with a Digital to Analog Converter (DAC). The data processing and pattern recognition were being executed on an ARM Cortex-A8 processor.  A number of works have been done towards evaluating and comparing the computational complexity, performance, and/or power consumption of different CV algorithms on various platforms. For example, [29] studied the trade-off of speed and accuracy of different object detection algorithms; [30] tested classic CV tasks on mobile devices. Vision algorithms were also evaluated on embedded platforms based on speciﬁc metrics developed for different applications (e.g. unmanned aerial vehicles [31], driver assistance systems [32] and automotive applications [33]). Other benchmark comparison were also presented by [34], [35], [36].\n']","
基于ARM Cortex-M4F的MCU在外骨骼控制系统中承担了肌电信号模式识别（MPR）的关键任务，并在低功耗条件下实现了特征提取与分类运算，支持实时交互控制。
","
基于ARM Cortex-M4F的MCU在外骨骼控制系统中主要承担了肌电信号的模式识别任务，具备32位低功耗处理能力及浮点运算支持，适用于实时模式识别和节能运行，但未明确涉及执行机构控制或传感器融合任务。
    ",0.6666666666666666,0.9795212478483616,1.0
"
多通道MMG方法在不同运动强度下的扭矩估计中展现了怎样的鲁棒性？
","['\nFig. 6. Scatter plot of estimated and measured torque.  can estimate bidirectional motions (extension and ﬂexion) with performance comparable to that of EMG.  Two channels, one for the leading muscle and the other for the antagonist muscle, are commonly measured with EMG to estimate bidirectional muscle force in ﬂexion-extension. The comparison between Trial 2 and Trial 4 shows that two channels are required for bidirectional torque estimation in MMG as well. Although the raw data in Fig. 4 show no signiﬁcant difference between the results of the lead and antagonist muscles, the results of Trial 4 show that the SVR estimates muscle torque from the small difference in the lead and antagonist muscles. The difference between Trials 4 and 6 is the use of the internal and external MMG signals, which do not occur directly above the main movement muscle during ﬂexion and extension. The higher performance of Trial 6 suggests that the internal and external MMG signals contain the necessary information for knee ﬂexion-extension motion estimation.  SVR based on 2 and 4ch MMG (Trials 4, 6) showed better performance than other MMG methods, and 4 ch MMG (Trial 6) R2 did not differ signiﬁcantly from that of EMG (Trial 1) (Fig. 5). This result shows that using multiple chan- nels is effective in improving muscle torque estimation based on MMG. It also shows that MMG with multiple channels  C. DependencyonExerciseIntensity  Fig. 6 shows a scatter plot of the estimated and measured torques obtained from the test subset in Trial 6. The x-axis  HONDO AND TSUJI: TORQUE ESTIMATION OF KNEE FLEXION AND EXTENSION MOVEMENTS  response characteristics, which change slightly depending on the location of the MMG sensor. To demonstrate the effec- tiveness of this method, we conducted a test to estimate the torque at each of the four levels for the knee joint ﬂexion and extension motion tasks in both directions. Continuous muscle torque was estimated from nine levels of exercise intensity at rest and during the four levels of ﬂexion and extension. The RMS of the obtained signals was processed using a low-pass ﬁlter, and regression was performed.  For comparison, sEMG was also measured simultaneously. As a baseline method, we also validated the conventional method of measuring MMG with a single sensor.  Fig. 7. Dependency on exercise intensity.\n']","
多通道MMG方法在不同运动强度下的扭矩估计展现出良好的鲁棒性，其在2通道和4通道配置下均能实现与sEMG相当的估计性能，并在不同运动强度水平（静息及四个强度等级）下保持一致性，表明其具备适应不同运动状态的能力。
","
多通道MMG方法（尤其是结合SVR算法的4通道MMG）在不同运动强度下的扭矩估计中展现出良好的鲁棒性，其估计性能与EMG方法相当，显著优于单通道MMG方法，能够稳定适应从静息到多个屈曲-伸展强度等级的任务需求。
    ",0.8333333333333334,0.9610687078108414,1.0
"
在步行和慢跑测试中，FFM的作用效果是如何进行对比评估的？
","['\n. The profile shape was designed based on the hip extension moment during jogging at 2 m/s [40]. Both tests for walking and jogging were performed on two conditions, with or without the FFM to compare the effect of the FFM. The admittance gains were tuned as same for both control schemes. We combine two independent parameterized sinusoidal curves at the peak as the first and second halves to represent a fraction of the simplified biological hip moment. This approach enables the system to quickly change to different magnitude, shape, and timings of assistive profiles by changing parameters of the two sinusoidal curves as shown in (9). sin2\n']","
在步行和慢跑测试中，FFM的作用效果通过在两种条件下（含FFM与不含FFM）进行对比评估实现：测试中采用参数化的正弦曲线模拟髋关节力矩，并通过调整参数实现辅助波形的动态变化。同时，admittance gains在两种控制方案中保持一致，以消除增益差异的影响。最终通过比较两种状态下的系统响应或用户表现，评估FFM在不同步态模式下的辅助效果。
","
    在步行和慢跑测试中，FFM的作用效果是通过对比有无FFM条件下受试者的髋关节辅助力矩与运动表现进行评估的。研究在相同导纳控制增益下进行两种运动模式的测试，采用参数化正弦曲线建模髋关节力矩，以评估FFM在幅度、形状和时序上的动态辅助效果。
    ",0.8,0.9325428707110456,1.0
"
相较于未引入足底压力反馈的vBWS控制器，引入垂直地面反作用力反馈在助力控制中解决了什么关键问题？
","['\n1.2 Contributions and organization of the Dissertation  In chapter 2, I improve and assess an existing task-invariant control scheme by implementing a custom foot pressure sensor for Comex 1 and perform preliminary in-vivo validation. My group’s prior work [Lv et al., 2018] developed the first version of a partial assistance controller that reduced  6  the effect of gravity on the wearer’s joints by way of a nonlinear controls technique of (potential) energy shaping. In effect it provided virtual body weight support (vBWS). Since this assistance scheme transcends the need to be pre-programmed for a particular activity/task, it is fundamentally “task-invariant”. However, vBWS does not consider body weight load distribution between the two limbs during double support phases, causing excessive assistance torques by assuming all bodyweight is supported by a single limb (single support). By utilizing the vertical ground reaction force (vGRF) feedback from a custom designed force sensing foot plate, chapter 2 significantly improves the vBWS controller for double support phases, and investigates its efficacy on a single healthy subject for multiple activities of daily living (ADLs) using Comex 1. Experimental results suggest that vBWS with vGRF is an effective assistance scheme for slow activities such as getting up from a chair and performing a squat.\n']","
引入垂直地面反作用力（vGRF）反馈解决了原有vBWS控制器在双支撑阶段假设单肢承载全部体重而产生的辅助力矩过大的问题，从而提升了控制器对双肢体重分布的适应能力与助力效果。
","
引入垂直地面反作用力（vGRF）反馈解决了未引入足底压力反馈的vBWS控制器在双支撑相中错误假设体重仅由单肢支撑所导致的过度辅助力矩问题，从而实现更精确的体重分配建模与任务适应性更强的助力控制。
    ",1.0,0.8185571076668271,1.0
"
时间缩放方法对关节速度和加速度的优化效果体现在哪些方面？
","['\n10101  (23)  (24)  (25)  (26)  (27)  (28)  10102  IEEE ROBOTICS AND AUTOMATION LETTERS, VOL. 9, NO. 11, NOVEMBER 2024  Fig. 7. The position of COG during ascending stairs. The pink areas represent the single support phase, whereas the green areas represent the double support phase.  Fig. 6. The swinging phase simulation result for different stairs dimensions. The subﬁgure (a) represents the results changing with different stair heights, while the subﬁgure (b) shows the changes with different stair lengths. The ﬁrst row of each subﬁgure represents the generated swing foot trajectories, while the second and third rows are the corresponding velocities (Vel) and accelerations (Acc) of each joint. In addition, both the results with time scaling method (hip1, knee1) and those without time scaling method (hip2, knee2) are shown in the second and third rows.  and 6(b) show the planned position of swing foot trajectory and velocity and acceleration of joints when parameter SH and SL ﬁxed and kt = 0.3, 0.5, 0.7 with and without time scaling. In all dimensions of the stair, the proposed method can successfully generate the corresponding trajectory. As the stair length increases, the trajectory direction near the end will rotate clockwise, while the height of stair almost has no impact on it. Therefore, kt can be tuned to a bigger value with the increasing stair length to avoid friction with the ground. Additionally, the time scaling method ensures that joint velocity and acceleration are smooth throughout the entire phase and are zero at the beginning and end. However, without time scaling, velocity and acceleration start and end at a non-zero value and cause sudden shocks. Furthermore, near and at the singular position, velocity and acceleration increase drastically, which exceeds physical constraints.  a screen, which allows the user to input commands to control the exoskeleton and show some information. For instance, the user can control the start and stop of the exoskeleton, as well as parameters such as stair height and length, enabling the exoskeleton to complete different gait parameters according to the user’s needs. Furthermore, the screen can display whether the current state is complete or if an error has occurred, enabling the user to take the appropriate action.\n']","
时间缩放方法通过平滑关节速度与加速度的过渡，确保其在整个运动周期中始终为零或在运动起始和结束时为零，从而避免非零结束值带来的冲击；在接近奇异位置时有效抑制了速度与加速度的突变，提升了运动的平稳性与安全性。
","
    时间缩放方法对关节速度和加速度的优化效果主要体现在三个方面：1）确保速度与加速度在整个运动阶段平滑变化；2）使速度与加速度在运动起始和终止时刻为零，避免突发电流与冲击；3）抑制在奇异点附近速度与加速度的剧烈上升，防止超过物理限制，从而提升外骨骼系统的稳定性与安全性。
    ",0.5,0.8546303649572677,0.75
"
虚拟锚点矩阵与系绳组件的协同作用在外骨骼力传递中的功能机制是什么？
","['\n. This was accomplished via a triangulated web of inextensible elements that spanned from desired attachment points to distal and proximal areas of the body known to more readily accept higher forces. A pilot evaluation demonstrated the effectiveness of this approach. Wearing the suit in a passive unpowered mode had little effect on hip, knee, and ankle joint kinematics as compared to baseline walking when not wearing the suit. We observed that when powered joint torque assistance is improperly provided, it alters gait kinematics and an undesirable increase in metabolic power occurs. However, through proper tuning of actuator timing, the exosuit becomes synergistic with the wearer resulting in kinematics that return to near baseline conditions while also simultaneously minimizing metabolic power. Specifically, we found that engaging the ankle plantatflexor actuators at 30% of the gait cycle for 250 ms resulted in gait kinematics similar to those during normal walking or walking with the unpowered suit. Furthermore, when walking with the powered exosuit with these actuation parameters, the subject’s average metabolic power was 386.7 W, almost identical to the average power when wearing no suit (381.8 W), and substantially less than walking with the unpowered suit (430.6 W). While, we did not demonstrate that the suit can make it easier to walk for the wearer, there are a number of avenues that we plan to explore to further optimize the device design. While, the actuators were designed to provide 50% assistance to the wearer, it is unlikely that this was the case due to some inherent compliance in the interface to the wearer. We plan to add sensors in series with the actuators to measure the actual forces that are transmitted to the soft suit. These data will be used to further optimize the webbing component of the interface. Additionally, for the pilot study presented here, actuation was only applied at the ankle joint and future studies could be performed to examine the effect at other joints as well as the combination of joints. Here we presented a simple timing based control scheme; however, with the addition of sensors to the virtual anchor matrix, additional human-machine interaction control modalities can be examined. Specifically, we can examine those relevant and have been shown to be very important from a physiological perspective [31]\n']","
虚拟锚点矩阵与系绳组件在外骨骼力传递中的功能机制是：虚拟锚点矩阵为系绳组件提供预定的力传递路径和方向，确保执行器输出的力通过合理结构传递至穿戴者的远端和近端肌肉或骨骼区域；系绳组件则承载并传导该力，两者协同作用实现高效的力传递与助力控制，同时支持动态优化与传感器反馈以提升系统性能。
","
虚拟锚点矩阵与系绳组件的协同作用主要体现在：系绳组件作为主要传力路径，将执行器产生的辅助力传递至穿戴者身体；而虚拟锚点矩阵通过集成传感器，提供动态反馈以优化执行时序与力分配，从而实现与人体运动的一致性与代谢效率的提升。这种协同机制确保了外骨骼系统在提供动力辅助的同时，维持自然的步态模式与较低的能量消耗。
    ",0.6666666666666666,0.9895824462364832,0.75
"
文中推导的扭矩误差公式如何体现被动刚度对扭矩跟踪性能的影响？
","['\nτdes = −Kdes(θe − θ0),  (11)  we have  (1 + Kd)˙θp = −Kp[Kt(θpR − θe) + Kdes(θe − θ0)].  (12)  in which θ0 is maximum joint position for the device to exert torque on the human ankle, i.e., the intersection of torque-angle relationship with the angle axis.  Modeling exoskeleton-assisted walking after stabilization as an oscillation process made of N sinusoidal waves of the same frequency F, we get a proﬁle of the ankle angle in the form of  N  θe = c +  dn · exp(j2πFt + βn),  (13)  Xn=1  where c is an constant denoting the oﬀset of the proﬁle on torque axis, dn and βn are the magnitude and phase shift of the nth sinusoidal wave, and t represents the time elapsed within one stride since heel strike. The corresponding stabilized motor position should also oscillates with the same frequency. We can therefore construct a stabilized motor position by equal number of sinusoidal waves with the same phase shifts in the form of  N  θp = e +  fn · exp(j2πFt + βn),  (14)  Xn=1  in which e is a constant and fn is a complex number. Substituting Equations (13) and (14) into Equation (12), we get Equation (15).  N  (1 + Kd)j2πF + KpKtR  fn · exp(j2πFt + βn)      Xn=1  = −KpKtRe − Kp(Kdes − Kt)c + KpKdesθ0 N  (15)  −Kp(Kdes − Kt)  dn · exp(j2πFt + βn)  Xn=1  Frontiers in Neurorobotics | www.frontiersin.org  5  Optimal Passive Stiffness in Torque-Controlled Exoskeletons  Equating the coeﬃcients of the various sinusoidal waves and the oﬀset, we have  fn =  −Kp(Kdes − Kt) (1 + Kd)j2πF + KpKtR  dn  (16)  and  e = −  Kdes − Kt KtR  c +  Kdes KtR  θ0.  (17)  Motor position proﬁle in Equation (14) can thus be expressed in terms of the ankle position proﬁle and the controller as  θp = −  +  Kdes − Kt Kdes KtR KtR −Kp(Kdes − Kt) (1 + Kd)j2πF + KpKtR  c +  θ0  N  Xn=1  dn · exp(j2πFt + βn).  (18)  Combining the oscillator assumption with Equation (12), we get the expression of the torque error as  eτ  = τ − τdes  = Kt(θpR − θe) + Kdes(θe − θ0)  = KtRθp + (Kdes − Kt)θe − Kdesθ0 N  j2πF j2πF + Kp 1+Kd  = (Kdes − Kt)  KtR  Xn=1  dn · exp(j2πFt + βn)  (19)  It is clear that without considering the control gains, asserting  Kdes − Kt = 0  will minimize torque tracking error. Therefore, we make the following hypothesis:  Hypothesis 1. In lower-limb exoskeletons, the optimal passive stiﬀness of the series elastic actuator for torque tracking is  Kt,opt = Kdes  (20)\n']","
扭矩误差公式 $ e_\tau = K_t R \theta_p + (K_{\text{des}} - K_t) \theta_e - K_{\text{des}} \theta_0 $ 表明被动刚度 $ K_{\text{des}} $ 通过 $ \theta_e - \theta_0 $ 和 $ \theta_e $ 的线性组合影响扭矩误差，进一步说明被动刚度在扭矩跟踪中具有关键作用。当 $ K_{\text{des}} $ 与 $ K_t $ 相等时，误差最小，表明被动刚度的大小和相位对系统跟踪性能有显著影响。
","
文中通过扭矩误差公式 eτ = KtRθp + (Kdes − Kt)θe − Kdesθ0 显示了被动刚度 Kt 对扭矩跟踪性能的影响，其中 (Kdes − Kt) 项直接决定了误差大小；当 Kt = Kdes 时误差最小，表明被动刚度与期望刚度匹配可优化扭矩跟踪性能。
    ",0.8,0.9592808261886724,0.5
"
文中实验结果显示FES对膝关节外骨骼电机扭矩有何影响？
","['\n. Fig. 4 shows the overlaid knee joint trajectories and torques during the series of leg lifts. Specifically, the top row in Fig. 4 shows the overlaid trajectories from 42 leg lifts without FES, along with the exoskeleton motor torque required to achieve these trajectories. The middle row in Fig. 4 shows the overlaid trajectories from 42 leg lifts with FES, along with the exoskeleton motor torque required to achieve these trajectories. Finally, the bottom row in Fig. 4 shows the average of the overlaid trajectories and torques, along with a plus and minus one standard deviation for each case. As indicated in the bottom left plot, the trajectory tracking is essentially the same in both cases, although somewhat better with FES than without. The bottom right plot shows the average torque required by the exoskeleton knee motors for both cases, with and without FES. The average motor torque required without FES was approximately 25 N·m, while the average motor torque required with FES was approximately 13 N·m. By computing the energy delivered by the knee motor (i.e., by computing power and integrating over the duration of the trajectory), one finds that on average, the knee motor\n']","
文中实验结果显示，外骨骼膝关节电机在包含FES（功能性电刺激）的情况下，平均所需的电机扭矩从约25 N·m降低至约13 N·m，表明FES显著减少了电机输出扭矩，提升了轨迹跟踪性能和系统效率。
","
实验结果显示，功能性电刺激（FES）显著降低了膝关节外骨骼电机所需的平均扭矩。无FES时平均电机扭矩约为25 N·m，而有FES时平均电机扭矩降低至约13 N·m。
    ",1.0,0.9164268595224916,1.0
"
文中提出的实时步态相位和任务估计方法如何提升动力踝关节外骨骼在极端不平地形上的控制性能？
","['\nMarigold, D. S. and Eng, J. J. (2006). The relationship of asymmetric weight-bearing with postural  sway and visual reliance in stroke. Gait & posture, 23(2):249–255. Publisher: Elsevier.  Marilyn Sharp, Mary Rosenberger, and Joseph Knapik (2006). Chapter 5 – COMMON MIL- Technical Report RTO-TR-IST-999. URL:  ITARY TASK: MATERIALS HANDLING. https://apps.dtic.mil/sti/pdfs/ADA472464.pdf.  McGibbon, C., Sexton, A., Gryfe, P., Dutta, T., Jayaraman, A., Deems-Dluhy, S., Novak, A., Fabara, E., Adans-Dester, C., and Bonato, P. (2023). Effect of using of a lower- extremity exoskeleton on disability of people with multiple sclerosis. Disability and Re- habilitation: Assistive Technology, 18(5):475–482. Publisher: Taylor & Francis eprint: https://doi.org/10.1080/17483107.2021.1874064.  McGibbon, C. A., Sexton, A., Jayaraman, A., Deems-Dluhy, S., Gryfe, P., Novak, A., Dutta, T., Fabara, E., Adans-Dester, C., and Bonato, P. (2018). Evaluation of the Keeogo exoskeleton for assisting ambulatory activities in people with multiple sclerosis: an open-label, randomized, cross-over trial. Journal of NeuroEngineering and Rehabilitation, 15(1):117.  Medrano, R. L., Thomas, G. C., Keais, C. G., Rouse, E. J., and Gregg, R. D. (2023). Real-Time Gait Phase and Task Estimation for Controlling a Powered Ankle Exoskeleton on Extremely Uneven Terrain. IEEE Transactions on Robotics, 39(3):2170–2182.  Mentiplay, B. F., Banky, M., Clark, R. A., Kahn, M. B., and Williams, G. (2018). Lower limb angular velocity during walking at various speeds. Gait & posture, 65:190–196. Publisher: Elsevier.  Miller, W. C., Deathe, A. B., Speechley, M., and Koval, J. (2001). The influence of falling, fear of falling, and balance confidence on prosthetic mobility and social activity among individuals with a lower extremity amputation. Archives of Physical Medicine and Rehabilitation, 82(9):1238– 1244.  Millington, P. J., Myklebust, B. M., and Shambes, G. M. (1992). Biomechanical analysis of the sit-to-stand motion in elderly persons. Archives of Physical Medicine and Rehabilitation, 73(7):609–617. Publisher: Elsevier.  Molinaro, D. D., Kang, I., Camargo, J., Gombolay, M. C., and Young, A. J. (2022). Subject- Independent, Biological Hip Moment Estimation During Multimodal Overground Ambulation Using Deep Learning. IEEE Transactions on Medical Robotics and Bionics, 4(1):219–229.\n']","
文中提出的实时步态相位和任务估计方法通过高鲁棒性的生物力学信号采集与动态识别，提升了动力踝关节外骨骼在极端不平地形中的步态适应能力与任务响应精度，从而增强控制性能。
","
文中提出的实时步态相位和任务估计方法通过融合IMU和关节角度数据，结合状态机与机器学习算法，实现对外骨骼控制器的动态调整。该方法能够准确识别用户的步态阶段和地形任务类型，从而在极端不平地形上优化辅助策略，提高响应能力与稳定性，显著提升了动力踝关节外骨骼的控制性能。
    ",0.0,0.9303168368261704,0.5
"
外骨骼控制系统中，如何通过动态调整阻抗参数来改善用户的行走稳定性与自然性？
","['\nData availability De-identiﬁed data relating to this study are available from the corresponding author upon reasonable request.  Results All 50 participants completed gait training and assessment (Pre/Mid/Post: n = 25 for FTST and SMA; Fol: n = 19 for FTST, n = 17 for SMA), with no adverse events in either intervention group. Stepping activity data were available for 24participantsineachgroup,andTMSdatawereavailablefor 15 participants in each group (ﬁgure 1).  Clinical assessments: comparison between time points One SMA participant was excluded from the 5XSST measure for having an outlying Pre score (121.5 seconds) compared with other time points (Mid: 29.7 seconds; Post: 41.6 sec- onds; Fol: 30.1 seconds). No reason was noted for the score. However, including the participant unfairly skews the average percentage changes for this outcome, so the SMA group appears to improve considerably in 5XSST. It is unlikely that such a drastic improvement at all other time-points could be attributed to the intervention at the participant’s stage of chronicity (5.1 years).  Figure 3 illustrates the progression of clinical outcome scores at Pre, Mid, Post, and Fol for the FTST and SMA groups. Table 2 reports the average percentage change in scores from Pre at Mid, Post, and Fol for each intervention group.  There was a main eﬀect of time on all outcome measures except pain rating and depression. There was also a main ef- fect of months since stroke on fastest walking speed (p = 0.023) and balance (p = 0.032). There was a main eﬀect of stroke subtype on balance (p = 0.002). Post hoc analyses revealed that both groups changed from Pre in walking speed, endurance, balance, and LE-FM at all other time points (p < 0.05). The primary outcome measure, self-selected walking speed, increased for the SMA group at Mid (0.14 ± 0.13 m/s, p < 0.001), Post (0.24 ± 0.14 m/s, p < 0.001), and Fol (0.22 ± 0.17 m/s, p < 0.001).  Only the SMA group exhibited changes in self-selected walking speed signiﬁcantly greater than MCID at Post. The number of participants with walking speed changes above MCIDatMid,Post,andFolwere6,14,and7inFTSTand12, 19, and 12 in SMA. Both groups had signiﬁcantly greater changes in walking endurance than MDC and MCID at Post and Fol, indicating that these improvements persist even 3 months after training. The number of participants with en- durance changes above MCID at Mid, Post, and Fol were 17, 23, and 15 in FTST and 20, 25, and 13 in SMA.\n']","
文献无相关内容。
","
文献无相关内容。
    ",0.0,0.0,1.0
"
在多种任务模式（平地行走、上下坡、坐站转换、上下楼梯）中，外骨骼控制器如何根据任务需求调整助力水平？
","['\n3.3 Human Subject Methods: Study 1  The following study was approved by the Institutional Review Board at the University of Michigan (HUM00164931). We enrolled five able-bodied human subjects (s1, male, mass: 78 kg, height: 1.78 m; s2, male, mass: 75 kg, height: 1.75 m; s3, female, mass: 50 kg, height: 1.62 m; s4, male, mass: 83 kg, height: 1.79 m; s5, female, mass: 60 kg, height: 1.75 m) to demonstrate the con- troller’s ability to assist multiple tasks. Two subjects (s4, s5) were excluded due to failure of a foot FSR causing unusual control torques, which was noticed after the experiment. The remaining sub- jects had substantial (s1), moderate (s2), or minimal (s3) experience with Comex 1. We assessed muscle activation via EMG (Delsys Inc.) of vastus medialis oblique (VMO), rectus femoris (RF), biceps femoris (BF), tibialis anterior (TA), gastrocnemius (GM), and soleus (SOL), which function as a knee extensor, knee extensor/hip flexor, knee flexor, dorsiflexor, plantarflexor/knee flexor, and plantarflexor respectively.  The experiment comprised level treadmill walking at self-selected speed (1 m/s for s1-2, 0.8 m/s for s3), incline/decline treadmill walking on a ±5.2◦ slope at 0.6 m/s and a ±12.4◦ slope at 0.6 m/s, repetitive sit-stand cycles with a metronome set to 45 beats-per-minute (BPM), and stairs ascent/descent over 7 inch steps with a 60 BPM metronome. The tasks were repeated for three ex- oskeleton modes: bare (no exoskeleton), active exoskeleton with φ (PHI), and active exoskeleton  26  without φ (WOP). The level of assistance (LOA)% for the active modes was set to 60% for s1 and 50% for other subjects, based on their comfort level during practice trials. We collected at least 30 gait cycles for each treadmill task, 18 gait cycles for each stair task, and 18 sit-stand cycles. Subjects were instructed not to use the treadmill handrails except to prevent a fall (which never occurred).\n']","
文献中未明确说明外骨骼控制器如何根据任务需求（如平地行走、上下坡、坐站转换、上下楼梯）调整助力水平的具体机制或算法，仅描述了助力百分比的设定是基于受试者的舒适程度进行个性化调整。
","
    外骨骼控制器通过调整助力水平百分比（LOA%）和控制参数φ来适应不同任务模式，依据任务的生物力学需求调节对关键肌肉群（如VMO、RF）的辅助强度，并结合传感器反馈实现个性化控制，确保在平地行走、上下坡、坐站转换及上下楼梯等任务中提供适当的助力。
    ",1.0,0.0,0.0
"
自适应阻抗控制策略在实现人机协同步态训练时，如何根据步态周期动态调整阻抗参数？
","['\n[1] L. Woolnough, A. Pomputius, H.K. Vincent, Juvenile idiopathic arthritis, gait characteristics and relation to function, Gait Posture 85 (2021) 38–54.  [2] M. Nazmul Islam Shuzan, M.E.H. Chowdhury, M. Bin Ibne Reaz, A. Khandakar, F. Fuad Abir, M. Ahasan Atick Faisal, S. Hamid Md Ali, A.A.A. Bakar, M. Hossain Chowdhury, Z.B. Mahbub, M. Monir Uddin, M. Alhatou, Machine learning-based classification of healthy and impaired gaits using 3D-GRF signals, Biomed. Sig. Process. Control 81 (2023) 104448.  [3] P. Aleixo, J. Vaz-Patto, H. Moreira, J. Abrantes, Dynamic joint stiffness of the ankle in healthy and rheumatoid arthritis post-menopausal women, Gait Posture 60 (2018) 225–234.  [26] N. Sun, M.L. Cao, Y.H. Chen, Y.N. Chen, J. Wang, Q. Wang, X.C. Chen, T. Liu,  Continuous estimation of human knee joint angles by fusing kinematic and myoelectric signals, IEEE Trans. Neural Syst. Rehabil. Eng. 30 (2022) 2446–2455.  [4] M. Hall, S. Chabra, N. Shakoor, S.E. Leurgans, H. Demirtas, K.C. Foucher, Hip joint moments in symptomatic vs. asymptomatic people with mild radiographic hip osteoarthritis, J. Biomech. 96 (2019) 8.  [27] L.T. Mou, C. Zhou, P.F. Zhao, B. Nakisa, M.N. Rastgoo, R. Jain, W. Gao, Driver stress detection via multimodal fusion using attention-based CNN-LSTM, Expert Syst. Appl. 173 (2021) 11.  [5] L. Ren, R.K. Jones, D. Howard, Whole body inverse dynamics over a complete gait cycle based only on measured kinematics, J. Biomech. 41 (2008) 2750–2759. [6] S.J. Kim, G.M. Gu, Y. Na, J. Park, Y. Kim, J. Kim, Wireless ground reaction force sensing system using a mechanically decoupled two-dimensional force sensor, IEEE-ASME Trans. Mechatron. 25 (2020) 66–75.  [28] X. Zhao, Z. Li, C. Zhao, C. Wang, Real-time multistep time-series prediction of  driver’s head pose during IVIS secondary tasks for human-machine codriving and distraction warning systems, IEEE Sens. J. 22 (2022) 24364–24379.  [29] D. P. Kingma, J. Ba, Adam: a method for stochastic optimization, in: International  Conference on Learning Representations (ICLR), 2015.  [7] G. Durandau, D. Farina, M. Sartori, Robust Real-time musculoskeletal modeling driven by electromyograms, IEEE Trans. Biomed. Eng. 65 (2018) 556–564. [8] T.S. Buchanan, D.G. Lloyd, K. Manal, T.F. Besier, Neuromusculoskeletal modeling: estimation of muscle forces and joint moments and movements from measurements of neural command, J. Appl. Biomech. 20 (2004) 367–395.\n']","
文献无相关内容，无法确定自适应阻抗控制策略在实现人机协同步态训练时如何根据步态周期动态调整阻抗参数的具体方法。
","
文献无相关内容。
    ",0.5,0.0,1.0
"
自适应阻抗控制如何实现人机协同以降低代谢能量消耗？
","['\nPosition  −0.05  0.05  0  t[min]∆VE  −0.25  Fig. 7. Relative change of minute ventilation when using  the knee exoskeleton with different control methods, compared to not using the knee exoskeleton (Free). The * denotes signiﬁcant difference between Free and both gravity and oscillator methods.  5  5  3  2  1  REC  Oscilator  Gravity  t[min]∆HR  0.05  0  −0.05  −0.1  −0.15  −0.2  Position  4  Fig. 8. Relative change of heart rate when using the knee exoskeleton with different control methods, compared to not using the knee exoskeleton (Free). The * denotes signiﬁcant difference between Free and both gravity and oscillator methods.  duces oxygen consumption (VO2) with respect to not using the device (Free), while other parameters are not signiﬁcantly affected.  Figure 9 shows the envelopes of the EMG signals measured at the vastus lateralis during a squat roughly half-way through the 5 minute series. Differences in the shapes of the envelopes for different methods can be observed. Two peaks of muscle activity can still be observed in all 4 cases, most speciﬁcally when us- ing the oscillator based control method. Differences in amplitudes are not very evident. From the view- point of the other physiological responses, half-way through the series no signiﬁcant differences should be observed.  5. Discussion  While a common task, periodic squatting can not be taken as an equivalent substitute of walking on a ﬂat terrain, because it is considerably more demanding. However, in everyday life many activities demand sim- ilar movement, for example walking up and down the stairs, which requires also dissipation of energy (nega- tive work) when going down. Another example is get- ting up from a chair. From this point of view periodic squatting can be considered as walking over a (very) rough terrain.  Our results show that using the knee exoskeleton statistically signiﬁcantly reduces the metabolic cost of squatting when an appropriate control method is ap- plied. While studies on metabolic cost when using an exoskeleton mechanism for carrying loads, e.g. (Walsh et al., 2007), or a stationary mechanism for walking (Ronsse et al., 2011), have shown an increase in the cost, come critical differences in the design of the stud-  0.04  0.06  0.1  0.08  0  0.02  0.5  0  Oscillatort[s]  2  1.5  1  0.5  0  FreeEMG[mV]  0.12  2  0  1  1.5  0.02  0.04  Position  Gravityt[s]EMG[mV]  0.08  0.06  0.1  0.12  Fig. 9. Envelopes of the measured EMG signal during an\n']","
自适应阻抗控制通过调节外骨骼刚度和阻尼参数，使其响应人体运动意图动态匹配，从而减少肌肉发力负担。实验结果显示，采用振荡器控制策略的膝关节外骨骼显著降低心率和呼吸频率，并改善肌肉激活模式，使EMG信号更接近自然运动状态，表明该控制方法提升了人机协同效率，降低了代谢能量消耗。
","
自适应阻抗控制通过动态调整外骨骼的阻抗参数，使其匹配人体运动特性和任务需求，从而优化人机协同性能，减少不必要的能量输出，降低使用者的代谢能量消耗。参考文献表明，适当控制策略（如重力补偿与振荡器控制）可显著降低心率与分钟通气量，尽管未直接提及“自适应阻抗控制”，但其原理可为该类控制方法提供理论支持。
    ",0.3333333333333333,0.7892914251768287,1.0
"
文中提到的自适应振荡器在欠驱动软体髋关节外骨骼中如何实现对人体步态的辅助？
","['\n[10] I. Kang, H. Hsu, and A. Young, “The effect of hip assistance levels on human energetic cost using robotic hip exoskeletons,” IEEE Robot. Automat. Lett., vol. 4, no. 2, pp. 430–437, Apr. 2019.  [11] D. Pinto-Fernandez et al., “Performance evaluation of lower limb ex- oskeletons: A systematic review,” IEEE Trans. Neural Syst. Rehabil. Eng., vol. 28, no. 7, pp. 1573–1583, Jul. 2020.  [12] Y. K. Cho, K. Kim, S. Ma, and J. Ueda, “A robotic wearable exoskeleton for construction worker’s safety and health,” in Proc. ASCE Construction Res. Congr., 2018, pp. 19–28.  [13] E. Tricomi et al., “Underactuated soft hip exosuit based on adaptive oscillatorstoassisthumanlocomotion,”IEEERobot.Automat.Lett.,vol.7, no. 2, pp. 936–943, Apr. 2022.  [33] J.M.CaputoandS.H.Collins,“Auniversalankle–footprosthesisemulator for human locomotion experiments,” J. Biomech. Eng., vol. 136, no. 3, 2014, Art. no. 035002.  [34] A. Martinez, B. Lawson, and M. Goldfarb, “A controller for guiding leg movement during overground walking with a lower limb exoskeleton,” IEEE Trans. Robot., vol. 34, no. 1, pp. 183–193, Feb. 2018.  [35] B. Lim et al., “Delayed output feedback control for gait assistance with a robotic hip exoskeleton,” IEEE Trans. Robot., vol. 35, no. 4, pp. 1055–1062, Aug. 2019.  [36] D. Quintero, D. J. Villarreal, D. J. Lambert, S. Kapp, and R. D. Gregg, “Continuous-phase control of a powered knee–ankle prosthesis: Amputee experimentsacrossspeedsandinclines,”IEEETrans.Robot.,vol.34,no.3, pp. 686–701, Jun. 2018.  [37] N. Thatte, T. Shah, and H. Geyer, “Robust and adaptive lower limb prosthesis stance control via extended Kalman ﬁlter-based gait phase estimation,” IEEE Robot. Automat. Lett., vol. 4, no. 4, pp. 3129–3136, Oct. 2019.  [14] M. K. MacLean and D. P. Ferris, “Energetics of walking with a robotic knee exoskeleton,” J. Appl. Biomech., vol. 35, no. 5, pp. 320–326, 2019. [15] K. Shamaei, M. Cenciarini, A. A. Adams, K. N. Gregorczyk, J. M. Schiffman,andA.M.Dollar,“Biomechanicaleffectsofstiffnessinparallel with the knee joint during walking,” IEEE Trans. Biomed. Eng., vol. 62, no. 10, pp. 2389–2401, Oct. 2015.  [16] G. S. Sawicki, C. L. Lewis, and D. P. Ferris, “It pays to have a spring in  [38] K. G. Holt, R. C. Wagenaar, M. E. LaFiandra, M. Kubo, and J. P. Obusek, “Increased musculoskeletal stiffness during load carriage at increasing walking speeds maintains constant vertical excursion of the body center of mass,” J. Biomech., vol. 36, no. 4, pp. 465–471, 2003.\n']","
自适应振荡器通过在线估计步态相位和运动状态，实时调整输出力矩，模仿人体自然步态周期，从而在欠驱动软体髋关节外骨骼中实现对人体步态的主动辅助。该方法能够适应个体差异和步态变化，提升行走稳定性与能量效率，增强外骨骼与穿戴者之间的步态匹配能力。
","
文中提到的自适应振荡器通过自动调整频率和相位，生成与人体步态同步的周期性控制信号，实现对欠驱动软体髋关节外骨骼的自适应控制，从而顺应不同步态模式和行走速度，辅助人体步态并提升行走效率。
    ",0.0,0.969100098554588,0.75
"
基于表面肌电信号的运动模式分类方法在康复外骨骼中的应用优势是什么？
","['\n[1] G. S. Sawicki et al., “The exoskeleton expansion: Improving walking and running economy,” J. NeuroEngineering Rehabil., vol. 17, no. 1, pp. 1–9, 2020.  [2] A. J. Young and D. P. Ferris, “State of the art and future directions for lower limb robotic exoskeletons,” IEEE Trans. Neural Syst. Rehabil. Eng., vol. 25, no. 2, pp. 171–182, Feb. 2017.  [3] J. Kim et al., “Reducing the metabolic rate of walking and running with a versatile, portable exosuit,” Science, vol. 365, no. 6454, pp. 668–672, 2019.  [4] J.Zhangetal.,“Human-in-the-loopoptimizationofexoskeletonassistance during walking,” Science, vol. 356, no. 6344, pp. 1280–1284, 2017. [5] S. Song and S. H. Collins, “Optimizing exoskeleton assistance for faster self-selected walking,” IEEE Trans. Neural Syst. Rehabil. Eng., vol. 29, pp. 786–795, 2021.  [6] G. S. Sawicki, C. L. Lewis, and D. P. Ferris, “It pays to have a spring in your step,” Exercise Sport Sci. Rev., vol. 37, no. 3, pp. 130–138, 2009. [7] D. A. Winter, “Kinematic and kinetic patterns in human gait: Variability andcompensatingeffects,”Hum.MovementSci.,vol.3,no.1/2,pp. 51–76, 1984.  [25] E. Ceseracciu et al., “SVM classiﬁcation of locomotion modes using surface electromyography for applications in rehabilitation robotics,” in Proc. IEEE 19th Int. Symp. Robot Hum. Interactive Commun., 2010, pp. 165–170.  [26] H. Kim, Y. J. Shin, and J. Kim, “Kinematic-based locomotion mode recognition for power augmentation exoskeleton,” Int. J. Adv. Robotic Syst., vol. 14, no. 5, 2017, Art. no. 1729881417730321.  [27] Y. Long et al., “PSO-SVM-based online locomotion mode identiﬁcation for rehabilitation robotic exoskeletons,” Sensors, vol. 16, no. 9, 2016, Art. no. 1408.  [28] C. Wang et al., “A ﬂexible lower extremity exoskeleton robot with deep  locomotion mode identiﬁcation,” Complexity, vol. 2018, 2018.  [29] Q. Guo and D. Jiang, “Method for walking gait identiﬁcation in a lower extremity exoskeleton based on c4. 5 decision tree algorithm,” Int. J. Adv. Robotic Syst., vol. 12, no. 4, p. 30, 2015.  [30] B. Laschowski et al., “Preliminary design of an environment recognition system for controlling robotic lower-limb prostheses and exoskeletons,” in Proc. IEEE 16th Int. Conf. Rehabil. Robot., 2019, pp. 868–873.  Authorized licensed use limited to: BEIJING UNIVERSITY OF TECHNOLOGY. Downloaded on January 15,2024 at 07:54:36 UTC from IEEE Xplore. Restrictions apply.  3241  3242  IEEE TRANSACTIONS ON BIOMEDICAL ENGINEERING, VOL. 69, NO. 10, OCTOBER 2022\n']","
基于表面肌电信号的运动模式分类方法在康复外骨骼中的应用优势包括：提升运动意图识别精度、实现个性化步态辅助、支持实时在线控制、增强人机协同交互，并具备良好的可穿戴性与适应性。
","
    基于表面肌电信号的运动模式分类方法在康复外骨骼中的应用优势包括：（1）可直接反映用户的运动意图；（2）支持高精度的运动模式识别（如SVM等方法）；（3）提升系统的响应性与个性化控制能力；（4）相比运动学方法具有更高的时间分辨率，便于实时控制；（5）促进人机协同控制，增强康复训练的自然性与适应性。
    ",0.4,0.9978640385585956,0.75
"
文中使用多通道MMG信号与SVR回归方法在A-P和M-L方向上的R²值分别达到多少？说明了什么互补关系？
","['\n1123  1124  IEEE TRANSACTIONS ON NEURAL SYSTEMS AND REHABILITATION ENGINEERING, VOL. 30, 2022  TABLE II COEFFICIENT OF DETERMINATION AND MSE OF EACH TRIAL  Fig. 5. Multiple comparisons between trials.  of 0.58 for both training and testing, which is not a sufﬁcient estimate; However, regression of the multichannel signal with SVR (Trials 4, 5, and 6) yielded 0.69 for training and 0.68 for testing in the A-P 2-channel (A-P 2ch) and 0.33 for both training and testing in the M-L 2-channel (M-L 2ch). The MMG signals closer to the targeted muscle group performed better. The 4-channel (4ch) mechanomyogram integrating A-P and M-L showed an average R2 of 0.91 for both training and test. These results suggest that the M-L MMG signal contains information that complements the A-P MMG signal.  The coefﬁcient of determination R2 of Trial 2 was signif- icantly lower (p=0.01) than that of Trial 1. In a previous study [19], the muscle torque generated during electrical stimulation was estimated using the RMS and PTP features of MMG, and a coefﬁcient of determination R2 of 0.94 was obtained for the training subset and 0.89 for the testing subset. We similarly performed SVR processing with the RMS and the coefﬁcient of PTP features of MMG in Trial 2, but determination R2 was much lower at 0.46 and 0.44 when no electrical stimulation was performed. These facts show the limitations of conventional MMG methods. The result of Trial 3 shows better performance than Trial 2 by introducing multiple MMG channels, while its coefﬁcient of determination R2 is still signiﬁcantly lower than that of Trial 1.  The MMG signal contains the acceleration of the vibration caused by the contraction of each muscle, but it also contains the superimposed acceleration caused by the motion of the limbs. The former is the main contributor to torque estimation, while the latter is the source of error. M-L 2ch is not suitable for estimating muscle contraction by itself because it contains more components of acceleration caused by limb motion than A-P 2ch, but by incorporating it into multiple regression analysis, it has the effect of contributing to the compensation of errors caused by limb motion.  Fig. 6. Scatter plot of estimated and measured torque.  can estimate bidirectional motions (extension and ﬂexion) with performance comparable to that of EMG.\n']","
文中使用多通道MMG信号与SVR回归方法在A-P方向上的R²值为0.69（训练）和0.68（测试），在M-L方向上的R²值为0.33（训练）和0.33（测试）。整合A-P与M-L方向的4-channel MMG信号在R²值为0.91（训练）和0.91（测试），说明A-P与M-L方向的MMG信号在多通道建模中具有互补关系，M-L信号可补偿A-P信号因肢体运动引起的误差。
","
    文中使用多通道MMG信号与SVR回归方法在A-P方向2通道（A-P 2ch）上的R²值分别为0.69（训练）和0.68（测试），在M-L方向2通道（M-L 2ch）上的R²值均为0.33。这说明M-L MMG信号虽然在单独使用时性能较差，但在多通道整合中能有效补偿A-P MMG信号中由肢体运动引起的误差，体现出两者之间的互补关系。
    ",1.0,0.8835501052154312,1.0
"
在康复训练过程中，如何通过优化阻抗参数确保轨迹跟踪的安全性和有效性？
","['\nWhen calculating the repulsion force, it is possible for the 1/ρ(X,Xobs) to be equal to zero, which results in a significant change to the potential function. It leads to a significant correction of the impedance coefficient, which in turn causes the instability of the system. Consequently, the Urep(X) can be modified accordingly.  The artificial potential field method is a common algorithm in path planning, which allows the upper and lower boundaries of the channel to be set as obstacles. The optimal torque can be considered as the target. Accordingly, when the actual human- robot interaction force deviates from the optimal force, the virtual force field is adjusted accordingly. When the robot is close to an obstacle, the corresponding virtual force field is increased, while when it is far away from the obstacle, the corresponding virtual force field is decreased. Therefore, the potential function is aligned with the impedance parameters. Consequently, the impedance control parameters can be ad- justed in real-time in accordance with the potential function.  0246810  Upper BoundaryLower BoundaryOptimal Torque CurveTime(s)  10010203040 (a) Torque Coordination Channel(b) Optimal Torque CurveTime(s)  Fig. 6. Schematic diagram of torque coordination channel.  U (X) = Uatt (X) + Urep (X)  (7)  where Uatt (X) represents the attractive potential function. Urep (X) represents the repulsive potential function.  Uatt(X) =  1 2  Kattρ(X,Xgoal)2  (8)  where ρ(X,Xgoal torque and the desired joint torque.  is the distance between the actual joint  Urep(X) =   1  2Krep(  2 )  ρ(X,Xobs)+a − 1 ρ0 0,if ρ(X,Xobs) > ρ0  1  ,if ρ(X,Xobs) ≤ ρ0  The optimal torque curve is defined as the estimated torque according to TCN-LSTM model based on joint attention mech- anism. The research [28], [29] shows that the estimated knee torque is similar to the torque curve, which can be employed as the optimal reference curve, as shown in Fig. 6(b). As showed in Fig. 6, the human moves in the initial stage, with the assistance of the robot. As the rehabilitation training progresses, the human-robot interaction force deviates from the optimal torque. In response, optimized impedance control is employed to regulate the impedance parameters, ensuring that the trajectory tracking remains within an appropriate range and that the rehabilitation training is completed safely and effectively.  (9) where a is a positive number, which can be modified according to the situation. ρ0 = 5.\n']","
在康复训练中，通过动态调整阻抗参数以适应人机交互力的变化，可以确保轨迹跟踪的安全性和有效性。具体方法包括：1）利用人工势场法构建总势函数 U(X) = Uatt(X) + Urep(X)，其中 Urep(X) 根据实际关节与目标关节之间的距离及与障碍物之间的距离进行动态修正；2）当实际交互力偏离最优力时，势函数发生相应变化，从而触发对阻抗控制参数的实时调整；3）阻抗控制参数可依据势函数的反馈信息进行自适应调节，以维持轨迹跟踪在安全范围并高效完成康复训练。
","
    在康复训练过程中，通过将阻抗控制与改进的人工势场方法结合，可确保轨迹跟踪的安全性和有效性。具体方法包括：设计包含吸引势Uatt(X)与排斥势Urep(X)的总势函数U(X)，其中排斥势函数采用平滑因子a与安全距离ρ0以避免系统不稳定；依据实际轨迹与最优扭矩曲线之间的偏差，实时调整虚拟力场，从而动态优化阻抗参数；构建扭矩协调通道，限制轨迹在安全范围内运动，并根据与障碍物的距离调整虚拟力场强度，实现轨迹的柔性引导与安全跟踪。
    ",0.8888888888888888,0.9485993820976412,0.75
"
文中将步态周期内的速度匹配问题转化为哪种类型的优化问题，其关键挑战是什么？
","['\nwhere  and ς are positive constants.  To achieve vx ≈ v0 during the entire contact period, an am- plitude oscillator is introduced as another observer. It takes the following form:  ¨ri = ρi    ρi 4  (Ri − ri) − ˙ri    +    j=G(i)  κij(rj − ri − Rij)  (14) where Ri is the input to the oscillator, and ρi and κij are constants. Rij can be given by  Rij =    j − α0 i  α0 0    /α0 i  j = i j = i.  Consequently,wecanconverttheissueofspeedmatchinginto an optimization problem involving the parameter Ri. This op- timization problem can be categorized as a functional problem. However, a challenge lies in determining the boundary values of this functional problem, given that the start and end times of walking do not have ﬁxed values.  Due to the periodicity of walking, a single gait cycle can be regarded as the interval of interest, eliminating the need for analyzing the entire walking process. Therefore, Ri can be set as a function of the phase of the reference oscillator, i.e., Ri =  (13)  (15)  Authorized licensed use limited to: BEIJING UNIVERSITY OF TECHNOLOGY. Downloaded on March 15,2024 at 00:46:05 UTC from IEEE Xplore. Restrictions apply.  This article has been accepted for inclusion in a future issue of this journal. Content is final as presented, with the exception of pagination.  DUAN et al.: GAIT-GENERATION STRATEGY FOR LOWER LIMB EXOSKELETON BASED ON CENTRAL PATTERN GENERATOR  Consider a set of n distinct instances xi ∈ Rd denoted as χ = {xi : i = 1,...,n},andasetofmobservedpairwisepreference relations on the instances, denoted as follows:   i  ub ua i over ub where the symbol  indicates that the user prefers ua i. ua i  ub i can be interpreted as a binary variable that takes the value 1 when ua i and 0, otherwise. From the dataset, the posterior distribution of the latent objective function f can be found as follows:  D =  i;i = 1,...,m  i is preferred over ub  Fig. 9.  Iterative evolution of vx.  P(f|D) = P(D|f)P(f)  P(D)  .  Ri(φref). Since φref ∈ [0,π], the boundary conditions of Ri can be set as Ri(0) = Ri(π).  Assume that the optimal solution of Ri is as follows:  Ri(φref) ∼= ki(φref) +  5  cijhj(φref)  (16)  j=1  where ki(φref) = Ri(0) + ˙Ri(0)φref      +  −    3 4π2  2 8π3  [Ri(2π) − Ri(0)] − 1 2π [Ri(2π) − Ri(0)] − 1 4π2  ˙Ri(2π) − 2 T   ˙Ri(0)  ˙Ri(2π) + ˙Ri(0)  φ2 ref   φ3 ref  and hj(φref) = 1 − cos(Ajφref), Aj = jφref. Then, the opti- mization of Ri is transformed into the optimization of cij.\n']","
文中将步态周期内的速度匹配问题转化为一个涉及参数 Ri 的功能优化问题，其关键挑战在于确定边界条件 Ri(0) 和 Ri(π)，由于行走周期的非固定起止时间，这一边界值的确定成为优化过程中的主要难题。
","
    文中将步态周期内的速度匹配问题转化为函数型（functional problem）优化问题，其关键挑战在于确定该优化问题的边界值，因为行走的起始和结束时间不具有固定值。
    ",0.3333333333333333,0.9348052874925552,1.0
"
自适应阻抗控制在髋关节外骨骼系统中如何实现人机协同，其控制策略的核心机制是什么？
",['\nTABLE I RMS EXOSKELETON HIP TORQUE AND POWER WITH AND WITHOUT FES Without FES With FES Contribution from FES  RMS Hip Torque (SD) 22.6 N´m (7.6) 15.9 N´m (7.4) 30%  RMS Hip Power (SD) 6.2 W (3.1) 4.1 W (2.5) 34%  Figure 5. Exoskeleton hip joint torque during extension without FES (dashed blue) and with FES (solid red). Thick lines are joint torques averaged over all steps taken. Thin lines indicate one standard deviation.  Figure 6. Exoskeleton hip joint power during extension without FES (dashed blue) and with FES (solid red). Thick lines are joint power averaged over all steps taken. Thin lines indicate one standard deviation.  Figure 4. Experimental setup. a) Surface electrodes placed over the posterior thigh. b) Subject walking with the exoskeleton.  346\n'],"
自适应阻抗控制在髋关节外骨骼系统中通过传感器反馈实时调整关节阻抗参数，以实现人机协同。其核心机制包括基于FES增强的人机交互状态感知与阻抗参数自适应调节。然而，参考文献未提供具体的控制算法实现细节，仅展示了不同条件下髋关节扭矩与功率的变化趋势。
","
文献无相关内容
    ",0.4285714285714285,0.9635158701016312,0.25
"
改变机器人膝关节假体的控制策略对双下肢的制动冲量和推进冲量产生了哪些影响？文中提供了怎样的量化数据支持？
","['\n5  This article has been accepted for publication in a future issue of this journal, but has not been fully edited. Content may change prior to final publication. Citation information: DOI 10.1109/TNSRE.2020.2979033, IEEE Transactions on Neural Systems and Rehabilitation Engineering  IEEE TRANSACTIONS ON NEURAL SYSTEMS AND REHABILITATION ENGINEERING, VOL. , NO. , MARCH 2020  the mechanics of the robotic knee prosthesis, on each subject. RL induced changes in prosthesis control parameters led to changes in prosthesis knee kinematics, bilateral AP impulses, and temporal-spatial gait symmetry.  was not consistently correlated with step length SI across subjects. The positive step length SI indicated a longer intact side step length, measured by the anteroposterior distance between two calcaneus markers at intact side heel strike.  1) The control parameters (mechanics) of the robotic knee prosthesis inﬂuenced the prosthetic knee kinematics signiﬁ- cantly (p < 0.01). They elicited wide ranges of responses in peak stance ﬂexion angle, peak stance extension angle, peak swing ﬂexion angle, and peak swing extension angle. Averaged across human subjects, the respective ranges were 12.5 degrees, 15.6 degrees, 11.3 degrees and 14.8 degrees. The average standard deviation of the peak angles when using the same control parameters was 1.2 degrees across all tested control settings and subjects. The angle variations caused by parameter changes were signiﬁcantly larger than those due to the intrinsic variation of human walking with ﬁxed prosthesis control (p < 0.01).  2) A change in the robotic knee prosthesis control elicited a change in the braking impulse and propulsive impulse on both lower limbs. The braking impulse and propulsive impulse of the prosthetic limb changed in the range of 1.95 %BW · s and 1.73 %BW · s, respectively. The braking impulse and propulsive impulse of the intact limb changed in the range of 2.42 %BW · s and 1.85 %BW · s, respectively. The average standard deviation of the impulse measurements was 0.35 %BW ·s across all control settings and subjects. Note that the positive impulse was aligned with the walking direction. There was a signiﬁcant effect of prosthetic knee control/mechanics on impulses at the 0.01 level for all subjects.\n']","
改变机器人膝关节假体的控制策略对双下肢的制动冲量和推进冲量产生了显著影响，表现为假肢侧和非假肢侧的冲量变化范围分别为 1.95 %BW·s 和 1.73 %BW·s（假肢侧）以及 2.42 %BW·s 和 1.85 %BW·s（非假肢侧）。平均标准差为 0.35 %BW·s，并在所有受试者中具有显著效应（p < 0.01）。冲量方向与行走方向一致，说明其物理意义与步态方向一致。
","
    改变机器人膝关节假体的控制策略显著影响了双下肢的制动冲量和推进冲量。文中数据显示，假肢侧制动冲量变化范围为1.95 %BW·s，推进冲量为1.73 %BW·s；健全侧制动冲量变化为2.42 %BW·s，推进冲量为1.85 %BW·s，且该影响在所有受试者中均具有统计学显著性（p < 0.01）。
    ",0.8571428571428571,0.9331254821300088,1.0
"
相比传统外骨骼驱动方式，文中提及的生物启发式控制策略具有哪些优势？
","['\n77. Schellenbach, M., Lovden, M., Verrel, J., Kruger, A. & Lindenberger, U. Adult age differences in familiarization to treadmill walking within virtual environments. Gait Posture 31, 295–299, https://doi.org/10.1016/j.gaitpost.2009.11.008 (2010).  78. Kurtzke, J. F. Rating neurologic impairment in multiple sclerosis: an expanded disability status scale (EDSS). Neurology 33, 1444–1452 (1983).  79. Cuthbert, S. C. & Goodheart, G. J. Jr. On the reliability and validity of manual muscle testing: a literature review. Chiropr Osteopat 15, 4, https://doi.org/10.1186/1746-1340-15-4 (2007).  80. Motl, R. W. et al. Validity of the timed 25-foot walk as an ambulatory performance outcome measure for multiple sclerosis. Mult Scler 23, 704–710, https://doi.org/10.1177/1352458517690823 (2017).  81. Goldman, M. D., Marrie, R. A. & Cohen, J. A. Evaluation of the six-minute walk in multiple sclerosis subjects and healthy controls. Mult Scler 14, 383–390, https://doi.org/10.1177/1352458507082607 (2008).  82. Bohannon, R. W. Comfortable and maximum walking speed of adults aged 20-79 years: reference values and determinants. Age Ageing 26, 15–19 (1997).  83. Lee, S. J. & Hidler, J. Biomechanics of overground vs. treadmill walking in healthy individuals. J Appl Physiol (1985) 104, 747–755, https://doi.org/10.1152/japplphysiol.01380.2006 (2008).  84. Filli, L. et al. Monitoring long-term efficacy of fampridine in gait-impaired patients with multiple sclerosis. Neurology 88, 832–841, https://doi.org/10.1212/WNL.0000000000003656 (2017).  85. Zeni, J. A. Jr, Richards, J. G. & Higginson, J. S. Two simple methods for determining gait events during treadmill and overground walking using kinematic data. Gait Posture 27, 710–714, https://doi.org/10.1016/j.gaitpost.2007.07.007 (2008).  86. Schmidt, K. et al. The Myosuit: Bi-articular Anti-gravity Exosuit That Reduces Hip Extensor Activity in Sitting Transfers. Front Neurorobot 11, 57, https://doi.org/10.3389/fnbot.2017.00057 (2017).  87. Plate, A. et al. Normative data for arm swing asymmetry: how (a)symmetrical are we? Gait Posture 41, 13–18, https://doi. org/10.1016/j.gaitpost.2014.07.011 (2015).  88. Killeen, T. et al. Increasing cognitive load attenuates right arm swing in healthy human walking. R Soc Open Sci 4, 160993, https:// doi.org/10.1098/rsos.160993 (2017).\n']","
文献无相关内容。
","
文献无相关内容，无法提供文中提及的生物启发式控制策略相较于传统外骨骼驱动方式的具体优势。
    ",1.0,0.0,1.0
"
基于Dataset B的实验设计，不同行走速度和足部进行角组合对步态分析的影响是什么？
","['\nb) Stair: Forstairtrialsstartingwiththeinstrumentedleg (right leg), we segment force plate data of FP1 and FP5 for the right leg. For the trials starting with the non-instrumented leg (left leg), we segment FP2, FP3, and FP4.  c) Ramp: For  starting with the non- instrumented leg (left leg), we segment force plate data of FP2 and FP4 for the right leg. For the trials starting with the instrumented leg (right leg), we segment FP1, FP3, and FP5.  ramp trials  2) Dataset B [43]: Seventeen subjects (all male; age: 23.2 ± 1.1 years; height: 1.76 ± 0.06 m; mass: 67.3 ± 8.3 Kg) participated in that study. Different walking speeds, foot pro- gression angles, step widths, and trunk sway angles were used as testing conditions. Subjects initially performed a 2-minute normalwalkingtrialwithaself-selectedspeed(1.16±0.04m/s), which was used as a baseline to determine foot progression angle and step width. Three foot progression angles (baseline– 15°, baseline, and baseline+15°) with three different speeds (self-selected–0.2 m/s, self-selected, and self-selected+0.2 m/s) were used in combinations to perform nine trials. In the same way, three step widths (baseline–0.054 m, baseline, and base- line+0.070 m)and trunkswayangles (4°,8°, and 12°) trialswith three different speeds were also performed.  Dataset Pre-processing: Infrared-based optical motion cap- ture data was recorded at 100 Hz with synchronized ground reaction force data at 1000 Hz. Eight IMU data were collected with a sampling rate of 100 Hz. In their pre-processed dataset, they have provided 3D GRFs with the same number of samples as IMU and joint moments. As they have only provided KAM, KFM, and 3D GRFs, we use these variables to build our algo- rithm. In the dataset, zeros are appended at the end of shorter steps to synchronize with the longest steps with a length of 152. We remove those extra zeros from the shorter steps and use the rest of the dataset to build our algorithm.  B. Implementation Details\n']","
基于Dataset B的实验设计中，不同行走速度、足部进行角（foot progression angles）以及步宽（step widths）与躯干摆动角（trunk sway angles）被作为多变量测试条件，用于分析步态特征。实验通过组合行走速度（自选速度±0.2 m/s）、足部进行角（baseline–15°, baseline, baseline+15°）和步宽（baseline–0.054 m, baseline, baseline+0.070 m）进行九种组合，评估这些参数对步态的影响。研究使用3D地面反作用力（3D GRFs）、关节力矩（KAM, KFM）和运动学数据（红外光学运动帽）进行分析，以量化步态参数随参数变化的趋势与交互效应。
","
Dataset B的实验设计通过组合三种足部进行角（baseline–15°, baseline, baseline+15°）与三种行走速度（self-selected–0.2 m/s, self-selected, self-selected+0.2 m/s）共九种条件，用于评估其对步态参数的影响。分析变量包括3D地面反作用力（GRFs）、膝关节附加力矩（KAM）和膝关节屈伸力矩（KFM），但文献中未报告具体影响结果，需基于数据进一步分析。
    ",0.5833333333333334,0.8568541044469585,0.5
"
在不同地形设置（坡度和楼梯高度）下，模型的分类误差变化趋势是否一致，是否存在统计学上的显著差异？
","['\nFig. 3. Effect of locomotion mode transition label. Each model’s clas- siﬁcation error is presented for both the (left) steady-state and (right) transitional gait cycle where the gait cycle is represented from 0% (toe-off in the previous mode) to 100% (toe-off in the next mode). The error bars represent ± 1 standard deviation and asterisks indicate statistical differences (p < 0.05). Only statistical comparisons between the optimized transition point and baseline condition are shown.  D. Effect of Sensor Signal Drop  Sensor or channel signal drop is a common phenomenon that can happen in a real-time system potentially due to the controller’s data communication failure. We have simulated this scenario to evaluate our model’s robustness in maintaining the overall classiﬁcation performance even with a certain sensor channel being disconnected. To simulate a sensor signal drop scenario, we changed the column (which represents a single channel in the sensor) value to 0. This analysis can also be representative of a feature importance analysis as the resulting performance can relate to which channel drop will cause a greater impact on the overall model accuracy.  Fig. 4. Leave-one-terrain-setting evaluation for different (left) slope inclines and (right) stair heights. Results are presented with the overall classiﬁcation errors. The error bars represent ± 1 standard deviation and the asterisks indicate statistical differences (p < 0.05). Statistical comparisons across different settings are not shown. Only statistical comparisons between settings within each model are shown.  E. Statistical Analysis  To test our model performance in different conditions, we conducted a two-way repeated measures analysis of variance (ANOVA) (α set to 0.05). After ANOVA, we conducted a post hoc analysis with a Bonferroni correction for multivariate analysistocomputethestatisticaldifferenceacrossthe5models (MATLAB R2020b, MathWorks, USA).  across subjects for each algorithm of 3.13 ± 0.67%, 7.38 ± 2.10%, 9.04 ± 2.06%, 9.09 ± 1.99%, and 12.73 ± 3.27%, respectively (Fig. 3). For the CNN, the overall classiﬁcation error was reduced by 24.95 ± 13.57% when the transition label was optimized compared to the baseline (p < 0.05), with similar relative error reductions across the other algorithms.  V. RESULTS  A. Optimized Locomotion Mode Classiﬁer Performance  C. Model Generalization\n']","
在不同地形设置（坡度和楼梯高度）下，模型的分类误差存在统计学上的显著差异（p < 0.05），但文献未提供不同模型之间的统计比较结果，因此无法确定是否存在统计学上的显著差异。
","
文献中分别评估了不同坡度和楼梯高度下模型的分类误差，并展示了统计显著性差异（p < 0.05），但未提供跨地形设置（坡度 vs 楼梯高度）之间的统计比较。因此，无法确定不同地形设置下的分类误差变化趋势是否一致，也无法判断是否存在统计学上的显著差异。
    ",0.6666666666666666,0.0,0.75
"
基于表面肌电信号的运动模式分类方法在康复外骨骼中的应用优势是什么？
","['\n[1] G. S. Sawicki et al., “The exoskeleton expansion: Improving walking and running economy,” J. NeuroEngineering Rehabil., vol. 17, no. 1, pp. 1–9, 2020.  [2] A. J. Young and D. P. Ferris, “State of the art and future directions for lower limb robotic exoskeletons,” IEEE Trans. Neural Syst. Rehabil. Eng., vol. 25, no. 2, pp. 171–182, Feb. 2017.  [3] J. Kim et al., “Reducing the metabolic rate of walking and running with a versatile, portable exosuit,” Science, vol. 365, no. 6454, pp. 668–672, 2019.  [4] J.Zhangetal.,“Human-in-the-loopoptimizationofexoskeletonassistance during walking,” Science, vol. 356, no. 6344, pp. 1280–1284, 2017. [5] S. Song and S. H. Collins, “Optimizing exoskeleton assistance for faster self-selected walking,” IEEE Trans. Neural Syst. Rehabil. Eng., vol. 29, pp. 786–795, 2021.  [6] G. S. Sawicki, C. L. Lewis, and D. P. Ferris, “It pays to have a spring in your step,” Exercise Sport Sci. Rev., vol. 37, no. 3, pp. 130–138, 2009. [7] D. A. Winter, “Kinematic and kinetic patterns in human gait: Variability andcompensatingeffects,”Hum.MovementSci.,vol.3,no.1/2,pp. 51–76, 1984.  [25] E. Ceseracciu et al., “SVM classiﬁcation of locomotion modes using surface electromyography for applications in rehabilitation robotics,” in Proc. IEEE 19th Int. Symp. Robot Hum. Interactive Commun., 2010, pp. 165–170.  [26] H. Kim, Y. J. Shin, and J. Kim, “Kinematic-based locomotion mode recognition for power augmentation exoskeleton,” Int. J. Adv. Robotic Syst., vol. 14, no. 5, 2017, Art. no. 1729881417730321.  [27] Y. Long et al., “PSO-SVM-based online locomotion mode identiﬁcation for rehabilitation robotic exoskeletons,” Sensors, vol. 16, no. 9, 2016, Art. no. 1408.  [28] C. Wang et al., “A ﬂexible lower extremity exoskeleton robot with deep  locomotion mode identiﬁcation,” Complexity, vol. 2018, 2018.  [29] Q. Guo and D. Jiang, “Method for walking gait identiﬁcation in a lower extremity exoskeleton based on c4. 5 decision tree algorithm,” Int. J. Adv. Robotic Syst., vol. 12, no. 4, p. 30, 2015.  [30] B. Laschowski et al., “Preliminary design of an environment recognition system for controlling robotic lower-limb prostheses and exoskeletons,” in Proc. IEEE 16th Int. Conf. Rehabil. Robot., 2019, pp. 868–873.  Authorized licensed use limited to: BEIJING UNIVERSITY OF TECHNOLOGY. Downloaded on January 15,2024 at 07:54:36 UTC from IEEE Xplore. Restrictions apply.  3241  3242  IEEE TRANSACTIONS ON BIOMEDICAL ENGINEERING, VOL. 69, NO. 10, OCTOBER 2022\n']","
基于表面肌电信号的运动模式分类方法在康复外骨骼中的应用优势包括：实时捕捉肌肉激活状态、具备良好的穿戴性和非侵入性、适用于多种运动模式识别、支持个性化辅助控制以及提升使用者的步态经济性。这些优势使其成为实现人机协同与康复训练智能化的重要手段。
","
    基于表面肌电信号的运动模式分类方法在康复外骨骼中的应用优势包括：（1）直接反映用户的肌肉激活状态与运动意图；（2）支持多种运动模式（如步行、上下楼梯等）的高精度识别；（3）具备良好的实时性，适用于在线识别；（4）减少对外部传感器的依赖，提升系统的便携性与鲁棒性；（5）结合机器学习算法如SVM、PSO-SVM、决策树等，可实现高效、精准的分类控制。
    ",0.0,0.9978640385585956,0.5
"
FSMC控制器在不同地形任务（水平、上坡、下坡）下的刚度参数调节趋势体现了何种控制策略？
","['\nThe latter two trials consisted of more rapid task changes to investigate each controller’s behavior during continuous task variations rather than at steady-state and over a wider range of tasks. Further, the controllers received no real-time knowledge of the task from the treadmill during these trials, investigating the autonomous capability of each controller to operate over the task space. Both controllers utilized the same task estimation methods (Section III-B). The FSMC used the task transition logic in Figure 13b with the tuned impedance parameters at the baseline tasks from the steady-state trials. Two trials, one with inclines (CV-Incline) and the other with declines (CV-Decline), started at χ = (0 deg, 1 m/s) and explored 8 other points within the task space. Each task point was commanded to the treadmill for 20 seconds. Because the treadmill required time to change task, smooth task trajectories with continuous variations were generated, shown in Fig. 5b.  C. Experimental Results  1) FSMC Tuning Time: To produce a normal gait, the FSMC required 22 minutes of tuning by the research team: 3 minutes for the level ground baseline task, 14 for the incline baseline task, and 5 for the decline baseline task. The tuned impedance and state transition parameters for each baseline  7  Fig. 6. Average kinematic and kinetic trajectories produced by each controller during level ground walking at 1 m/s in the steady-state trials. Inter-subject mean able-bodied data (AB) is also shown [21]. Shaded regions show ±1 standard deviation. At most points in the gait cycle, the HKIC is closer to the able-bodied reference than the FSMC, particularly in the kinetic trajectories.  task are shown in the Appendix (Table IV). Trends in the tuned parameters included higher stiffness values during stance than in swing and highly-varying knee equilibrium angles across tasks. Also, the observed gait was noted to be quite sensitive to the tunable FSM transition criteria.\n']","
FSMC控制器在不同地形任务（水平、上坡、下坡）下的刚度参数调节趋势体现了在任务空间中对支撑相刚度增强的适应性控制策略。该策略在稳态试验中调参后应用于基线任务，并在上坡和下坡任务中保留了支撑相更高的刚度特性，表明其控制策略能够适应地形变化，同时维持任务空间的连续性与可控性。
","
    FSMC控制器在不同地形任务下的刚度参数调节趋势体现了地形相关性与步态相位依赖性的控制策略：在支撑相中采用较高刚度以增强稳定性，并通过预调的阻抗参数与任务转换逻辑实现对地形变化的自主适应。
    ",0.8571428571428571,0.9609458021672236,1.0
"
临床人员如何通过无线安卓应用程序参与外骨骼控制器的实时调优过程？
","['\n5051015Torque (Nm) 010203040hamstrings EMG (%MVC)  5051015Torque (Nm) 0204060hamstrings EMG (%MVC)  50510Torque (Nm) Exo Torque  Figure 5.12: Hamstrings EMG and exoskeleton knee torque. The figure shows the ensemble averaged hamstrings EMG profiles and the torque profiles of the exoskeleton for all tasks tested. Torques are positive in the extension direction.  74  CHAPTER 6  Customizability and Preliminary Validation of a Versatile Bilateral Knee Exoskeleton for Assisting Impaired Individuals  6.1  Introduction  Individuals with impairments present a difficult challenge for task-invariant controllers. Specifi- cally, controllers that are trained on normative datasets may prove overly generic to cater to the unique deficits present in impaired individuals. Moreover these controllers require a secondary optimization process (e.g., reinforcement learning, human in the loop optimization) which then tries to update the algorithm by incorporating the individual’s personalized gait data. However this optimization process can take several hours of cyclical data collection and re-tuning, especially if the number of basis functions (control parameters) is large. While this may be doable for healthy individuals, it is highly burdensome and impractical for impaired individuals who usually have a small reserve of energy before fatiguing, e.g., individuals with multiple sclerosis (MS) and post- polio syndrome (PPS). Moreover, the clinician (physical therapist) is completely sidelined in this methodology, preventing them from contributing their expert knowledge. Patients may also prefer their therapist’s involvement.  This chapter focuses on addressing these challenges with the novel bilateral knee controller developed in chapter 4, and the latest M-BLUE exoskeleton shown in chapter 5. First we go through the development of a clinician friendly android app (GUI) that facilitates wireless, live modification of the coefficients of the task sensitized torque bases and also displays live control torques from the exoskeleton for both legs. Next we present the individual case studies focusing on customizing the controller to suit each participant’s highly unique gait deficits, and assessing the corresponding functional and biomechanical improvements with exoskeleton assistance.  We investigated two highly impaired cases of MS and PPS. The manual muscle test (MMT) and clinician assessment of the PPS patient revealed that he had a highly impaired (atrophied) right  75\n']","
临床人员可通过开发的无线安卓应用程序实时调优外骨骼控制器，该应用支持无线修改任务敏感扭矩基函数的系数，并实时显示双侧外骨骼的控制扭矩，从而实现个性化优化与临床反馈的闭环控制。
","
临床人员通过专用的无线安卓应用程序（GUI）实时修改外骨骼控制器的任务敏感扭矩基函数系数，并实时查看双侧膝关节的控制扭矩输出，从而在个性化调优过程中结合其专业判断对控制器参数进行优化调整。
    ",0.8,0.9696405287466526,1.0
"
如何通过胫骨角速度信号识别步态事件中的 heel strike 和 toe off 时间点？
","['\nPLOS ONE | DOI:10.1371/journal.pone.0171346 February 8, 2017  5 / 19  Monitoringgait in MS with wearblesensors  Fig 3. Schematic of shank angular velocity and gait events.  doi:10.1371/journal.pone.0171346.g003  with fourth-order, zero-phase, low-pass Butterworth filter with 10 Hz cutoff frequency [34]. Prior to the calculation of the temporal gait parameters of each trial, the reference frames of the BioStampRC and MTx were aligned using custom developed MATLAB script that employs a singular value decomposition based approach.  The projection of the shank angular velocity onto the medial-lateral axis was then analyzed  to identify the gait events based on a method described previously [20]. This algorithm has been utilized in several investigations analyzing temporal gait parameters in diverse popula- tions including MS [21, 35]. Heel strike point (HS, when the foot first touches the floor) was defined as the time point where the minimum negative peak shank angular velocity occurs immediately following the time point where the positive peak shank angular velocity occurs. This derives from the fact that the shank angular velocity reaches its highest value at the mid- swing phase and at the end of the swing phase the leg is brought to a halt by a heel strike lead- ing to a sharp negative peak of shank angular velocity [36]. Toe off point (TO, when the foot takes off) was defined as the time point where minimum negative peak occurs immediately before the positive peak [20]. Prior to the swing phase, the toe off contributes to progression with a forward push leading to negative peak of shank angular velocity [36] (See Fig 3). Once every HS and TO point was obtained, the temporal gait parameters were calculated using the following equations:  Stride timeðiÞ ¼ HSLeftði þ 1Þ  HSLeftðiÞð1  i  N  1; N: number of gait cyclesÞ  ð1Þ  Swing timeðiÞ ¼ TOLeftðiÞ  HSLeftðiÞ  ð2Þ  Step timeðiÞ ¼ HSLeftðiÞ  HSRightðiÞ  ð3Þ  For Actigraph GT3X data, the sensor recorded tri-axis acceleration at 30Hz in 6MW trials. The data was processed to count step numbers with ActiLife 6 software (Actigraph, Pensacola, FL) in one second epoch intervals (i.e. sampling window). Following the manufacturer’s guide- line [17, 37], a low frequency extension filter was used as it increases the sensitivity for detect- ing low-frequency accelerations (i.e. slow walking).  PLOS ONE | DOI:10.1371/journal.pone.0171346 February 8, 2017  6 / 19  Monitoringgait in MS with wearblesensors\n']","
通过胫骨角速度信号的正负峰值及其时间关系识别 heel strike 和 toe off 时间点的方法如下：首先，使用四阶、零相位、低通 Butterworth 滤波器（截止频率 10 Hz）预处理信号，提取胫骨角速度特征；其次，定义 heel strike 为正峰值发生后紧接着的最小负峰值时间点；定义 toe off 为正峰值发生前紧接着的最小负峰值时间点。该方法基于踝关节在摆动相中最大值与 heel strike 导致负峰值之间的时序关系，已在多种研究中验证用于识别步态事件。
","
    通过胫骨角速度信号识别步态事件中的 heel strike 和 toe off 时间点的方法如下：首先使用截止频率为10 Hz的四阶零相位低通Butterworth滤波器对信号进行滤波；heel strike 被定义为正峰值之后紧接着出现的最小负峰值的时间点；toe off 被定义为下一个正峰值前出现的最小负峰值的时间点；这些特征基于胫骨角速度在步态周期中变化的典型模式。
    ",0.6666666666666666,0.9491832516890956,1.0
"
实验中通过何种方法评估被动刚度对扭矩跟踪性能的影响？
","['\nParam  Value  Param  Value  [θ0,lτ0,l]  [−2, 0]  Kdes,0  5  TABLE 2 | Piece-wise linear unit curve parameter values.  Param  Value  Param  Value  [θ0,pτ0,p] [θ2,p,τ2,p] [θ4,p,τ4,p]  [−2, 0]  [−12, 50]  [8, 0]  [θ1,p,τ1,p] [θ3,p,τ3,p]  [−8, 20]  [0, 12.5]  Frontiers in Neurorobotics | www.frontiersin.org  9  Optimal Passive Stiffness in Torque-Controlled Exoskeletons  subject standing in neutral position. Such walking sessions were repeated multiple times for the same passive stiﬀness along the study. For each session of one hundred steps, the instantaneous value of passive stiﬀness at each time stamp was calculated and presented in relation to the measured torque values. Figure 4 presentssuchplotsofpassivewalkingsessionsfordiﬀerentspring conﬁgurations, one session for each conﬁguration. Median of the instantaneous passive stiﬀness values within the stabilized region was deﬁned as the stabilized passive stiﬀness value of the session. For any spring conﬁguration, its stabilized region is deﬁned as a 5.65 Nm torque range, within which the change of trend for the instantaneous passive stiﬀness averaged over all sessions is minimum. The mean of the stabilized passive stiﬀness values across multiple experimental sessions for the same passive stiﬀness conﬁguration was then used as its eﬀective passive stiﬀness value.  2.6.3. Deﬁnition of Difference in Desired and Passive Stiffness Values The diﬀerence between the desired and passive stiﬀnesses is an important index since Hypotheses 1 and 2 state that the optimal passive stiﬀness for torque tracking equals the the desired quasi- stiﬀness and torque errors are closely related to the diﬀerence between the two. In analyzing our experimental results, this value is deﬁned as the algebraic diﬀerence between the desired and passive values, i.e., Kt − Kdes.  2.6.4. Experiment Procedures The key to be able to compare the inﬂuence of passive stiﬀness on torque tracking performance under a ﬁxed desired quasi-stiﬀness is to evaluate the “best” tracking performance under each passive stiﬀness conﬁguration. We did so by experimentally evaluate the tracking errors of multiple experimental sessions, each with diﬀerent feedback control gains. The lowest error across these trials was then assigned as the estimate of the actual optimal performance with this passive stiﬀness.\n']","
实验中通过比较不同被动刚度配置下多个实验会话中最小的扭矩跟踪误差，评估其对扭矩跟踪性能的影响。具体方法包括：定义期望刚度与实际刚度的差值 $ K_t - K_{\text{des}} $，并基于每个刚度配置下多个控制增益组合的跟踪误差，选择误差最小的刚度配置作为最优性能评估基准。
","
    实验通过在不同被动刚度配置下进行多次实验会话，记录每个时间戳的瞬时被动刚度和扭矩值，并定义稳定区域来计算稳定被动刚度。将稳定区域内的中位数作为该会话的稳定被动刚度，并对多会话结果取均值得到有效被动刚度。同时，定义期望刚度与被动刚度的代数差（Kt − Kdes）作为误差指标，并在固定期望准刚度条件下，评估不同反馈控制增益下的跟踪误差，取最低误差作为该被动刚度配置下的最优性能，从而评估被动刚度对扭矩跟踪性能的影响。
    ",0.6666666666666666,0.9542014405638334,0.5
"
文中通过何种方式量化评估地面反作用力（GRF）差异，并说明其在训练前后的变化趋势？
","['\nSymmetry (%) Toe clearance GRF difference  28.24±7.84 36.32±8.48 41.12±8.37 7.8±3.01 0.048±0.012 2.30±1.01  31.96±6.90 39.57±11.32 44.46±12.05 5.6±3.77 0.058±0.015 4.66±1.27  0.046 0.173 0.116 0.046 0.028 0.031  Free walking before 16 minutes of training for  Sess 1 (Week 1)  Sess 3 (Week 1)  Sess 6 (Week 2)  Sess9 (Week 3)  Sess12 (Week 4)  Sess15 (Week 5)  Sess16 (Week 6)  Fig. 4. Group data during free walking between sessions 1 and 16. For (A) to (C), the left side of the graphs pre sents data for each week (sessions 1, 3, 6, 9, 12, and 15), and the right side presents data for sessions 1 and 16, which have the same walking speed. From sessions 1 to 15, the treadmill speed was increased every first session of each week, as described in Materials and Methods. (D) EMG is scaled with the maximum value of baseline in session 1. (E) Trunk angle during walking. (F) The definition of the GRF difference is illustrated, and its group value is presented in (G). Mean and SEs are presented for six participants (n = 6), except EMG (n = 5).  from the Six Minute Walk test. In addition, treadmill walking after 15 sessions of training showed increased step length, symmetric gait, and better foot clearance, as shown in Fig. 4G. Symmetry of each child was computed by comparing the normalized stance time between right and left legs. According to Eq. 1, the value is close to 0, when the child pres- ents a symmetric gait.  Symmetry (%) = |1 −  right stance time _____________________ left stance time  | × 100  EMG of gastrocnemius and soleus is presented in Fig. 4D for the group. We investigated the magnitudes and patterns of the EMG ac-  (1)  GRF difference =  [ first peak (P1 ) + second peak (P3 ) ] _______________________________________ 2  − valley (P2)  (2)  The first peak (P1) in Fig. 4F indicates the force during heel strike, and the second peak (P3) is the force during push-off of the stance foot. GRF difference was scaled for each child’s weight. GRF differ- ence values for sessions 1 and 16 are presented with the P value in Fig. 4G. The training promoted a heel-to-toe pattern that stabilizes the stance leg during initial contact and propels the body forward.  5 of 11  f r o m h t t p : / / r o b o t i c s . s c e n c e m a g . o r g / b y  i  g u e s t  o n  J u y  l  3 0 ,  2 0 1 7\n']","
文中通过定义GRF差异为[P1 + P3]/2 - P2，并在训练前后（sessions 1 and 16）计算每位受试者的GRF差异值，结合个体体重进行归一化处理，图4G展示了GRF差异的组间平均值及其统计显著性（P值）。训练促进了更对称的足部接触模式，表现为GRF差异逐渐减小，表明步态稳定性与推进能力的改善。
","
    文中通过公式 GRF difference = ([first peak (P1) + second peak (P3)] / 2 − valley (P2)) 量化评估地面反作用力（GRF）差异，并基于个体体重进行标准化。训练后（Session 16）GRF差异值显著增加（从28.24±7.84增至44.46±12.05），表明训练促进了更接近成人典型步态的GRF模式，即从脚跟到脚尖的推进模式，提升了步态稳定性。
    ",0.7142857142857143,0.7363470656601253,0.25
"
部分助力控制器如何利用下肢关节角度和地面反作用力信号实现生物拟态助力扭矩输出？
","['\nKnee orthoses must be highly versatile to handle the multi-terrain LLC that is performed in many work environments [NIOSH, 2007; Orr et al., 2021; Chung et al., 2005; Work Fit, 2023; HC Chung and MJJ Wang, 2001]. The knee joint kinetics and kinematics vastly vary between the various activities that fall under general LLC such as squatting, level walking, and stairs and ramp ascent and descent [Chan et al., 2022; Camargo et al., 2021]. Numerous knee orthoses, both passive and active, have been developed for various applications [Zhang et al., 2020]. State-of- the-art passive knee orthoses naturally fall short of the versatility required for the LLC application, as a fixed spring (even with an elaborate mechanical clutch) simply cannot recreate biomimetic assistance over a variety of tasks. Such devices have therefore been limited to supporting only squatting at best [Ranaweera et al., 2018; Hidayah et al., 2021]. Active knee orthoses on the other hand have the potential to provide versatile assistance for multi-terrain LLC. Traditionally, the development of active orthoses has favored rigid (highly geared) actuators that track predefined kinematics to assist severely impaired individuals [Zeilig et al., 2012; Harib et al., 2018]. However these orthoses are not suitable for the LLC application as the combination of rigid actuators and kinematic control hinders the voluntary motion of healthy individuals. The commercial pneumatic knee exoskeleton ROAM Forge, for example, needs to be manually turned off for dynamic gait (non-squatting) tasks since it impedes knee flexion during the swing phase [WIRED, 2021]. Only recently has there been a paradigm shift towards lightweight orthoses fitted with low-impedance (highly-backdrivable) actuators [Laschowski and McPhee, 2023], however their control strategies still lack the versatility to seamlessly support all tasks involved in multi-terrain LLC.  The overall goal of a partial assistance controller for an application like LLC is to use readily measurable signals (lower-limb segment and joint angles/velocities, foot pressure, etc.) to com- mand a biomimetic assistance torque over a wide range of tasks. A direct approach is to use inverse dynamics to estimate joint torque from measured ground reaction forces (GRFs), but this has only  53\n']","
部分助力控制器通过逆动力学方法，将下肢关节角度和地面反作用力信号输入系统，利用运动学模型计算出所需的关节力矩，从而输出具有生物拟态特性的助力扭矩，以适应多种下肢运动任务和地形变化。
","
部分助力控制器通过整合下肢关节角度与地面反作用力信号，利用逆动力学模型估算目标关节扭矩，并结合低阻抗执行器实现动态调节，从而在蹲下、行走、上下楼梯等多种任务中输出仿生助力扭矩，适应多地形负载搬运（LLC）需求。
    ",0.8571428571428571,0.8590252277422389,1.0
"
如何通过IMU、GRF和运动捕捉数据实现不同步态周期的数据分割？
","['\n1) Dataset A [42]: Twenty subjects’ data (8 females and 12 males, age: 21.7 ± 3.65 years, height: 1.70 ± 0.07 m, weight: 68.21 ± 11.52 Kg) are used for model training, discarding two subjects (AB06, AB20) because of the absence of GRFs for level-ground condition (AB20) and IMU data mismatch (AB06) comparing to rest of the subjects. This dataset is comprised with four locomotion modes, i.e., treadmill walking, level-ground walking, ramp ascent/descent, and stair ascent/descent. Tread- mill walking was collected for 28 different speeds ranging from 0.5 to 1.85 m/s in 0.05 m/s increments across seven trials (four speeds per trial). Level-ground walking data was collected for 30circuits–5clockwiseand5counterclockwiseforself-selected slow, normal, and fast speed, which includes both straight walking and turning. In stair walking, the subject was walking on a six-step stair-case with four different stair heights. All the subjects completed a total of 40 trials with a set of ﬁve trials starting with their instrumented leg (right leg). Four IMU sensors (thigh, shank, and foot), three electronic goniometers (hip, knee, and ankle joint), and 11 EMG sensors were attached on the instrumented leg. A set of ﬁve trials starting with their non-instrumented leg for each stair height (4 in, 5 in, 6 in, and 7 in). Sixty ramp trials were performed with six different inclination angles (5.2°, 7.8°, 9.2°, 11°, 12.4°, and 18°) with a set of ﬁve trials for each starting leg (left and right) on each inclination. Other detailed information on the protocol of the experiment is described in [42]. Dataset Pre-processing: IMU data and marker trajectory data from the motion capture system are collected at 200 Hz. GRFs data are measured at 1000 Hz, then they are re-sampled to 200 Hz to synchronize with IMU and motion capture data. Joint moment is calculated using the Opensim [12] inverse dynamics tool with motion capture and GRFs data. For level-ground, stair, and ramp walking, IMUs, joint moments, and GRFs data are segmented for a full gait cycle based on the availability of GRFs from the installed force plates on the instrumented right leg. On the other hand, data segmentation is not performed for the treadmill walking as GRFs are present for entire gait cycles. We normalize joint moment data with the body weight and height of the participants. We also normalize GRF data with the body weight of the participants. IMU data are collected from the foot, shank,thigh,andtorso\n']","
通过IMU、GRF和运动捕捉数据实现不同步态周期的数据分割，首先基于安装在仪器化右腿上的力板采集的GRF数据进行步态周期识别。对于水平地面、楼梯和坡道行走，将IMU（包括脚、胫骨、大腿）与关节力矩及GRF数据同步处理，并以GRF信号作为步态节律的判定依据，分割出完整的步态周期。跑步机行走由于GRF贯穿整个步态周期，无需数据分割。运动捕捉系统标记点轨迹与IMU数据同步处理后用于辅助步态识别，但主要依赖GRF数据进行周期分割。
","
通过结合IMU、GRF和运动捕捉数据，利用GRF信号中的足跟着地与足尖离地事件识别步态周期起止点，将数据分割为完整的步态周期。GRF数据以1000 Hz采样并重采样至200 Hz以与IMU及运动捕捉数据同步，随后基于力板信号对水平地面、楼梯和坡道行走任务中的数据进行分割。跑步机行走由于GRF在整个周期中存在，无需分割。IMU和关节力矩数据同步分割后，结合运动学事件进行验证，同时对GRF和关节力矩进行体重和身高归一化以提升一致性。
    ",0.8461538461538461,0.9985488973197812,1.0
"
本文提出的基于频谱图的CNN识别框架在下肢运动意图识别中是如何实现的？
","['\nThe contributions from this letter include: (1) We propose a spectrogram-based CNN recognition framework for predict- ing the intent of the lower-limb locomotor activities. Inspired by [15], we modiﬁed this approach to be suitable for our tasks by developing an analysis pipeline composed of a lightweight neural network architecture and a mel-scaled spectrogram. (2) We compared the performance of our system to the state-of- the-art (SOTA) locomotor intent recognition strategies using bi- lateral neuromechanical signals. The proposed system achieved a classiﬁcation error rate of 1.1%, which outperformed or was comparable to previous works [5], [19]. (3) We characterized the effect of sensor locations and modalities on the classiﬁer performance; ﬁnally, (4) we qualitatively identiﬁed the region of the gait cycle responsible for the intention by visualizing the activation of the CNN. To our knowledge, this is the ﬁrst work to use CNNs with image encoding of frequency content forlower-limbintentrecognitionwithbilateralneuromechanical sensorfusion.Theintentofourworkistoenablefuturewearable robotic technologies to be used outside the laboratory, where a diverse range of activities is required.  II. SYSTEM DESIGN  Fig.1. Instrumentationsetupforthedataset.TheEMGelectrodeswereplaced on seven muscle groups responsible for lower limb locomotion: tibialis anterior (TA), medial gastrocnemius (MG), soleus (SOL), vastus lateralis (VL), rectus femoris(RF),bicepsfemoris(BF),andsemitendinosus(ST).TheGONIOswere placedonkneeandanklejointsandtheIMUswereplacedonthethighandshank to measure angular position and velocity. [20].\n']","
本文提出的基于频谱图的CNN识别框架通过构建包含梅尔尺度频谱图的轻量级神经网络架构，将双侧神经机械信号转换为时频特征进行下肢运动意图识别。该方法在频域与时域结合的特征提取基础上，利用CNN实现高精度分类（分类误差率1.1%），并结合可视化激活区域，识别步态关键阶段的运动意图。
","
本文提出的基于频谱图的CNN识别框架通过将肌电信号和其他传感器数据转化为梅尔刻度频谱图，作为图像输入至轻量级卷积神经网络，从而实现对下肢运动意图的高精度识别。该方法融合了双侧神经机械信号，并通过CNN的特征学习与分类能力，在多个运动意图任务中实现了1.1%的分类错误率，同时通过可视化CNN激活区域识别了与运动意图相关的步态周期阶段。
    ",0.7777777777777778,0.8045836464621386,1.0
"
髋关节与踝关节外骨骼在降低行走代谢成本方面的控制策略有何异同？
","['\nA common goal of human augmentation exoskeletons is to reduce the metabolic cost of walking (Ronsse et al., 2011; Mooney et al., 2014; Ding et al., 2016a; Ruiz Garate et al., 2016; Seo et al., 2016). Recent advances in the exoskeleton field have successfully reduced metabolic cost of walking in an exoskeleton below the metabolic cost of humans walking without an exoskeleton both with ankle exoskeletons (Collins et al., 2015; Mooney and Herr, 2016) and hip exoskeletons (Asbeck et al., 2015; Seo et al., 2016). The performance of these exoskeletons is a combination of both the hardware and control system. A wide variety of control systems have been proposed (Aguirre-Ollinger, 2013; Jang et al., 2015; Koller et al., 2015b; Oh et al., 2015; Takahashi et al., 2015; Wu et al., 2015; Yan et al., 2015; Ao et al., 2016; Chen et al., 2016; Ding et al., 2016b; Zhang et al., 2016) but rarely are direct comparisons made. For interested readers, recent reviews of the exoskeleton control literature are available that discuss controllers in detail (Tucker et al., 2015; Yan et al., 2015; Young and Ferris, 2017). Our study helps to bridge this gap by directly comparing control strategies on the same hardware and analyzing changes in metabolic cost.  Controller studies on testbed ankle exoskeleton systems (Ferris et al., 2006; Sawicki and Ferris, 2008; Malcolm et al., 2013; Farris et al., 2014b; Galle et al., 2015; Jackson and Collins, 2015; Kim et al., 2015; Koller et al., 2015a; Sawicki and Khan, 2015; Takahashi et al., 2015) and multi-joint exoskeleton sys- tems (Neuhaus et al., 2011; Van Kammen et al., 2014; Cestari et al., 2015; Wang et al., 2015; van Asseldonk and van der Kooij, 2016; Stroppa et al., 2017) have helped enable the development of highly engineered, autonomous ankle (Meijneke et al., 2014; Mooney et al., 2014; Collins et al., 2015; Mooney and Herr, 2016; van Dijk et al., 2017) and multi-joint exoskeletons (Zoss\n']","
髋关节与踝关节外骨骼在降低行走代谢成本方面的控制策略均以优化步态能量消耗为目标，但具体策略存在差异：踝关节外骨骼侧重于局部步态阶段（如足部离地）的助力控制，而髋关节外骨骼则更关注步态周期的全局优化。尽管两者均成功降低代谢成本，但文献中缺乏直接比较的具体控制方法描述。
","
文献中未明确提供髋关节与踝关节外骨骼在降低行走代谢成本方面的具体控制策略异同信息，仅指出两者均通过硬件与控制系统的协同设计成功降低了代谢成本。踝关节外骨骼已有较系统的控制策略研究基础，而髋关节外骨骼的控制策略异同未被具体说明，建议参考专门综述文献进一步分析。
    ",0.6,0.9952351816680048,0.75
"
本文提出的基于时间的控制方案有哪些局限性，未来如何通过传感器集成进行改进？
","['\n. Here we presented a simple timing based control scheme; however, with the addition of sensors to the virtual anchor matrix, additional human-machine interaction control modalities can be examined. Specifically, we can examine those relevant and have been shown to be very important from a physiological perspective [31]. An extensive study of the full range of parameters of this device was beyond the scope of this paper, but we feel that this work opens the door to a broad range of biomechanics studies, not previously possible with other exoskeletons that have a significant effect on natural dynamics and kinematics. Further, we note that while no statistical analyses were performed here, the trends presented for this first case study are promising. Future work will also focus on statistically evaluating the efficacy of the exosuit with an increased number of human subjects. This new paradigm provides, for the first time, design rules, fabrication methodologies, and control strategies for\n']","
本文基于时间的控制方案存在对动态环境适应性不足、缺乏个体自适应能力的局限性。未来可通过集成多种传感器（如力、惯性和肌电信号）获取用户生理与运动状态信息，并基于这些数据实时调整控制策略，以提升人机交互的精确性和适应性。此外，未来将通过增加实验样本并进行统计分析，验证该控制方案的系统性与有效性。
","
本文提出的基于时间的控制方案存在参数适应性不足和缺乏统计验证的局限性。未来可通过在虚拟锚点矩阵中集成多种传感器，引入生理信号、运动状态和力反馈等信息，以发展更具个性化和自适应能力的人机交互控制模态，从而提升外骨骼系统的生物力学兼容性和控制效能。
    ",0.2222222222222222,0.8407565797802962,0.75
"
文中提到如何通过改进模型对股直肌（RF）的控制来提升模型与人体实验的响应一致性？
","['\nthe model  For several of the marked comparisons, simple modiﬁcations of either the reﬂex control or the model tuning could improve the overlap. First, in the model, the rectus femoris muscle (RF) is used mainly for sensing but not actuation. As a result, it cannot change activation except during swing. In the human experiments, by contrast, RF shows response trends similar to the synergistic vasti muscle group (VAS) throughout stride, although careful interpretation of these RF responses is needed, since surface EMGs of RF, which are used in the disturbance experiments, are prone to crosstalk from VAS (Nene et al., 2004). If ﬁne wire EMG of RF reveal response trends similar to those of VAS, these trends can be reproduced by modifying the model to control RF with the same reﬂex pathways as VAS. Such modiﬁcation is tenable in the functional point of view, since RF and VAS share a common role of knee extension.  Second, the diﬀerence between human and model responses of the vasti and the gastrocnemius muscles (GAS) during late swing may be an artifact of the model tuning process, which only considered undisturbed walking. The late swing reﬂexes that control VAS and GAS in the model do not engage during undisturbed locomotion (Song and Geyer, 2015a), and thus the  March 2017 | Volume 11 | Article 15  Song and Geyer  Evaluation of Neuromechanical Walking Model  FIGURE 2 | Response trends. The responses of the model and human subjects in all ﬁve disturbance experiments are shown. Human responses (gray lines) are normalized with respect to their maximum value in each experiment and for each muscle. The model responses (black lines) are linearly scaled to place as many of the responses as possible within ±1 s.d. of the human responses (gray shaded area). The % of the model responses within ±1 s.d. of human responses are shown at the top of each graph, and those which are ≤50% are marked with *.  optimization process sets their parameters to arbitrary values as far as they do not eﬀect normal walking. In other words, these control parameters could be further tuned to improve the overlap with human responses for the two muscles without changing the undisturbed walking behavior.  the weak overlap for the soleus muscle (SOL) in the late swing phase of the SR experiment may be the  Finally,\n']","
为了提升模型与人体实验中股直肌（RF）的响应一致性，文中提出通过以下方式改进模型：首先，若通过fEMG验证RF的响应趋势与股外侧肌（VAS）一致，则可将其纳入与VAS相同的反射通路进行控制；其次，调整模型中用于晚摆动期控制VAS和GAS的参数，以优化其与人体实验的响应重合度。
","
    文中提出通过将股直肌（RF）的控制机制修改为与股外侧肌群（VAS）共享相同的反射通路，以提升模型与人体实验响应的一致性。这一改进基于RF与VAS在膝关节伸展功能上的协同作用，并结合精细肌电图验证后的参数优化，从而在步态周期中更好地复现人体实验中观察到的RF激活趋势。
    ",1.0,0.967933553290906,0.5
"
文中提到的外骨骼设计范式在生物力学研究中相较于传统外骨骼有哪些独特优势？
","['\n. Here we presented a simple timing based control scheme; however, with the addition of sensors to the virtual anchor matrix, additional human-machine interaction control modalities can be examined. Specifically, we can examine those relevant and have been shown to be very important from a physiological perspective [31]. An extensive study of the full range of parameters of this device was beyond the scope of this paper, but we feel that this work opens the door to a broad range of biomechanics studies, not previously possible with other exoskeletons that have a significant effect on natural dynamics and kinematics. Further, we note that while no statistical analyses were performed here, the trends presented for this first case study are promising. Future work will also focus on statistically evaluating the efficacy of the exosuit with an increased number of human subjects. This new paradigm provides, for the first time, design rules, fabrication methodologies, and control strategies for\n']","
文中提及的外骨骼设计范式相较于传统外骨骼，在生物力学研究中具有以下独特优势：首先，其基于时间的简单控制方案可扩展为多模态传感器驱动的人机交互控制；其次，该范式提供了系统的设计规则、制造方法和控制策略，具备更强的通用性和可重复性；再次，该设计范式在研究自然动力学与运动学方面更具开放性，为生物力学机制探索提供了新平台；最后，其结构支持未来通过统计分析验证控制策略的有效性，相较传统外骨骼在实验验证层面更具系统性。
","
该外骨骼设计范式相较于传统外骨骼在生物力学研究中的独特优势包括：1）支持基于虚拟锚点矩阵的传感器集成，实现更精细的人机交互控制；2）对自然动力学和运动学干扰更小，有助于维持人体自然运动模式；3）提供系统化的设计规则、制造方法和控制策略，便于扩展与复现；4）具备良好的可扩展性，支持未来大规模统计评估与个性化应用研究。
    ",0.75,0.9899965053771392,0.5
"
本文中机器人驱动的向下骨盆牵引技术如何影响脑瘫儿童的蹲伏步态？
","['\nCitation: J. Kang, D. Martelli, V. Vashista, I. Martinez-Hernandez, H. Kim, S. K. Agrawal, Robot- driven downward pelvic pull to improve crouch gait in children with cerebral palsy. Sci. Robot. 2, eaan2634 (2017).  11 of 11  D o w n o a d e d  l  f r o m h t t p : / / r o b o t i c s . s c e n c e m a g . o r g / b y  i  g u e s t  o n  J u y  l  3 0 ,  2 0 1 7  Robot-driven downward pelvic pull to improve crouch gait in children with cerebral palsy J. Kang, D. Martelli, V. Vashista, I. Martinez-Hernandez, H. Kim and S. K. Agrawal  Sci. Robotics DOI: 10.1126/scirobotics.aan2634  2  , eaan2634.  ARTICLE TOOLS  http://robotics.sciencemag.org/content/2/8/eaan2634  SUPPLEMENTARY MATERIALS  http://robotics.sciencemag.org/content/suppl/2017/07/24/2.8.eaan2634.DC1  REFERENCES  This article cites 56 articles, 6 of which you can access for free http://robotics.sciencemag.org/content/2/8/eaan2634#BIBL  PERMISSIONS  http://www.sciencemag.org/help/reprints-and-permissions  Use of this article is subject to the  Terms of Service  Science Robotics New York Avenue NW, Washington, DC 20005. 2017 © The Authors, some rights reserved; exclusive licensee American Association for the Advancement of Science. No claim to original U.S. Government Works. The title Science Robotics  (ISSN 2470-9476) is published by the American Association for the Advancement of Science, 1200  is a registered trademark of AAAS.  D o w n o a d e d  l  f r o m h t t p : / / r o b o t i c s . s c e n c e m a g . o r g / b y  i  g u e s t  o n  J u y  l  3 0 ,  2 0 1 7\n']","
机器人驱动的向下骨盆牵引技术通过物理调整骨盆位置，改善其对步态的支撑作用，从而有效提升脑瘫儿童的蹲伏步态质量，表现为步态对称性增强、步长增加和步频提升，但文献未提供关于神经功能或肌肉力量变化的直接证据。
","
    本文中机器人驱动的向下骨盆牵引技术通过施加外力调节骨盆姿态，旨在矫正脑瘫儿童蹲伏步态中常见的髋膝过度屈曲和骨盆后倾问题，从而改善其步态模式。由于参考文本信息有限，具体干预效果和机制需参考完整论文。
    ",0.375,0.9841864023793464,0.5
"
相比先前设计，多关节软体外骨骼在驱动方案上如何实现携带重量的显著降低？
","['\n.Thisisduetothehipactuatorstoppinginapositionthatcreatedsmallforcespassivelyontherightleg.Atpoint4,theleftlegstepsontothetreadmillagain.Afterthis,therightleghasnormalkinematics,andsothepassiveforcecrossesthethresholdandactuationresumesasnormal.VI.DISCUSSIONANDCONCLUSIONSInconclusion,wehavepresentedabody-wornmulti-jointsoftexosuitcapableofrobustandlong-termoperationinnaturaloutdoorenvironments.Theactuationschemede-scribedherereducedthecarriedactuatorweightsubstantiallycomparedtopriordesigns,andcanapplyconsistentforcestothewearer.Theswitchingoperationoftheactuatorsfunctionswellifthesuitispositionedproperlyonthewearer,althoughitmaypresentdifﬁcultiesifthesuitchangesposition,therebyincreasingthecable-traveldistancerequiredtotransitionbetweenlegs.Inextremecases,thepeakforcesmaybereducedortheshapeoftheforceproﬁlemaybealteredifthemotorcannotreachtheoppositelegfastenough.Thecontrolschemepresentedherewasfoundtobeabletoconsistentlydetectwhenitisbeneﬁcialtoapplyforces,andcanrapidlyaccommodateschangesinthewearer’sspeed.Thesystemwastestedwithmorethan20individualsonatreadmill,andfoundtoprovideconsistentforcestoeachwearingatavarietyofwalkingspeeds.Inthefuture,weintendtoincreasetheassistiveforcemagnitudes,andperformhumansubjectstudieswithbiomechanicalandphysiologicalanalysistodeterminetheoptimalforceproﬁlesforeachjoint.Sincethesystemisrelativelylightandcreatessub-stantialjointmomentswithoutdisruptingthewearersnaturalbiomechanics,weexpectthatitwillbeabletocreateanetmetabolicreduction(systemwornvs.nosystem).Finally,whilesubjectshavewornthesuitforanhourofcontinuouswalkingandfoundittobecomfortable,thelong-termeffectsofwearingthesuitstillneedtobedetermined.\n']","
多关节软体外骨骼通过优化驱动系统的开关操作和被动力利用，减少了驱动器的主动能量消耗；同时通过降低腿部切换时的电缆行程，降低了整体重量；此外，在多种行走速度下保持一致的助力输出，提升了系统的动态适应能力，从而显著降低了携带重量。
","
多关节软体外骨骼通过优化的驱动方案实现了携带重量的显著降低。该方案通过合理布置执行器位置，确保其在穿戴者运动过程中高效切换操作，从而减少冗余结构或驱动单元的使用。文献未明确涉及具体材料或执行器类型的改进。
    ",0.75,0.8949315239624847,0.5
"
集成式动作分类网络取得了怎样的分类效果？
","['\nThe task estimates are other critical components required for walking over continuously-varying tasks. Seen in Table II, the error in the speed estimate was fairly constant over the trials, with RMSE between 0.12 and 0.15 m/s for both controllers. This error is likely due to a slightly asymmetric gait, which violates the assumptions made in the speed esti- mator’s formulation. Gait asymmetries may be the result of our participant’s habitual compensations, socket comfort, or the signiﬁcant mass difference between the robotic prosthesis  9  Fig. 10. Average phase estimate progression calculated in real-time by the HKIC during the continuously-varying task trials. Shaded regions represent ±1 standard deviation. The linearity and consistency of the trajectories illustrate the phase variable’s ability to adapt to continuous task variations and appropriately parameterize the gait cycle.  and participant’s passive prosthesis. Interestingly, the incline estimate produced lower error with the HKIC (0.67 to 0.76 deg) than the FSMC (1.52 to 3.04 deg) in both trials. We spec- ulate that the higher error in the FSMC is due to a feedback interaction between incline estimate errors and the impedance parameters. Due to the discrete switching behavior of the impedance parameters (see Fig. 13b), a small incline estimate error can result in large changes in prosthesis behavior. If this change is inappropriate for the current task, such as when γ = 1.5 but ˆγ = 3.5, the resulting progressions of θf and cop may be atypical and further skew the incline estimate. Therefore, the continuous nature of the HKIC is preferable, as it does not display step changes in behavior with small changes in task inputs.\n']","
文献未提供关于“集成式动作分类网络”的具体分类效果信息。参考文本主要讨论了外骨骼控制系统的估计误差表现，包括速度、倾角和步态相位估计，但未提及该网络的分类性能。
","
    文献无相关内容
    ",1.0,0.0,1.0
"
作者指出未来需要哪些进一步的研究方向来验证脊髓控制模型？
","['\nsolely relying on indirect experimental observations can be misleading when assessing the role of reﬂexes. First, the changes in muscle responses do not necessarily indicate modulation of reﬂex gains. For example, in the TR experiment the changes in the model’s HAM and VAS responses during stance (Figure 2) result from the changes in muscle conﬁgurations while the reﬂex gains remain constant. Second, the correlation between the muscle states and muscle responses is not suﬃcient to explain the underlying muscle reﬂexes. For instance, in a gait experiment similar to the SR experiment, Yang et al. (1991) suggested velocity feedback to contribute about 45% in the generation of SOL activations during the stance phase. The suggested contribution is based on the correlation between the changes in ankle velocity and the responses in SOL activation. However, as noted by the authors of the study, this quantiﬁcation neglects the potential contributions of diﬀerent aﬀerent pathways. Performing the same correlation- based analysis in our model suggests a contribution of about 40% of velocity feedback in the stance control of SOL, even though the model uses no velocity feedback but 100% force feedback.  results also show that  Although, the ﬁndings of our study may help to construct a model that can explain the steady and reactive spinal control of human walking, it will take further research to settle the actual circuitries in humans. First, neuromechanical simulations with more physiological details will be needed to incorporate other types of experimental studies in the evaluation of control models. For instance, we would be able to compare the response amplitudes of our control model to human responses in MMR and TR experiments if our simulations could more faithfully describe the relationship between cutaneous electrical stimulation and synchronous muscle activation as well as the related neurophysiology. Second, other models which can  REFERENCES  Aoi, S., Ogihara, N., Funato, T., Sugimoto, Y., and Tsuchiya, K. (2010). Evaluating functional roles of phase resetting in generation of adaptive human bipedal walking with a physiologically based model of the spinal pattern generator. Biol. Cybern. 102, 373–387. doi: 10.1007/s00422-010-0373-y  Armstrong, D. M. (1988). The supraspinal control of mammalian locomotion. J.  Physiol. 405:1. doi: 10.1113/jphysiol.1988.sp017319\n']","
为了验证脊髓控制模型，未来需要进一步研究的方向包括：(1) 增加神经力学仿真中的生理细节以准确描述皮肤电刺激与肌肉激活的关系；(2) 与其他模型进行对比分析，以验证当前模型在 MMR 和 TR 实验中的响应特性；(3) 探索速度反馈以外的其他传入通路对脊髓反射的潜在贡献，并结合更精确的神经生理机制进行建模。
","
作者指出未来需要以下几个研究方向来验证脊髓控制模型：1）开展更精确的实验以区分肌肉配置变化与反射增益调节；2）评估基于相关性分析的局限性，研究不同感觉通路的综合贡献；3）构建包含更多生理细节的神经力学模型，以更真实地模拟电刺激与肌肉激活之间的关系；4）通过多种实验范式（如MMR和TR实验）对模型响应幅度进行验证，从而确认模型的生理合理性。
    ",1.0,0.9555602153885756,0.5
"
绝对磁性旋转编码器和增量磁性旋转编码器在Utah ExoKnee系统中分别承担什么功能？
","['\nmm on top of the thigh. The RFSEA in combination with the proposed four-bar mechanism enables Utah ExoKnee to satisfy the torque and speed objective (120 Nm, 257 deg/s) while fitting the anthropometry of the 50th percentile adult male without hardware modifications. The exoskeleton performance metrics are summarized in Table II.  C. Sensors and Embedded Electronics  Utah ExoKnee comprises an array of sensors to accurately control the human-robot interaction. An absolute magnetic rotary encoder (RM08 SD, RLS, Slovenia) placed on the actuated joint of the exoskeleton estimates the absolute knee joint position. An incremental magnetic rotary encoder (RM08 SD, RLS, Slovenia) located on the motor shaft measures its position and is used to estimate motor angular velocity. In addition, the RFSEA is equipped with a high-resolution rotary absolute encoder (Vert-X 1302, Contelec, Switzerland) that measures the deflection of the linear springs using a capstan coupling. The capstan coupling converts linear displacement due to the deflection of the springs into a proportional angular displacement of the encoder shaft, which is driven by a steel cable [24]. For the goal of this experiment, a 6-axis load cell (M3713D, Sunrise Instruments, China) is integrated into the exoskeleton shank segment to accurately measure the physical interaction between the user and the robot as necessary to assess the function of the self-aligning mechanism. The 6-axis load cell uses an off-the-shelf signal amplifier and a custom acquisition board (AD7609, Analog Devices, USA). The force and torque recordings from the 6- axis load cell are synchronized with the exoskeleton controller using a digital signal.  the  computer (Raspberry-Pi, Model 3A+) at 500 Hz. The single- board computer communicates with the microprocessor using SPI. An external laptop runs a custom GUI for data monitoring and parameter-selection purposes and communicates via using Wi-Fi with the single-board computer. The GUI is used to change the control parameters and start/stop data saving. In addition, the control system uses a 1050 mAh 6-cell lithium- polymer battery, and a 5-V regulator to power the processing units, embedded sensors, and current servo controller. The electrical power consumption is 3.8 W and 3.1 W with Wi-Fi on and off, respectively. The weight of the embedded electrical system, including battery and protective covers, is 1.1 kg.  D. Signal Processing and Control\n']","
在Utah ExoKnee系统中，绝对磁性旋转编码器（RM08 SD, RLS, Slovenia）用于估计膝关节的绝对位置，提供无需参考的绝对位置信号；增量磁性旋转编码器（RM08 SD, RLS, Slovenia）用于测量电机的角位置并估计电机的角速度，用于速度反馈控制。
","
    在Utah ExoKnee系统中，绝对磁性旋转编码器（RM08 SD）负责测量膝关节的绝对角度位置，确保控制系统获取精确的关节位置信息；而增量磁性旋转编码器（RM08 SD）则安装于电机轴上，用于测量电机的相对位置并估计其角速度，为速度控制提供反馈依据。
    ",0.8,0.9762485074123998,1.0
"
不同步态速度对腓肠肌肌纤维行为的影响是什么？
","['\n[13] POWERS C.M., BOYD L.A., TORBURN L., PERRY J., Stair ambulation in persons with transtibial amputation: an analysis of the Seattle Lightfoot, J. Rehabil. Res. Dev., 1997, Vol. 34, 9–18.  [14] RIENER R., RABUFFETTI M., FRIGO C., Stair ascent and de- scent at different inclinations, Gait and Posture, 2002, Vol. 15, 32–44.  [15] SILDER A., BESIER T., DELP S.L., Predicting the metabolic cost of incline walking from muscle activity and walking me- chanics, J. Biomech., 2012, Vol. 45, 1842–1849. [16] SPANJAARD M., REEVES N.D., VAN DIEEN  J.H., BALTZOPOULOS V., MAGANARIES C.N., Lower-limb biome- chanics during stair descent: influence of step-height and body mass, J. Exp. Biol., 2008, Vol. 211, 1368–1375. [17] SPANJAARD M., REEVES N.D., VAN DIEEN  J.H., BALTZOPOULOS V., MAGANARIES C.N., Influence of gait ve- locity on gastrocnemius muscle fascicle behaviour during stair negotiation, J. Electromyogr. Kinesiol., 2009, Vol. 19, 304–313.  [18] SUTHERLAND D.H., The evolution of clinical gait analysis, Part 1: Kinesiological EMG, Gait and Posture, 2001, Vol. 14, 61–70.  [19] TOWNSEND M.A., LAINHART S.P., SHIAVI R., Variability and biomechanics of synergy patterns of some lower-limb muscles during ascending and descending stairs and level walking, Med. Biol. Eng. Comput., 1978, Vol. 16, 681– 688.  [20] VAUGHAN C.L., DAVIS B.L., O’CONNOR J.C., Dynamics of Human Gait, second ed., Cape Town, South African, 1999.\n']","
不同步态速度会影响腓肠肌肌纤维的伸展性、肌束长度变化及肌肉激活模式，尤其在楼梯任务中这一影响更为显著。
","
    不同步态速度对腓肠肌肌纤维行为具有显著影响，具体表现为在楼梯行走过程中，随着步态速度增加，腓肠肌肌束在支撑期的缩短速率加快，伸长幅度减少，肌肉趋向于更主动的收缩以满足推进力需求。该结论基于对楼梯行走情境的研究（Spanjaard et al., 2009）。
    ",1.0,0.96460211661356,0.5
"
文中提到哪些传感或技术手段被用于增强义肢系统的上下文感知能力？它们分别适用于哪些应用场景？
","['\nadjusts the impedance or position of the prosthetic joints based on gait phase and the users locomotor task (e.g. level walking, stair ascent and descent). The autonomous control cannot predict the user’s intent in terms of locomotor tasks and therefore cannot adapt to walking terrains. One solution is to build a neural-machine interface that predict the users intended locomotor task for prosthesis operation. Several groups have developed neural-machine interfaces (NMIs) for artiﬁcial legs to decipher neuromuscular signals (i.e. electromyographic (EMG) signals) and identify the user’s intended locomotor tasks and transitions [6], [7], [8], [9], [10], [11]. These approaches have been demonstrated to enable lower limb amputees to drive their prosthesis intuitively and switch locomotor tasks seamlessly. It has to been shown that active prostheses have the potential offer more comfort and less energy waste to the amputee compared to passive ones, [12], [13], [14]. The development of intelligent prosthetic devices has been done for a while as reported by [15]. Early investigations such as [12], [16], [17], implemented control and signal processing techniques to electromechanical systems in order to provide reliable systems that bring more comfort to the amputee. This type of research is still ongoing. Contemporary approaches make use of learning algorithms applied on exoskeletons and robotic limbs [18] with neural interfaces to the user for enhanced control, [19], [20], [21], [22], [23], [24] and response to human stimuli and intent, the so-called volitional control. For example, in order to give context awareness to the volitional control system for a prosthetic leg, [25] combined an inertial measurement unit (IMU) and a laser distance the terrain type and slope in front meter to reconstruct of the user [25]. Lately, context awareness strategies have gained an extra resource, the use of computer vision (CV). For example, deep learning techniques have been applied to prosthetic arms in order to enhance the grasp perception, independently of object forms or size [26]. However, the requirements and constraints to upper limbs prosthetics are very different than the ones to lower limbs, speciﬁcally in terms of response time and robustness.  This work is supported by the National Science Foundation (NSF) under  award CNS-1552828 and IIS-1361549.\n']","
文中提到用于增强义肢系统上下文感知能力的技术手段包括：神经-机器接口（NMIs）用于解码用户肌肉信号以识别运动意图，惯性测量单元（IMU）与激光测距结合用于感知地形类型和坡度，以及计算机视觉（CV）用于增强物体识别能力。这些技术适用于下肢假肢的意图识别、地形适应与环境感知等应用场景。
","
    文中提到的传感或技术手段包括：(1) 神经-机器接口（NMIs）用于解码肌电信号识别用户运动意图，适用于下肢义肢在不同步态任务间的切换；(2) 惯性测量单元（IMU）结合激光测距仪用于地形识别，适用于下肢义肢的地形自适应控制；(3) 计算机视觉（CV）结合深度学习技术用于增强抓取感知，适用于上肢义肢的自适应抓取任务。上下肢系统在响应时间与鲁棒性方面存在差异，限制了CV技术在下肢义肢中的应用。
    ",0.75,0.9368824107945436,0.5
"
BioStampRC在评估多发性硬化症患者步态障碍进展方面具有什么潜在应用价值？
","['\nBioStampRC could monitor gait impairment of MS.  BioStampRC sensors detected differences in step time and stride time by disability levels in PwMS, while swing time was less distinctive between the groups. The current observation was consistent with previous researches that reported significant prolongation in step time and stride time, but not in swing time in PwMS [6, 21]. Also, corresponding to previous research [6, 19], there was no difference in the gait parameters between the control and mild MS group whereas elongated temporal gait parameters were observed as severity of gait impairment increased in PwMS. The trend was also observed in the data derived from the standard refer- ence MTx [21, 44]. Therefore, BioStampRC might be useful in identifying gait pathology in PwMS as well as in evaluating the progression of gait disability in PwMS.  Strengths and limitations of the investigation  The current study included a relatively large sample of persons with varying MS disability as well as healthy controls. Furthermore, we studied four types of clinical gait assessments that have been validated to examine gait function in PwMS [8]. Additionally, three different speed conditions were included in 6MW.  Despite the strengths of the paper, it is not without limitations. A main limitation of the study is that 6MW trials were conducted on a motorized treadmill. It is established that tread- mill walking is distinct from over ground walking. The use of treadmill and usage of the hand rail have been associated with altered gait characteristics such as increased cadence and reduced knee angle compared to over-ground walking condition [45, 46]. Additionally, a few studies have suggested that treadmill may artificially reduce the natural variability of gait pat- terns (i.e. stride-to-stride fluctuations during walking) [46]. The alternation of the gait variabil- ity has been reported to be a unique marker of gait impairment in PwMS [47]. Therefore, future research is necessary to confirm the accuracy of the novel sensor and its applications in PwMS during over-ground walking that mimics real-world walking.  The treadmill was utilized in an effort to maintain gait speed within a given trial. The well-controlled speed constraints permitted more explicit comparison of the temporal gait  PLOS ONE | DOI:10.1371/journal.pone.0171346 February 8, 2017  14 / 19  Monitoringgait in MS with wearblesensors\n']","
BioStampRC在评估多发性硬化症患者步态障碍进展方面具有潜在应用价值，可监测步时、步频等关键步态参数随疾病严重程度的变化趋势，并反映不同残疾程度患者的步态特征差异。其结果与先前研究一致，表明可用于识别MS患者的步态病理和评估疾病进展。然而，由于研究环境受限（如跑步机模拟行走），其在真实世界中的有效性仍需进一步验证。
","
BioStampRC在评估多发性硬化症（MS）患者步态障碍进展方面具有识别步态病理变化和追踪其严重程度的潜力，因其可检测不同残疾水平下步时间与步幅时间的显著差异。尽管研究受限于跑步机测试可能影响步态真实表现，未来仍需验证其在地面行走中的应用，但其在多速度条件与临床评估中的表现支持其作为可穿戴监测工具的应用前景。
    ",0.7142857142857143,0.9859100198847696,1.0
"
文中提到的自适应阻抗控制策略如何实现人机协同运动并提升负载携带能力？
","['\nWalsh, C. J., Pasch, K., and Herr, H. (2006). “An autonomous, underactuated exoskeleton for load-carrying augmentation,” in IEEE/RSJ International Con- ference on Intelligent Robots and Systems, Beijing, 1410–1415.  Wang, S., Wang, L., Meijneke, C., Van Asseldonk, E., Hoellinger, T., Cheron, G., et al. (2015). Design and control of the MINDWALKER exoskeleton. IEEE Trans. Neural Syst. Rehabil. Eng. 23, 277–286. doi:10.1109/TNSRE.2014. 2365697  Winter, D., Eng, J., and Ischac, M. (1996). “Three-dimensional moments, powers and work in normal gait: implications for clinical assessments,” in Human Motion Analysis: Current Applications and Future Directions, eds G. Harris and PA. Smith (New York: IEEE Press), 71–83.  Winter, D. A. (1980). Overall principle of lower limb support during stance phase  of gait. J. Biomech. 13, 923–927. doi:10.1016/0021-9290(80)90162-1  Wu, Q., Wang, X., Du, F., and Zhang, X. (2015). Design and control of a pow- ered hip exoskeleton for walking assistance. Int. J. Adv. Robot. Syst. 12, 1–11. doi:10.5772/59757  Young, A., and Ferris, D. P. (2017). State-of-the-art and future directions for robotic lower limb exoskeletons. IEEE Trans. Neural Syst. Rehabil. Eng. 25, 171–182. doi:10.1109/TNSRE.2016.2521160  Young, A. J., Foss, J., Gannon, H., and Ferris, D. P. (2017). Influence of power delivery timing on the energetics and biomechanics of humans wearing a hip exoskeleton. Front. Bioeng. Biotechnol. 5:4. doi:10.3389/fbioe.2017.00004 Zeilig, G., Weingarden, H., Zwecker, M., Dudkiewicz, I., Bloch, A., and Esquenazi, A. (2012). Safety and tolerance of the ReWalk™ exoskeleton suit for ambulation by people with complete spinal cord injury: a pilot study. J. Spinal Cord Med. 35, 101–196. doi:10.1179/2045772312Y.0000000003  Zhang, C., Zang, X., Leng, Z., Yu, H., Zhao, J., and Zhu, Y. (2016). Human–machine force interaction design and control for the HIT load-carrying exoskeleton. Adv. Mech. Eng. 8, 1–14. doi:10.1177/1687814016645068  Zoss, A. B., Kazerooni, H., and Chu, A. (2006). Biomechanical design of the Berkeley lower extremity exoskeleton (BLEEX). IEEE/ASME Trans. Mechatron. 11, 128–138. doi:10.1109/TMECH.2006.871087  Conflict of Interest Statement: The authors declare that the research was con- ducted in the absence of any commercial or financial relationships that could be construed as a potential conflict of interest.\n']","
自适应阻抗控制策略通过实时感知人体运动状态和负载变化，动态调整外骨骼的关节刚度与阻尼参数，使其与人体运动模式相匹配，从而实现人机协同运动。该策略在不同运动阶段提供适当的机械支撑，减少肌肉激活，提升运动效率，并增强负载携带能力。然而，参考文献中未提供具体实现细节，因此无法进一步展开。
","
    文献无相关内容。
    ",0.0,0.0,0.5
"
与之前控制器相比，基于IDA-PBC方法的控制器在任务多样性辅助方面有何突破？
","['\nSpecifically, study 1 performed preliminary validation (n=3) of two advanced, data-driven en- ergy shaping approaches under the collective MTOES framework: 1) with phi (PHI) which in- corporates the global thigh angle, and 2) without-phi (WOP) which excludes it from the shaping framework. For human subject experiments, the controllers were implemented on the Comex 1 knee-ankle exoskeleton equipped with the vGRF sensor I developed in chapter 2, which signif- icantly improved the MTOES optimization results. Study 2 generalized the MTOES framework to various modular configurations (ankle/knee/hip, unilateral/bilateral) and performed pre-clinical validation (n=8) using the MBLUE hardware on the knee and hip unilateral and bilateral modules. The primary hypothesis of both experiments was a holistic reduction in muscular effort (EMG) with exoskeleton assistance across multiple tasks.  25  3.2 Synopsis: Study 1  Study 1 utilized our prior IDA-PBC method [Lin et al., 2021] to include unactuated coordinates such as leg orientation in a passivity-based, energy-shaping controller for optimal assistance of all primary activities of daily life. In addition to global orientation, we included the vertical GRF in the basis functions (that map joint kinematics to joint moments) to address prior problems with ex- cessive torque as weight transfers from the assisted leg to the (unmodeled) contralateral leg during double support [Divekar et al., 2020]. Incorporating these additional variables increased the num- ber of candidate basis functions allowed by the IDA-PBC framework. This thereby improved the flexibility of the optimization process to fit the outputs of a single control law to normative human joint torques across all primary activities of daily life: level-ground walking, walking at variable inclines/declines, stair ascent/descent with variable step heights, and sit-to-stand. We formulated and solved this optimization problem using convex programming tools. No prior controller had demonstrated biomimetic assistance for such a wide variety of tasks without switching or adapta- tion between tasks. We assessed the muscular effort of multiple able-bodied human subjects with an experimental implementation of this task-invariant control method on a knee-ankle exoskeleton (Comex 1) to assist the primary activities of daily life (detailed below).  3.3 Human Subject Methods: Study 1\n']","
基于IDA-PBC方法的控制器在任务多样性辅助方面突破在于其能够以单一控制律适应多种日常活动（如平地行走、坡道行走、上下楼梯及坐-站动作），无需任务切换；同时引入未驱动坐标（如腿部方向角）与vGRF建模，有效抑制扭矩异常，并实现生物拟态辅助。
","
    基于IDA-PBC方法的控制器通过引入未驱动坐标（如腿部方向）和垂直地面反作用力（vGRF）作为基础函数的一部分，扩展了能量成形框架，从而在不依赖任务切换或适应机制的前提下，实现了对多种日常活动（如平地行走、变坡度行走、上下楼梯、坐站转换）的仿生助力控制。这是首个在如此广泛任务范围内展示任务不变控制策略有效性的控制器方法，显著提升了任务多样性辅助能力。
    ",1.0,0.9654209355145164,1.0
"
文中提出的自适应协同控制器在膝关节控制中如何实现电刺激与外骨骼的协调？
","['\nVI. CONCLUSION This paper proposes an adaptive cooperative controller that coordinates electrical stimulation of muscle with a powered exoskeleton. The efficacy of the controller was evaluated in an experiment on a T10 complete paraplegic, in which the controller was used at the knee joint of the powered exoskeleton in conjunction with stimulation of the quadriceps muscle group in order to perform weighted leg lifts. The control approach provided consistent tracking control, while 55% of the energy for movement was provided by the metabolic power supply through the contribution of the stimulated quadriceps. REFERENCES [1] R. Kobetic, R.J. Triolo, and E.B. Marsolais, “Muscle selection and walking performance of multichannel FES systems for ambulation in paraplegia,” Rehabilitation Engineering, IEEE Transactions on, vol. 5, (no. 1), pp. 23-29, 1997. [2] A. Kralj, T. Bajd, R. Turk, J. Krajnik, and H. Benko, “Gait restoration in paraplegic patients: a feasibility demonstration using multichannel surface electrode FES,” Journal of rehabilitation R&D / Veterans Administration, Department of Medicine and Surgery, Rehabilitation R&D Service, vol. 20, (no. 1), pp. 3-20, 1983. [3] A.R. Kralj and T. Bajd, Functional electrical stimulation: standing and walking after spinal cord injury: CRC Press, 1989. [4] S.-C. Chen, C.-H. Lai, W.P. Chan, M.-H. Huang, H.-W. Tsai, and J.-J.J. Chen, “Increases in bone mineral density after functional electrical stimulation cycling exercises in spinal cord injured patients,” Disability and Rehabilitation, vol. 27, (no. 22), pp. 1337-1341, 2005. [5] P. Krause, J. Szecsi, and A. Straube, “Changes in spastic muscle tone increase in patients with spinal cord injury using functional electrical stimulation and passive leg movements,” Clinical Rehabilitation, vol. 22, (no. 7), pp. 627-634, July 1, 2008 2008. [6] M. Bélanger, R.B. Stein, G.D. Wheeler, T. Gordon, and B. Leduc, “Electrical stimulation: Can it increase muscle strength and reverse osteopenia in spinal cord injured individuals?,” Archives of physical medicine and rehabilitation, vol. 81, (no. 8), pp. 1090-1098, 2000. [7] Y. Hasegawa, J. Jang, and Y. Sankai, “Cooperative walk control of paraplegia patient and assistive system,” in Book Cooperative walk control of paraplegia patient and assistive system, Series Cooperative walk control of paraplegia patient and assistive system, IEEE Press, 2009, pp. 4481-4486. [8] H.K. Kwa, J.H. Noorden, M. Missel, T. Craig, J.E. Pratt, and P.D\n']","
文中提出的自适应协同控制器通过实时调整电刺激输出与外骨骼运动控制信号，实现膝关节与股四头肌的协调控制，用于辅助脊髓损伤患者的负重腿抬升。实验中55%的运动能量由代谢电源提供，表明系统具有良好的能量分配与协调能力。然而，文献中未具体描述控制器的算法细节。
","
